index,url,valid,domain,title,description,image,published,archive,content,quote,language,keyword
https://www.zeit.de/news/2023-08/01/staedte-wappnen-sich-gegen-hitze-aktionsplaene-fehlen-noch,https://www.zeit.de/news/2023-08/01/staedte-wappnen-sich-gegen-hitze-aktionsplaene-fehlen-noch,0,www.zeit.de,Gesundheit: Städte wappnen sich gegen Hitze: Aktionspläne fehlen noch,,,2023-08-01T04:35:31Z,,"When browsing with ads:
We collect personal data and also transmit it to third-party providers
 that help us improve and finance our digital content. Some of the information stored on your device, … [+821 chars]",,de,'Hitze'
https://www.welt.de/reise/article246672142/Traumziel-Westkueste-Hoch-hoeher-Kalifornien-oder-doch-nicht.html,https://www.welt.de/reise/article246672142/Traumziel-Westkueste-Hoch-hoeher-Kalifornien-oder-doch-nicht.html,0,www.welt.de,"Hoch, höher, Kalifornien – oder doch nicht?","Immer scheint die Sonne und alle sind gut drauf. Kalifornien gilt als magischer Ort, der Zukunft besonders nah. Wie viel Realität steckt angesichts zunehmender sozialer und ökologischer Probleme noch in seinem Mythos?",https://img.welt.de/img/reise/mobile246675494/3561352077-ci16x9-w1200/San-Francisco-City-view-during-sunset.jpg,2023-08-01T07:39:48Z,,"Vermutlich ging es vielen wie dem jungen David Hockney: 1964 saß das Wunderkind der britischen Nachkriegsmalerei am Strand von Santa Monica. Die Luft war mild, der Pazifische Ozean schwappte, Hockney… [+8939 chars]",,de,'Sonne'
https://www.stern.de/panorama/weltgeschehen/storchen-romanze-in-schwarz-weiss---die-ungleichen-arten-werden-eltern-33691374.html,https://www.stern.de/panorama/weltgeschehen/storchen-romanze-in-schwarz-weiss---die-ungleichen-arten-werden-eltern-33691374.html,0,www.stern.de,Lüneburger Heide: Storchen-Romanze in Schwarz-Weiß – ungleiche Arten werden Eltern,In der Lüneburger Heide haben eine Schwarzstörchin und ein Weißstorch Küken bekommen. Das galt bisher als unmöglich – denn die Vögel leben buchstäblich in unterschiedlichen Welten.,https://image.stern.de/33691408/t/P0/v3/w1440/r1.7778/-/storch-weissstorch-schwarzstorch-niedersachsen.jpg,2023-08-01T09:06:00Z,,"Wenn in der beschaulichen Lüneburger Heide gestandene niedersächsische Vogelexperten von einer Sensation sprechen, dann ist das auch so. Dort geschieht in diesen Wochen etwas, was bisher in freier Wi… [+4746 chars]",,de,'Vögel'
https://www.morgenpost.de/berlin/article239079753/sport-kultur-natur-wannsee-babelsberg-route-fahrrad-tour-liebermann-villa-pfaueninsel.html,https://www.morgenpost.de/berlin/article239079753/sport-kultur-natur-wannsee-babelsberg-route-fahrrad-tour-liebermann-villa-pfaueninsel.html,0,www.morgenpost.de,"Ferientag für 40 Euro: Sport, Kultur, Natur: Wannsee-Babelsberg-Route auf dem Rad","Die Max Liebermann Villa, die Pfaueninsel und einige Kilometer auf dem Fahrrad: Der perfekte Ausflug für Sport- und Kulturbegeisterte.",https://img.morgenpost.de/img/berlin/crop239079751/9512604918-w820-cv16_9-q85/0aca07ee-270a-11ee-918f-6270efe653e1.jpg,2023-08-01T09:18:23Z,,"Berlin.  Ich will immer am liebsten alles, und zwar auf einmal und zur selben Zeit. Das gilt auch, oder vor allem, für freie Tage: Erholung, Sport, Natur, Kultur und das natürlich in der richtigen Ge… [+8684 chars]",,de,'Vögel'
https://www.zeit.de/news/2023-08/01/regen-gewitter-und-zeitweise-sonne-in-baden-wuerttemberg,https://www.zeit.de/news/2023-08/01/regen-gewitter-und-zeitweise-sonne-in-baden-wuerttemberg,0,www.zeit.de,"Wetter: Regen, Gewitter und zeitweise Sonne in Baden-Württemberg",,,2023-08-01T10:10:27Z,,"When browsing with ads:
We collect personal data and also transmit it to third-party providers
 that help us improve and finance our digital content. Some of the information stored on your device, … [+821 chars]",,de,'Sonne'
https://www.focus.de/reisen/italien-spanien-griechenland-so-wirkt-sich-die-klimakrise-auf-unser-liebsten-reiseziele-aus_id_200646955.html,https://www.focus.de/reisen/italien-spanien-griechenland-so-wirkt-sich-die-klimakrise-auf-unser-liebsten-reiseziele-aus_id_200646955.html,0,www.focus.de,"Italien, Spanien, Griechenland - So wirkt sich die Klimakrise auf unser liebsten Reiseziele aus","Camping-Urlaub in Italien, Ferienhaus in Spanien, Strand und Sonne in Griechenland: Manche Reiseziele sind absolute Klassiker für Urlauber aus Deutschland. Doch im Süden Europas wüten Waldbrände und Hitze. Wie sieht die Lage aus?",https://p6.focus.de/img/fotos/id_200647285/gettyimages-1171392359.jpg?im=Crop%3D%280%2C208%2C2121%2C1061%29%3BResize%3D%281200%2C627%29&impolicy=perceptual&quality=mediumHigh&hash=ff171888e2a4bb3bd7bd52bf12de0d2b257d5527a94f6638209463741e430b5a,2023-08-01T14:28:56Z,,"Camping-Urlaub in Italien, Ferienhaus in Spanien, Strand und Sonne in Griechenland: Manche Reiseziele sind absolute Klassiker für Urlauber aus Deutschland. Doch im Süden Europas wüten Waldbrände und … [+7896 chars]",,de,'Sonne'
https://www.n-tv.de/mediathek/videos/wetter/Sonne-kann-nur-punktuell-durch-Wolkendecke-brechen-article24296374.html,https://www.n-tv.de/mediathek/videos/wetter/Sonne-kann-nur-punktuell-durch-Wolkendecke-brechen-article24296374.html,0,www.n-tv.de,"Warme, aber nasse Wochenmitte: Sonne kann nur punktuell durch Wolkendecke brechen","In der Nacht schwächen sich die Regenfälle ab, und örtlich klart es auch mal auf. Der Mittwoch beginnt in der Osthälfte noch mit freundlichem Sommerwetter, bevor neue Regenwolken den Himmel bedecken. Dazu kommt stellenweise ein kräftiger Wind auf.",https://bilder2.n-tv.de/img/incoming/crop24299053/9941321589-cImg_16_9-w1200/419000824.jpg,2023-08-01T15:51:00Z,,,,de,'Sonne'
https://www.sueddeutsche.de/wissen/voegel-wilderei-schusswaffen-usa-illegaler-abschuss-1.6086885,https://www.sueddeutsche.de/wissen/voegel-wilderei-schusswaffen-usa-illegaler-abschuss-1.6086885,0,www.sueddeutsche.de,Artenschutz: Amerikaner schießen Vögel auf Stromleitungen ab,"Anders als gedacht, besteht das größte Risiko für geschützte Arten nicht darin, einen Stromschlag zu bekommen. Viel öfter werden sie zur Zielscheibe von Schützen.",https://www.sueddeutsche.de/image/sz.1.6086886/1200x675?v=1690956969,2023-08-01T15:59:47Z,,"Anders als gedacht, besteht das größte Risiko für geschützte Arten nicht darin, einen Stromschlag zu bekommen. Viel öfter werden sie zur Zielscheibe von Schützen.Der Mensch baut nicht nur die Erde zu… [+4404 chars]",,de,'Vögel'
https://futurezone.at/science/klimawandel-sonnenschirm-erde-abkuehlen-konzept-forschung/402543029,https://futurezone.at/science/klimawandel-sonnenschirm-erde-abkuehlen-konzept-forschung/402543029,0,futurezone.at,"Forscher will Schirm an Asteroiden binden, um die Sonne zu verdunkeln",Das Sonnensegel ist kleiner als frühere Konzept und soll daher schneller umsetzbar werden.,https://image.futurezone.at/images/facebook/8067044/asteroids-gef461f5761920.jpg,2023-08-01T16:21:40Z,,"01.08.2023
Das Sonnensegel ist kleiner als frühere Konzept und soll daher schneller umsetzbar werden.
© Bild: Brooks Bays/UH Institute for Astronomy
So stellt sich Szapudi das Sonnensegel vor
© B… [+96 chars]",,de,'Sonne'
https://www.stern.de/gesundheit/sommerblues--warum-uns-das-regenwetter-so-fertig-macht-33699952.html,https://www.stern.de/gesundheit/sommerblues--warum-uns-das-regenwetter-so-fertig-macht-33699952.html,0,www.stern.de,Wetterfühligkeit: Sommerblues: Warum uns das Regenwetter so fertig macht,"Sommer, Sonne, Kaktus?! Schön wär's. Derzeit fällt der Sommer eher ins Wasser, es ist kalt geworden. Das drückt vielen auf die Stimmung. Stellen wir uns einfach nur an oder hat das miese Wetter wirklich einen Einfluss auf unseren Körper?",https://image.stern.de/33701382/t/5-/v2/w1440/r1.7778/-/regenwetter.jpg,2023-08-01T17:10:00Z,,"""Alles grau, alles grau in grau. Alles kalt, alles kalt, kalt, kalt"" so beginnt ein Lied der Berliner Band Isolation Berlin. Eigentlich keine Zeilen, die man unmittelbar mit dem Sommer in Verbindung … [+4369 chars]",,de,'Sonne'
https://www.brigitte.de/aktuell/buzz/anti-einbruch--deswegen-solltest-du-ein-handtuch-ueber-die-tuerklinke-haengen-13568802.html,https://www.brigitte.de/aktuell/buzz/anti-einbruch--deswegen-solltest-du-ein-handtuch-ueber-die-tuerklinke-haengen-13568802.html,0,www.brigitte.de,Urlaubstipp: Darum solltest du immer ein Handtuch über die Türklinke hängen,"Sommer, Sonne, Strand – der Urlaub ist da und den möchten wir in vollen Zügen genießen. Doch dann das: In das eigene Hotelzimmer wurde eingebrochen. Wir verraten dir, warum ein Handtuch dich davor schützen kann.",https://image.brigitte.de/13568778/t/76/v3/w1440/r1.7778/-/einbruch-urlaub-tipp-handtuch.jpg,2023-08-01T18:00:00Z,,"Der Urlaub ist da und den möchten wir in vollen Zügen genießen. Doch dann das  in das eigene Hotelzimmer wird eingebrochen. Wir verraten dir, warum ein Handtuch dagegen helfen kann.
Egal ob am Meer … [+667 chars]",,de,'Sonne'
https://www.zeit.de/wissen/umwelt/2023-07/hitzetote-paris-notfallplan-hitzewelle-banlieue-olympia,https://www.zeit.de/wissen/umwelt/2023-07/hitzetote-paris-notfallplan-hitzewelle-banlieue-olympia,0,www.zeit.de,Hitzetote: Schutzlos unter der Sonne,Paris hat einen vorbildlichen Notfallplan für heiße Tage. Trotzdem sterben hier so viele Menschen infolge von Hitze wie in keiner anderen europäischen Hauptstadt. Warum?,,2023-08-01T18:04:28Z,http://archive.md/20230801181709/https://www.zeit.de/wissen/umwelt/2023-07/hitzetote-paris-notfallplan-hitzewelle-banlieue-olympia,"When browsing with ads:
We collect personal data and also transmit it to third-party providers
 that help us improve and finance our digital content. Some of the information stored on your device, … [+821 chars]",,de,'Hitze'
https://www.diepresse.com/13603558/temperaturen-bis-zu-50-grad-iran-gibt-zwei-tage-hitzefrei,https://www.diepresse.com/13603558/temperaturen-bis-zu-50-grad-iran-gibt-zwei-tage-hitzefrei,0,www.diepresse.com,Temperaturen bis zu 50 Grad: Iran gibt zwei Tage hitzefrei,„Beispiellose Hitze“ fordert Menschen und Gesundheitssystem in einigen Region des Irans. Das Gesundheitsministerium warnt die Menschen vor extremer Hitze.,https://img.diepresse.com/public/incoming/pvbqnz-IRAN-WEATHER-HEAT-WAVE-CLIMATE/alternates/DPR_SOCIAL_NACHRICHTEN/IRAN-WEATHER-HEAT%20WAVE-CLIMATE,2023-08-01T18:05:30Z,,"Beispiellose Hitze fordert Menschen und Gesundheitssystem in einigen Region des Irans. Das Gesundheitsministerium warnt die Menschen vor extremer Hitze.
Wegen einer Hitzewelle mit Temperaturen bis 5… [+1534 chars]",,de,'Temperaturen'
https://t3n.de/news/e-autos-solarstrom-speicher-beton-1567614/,https://t3n.de/news/e-autos-solarstrom-speicher-beton-1567614/,0,t3n.de,E-Autos beim Fahren laden: Forscher speichern Solar- und Windstrom in Beton,"US-Forscher haben aus Zement, Wasser und Ruß eine Speicherlösung entwickelt, in der von Sonne oder Wind erzeugter Strom zwischengespeichert werden kann. Künftig könnten damit etwa E-Autos während des Fahrens geladen werden. Nicht immer, wenn Solar- und Windst…",https://t3n.de/news/wp-content/uploads/2023/08/MIT-Cement-Beton-Stromspeicher.jpg,2023-08-01T21:16:23Z,https://web.archive.org/web/20230803053015/https://t3n.de/news/e-autos-solarstrom-speicher-beton-1567614/,"Nicht immer, wenn Solar- und Windstrom erzeugt wird, wird dieser auch in vollem Umfang benötigt und umgekehrt. Um den Übergang von einer auf fossilen Brennstoffen zu einer auf erneuerbaren Energien b… [+1960 chars]",,de,'Sonne'
https://www.zeit.de/news/2023-08/02/taifun-und-hitze-plagen-japan,https://www.zeit.de/news/2023-08/02/taifun-und-hitze-plagen-japan,0,www.zeit.de,Extremwetter: Taifun und Hitze plagen Japan,,,2023-08-02T02:18:47Z,,"When browsing with ads:
We collect personal data and also transmit it to third-party providers
 that help us improve and finance our digital content. Some of the information stored on your device, … [+821 chars]",,de,'Hitze'
https://www.stern.de/gesellschaft/regional/berlin-brandenburg/wetter--regnerischer-mittwoch-in-berlin-und-brandenburg-33702662.html,https://www.stern.de/gesellschaft/regional/berlin-brandenburg/wetter--regnerischer-mittwoch-in-berlin-und-brandenburg-33702662.html,0,www.stern.de,Wetter: Regnerischer Mittwoch in Berlin und Brandenburg,"Der Mittwoch wird bewölkt und regnerisch in Berlin und Brandenburg. Wie der Deutsche Wetterdienst (DWD) am Mittwoch mitteilte, beginnt der Tag locker bewölkt, am Vormittag zieht es aber zu. Nachmittags setzt im Westen Regen ein, der abends über Oder und Neiße…",https://image.stern.de/33702664/t/_s/v1/w1440/r1.7778/-/02--urnnewsmldpacom2009010123080299656620v2w800h600l1108t739r3325b2223jpeg---f2736398bb126c0e.jpg,2023-08-02T04:47:33Z,,"Der Mittwoch wird bewölkt und regnerisch in Berlin und Brandenburg. Wie der Deutsche Wetterdienst (DWD) am Mittwoch mitteilte, beginnt der Tag locker bewölkt, am Vormittag zieht es aber zu. Nachmitta… [+1286 chars]",,de,'Temperaturen'
https://www.morgenpost.de/berlin/article239086173/Regnerischer-Mittwoch-in-Berlin-und-Brandenburg.html,https://www.morgenpost.de/berlin/article239086173/Regnerischer-Mittwoch-in-Berlin-und-Brandenburg.html,0,www.morgenpost.de,Wetter: Regnerischer Mittwoch in Berlin und Brandenburg,"Der Mittwoch wird bewölkt und regnerisch in Berlin und Brandenburg. Wie der Deutsche Wetterdienst (DWD) am Mittwoch mitteilte, beginnt der Tag locker bewölkt, am Vormittag zieht es aber zu. Nachmittags setzt im Westen Regen ein, der abends über Oder und Neiße…",https://img.morgenpost.de/img/berlin/crop239086171/9852608204-w820-cv16_9-q85/Regen.jpg,2023-08-02T04:47:33Z,,"Berlin (dpa/bb). Der Mittwoch wird bewölkt und regnerisch in Berlin und Brandenburg. Wie der Deutsche Wetterdienst (DWD) am Mittwoch mitteilte, beginnt der Tag locker bewölkt, am Vormittag zieht es a… [+958 chars]",,de,'Regen'
https://www.n-tv.de/mediathek/videos/wetter/Regenfreie-Phase-im-Osten-ist-nicht-von-langer-Dauer-article24298498.html,https://www.n-tv.de/mediathek/videos/wetter/Regenfreie-Phase-im-Osten-ist-nicht-von-langer-Dauer-article24298498.html,0,www.n-tv.de,Wind gesellt sich zum Dauernass: Regenfreie Phase im Osten ist nicht von langer Dauer,Der Regen legt tatsächlich eine Pause ein - wenn auch nicht allzu lang. Der Mittwoch startet vor allem im Osten des Landes freundlich. Später ziehen jedoch schnell neue Unwetter auf. Die Temperaturen liegen dazu zwischen 17 und 27 Grad.,https://bilder1.n-tv.de/img/incoming/crop24298804/3441322328-cImg_16_9-w1200/418940548.jpg,2023-08-02T04:58:00Z,,,,de,'Temperaturen'
https://www.tagesschau.de/wirtschaft/hybride-solarparks-100.html,https://www.tagesschau.de/wirtschaft/hybride-solarparks-100.html,0,www.tagesschau.de,Erneuerbare Energien: Batterien für ein zunehmend wackliges System,Energie aus Wind und Sonne ist nicht wirklich planbar - und die Netzstabilität der Zukunft daher ein heikles Thema. Abhilfe könnten Batteriespeicher schaffen. Von Tim Diekmann.,https://images.tagesschau.de/image/3b52be30-afde-4f9d-9193-e5395f22db71/AAABibDWyq8/AAABibBxqrQ/16x9-1280/sendungsbild-1183366.jpg,2023-08-02T05:01:59Z,,"Stand: 02.08.2023 07:01 Uhr
Energie aus Wind und Sonne ist nicht wirklich planbar - und die Netzstabilität der Zukunft daher ein heikles Thema. Abhilfe könnten Batteriespeicher schaffen.
Wer sich d… [+4528 chars]",,de,'Sonne'
https://www.stern.de/gesellschaft/regional/sachsen-anhalt/niederschlaege--stuermisches-wetter-in-sachsen-anhalt--33702760.html,https://www.stern.de/gesellschaft/regional/sachsen-anhalt/niederschlaege--stuermisches-wetter-in-sachsen-anhalt--33702760.html,0,www.stern.de,Niederschläge: Stürmisches Wetter in Sachsen-Anhalt,"Das Wetter in Sachsen-Anhalt wird in den kommenden Tagen stürmisch und regnerisch. Der Mittwoch startet bewölkt, wie der Deutsche Wetterdienst (DWD) morgens mitteilte. Am Mittag wird es regnerisch, der Regen soll aber zum Abend hin wieder abziehen. Es weht mä…",https://image.stern.de/33702762/t/X6/v1/w1440/r1.7778/-/02--urnnewsmldpacom2009010123080299657126v1w800h600l1500t279r3691b2855jpeg---aff2176f22024eb6.jpg,2023-08-02T05:34:16Z,,"Das Wetter in Sachsen-Anhalt wird in den kommenden Tagen stürmisch und regnerisch. Der Mittwoch startet bewölkt, wie der Deutsche Wetterdienst (DWD) morgens mitteilte. Am Mittag wird es regnerisch, d… [+1731 chars]",,de,'Regen'
https://www.stern.de/gesellschaft/regional/thueringen/wetter--viele-wolken-und-regen-in-thueringen-33702764.html,https://www.stern.de/gesellschaft/regional/thueringen/wetter--viele-wolken-und-regen-in-thueringen-33702764.html,0,www.stern.de,Wetter: Viele Wolken und Regen in Thüringen,"In Thüringen wird das Wetter in den kommenden Tagen wechselhaft. Der Mittwoch startet locker bewölkt, wie der Deutsche Wetterdienst (DWD) am Morgen mitteilte. Ab dem Vormittag wird die Bewölkung demnach dichter und es regnet. Zum Nachmittag hin lockert es etw…",https://image.stern.de/33702766/t/TL/v1/w1440/r1.7778/-/02--urnnewsmldpacom2009010123080299657158v2w800h600l1357t1116r4717b3356jpeg---ec4003148f32500e.jpg,2023-08-02T05:35:28Z,,"In Thüringen wird das Wetter in den kommenden Tagen wechselhaft. Der Mittwoch startet locker bewölkt, wie der Deutsche Wetterdienst (DWD) am Morgen mitteilte. Ab dem Vormittag wird die Bewölkung demn… [+1870 chars]",,de,'Temperaturen'
https://www.stern.de/gesellschaft/regional/thueringen/landwirtschaft--regen-stoppt-maehdrescher-einsaetze--ernte-wird-laenger-dauern--33701684.html,https://www.stern.de/gesellschaft/regional/thueringen/landwirtschaft--regen-stoppt-maehdrescher-einsaetze--ernte-wird-laenger-dauern--33701684.html,0,www.stern.de,Landwirtschaft: Regen stoppt Mähdrescher-Einsätze: Ernte wird länger dauern,"Für Mais und Kartoffeln ist der Regen gut, bei der Getreideernte macht er Probleme. Nicht nur, weil sie sich verzögert. Den Bauern drohen auch Einnahmeverluste.",https://image.stern.de/33701686/t/QH/v2/w1440/r1.7778/-/02--urnnewsmldpacom2009010123080199646816v3w800h600l412t373r2306b1279jpeg---799b392d4bda19c2.jpg,2023-08-02T05:58:30Z,,"Für Mais und Kartoffeln ist der Regen gut, bei der Getreideernte macht er Probleme. Nicht nur, weil sie sich verzögert. Den Bauern drohen auch Einnahmeverluste.
Die anhaltenden Niederschläge sorgen … [+2229 chars]",,de,'Regen'
https://www.stern.de/gesellschaft/regional/hessen/wetter--regen-und-teils-kraeftige-gewitter-in-hessen-erwartet-33702892.html,https://www.stern.de/gesellschaft/regional/hessen/wetter--regen-und-teils-kraeftige-gewitter-in-hessen-erwartet-33702892.html,0,www.stern.de,Wetter: Regen und teils kräftige Gewitter in Hessen erwartet,"In Hessen benötigen die Menschen auch in den kommenden Tagen einen Regenschirm. Bis zum Mittwochnachmittag komme es wieder zu Schauern - südlich des Mains sei in den Staulagen auch Dauerregen möglich, schrieb der Deutsche Wetterdienst (DWD). Abends gebe es da…",https://image.stern.de/33702894/t/67/v1/w1440/r1.7778/-/02--urnnewsmldpacom2009010123080299657498v2w800h600l1357t1116r4717b3356jpeg---135b0dcc9db60db4.jpg,2023-08-02T06:10:49Z,,In Hessen benötigen die Menschen auch in den kommenden Tagen einen Regenschirm. Bis zum Mittwochnachmittag komme es wieder zu Schauern - südlich des Mains sei in den Staulagen auch Dauerregen möglich… [+1513 chars],,de,'Regen'
https://www.stern.de/gesellschaft/regional/nordrhein-westfalen/wetter--regen-und-teils-kraeftige-gewitter-in-nordrhein-westfalen-33702990.html,https://www.stern.de/gesellschaft/regional/nordrhein-westfalen/wetter--regen-und-teils-kraeftige-gewitter-in-nordrhein-westfalen-33702990.html,0,www.stern.de,Wetter: Regen und teils kräftige Gewitter in Nordrhein-Westfalen,"In Nordrhein-Westfalen bleibt es in den nächsten Tagen regnerisch. Nach ersten Schauern am Vormittag komme es ab dem Mittwochnachmittag und -abend zu mitunter kräftigem Gewitter mit Starkregen und kleinerem Hagel, gab der Deutsche Wetterdienst (DWD) bekannt. …",https://image.stern.de/33702992/t/Dm/v1/w1440/r1.7778/-/02--urnnewsmldpacom2009010123080299658151v2w800h600l1357t1116r4717b3356jpeg---bad5cd61a47641fe.jpg,2023-08-02T07:07:00Z,,In Nordrhein-Westfalen bleibt es in den nächsten Tagen regnerisch. Nach ersten Schauern am Vormittag komme es ab dem Mittwochnachmittag und -abend zu mitunter kräftigem Gewitter mit Starkregen und kl… [+1379 chars],,de,'Regen'
https://www.nzz.ch/schweiz/showdown-an-der-schneegrenze-ein-dorf-kaempft-fuer-seine-skilifte-ld.1749736,https://www.nzz.ch/schweiz/showdown-an-der-schneegrenze-ein-dorf-kaempft-fuer-seine-skilifte-ld.1749736,0,www.nzz.ch,Showdown an der Schneegrenze – ein Dorf kämpft für seine Skilifte,"Auf Sattel-Hochstuckli spielt sich ein Kampf ab, der angesichts des Schneemangels anderen Skigebieten noch bevorsteht.","https://img.nzz.ch/2023/08/03/2d0113a9-7c6b-4217-8d6f-86f4700f9b43.jpeg?width=1200&height=675&fit=bound&quality=75&auto=webp&crop=4944,2781,x0,y927&wmark=nzz",2023-08-02T07:43:53Z,http://archive.md/20230803072445/https://www.nzz.ch/schweiz/showdown-an-der-schneegrenze-ein-dorf-kaempft-fuer-seine-skilifte-ld.1749736,"Grossandrang zur Generalversammlung der Bergbahn Sattel-Hochstuckli.
Skigebiete sterben normalerweise still. Nicht so auf Sattel-Hochstuckli im Kanton Schwyz. In dem kleinen Wintersportort sollen di… [+7786 chars]",,de,'Temperaturen'
https://www.faz.net/einspruch/was-schnellverfahren-im-strafrecht-leisten-koennen-und-was-nicht-19076229.html,https://www.faz.net/einspruch/was-schnellverfahren-im-strafrecht-leisten-koennen-und-was-nicht-19076229.html,0,www.faz.net,Was Schnellverfahren im Strafrecht leisten können – und was nicht,"Geht es um Freibad-Krawalle oder Klimaaktivisten, wird immer wieder die Forderung erhoben, Straftäter möglichst noch am selben Tag zu verurteilen. In Folge 266 des F.A.Z. Einspruch Podcasts klären wir, in welchen Fällen das in Betracht kommt.",https://media0.faz.net/ppmedia/aktuell/politik/2353737877/1.9076226/facebook_teaser/drei-angeklagte.jpg,2023-08-02T14:20:38Z,,Drei angeklagte Klimaaktivisten sitzen während eines beschleunigten Verfahrens am 30.11.2022 im Gerichtssaal in München. Zuvor hatten sie in der Münchner Innenstadt zweimal binnen weniger Stunden den… [+2236 chars],,de,'Freibad'
https://www.zeit.de/2023/33/hitzerekord-oesterreich-klimakrise-klimaforschung,https://www.zeit.de/2023/33/hitzerekord-oesterreich-klimakrise-klimaforschung,0,www.zeit.de,Hitzerekord in Österreich: Hundstage,Zwar erlebt Österreich gerade eine Verschnaufpause von der Hitze. Doch ein kühler Blick auf die Daten der vergangenen Sommer zeigt: Ein Land heizt sich auf.,,2023-08-02T15:52:30Z,http://archive.md/20230802172432/https://www.zeit.de/2023/33/hitzerekord-oesterreich-klimakrise-klimaforschung,"When browsing with ads:
We collect personal data and also transmit it to third-party providers
 that help us improve and finance our digital content. Some of the information stored on your device, … [+821 chars]",,de,'Hitze'
https://www.welt.de/vermischtes/article246712588/Regen-und-Sturm-Wann-der-Sommer-in-Deutschland-endlich-zurueckkehrt.html,https://www.welt.de/vermischtes/article246712588/Regen-und-Sturm-Wann-der-Sommer-in-Deutschland-endlich-zurueckkehrt.html,0,www.welt.de,Wann der Sommer in Deutschland endlich zurückkehrt,"Statt Sommer, Sonne, Strand eher Regenschirm und Jacke: Das Wetter Anfang August wirkt wie ein Herbstbeginn. Doch die hohen Temperaturen kommen bald wieder zurück. Meteorologen sagen, wann sich das Wetter wieder ändert.",https://img.welt.de/img/vermischtes/mobile246712770/5441359687-ci16x9-w1200/Orkan-am-Brocken-erwartet.jpg,2023-08-03T08:52:38Z,,"Es ist Anfang August, doch die Temperaturen liegen bei nur 20 Grad dazu kommen vielerorts auch noch Orkanböen und Regenschauer. Einen Sommer hat man sich anders vorgestellt. Pech für viele Urlauber, … [+2545 chars]",,de,'Sonne'
https://taz.de/Die-Kunst-der-Woche/!5948016/,https://taz.de/Die-Kunst-der-Woche/!5948016/,0,taz.de,Die Kunst der Woche: Denken in Bildern,"Das Guthaus Steglitz zeigt 40 Blätter von Sandra Vásquez de la Horra, das Palais Populaire würdigt Rudolf Zwirner und am Bürgerplatz setzte es Arien.",https://taz.de/picture/6429514/948/Ausstellungsansicht-Foto-Ludger-Paffrath2-web-1.jpeg,2023-08-03T09:48:00Z,,"Das Guthaus Steglitz zeigt 40 Blätter von Sandra Vásquez de la Horra, das Palais Populaire würdigt Rudolf Zwirner und am Bürgerplatz setzte es Arien.
Arbeiten der Zeichnerin Sandra Vasquez de la Hor… [+7111 chars]",,de,'Blätter'
https://www.brigitte.de/so-bringen-wir-den-cruise-chic-in-unseren-kleiderschrank-13565362.html,https://www.brigitte.de/so-bringen-wir-den-cruise-chic-in-unseren-kleiderschrank-13565362.html,0,www.brigitte.de,Cruise-Chic: So wird der angesagte Yacht-Look alltagstauglich,"Urlaubsfeeling im Kleiderschrank: Die Sonne scheint , die Temperaturen steigen und so wie jedes Jahr sehnen wir uns immer mehr nach Urlaub und nach dem Meer. Kein Wunder also, dass sich diese Sehnsucht auch in der Mode widerspiegelt. Mit dem ""Cruise-Chic"" bri…",https://image.brigitte.de/13565482/t/Os/v4/w1440/r1.7778/-/aufmacher-sofia-richie.jpg,2023-08-03T19:00:00Z,,"Die Sonne scheint, die Temperaturen steigen und so wie jedes Jahr sehnen wir uns immer mehr nach Urlaub am Meer. Kein Wunder, dass sich diese Sehnsucht auch in der Mode spiegelt.
Spätestens seit Sof… [+2704 chars]",,de,'Temperaturen'
