index,url,valid,domain,title,description,image,published,archive,content,quote,language,keyword
https://www.faz.net/aktuell/gesellschaft/ungluecke/florida-sturmtief-debby-erreicht-sueden-der-usa-mehrere-tote-19901748.html,https://www.faz.net/aktuell/gesellschaft/ungluecke/florida-sturmtief-debby-erreicht-sueden-der-usa-mehrere-tote-19901748.html,0,www.faz.net,Mehrere Tote: Sturm „Debby“ erreicht US-Bundesstaat Florida,"Seit dem frühen Morgen sorgt Sturm „Debby“ im Süden der USA für heftigen Wind und Regen, es gelten Unwetterwarnungen. Mindestens drei Menschen starben infolge des Unwetters, viele Haushalte sind ohne Strom.",https://media1.faz.net/ppmedia/aktuell/feuilleton/1536156387/1.9901753/facebook_teaser/ueberspuelte-strassen-das.jpg,2024-08-05T18:04:44Z,,"Ein Teenager sei nahe der Stadt Fanning Springs gestorben, nachdem ein Baum in einer Wohnwagensiedlung auf einen der Trailer gefallen sei, hieß es beim Sender WCJB. Der Sender NBC News berichtete übe… [+1124 chars]",,de,'Regen'
https://taz.de/Die-Verkehrswende-ist-machbar/!6028593/,https://taz.de/Die-Verkehrswende-ist-machbar/!6028593/,0,taz.de,Die Verkehrswende ist machbar: Hamburg hat kein schlechtes Wetter,"Regen und Wind dürften Hamburger selten vom Radeln abhalten, eher schon die Temperaturen, sagt eine Studie. Mit etwas Flexibilität bleibt man trocken.",https://taz.de/picture/7162139/948/219440524-1.jpeg,2024-08-05T19:00:00Z,,"Regen und Wind dürften Hamburger selten vom Radeln abhalten, eher schon die Temperaturen, sagt eine Studie. Mit etwas Flexibilität bleibt man trocken.
Kommt weniger häufig vor als man denkt: Radfahr… [+4812 chars]",,de,'Regen'
https://www.stern.de/gesellschaft/regional/baden-wuerttemberg/natur--giftiges-jakobskreuzkraut-breitet-sich-im-suedwesten-aus-34953014.html,https://www.stern.de/gesellschaft/regional/baden-wuerttemberg/natur--giftiges-jakobskreuzkraut-breitet-sich-im-suedwesten-aus-34953014.html,0,www.stern.de,Natur: Giftiges Jakobskreuzkraut breitet sich im Südwesten aus,Das hochgiftige Jakobskreuzkraut kann vor allem für Pferde und Rinder gefährlich werden. Durch immer trockenere Sommer breitet sich die gelbe Pflanze aus. Für das Ökosystem ist sie aber auch wichtig.,https://image.stern.de/34953016/t/NS/v1/w1440/r1.7778/-/06--iim657f7lyv14axw800h600jpeg---f774e9fefb99d715.jpg,2024-08-06T02:00:43Z,,Das hochgiftige Jakobskreuzkraut kann vor allem für Pferde und Rinder gefährlich werden. Durch immer trockenere Sommer breitet sich die gelbe Pflanze aus. Für das Ökosystem ist sie aber auch wichtig.… [+2401 chars],,de,'Blätter'
https://www.zeit.de/news/2024-08/06/giftiges-jakobskreuzkraut-breitet-sich-im-suedwesten-aus,https://www.zeit.de/news/2024-08/06/giftiges-jakobskreuzkraut-breitet-sich-im-suedwesten-aus,0,www.zeit.de,Natur: Giftiges Jakobskreuzkraut breitet sich im Südwesten aus,Hier finden Sie Informationen zu dem Thema „Natur“. Lesen Sie jetzt „Giftiges Jakobskreuzkraut breitet sich im Südwesten aus“.,https://img.zeit.de/news/2024-08/06/giftiges-jakobskreuzkraut-breitet-sich-im-suedwesten-aus-image-group/wide__1300x731,2024-08-06T02:00:43Z,,Es ist giftig und breitet sich auch im Südwesten immer mehr aus: Das gelbe Jakobskreuzkraut stellt vor allem für Pferde und Rinder eine Gefahr dar. Die heimische Pflanze mag besonders sonnige und tro… [+3190 chars],,de,'Natur'
https://www.stern.de/gesellschaft/regional/hessen/deutscher-wetterdienst--wechselhaftes-sommerwetter-in-hessen-34953412.html,https://www.stern.de/gesellschaft/regional/hessen/deutscher-wetterdienst--wechselhaftes-sommerwetter-in-hessen-34953412.html,0,www.stern.de,Deutscher Wetterdienst: Wechselhaftes Sommerwetter in Hessen,"Sonne, Regen, Sonne, Regen: Es bleibt wechselhaft in Hessen. Immerhin für heute können sich die Menschen auf blauen Himmel und nur ein paar Wolken freuen.",https://image.stern.de/34953414/t/o4/v1/w1440/r1.7778/-/06--pfmv76q34av11axw800h600jpeg---10054c215ac6b97b.jpg,2024-08-06T06:45:26Z,,"Sonne, Regen, Sonne, Regen: Es bleibt wechselhaft in Hessen. Immerhin für heute können sich die Menschen auf blauen Himmel und nur ein paar Wolken freuen.
Der Sommer zeigt sich weiterhin in seiner f… [+1021 chars]",,de,'Regen'
https://www.zeit.de/news/2024-08/06/sommerwetter-im-norden-temperaturen-bis-28-grad,https://www.zeit.de/news/2024-08/06/sommerwetter-im-norden-temperaturen-bis-28-grad,0,www.zeit.de,Deutscher Wetterdienst: Sommerwetter im Norden – Temperaturen bis 28 Grad,Hier finden Sie Informationen zu dem Thema „Deutscher Wetterdienst“. Lesen Sie jetzt „Sommerwetter im Norden – Temperaturen bis 28 Grad“.,https://img.zeit.de/news/2024-08/06/sommerwetter-im-norden-temperaturen-bis-28-grad-image-group/wide__1300x731,2024-08-06T06:47:57Z,,Der Deutsche Wetterdienst (DWD) hat Sommerwetter für Hamburg und Schleswig-Holstein vorausgesagt. Tagsüber sei es heiter und trocken bei Temperaturen von bis zu 28 Grad Celsius auf dem Festland und 2… [+417 chars],,de,'Temperaturen'
https://www.stern.de/gesellschaft/regional/hamburg-schleswig-holstein/deutscher-wetterdienst--sommerwetter-im-norden---temperaturen-bis-28-grad-34953422.html,https://www.stern.de/gesellschaft/regional/hamburg-schleswig-holstein/deutscher-wetterdienst--sommerwetter-im-norden---temperaturen-bis-28-grad-34953422.html,0,www.stern.de,Deutscher Wetterdienst: Sommerwetter im Norden – Temperaturen bis 28 Grad,Hamburg/Kiel (lno) - Der Deutsche Wetterdienst (DWD) hat Sommerwetter für Hamburg und Schleswig-Holstein vorausgesagt. Tagsüber sei es heiter und trocken,https://image.stern.de/34953424/t/Oj/v1/w1440/r1.7778/-/06--bj3kj7urnyv11axw800h600jpeg---090f34eadd17a3bd.jpg,2024-08-06T06:47:57Z,,"Die Bewohner Hamburgs und Schleswig-Holsteins dürfen sich auf Sommerwetter freuen. Für Mittwoch sagt der Deutsche Wetterdienst aber Gewitter voraus.
Der Deutsche Wetterdienst (DWD) hat Sommerwetter … [+576 chars]",,de,'Temperaturen'
https://www.autobild.de/artikel/dtm-pirelli-entwickelt-neue-slickreifen-26355629.html,https://www.autobild.de/artikel/dtm-pirelli-entwickelt-neue-slickreifen-26355629.html,0,www.autobild.de,DTM als Testlabor für GT3-Reifen,"Pirelli ist exklusiver Reifenausrüster in der DTM. 2024 kamen neue Regenreifen, 2025 sind neue Slicks geplant.",https://i.auto-bild.de/ir_img/3/6/4/9/5/7/7/DTM_Pirelli_16_9-18b5fd9cfb12d3b7.jpg?impolicy=og_images,2024-08-06T07:06:00Z,,Am kommenden Wochenende steht das DTM-Rennen am Nürburgring auf dem Programm. Mirko Bortolotti (SSR Performance) will im Lamborghini Huracan GT3 dann seine Tabellenführung verteidigen. Sechs Punkte V… [+1942 chars],,de,'Regen'
https://www.stern.de/gesellschaft/regional/rheinland-pfalz-saarland/wetter--wechselhafte-woche-in-rheinland-pfalz-und-saarland-34953486.html,https://www.stern.de/gesellschaft/regional/rheinland-pfalz-saarland/wetter--wechselhafte-woche-in-rheinland-pfalz-und-saarland-34953486.html,0,www.stern.de,Wetter: Wechselhafte Woche in Rheinland-Pfalz und Saarland,In Rheinland-Pfalz und dem Saarland zeigt sich die Sonne bei heißen Temperaturen. Im Laufe der Woche wechselt sich die Sonne oft mit Wolken und Niederschlägen ab.,https://image.stern.de/34953488/t/ec/v1/w1440/r1.7778/-/06--demkaitwnfv6axw800h600jpeg---ff6e58fd8a37ed76.jpg,2024-08-06T07:08:12Z,,"In Rheinland-Pfalz und dem Saarland zeigt sich die Sonne bei heißen Temperaturen. Im Laufe der Woche wechselt sich die Sonne oft mit Wolken und Niederschlägen ab.
Sonne und Regen wechseln sich diese… [+1079 chars]",,de,'Sonne'
https://www.focus.de/panorama/wetter-in-deutschland-sommer-und-sonne-kehren-zurueck-hitzewarnungen-im-sueden_id_54933749.html,https://www.focus.de/panorama/wetter-in-deutschland-sommer-und-sonne-kehren-zurueck-hitzewarnungen-im-sueden_id_54933749.html,0,www.focus.de,"Wetter im Ticker - Sommer und Sonne kehren zurück, Hitzewarnungen im Süden",Das Sommerwetter war lang ersehnt - und kommt nach einem gewittrigen Wochenende wieder nach Deutschland zurück - wenn auch nur kurz. Im Südwesten gelten in mehreren Kreisen amtliche Hitzewarnungen für den Dienstag. Ab Mittwoch werden wieder Schauer erwartet. …,https://p6.focus.de/img/regional/rheinland-pfalz/id_260193770/nach-dicken-wolken-wird-es-immer-waermer.jpg?im=Crop%3D%280%2C171%2C2048%2C1024%29%3BResize%3D%281200%2C627%29&impolicy=perceptual&quality=mediumHigh&hash=4522f08d44bdbae641e9043f46c3557734971dafc4f418eded7cf68f5d5f73d8,2024-08-06T07:21:41Z,,Das Sommerwetter war lang ersehnt - und kommt nach einem gewittrigen Wochenende wieder nach Deutschland zurück - wenn auch nur kurz. Im Südwesten gelten in mehreren Kreisen amtliche Hitzewarnungen fü… [+9369 chars],,de,'Hitze'
https://www.kicker.de/den-eigenen-atem-nicht-gehoert-triathlon-staffel-feiert-gold-im-champagner-regen-1042630/video,https://www.kicker.de/den-eigenen-atem-nicht-gehoert-triathlon-staffel-feiert-gold-im-champagner-regen-1042630/video,0,www.kicker.de,"""Den eigenen Atem nicht gehört"": Triathlon-Staffel feiert Gold im Champagner-Regen",Video: Die deutsche Mixed-Staffel hat im Triathlon die Goldmedaille gewonnen. Nach dem Zieleinlauf wurde das Quartett im Deutschen Haus empfangen und sprach über den packenden Wettkampf.,https://derivates.kicker.de/image/upload/c_crop%2Cx_572%2Cy_133%2Cw_2972%2Ch_1672/w_1200%2Cq_auto/v1/2024/08/06/9b9fb9c1-0014-4cdf-906d-4b4b5885196d.jpeg,2024-08-06T08:00:34Z,,"Werbung und Tracking: Um dir relevante Inhalte und personalisierte Werbung anzubieten, setzen wir Cookies und andere Technologien ein. Damit messen wir, wie und womit du unsere Angebote nutzt. Diese … [+1979 chars]",,de,'Regen'
https://www.tagesschau.de/faktenfinder/solarenergie-erderwaermung-100.html,https://www.tagesschau.de/faktenfinder/solarenergie-erderwaermung-100.html,0,www.tagesschau.de,Klimawandel: Solarenergie sorgt nicht für globale Erwärmung,"Zum Thema Solarenergie gibt es zahlreiche Mythen. Photovoltaik-Anlagen sollen zur globalen Erderwärmung beitragen und für mehr Hitze in den Städten sorgen, wird dabei oft behauptet. Wie ist das einzuordnen? Von Julia Kuttner.",https://images.tagesschau.de/image/73821e94-dc7f-4aed-bd15-87b72b8e7a45/AAABkMW207o/AAABjwnlFvA/16x9-1280/photovoltaik-112.jpg,2024-08-06T08:06:59Z,,"Stand: 06.08.2024 10:06 Uhr
Zum Thema Solarenergie gibt es zahlreiche Mythen. Photovoltaik-Anlagen sollen zur globalen Erderwärmung beitragen und für mehr Hitze in den Städten sorgen, wird dabei oft… [+7318 chars]",,de,'Hitze'
https://www.bild.de/news/wetter/extrem-sommer-im-anmarsch-ab-sonntag-droht-hitzeblase-mit-40-grad-66b1bee3c3cfd352dfe78b18,https://www.bild.de/news/wetter/extrem-sommer-im-anmarsch-ab-sonntag-droht-hitzeblase-mit-40-grad-66b1bee3c3cfd352dfe78b18,0,www.bild.de,Bis zu 40 Grad - Jetzt kommen die Hitzeblasen!,Heiß ist es ja. Am Mittwoch rauschen ein paar Hitze-Unwetter durch Deutschland. Und dann knallen die Temperaturen mal so richtig nach oben!,"https://images.bild.de/66b1bee3c3cfd352dfe78b18/bed8a3405c20a334a5145405fb03ee4e,1542d8e?w=1280",2024-08-06T08:48:56Z,,"Am Mittwoch rauschen ein paar Hitze-Unwetter durch Deutschland. Und dann knallen die Temperaturen mal so richtig nach oben!
Der August fährt auf der sommerlichen Schiene weiter. Die Höchstwerte erre… [+1906 chars]",,de,'Temperaturen'
https://www.zeit.de/gesundheit/2024-08/hitze-schwangerschaft-fruehgeburt-entzuendung-wehen-schutz,https://www.zeit.de/gesundheit/2024-08/hitze-schwangerschaft-fruehgeburt-entzuendung-wehen-schutz,0,www.zeit.de,"Hitze in der Schwangerschaft: ""Die Hitze könnte Entzündungen triggern und verfrühte Wehen auslösen""",Hitze und Luftfeuchtigkeit erhöhen das Risiko für Frühgeburten. Eine fetomaternale Medizinerin erklärt mögliche Ursachen und wie Schwangere sich und ihr Baby schützen.,https://img.zeit.de/gesundheit/2024-07/hitze-schwangerschaft-fruehgeburt-entzuendung-wehen-schutz-bild/wide__1300x731,2024-08-06T09:05:42Z,,"Studien aus Asien, Australien und den  USA belegen schon länger, dass hohe Temperaturen dort Frühgeburten auslösen können. 2023 konnte ein Team um die Medizinerin Petra Arck und die Geburtsmedizineri… [+595 chars]",,de,'Hitze'
https://www.zeit.de/news/2024-08/06/outdoor-apps-koennten-beim-naturschutz-helfen,https://www.zeit.de/news/2024-08/06/outdoor-apps-koennten-beim-naturschutz-helfen,0,www.zeit.de,"Wandern, Biken, Touren gehen: Outdoor-Apps könnten beim Naturschutz helfen","Hier finden Sie Informationen zu dem Thema „Wandern, Biken, Touren gehen“. Lesen Sie jetzt „Outdoor-Apps könnten beim Naturschutz helfen“.",https://img.zeit.de/news/2024-08/06/outdoor-apps-koennten-beim-naturschutz-helfen-image-group/wide__1300x731,2024-08-06T09:18:16Z,,"Viele Outdoor-Apps weisen bei der Tourenplanung nicht auf Schutzgebiete und dort geltende Regeln hin - dabei könnten sie sogar helfen, die Natur besser zu schützen. Zu diesem Ergebnis kommt ein Fachb… [+4077 chars]",,de,'Natur'
https://www.zeit.de/news/2024-08/06/aktive-sonne-zahlreiche-sonnenflecken-sichtbar,https://www.zeit.de/news/2024-08/06/aktive-sonne-zahlreiche-sonnenflecken-sichtbar,0,www.zeit.de,Astronomie: Aktive Sonne: Zahlreiche Sonnenflecken sichtbar,Hier finden Sie Informationen zu dem Thema „Astronomie“. Lesen Sie jetzt „Aktive Sonne: Zahlreiche Sonnenflecken sichtbar“.,https://img.zeit.de/news/2024-08/06/aktive-sonne-zahlreiche-sonnenflecken-sichtbar-image-group/wide__1300x731,2024-08-06T09:18:55Z,,"Die Zahl der dunklen Sonnenflecken ist derzeit so hoch wie seit 20 Jahren nicht. «Wir sind gerade auf dem Maximum eines relativ starken Sonnenzyklus», erklärt Sonnenphysiker Achim Gandorfer vom Max-P… [+2917 chars]",,de,'Sonne'
https://www.zeit.de/news/2024-08/06/jeder-dritte-erwachsene-hat-bluthochdruck-hitze-gefaehrlich,https://www.zeit.de/news/2024-08/06/jeder-dritte-erwachsene-hat-bluthochdruck-hitze-gefaehrlich,0,www.zeit.de,Gesundheit: Jeder dritte Erwachsene hat Bluthochdruck - Hitze gefährlich,Hier finden Sie Informationen zu dem Thema „Gesundheit“. Lesen Sie jetzt „Jeder dritte Erwachsene hat Bluthochdruck - Hitze gefährlich“.,https://img.zeit.de/news/2024-08/06/jeder-dritte-erwachsene-hat-bluthochdruck-hitze-gefaehrlich-image-group/wide__1300x731,2024-08-06T11:21:14Z,,"Jeder dritte Erwachsene in Mecklenburg-Vorpommern hat nach Angaben der Krankenkasse Barmer Bluthochdruck - was bei Hitze gefährlich werden könne. «Extreme Temperaturen setzen den Körper unter Stress,… [+2507 chars]",,de,'Hitze'
https://www.zeit.de/news/2024-08/06/regenwetter-kann-melonenernte-in-velten-nicht-trueben,https://www.zeit.de/news/2024-08/06/regenwetter-kann-melonenernte-in-velten-nicht-trueben,0,www.zeit.de,Erste Bilanz: Regenwetter kann Melonenernte in Velten nicht trüben,Hier finden Sie Informationen zu dem Thema „Erste Bilanz“. Lesen Sie jetzt „Regenwetter kann Melonenernte in Velten nicht trüben“.,https://img.zeit.de/news/2024-08/06/regenwetter-kann-melonenernte-in-velten-nicht-trueben-image-group/wide__1300x731,2024-08-06T12:24:08Z,,"Genug gelbe Melonen, steigende Nachfrage: Der als «Melonenmann» bekanntgewordene Landwirt Attila Puszti ist mit der laufenden Melonenernte in Velten im Kreis Oberhavel zufrieden. Zwar habe der viele … [+1895 chars]",,de,'Regen'
https://www.stern.de/gesellschaft/regional/berlin-brandenburg/erste-bilanz--regenwetter-kann-melonenernte-in-velten-nicht-trueben-34954994.html,https://www.stern.de/gesellschaft/regional/berlin-brandenburg/erste-bilanz--regenwetter-kann-melonenernte-in-velten-nicht-trueben-34954994.html,0,www.stern.de,Erste Bilanz: Regenwetter kann Melonenernte in Velten nicht trüben,"""Melonenmann"" Attila Puszti gilt als der einzige gewerbsmäßige Melonen-Anbauer in Brandenburg. In diesem Jahr regnete es viel - doch das tat der Ernte nicht nur schlecht.",https://image.stern.de/34954996/t/bz/v1/w1440/r1.7778/-/06--zxf5wpat4bv14axw800h600jpeg---f5214aeacee8cc73.jpg,2024-08-06T12:24:08Z,,"""Melonenmann"" Attila Puszti gilt als der einzige gewerbsmäßige Melonen-Anbauer in Brandenburg. In diesem Jahr regnete es viel - doch das tat der Ernte nicht nur schlecht.
Genug gelbe Melonen, steige… [+1333 chars]",,de,'Regen'
https://www.tagesspiegel.de/berlin/erste-bilanz-regenwetter-kann-melonenernte-in-velten-nicht-truben-12153473.html,https://www.tagesspiegel.de/berlin/erste-bilanz-regenwetter-kann-melonenernte-in-velten-nicht-truben-12153473.html,0,www.tagesspiegel.de,Erste Bilanz: Regenwetter kann Melonenernte in Velten nicht trüben,„Melonenmann“ Attila Puszti gilt als der einzige gewerbsmäßige Melonen-Anbauer in Brandenburg. In diesem Jahr regnete es viel - doch das tat der Ernte nicht nur schlecht.,https://www.tagesspiegel.de/images/12153470/alternates/BASE_16_9_W1400/1722947104000/melonenmann-aus-velten.jpeg,2024-08-06T12:25:04Z,,"Genug gelbe Melonen, steigende Nachfrage: Der als Melonenmann bekanntgewordene Landwirt Attila Puszti ist mit der laufenden Melonenernte in Velten im Kreis Oberhavel zufrieden. Zwar habe der viele Re… [+1242 chars]",,de,'Regen'
https://www.stern.de/gesellschaft/regional/bayern/vollsperrung--lastwagen-kippt-auf-a93-um---fahrer-verletzt-34955068.html,https://www.stern.de/gesellschaft/regional/bayern/vollsperrung--lastwagen-kippt-auf-a93-um---fahrer-verletzt-34955068.html,0,www.stern.de,Vollsperrung: Lastwagen kippt auf A93 um - Fahrer verletzt,Regenstauf (lby) - Ein Lastwagen ist auf der Autobahn 93 bei Regenstauf (Landkreis Regensburg) umgekippt und liegt quer auf der Fahrbahn. Der Fahrer sei,https://image.stern.de/34955070/t/Ux/v1/w1440/r1.7778/-/06--lbkd2des2qv15axw800h600jpeg---fc11878c76129ce0.jpg,2024-08-06T12:33:59Z,,"Deutlich länger werden Autofahrer heute auf der A93 benötigen. Nach einem Unfall ist die Fahrbahn in Richtung München komplett gesperrt.
Ein Lastwagen ist auf der Autobahn 93 bei Regenstauf (Landkre… [+663 chars]",,de,'Regen'
https://www.focus.de/wissen/mensch/playboy-umfrage-zeigt-auf-oben-ohne-im-freibad-so-viel-nackte-haut-finden-wir-in-ordnung_id_260201859.html,https://www.focus.de/wissen/mensch/playboy-umfrage-zeigt-auf-oben-ohne-im-freibad-so-viel-nackte-haut-finden-wir-in-ordnung_id_260201859.html,0,www.focus.de,Playboy-Umfrage zeigt auf - Oben ohne im Freibad - so viel nackte Haut finden wir in Ordnung,"Für die meisten Deutschen könnten wir nackiger sein, doch ein Drittel ist dagegen. In einer Umfrage hat der Playboy herausgefunden, wie viel Nacktheit im öffentlichen Raum für uns in Ordnung ist und wo es durchaus kritisch wird.",https://p6.focus.de/img/kultur/id_260201858/von-freibad-bis-social-media-wie-nackig-moegen-s-die-deutschen-.jpg?im=Crop%3D%280%2C382%2C3000%2C1500%29%3BResize%3D%281200%2C627%29&impolicy=perceptual&quality=mediumHigh&hash=ce4da87f11a34e984d63e2e3e4a88bb003d7306c9d3ce87af61c41791cc740f0,2024-08-06T13:20:06Z,,"Für die meisten Deutschen könnten wir nackiger sein, doch ein Drittel ist dagegen. In einer Umfrage hat der Playboy herausgefunden, wie viel Nacktheit im öffentlichen Raum für uns in Ordnung ist und … [+3413 chars]",,de,'Freibad'
https://www.zeit.de/news/2024-08/06/waldbrandgefahr-niederbayern-ordnet-beobachtungsfluege-an,https://www.zeit.de/news/2024-08/06/waldbrandgefahr-niederbayern-ordnet-beobachtungsfluege-an,0,www.zeit.de,Natur: Waldbrandgefahr - Niederbayern ordnet Beobachtungsflüge an,Hier finden Sie Informationen zu dem Thema „Natur“. Lesen Sie jetzt „Waldbrandgefahr - Niederbayern ordnet Beobachtungsflüge an“.,https://img.zeit.de/news/2024-08/06/waldbrandgefahr-niederbayern-ordnet-beobachtungsfluege-an-image-group/wide__1300x731,2024-08-06T14:53:50Z,,Wegen der steigenden Waldbrandgefahr sollen am Mittwoch in Niederbayern drei Beobachtungsflüge stattfinden. Durch die Beobachtung aus der Luft sollen mögliche Gefahrenquellen für Waldbrände frühzeiti… [+621 chars],,de,'Natur'
https://www.stern.de/gesellschaft/regional/bayern/natur--waldbrandgefahr---niederbayern-ordnet-beobachtungsfluege-an-34955720.html,https://www.stern.de/gesellschaft/regional/bayern/natur--waldbrandgefahr---niederbayern-ordnet-beobachtungsfluege-an-34955720.html,0,www.stern.de,Natur: Waldbrandgefahr - Niederbayern ordnet Beobachtungsflüge an,Wegen trockener Böden durch fehlende Niederschläge steigt die Waldbrandgefahr in Bayern an. In Niederbayern soll die Lage am Mittwoch aus der Luft beobachtet werden. Was ist konkret geplant?,https://image.stern.de/34955722/t/mI/v1/w1440/r1.7778/-/06--yozgg4zv3hv15axw800h600jpeg---ebbcdfa876b8f25e.jpg,2024-08-06T14:53:50Z,,"Wegen trockener Böden durch fehlende Niederschläge steigt die Waldbrandgefahr in Bayern an. In Niederbayern soll die Lage am Mittwoch aus der Luft beobachtet werden. Was ist konkret geplant?
Wegen d… [+822 chars]",,de,'Natur'
https://www.n-tv.de/wissen/Perseidenschwarm-Wann-der-Sternschnuppen-Regen-wieder-sichtbar-ist-article25139901.html,https://www.n-tv.de/wissen/Perseidenschwarm-Wann-der-Sternschnuppen-Regen-wieder-sichtbar-ist-article25139901.html,0,www.n-tv.de,Phänomen Perseidenschwarm: Wann der Sternschnuppen-Regen wieder erstrahlt,Dank des Perseidenschwarms erleuchten im August unzählige Sternschnuppen den Himmel. Insbesondere in einer Nacht ist das Himmelsspektakel ideal zu erkennen - und das mit bloßem Auge. Aber wie kommt es überhaupt dazu?,https://bilder1.n-tv.de/img/incoming/crop25139900/7261329033-cImg_16_9-w1200/420724132.jpg,2024-08-06T15:32:49Z,,Hochsommer ist Sternschnuppenzeit: Mitte August sind dank des legendären Perseidenschwarms wieder unzählige Sternschnuppen mit bloßem Auge am Himmel zu sehen. Der Meteorregen wird in diesem Jahr in d… [+3532 chars],,de,'Regen'
https://www.basicthinking.de/blog/2024/08/06/schlechtesten-freibaeder-in-deutschland/,https://www.basicthinking.de/blog/2024/08/06/schlechtesten-freibaeder-in-deutschland/,0,www.basicthinking.de,Das sind die 10 schlechtesten Freibäder in Deutschland,"Wenn es heiß wird, zieht es viele Menschen ins Freibad. Denn Badeanstalten versprechen Abkühlung und Erholung. Hohe Preise, kleine Becken und eine dreckige Umgebung können das Erlebnis allerdings schnell trüben. In unserem wöchentlichen Ranking die zehn schle…",https://www.basicthinking.de/blog/wp-content/uploads/2024/07/schelchtesten-freibader-in-deutschland.jpeg,2024-08-06T18:20:37Z,,"Wenn es heiß wird, zieht es viele Menschen ins Freibad. Denn Badeanstalten versprechen Abkühlung und Erholung. Hohe Preise, kleine Becken und eine dreckige Umgebung können das Erlebnis allerdings sch… [+1844 chars]",,de,'Freibad'
"https://www.gamestar.de/artikel/bester-maehroboter-ohne-draht-gardena-gps-rasenmaeher,3417562.html","https://www.gamestar.de/artikel/bester-maehroboter-ohne-draht-gardena-gps-rasenmaeher,3417562.html",0,www.gamestar.de,Deals: Rasen wie im Stadion - Ein neuer Mähroboter mäht Muster - und kehrt euer Laub auf! [Anzeige],"Der neue Mammotion YUKA Mähroboter ist ein großer Wurf: Ein Mähroboter ohne Begrenzungskabel oder Draht, der sogar Laub aufkehrt, Muster schneidet und auch in GPS-versperrten Zonen funktioniert.",https://images.cgames.de/images/gamestar/4/mammotion-yuka-1500-mähroboter-ohne-begrenzungskabel-mit-kehrfunktion-rasenmäher-roboter-1500-rasenmähroboter-mähroboter-bester-angebot_6303627.jpg,2024-08-06T19:03:00Z,,"Einer der besten neuen Mähroboter? Was der Mammotion Yuka kann, können nicht viele.
Euer Rasen wird zum Kunstwerk: Wollt ihr ihn lieber schön im Streifenmuster wie im Stadion? Oder eurem Lieblingsme… [+3460 chars]",,de,'Blätter'
https://www.morgenpost.de/berlin/article406965305/wetter-in-berlin-sommer-dreht-auf-doch-es-drohen-unwetter.html,https://www.morgenpost.de/berlin/article406965305/wetter-in-berlin-sommer-dreht-auf-doch-es-drohen-unwetter.html,0,www.morgenpost.de,Wetter in Berlin: Sommer dreht auf – doch es drohen Unwetter,Sonne satt und sehr hohe Temperaturen sind am Mittwoch zu erwarten. Doch später ist Vorsicht geboten. Es kann ungemütlich werden.,https://img.sparknews.funkemedien.de/406857743/406857743_1721716096_v16_9_1600.jpeg,2024-08-07T05:00:48Z,,"Berlin. Sonne satt und sehr hohe Temperaturen sind am Mittwoch zu erwarten. Doch später ist Vorsicht geboten. Es kann ungemütlich werden.
Nach einem sonnigen Tag kann es am Abend in Berlin und Brand… [+1743 chars]",,de,'Sonne'
https://sz-magazin.sueddeutsche.de/leben-und-gesellschaft/katastrophenfall-notfallplan-94175,https://sz-magazin.sueddeutsche.de/leben-und-gesellschaft/katastrophenfall-notfallplan-94175,0,sz-magazin.sueddeutsche.de,"Die Frau, die gegen unsere Albträume helfen soll","Ist Deutschland auf Naturkatastrophen oder Kriege vorbereitet? Was, wenn nicht ein Dutzend Menschen schwer verletzt sind, sondern Tausende? Die Ärztin Annika Rohde muss mit einem kleinen Team lebenswichtige Antworten finden – und wird dabei von der Wirklichke…",https://szm-media.sueddeutsche.de/image/szm/b0f3c873e2bbdaae5b959cb8891952a6/t0l0w1200h630/1280/image.jpeg,2024-08-07T05:30:00Z,,"Das erste Opfer war bereit, seine Rolle zu spielen. Der Mann sollte flüchten, als eine Explosion seine Straße erschütterte. Seine Rolle sah vor, dass die Schockwelle ihn zwei, drei Meter zurückschleu… [+373 chars]",,de,'Natur'
