index,url,valid,domain,title,description,image,published,archive,content,quote,language,keyword
https://www.faz.net/aktuell/rhein-main/frankfurt-wassereinbruch-in-dom-nach-starkregen-19900058.html,https://www.faz.net/aktuell/rhein-main/frankfurt-wassereinbruch-in-dom-nach-starkregen-19900058.html,0,www.faz.net,Wassereinbruch nach starkem Regen,"Nach starken Regenfällen in Frankfurt ist Wasser durch die Decke des Frankfurter Doms eingedrungen. Wie hoch der Schaden ist, ist derzeit noch unbekannt.",https://media0.faz.net/ppmedia/aktuell/rhein-main/2513042306/1.9900064/facebook_teaser/der-regen-sickerte-nach.jpg,2024-08-05T06:54:26Z,,"Im Frankfurter Dom hat die Feuerwehr Hunderte Liter Wasser abpumpen müssen. Ein Deckengewölbe des Gotteshauses war zeitweise mit rund 500 Litern Wasser geflutet, wie die Feuerwehr mitteilte. Mit Spez… [+383 chars]",,de,'Regen'
https://www.stern.de/panorama/wetter/kreta--urlaubsinsel-trocknet-aus---schuld-sind-nicht-nur-hitzewellen-34929252.html,https://www.stern.de/panorama/wetter/kreta--urlaubsinsel-trocknet-aus---schuld-sind-nicht-nur-hitzewellen-34929252.html,0,www.stern.de,Akuter Wassermangel: Urlaubsinsel Kreta trocknet aus – Schuld sind nicht nur Hitzewellen,"Auf der griechischen Insel Kreta ist Wasser Mangelware. Aber es ist nicht nur die extreme Hitze, die das Wasser knapper werden lässt. Der Frust bei der Bevölkerung ist groß.",https://image.stern.de/34930952/t/b6/v1/w1440/r1.7778/-/kreta-hitze-wassermangel.jpg,2024-08-05T06:57:00Z,,Zugang zu allen STERN PLUS-Inhalten und Artikeln aus dem Print-Magazin,,de,'Hitze'
https://www.fitforfun.de/news/tipps-gegen-die-hitze-so-bleibt-es-bei-hohen-temperaturen-drinnen-kuehl-524620.html,https://www.fitforfun.de/news/tipps-gegen-die-hitze-so-bleibt-es-bei-hohen-temperaturen-drinnen-kuehl-524620.html,0,www.fitforfun.de,Tipps gegen die Hitze: So bleibt es bei hohen Temperaturen drinnen kühl,"Um heiße Sommertage auch in Innenräumen aushalten zu können, brauchst du die richtige Lüftungstechnik. Aber ist es wirklich richtig, morgens alle Fenster aufzureißen?","https://www.fitforfun.de/files/images/202208/1/hilfe-gegen-die-hitze-so-lueftest-du-im-sommer-richtig-1263741979,524618_3x2_n.jpg",2024-08-05T07:49:00Z,,"Die nächste Hitzewelle erreicht Deutschland. Was nach Freibad und Eis klingt, kann zur Gesundheitsgefahr vor allem für ältere und kranke Menschen werden.",,de,'Temperaturen'
"https://www.gamestar.de/artikel/tesla-warnt-vor-nassem-lappen,3417493.html","https://www.gamestar.de/artikel/tesla-warnt-vor-nassem-lappen,3417493.html",0,www.gamestar.de,"Tesla - Unternehmen warnt vor nassem Handtuch: Ein Trick sollte viel Ladezeit sparen, doch er stellt sich als gefährlich heraus","Schnelleres Laden dank verminderter Hitze? In der Theorie, ja. In der Praxis aber bitte auf keinen Fall.",https://images.cgames.de/images/gamestar/4/tesla-laden-kittyfly-adobestockcom_6303420.jpg,2024-08-05T08:09:00Z,,"So geht's richtig: Tesla aufladen ohne nassen Lappen. (Bild: kittyfly - adobe.stock.com)
Wasser und Elektrizität sind keine Freunde. Einigen Tesla-Besitzern musste das erklärt werden durch Tesla sel… [+2717 chars]",,de,'Hitze'
https://www.welt.de/gesundheit/article252846932/Belastung-durch-Hitze.html,https://www.welt.de/gesundheit/article252846932/Belastung-durch-Hitze.html,0,www.welt.de,"„Alarmierend, wie viele Menschen schon in den ersten Hitze-Wochen Gesundheitsprobleme hatten“","Abgeschlagenheit, Kreislaufprobleme, Schlafstörungen: Extreme Hitzetage können zur körperlichen Belastung werden. Ein neuer Report zeigt, wie viele Menschen deswegen bereits Probleme hatten – und welche Berufsgruppen besonders gefährdet sind.",https://img.welt.de/img/gesundheit/mobile252846934/4647933947-ci16x9-w1200/Hitze-erhoeht-den-Durst.jpg,2024-08-05T08:28:14Z,,"Abgeschlagenheit, Kreislaufprobleme, Schlafstörungen: Extreme Hitzetage können zur körperlichen Belastung werden. Ein neuer Report zeigt, wie viele Menschen deswegen bereits Probleme hatten und welch… [+2618 chars]",,de,'Hitze'
https://www.sueddeutsche.de/wirtschaft/boerse-hitze-wetter-lux.LCN52k8yL8fRuuEKVdaEGB,https://www.sueddeutsche.de/wirtschaft/boerse-hitze-wetter-lux.LCN52k8yL8fRuuEKVdaEGB,0,www.sueddeutsche.de,Finanzmarkt: Nur Hitzköpfe an der Börse?,Ganze Forschungsteams untersuchen den Zusammenhang zwischen Temperaturen und Aktienmärkten. Das Ergebnis: Hitze schadet den Kursen – und zwar gleich doppelt.,https://www.sueddeutsche.de/2023/10/12/7509b23a-2118-4404-878d-035a8c0999a4.jpeg?q=60&fm=webp&width=1200&rect=0%2C76%2C1337%2C752,2024-08-05T10:02:41Z,,"Ganze Forschungsteams untersuchen den Zusammenhang zwischen Temperaturen und Aktienmärkten. Das Ergebnis: Hitze schadet den Kursen und zwar gleich doppelt.Vielleicht zeigt schon manche Redewendung, d… [+544 chars]",,de,'Temperaturen'
https://www.focus.de/experts/ernaehrungswissenschaftler-erklaert-es-deftiges-sommeressen-warum-ihr-koerper-im-freibad-nach-pommes-verlangt_id_260196872.html,https://www.focus.de/experts/ernaehrungswissenschaftler-erklaert-es-deftiges-sommeressen-warum-ihr-koerper-im-freibad-nach-pommes-verlangt_id_260196872.html,0,www.focus.de,Ernährungswissenschaftler erklärt es - Deftiges Sommeressen: Warum Ihr Körper im Freibad nach Pommes verlangt,"Wenn die Temperaturen steigen und der Spaß im Freibad ruft, scheint auch der Hunger auf Pommes gefühltr „ins Unermessliche“ zu wachsen. Ernährungswissenschaftler Uwe Knop lüftet das Geheimnis hinter dieser unwiderstehlichen Kombination.Von FOCUS-online-Expert…",https://p6.focus.de/img/fotos/id_260196884/gettyimages-500374975.jpg?im=Crop%3D%280%2C289%2C3462%2C1731%29%3BResize%3D%281200%2C627%29&impolicy=perceptual&quality=mediumHigh&hash=84d32f318150e5104b5ec3386c31a40b3f99609a7710a60e43bd90bbead3fce9,2024-08-05T10:31:51Z,,"<ul><li>
Kommentare</li><li>
E-Mail</li><li>
Teilen</li><li>
Mehr</li><li>
Twitter</li><li>
Drucken</li><li>
Feedback</li><li>
Fehler meldenSie haben einen Fehler gefunden?
Bitte markieren S… [+4707 chars]",,de,'Freibad'
https://www.bild.de/sport/olympia/olympia-2024-hitze-flucht-der-deutschen-hockey-damen-66b0b0ec2c601a58390ce35c,https://www.bild.de/sport/olympia/olympia-2024-hitze-flucht-der-deutschen-hockey-damen-66b0b0ec2c601a58390ce35c,0,www.bild.de,Im Viertelfinale gegen Argentinien - Hitze-Flucht der deutschen Hockey-Damen,Besondere Maßnahme unsere Hockey-Damen! Beim olympischen Viertelfinalspiel gegen Argentinien schützen sie sich vor der Sonne.,"https://images.bild.de/66b0b0ec2c601a58390ce35c/dee07bbae35a9e4c495d882316bb79e0,8989375a?w=1280",2024-08-05T11:09:49Z,,"Besondere Maßnahme unsere Hockey-Damen!
Beim olympischen Viertelfinalspiel gegen Argentinien (
hier im Live-Ticker) knallt die Pariser Hitze nur ins Yves-Du-Manoir Stadion. Aktuell sind in der fran… [+548 chars]",,de,'Sonne'
https://www.focus.de/wissen/natur/meteorologie/wetter-in-deutschland-hitze-und-gewitter-in-deutschland-diese-staedte-sind-am-mittwoch-betroffen_id_260198117.html,https://www.focus.de/wissen/natur/meteorologie/wetter-in-deutschland-hitze-und-gewitter-in-deutschland-diese-staedte-sind-am-mittwoch-betroffen_id_260198117.html,0,www.focus.de,Wetter in Deutschland - Tief Nicole überzieht Deutschland mit Gewittern: Diese Städte sind betroffen,Die Luft über Deutschland heizt sich auf. Hoher Luftdruck sorgt für sommerliche Temperaturen und viel Sonnenschein am Dienstag. Doch schon am Mittwoch bringt Tief Nicole neue Gewitter.,https://p6.focus.de/img/fotos/id_260200529/de-gewitter-mi-teaser.jpg?im=Crop%3D%280%2C60%2C1920%2C960%29%3BResize%3D%281200%2C627%29&impolicy=perceptual&quality=mediumHigh&hash=5e91fa3832186157c55a4f16f0faf8d357e04f7ef8b8b959dca6937251e3a1ec,2024-08-05T11:34:40Z,,"Die Luft über Deutschland heizt sich auf. Hoher Luftdruck sorgt für sommerliche Temperaturen und viel Sonnenschein am Dienstag. Doch schon am Mittwoch bringt Tief Nicole neue Gewitter.
Am Dienstag k… [+3038 chars]",,de,'Hitze'
https://www.focus.de/wissen/natur/meteorologie/wetter-in-deutschland-superzellen-und-hitzewarnungen-das-erwartet-uns-in-den-naechsten-tagen_id_260198117.html,https://www.focus.de/wissen/natur/meteorologie/wetter-in-deutschland-superzellen-und-hitzewarnungen-das-erwartet-uns-in-den-naechsten-tagen_id_260198117.html,0,www.focus.de,"Wetter in Deutschland - Hitze-Comeback über Deutschland, doch die nächste Superzelle droht schon",Nach einer kurzen Abkühlung kehrt die Hitze zurück nach Deutschland. Bereits am Dienstag springen die Temperaturen wieder in die Höhe. Doch neue Gewitter rollen schon am Mittwoch an. Dann auch wieder mit Superzellen-Gefahr.,https://p6.focus.de/img/fotos/id_260198116/de-august-superzellen.jpg?im=Crop%3D%280%2C60%2C1920%2C960%29%3BResize%3D%281200%2C627%29&impolicy=perceptual&quality=mediumHigh&hash=8740a838c1f9f1c9b702c12aaccbc4a198f64468e31c85810d1504d23987477f,2024-08-05T11:34:40Z,,Nach einer kurzen Abkühlung kehrt die Hitze zurück nach Deutschland. Bereits am Dienstag springen die Temperaturen wieder in die Höhe. Doch neue Gewitter rollen schon am Mittwoch an. Dann auch wieder… [+1154 chars],,de,'Hitze'
https://www.welt.de/reise/deutschland/article243445547/Camping-So-wird-der-Urlaub-selbst-fuer-Anti-Camper-attraktiv.html,https://www.welt.de/reise/deutschland/article243445547/Camping-So-wird-der-Urlaub-selbst-fuer-Anti-Camper-attraktiv.html,0,www.welt.de,So wird Camping selbst für Anti-Camper attraktiv,"Nähe zur Natur und ein Gefühl der Freiheit – das suchen viele, die mit einem Caravan Urlaub machen. Tatsächlich landen sie dann aber oft auf Campingplätzen, auf denen alles streng reguliert ist. Doch es gibt Hoffnung: Manche Stellplatzbetreiber bieten neue Fo…",https://img.welt.de/img/reise/deutschland/mobile243445545/7931354577-ci16x9-w1200/Friends-relaxing-in-front-of-camper-van.jpg,2024-08-05T13:06:36Z,,"Mit Campingplätzen ist das eine heikle Angelegenheit. Wenn man Pech hat, kann solch ein ritualisierter Urlaub zur Hölle werden, fremdbestimmt durch Vorschriften, Verbote, Parzellengrenzen, kontrollie… [+2972 chars]",,de,'Natur'
https://www.stern.de/panorama/unwetter--sturm--debby--erreicht-us-bundesstaat-florida-34952170.html,https://www.stern.de/panorama/unwetter--sturm--debby--erreicht-us-bundesstaat-florida-34952170.html,0,www.stern.de,"Unwetter: Sturm ""Debby"" erreicht US-Bundesstaat Florida","Heftiger Regen und starke Winde: Wegen Sturm ""Debby"" gelten im Süden der USA Unwetterwarnungen, Flüge wurden gestrichen. Viele haben keinen Strom. Mindestens drei Menschen sterben.",https://image.stern.de/34952172/t/Z_/v1/w1440/r1.7778/-/05--4bzzz6axnnv23axw800h600jpeg---01a6d6b980a64e98.jpg,2024-08-05T16:04:38Z,,"Heftiger Regen und starke Winde: Wegen Sturm ""Debby"" gelten im Süden der USA Unwetterwarnungen, Flüge wurden gestrichen. Viele haben keinen Strom. Mindestens drei Menschen sterben.
Sturm ""Debby"" ist… [+1287 chars]",,de,'Regen'
https://www.tagesspiegel.de/gesellschaft/panorama/unwetter-sturm-debby-erreicht-us-bundesstaat-florida-12149252.html,https://www.tagesspiegel.de/gesellschaft/panorama/unwetter-sturm-debby-erreicht-us-bundesstaat-florida-12149252.html,0,www.tagesspiegel.de,Unwetter: Sturm „Debby“ erreicht US-Bundesstaat Florida,"Heftiger Regen und starke Winde: Wegen Sturm „Debby“ gelten im Süden der USA Unwetterwarnungen, Flüge wurden gestrichen. Viele haben keinen Strom. Mindestens drei Menschen sterben.",https://www.tagesspiegel.de/images/12149249/alternates/BASE_16_9_W1400/1722873932000/sturm-debby.jpeg,2024-08-05T16:05:32Z,,Sturm Debby ist im US-Bundesstaat Florida als Hurrikan der Kategorie 1 von 5 auf Land getroffen und wurde wenig später zu einem Tropensturm zurückgestuft. Laut Medienberichten kostete das Unwetter me… [+1855 chars],,de,'Regen'
https://www.morgenpost.de/bezirke/charlottenburg-wilmersdorf/article406953897/wilmersdorfer-wohnhaus-geflutet-nun-waechst-der-schimmel.html,https://www.morgenpost.de/bezirke/charlottenburg-wilmersdorf/article406953897/wilmersdorfer-wohnhaus-geflutet-nun-waechst-der-schimmel.html,0,www.morgenpost.de,Wilmersdorfer Wohnhaus geflutet: Nun wächst der Schimmel,Der Alptraum in der Mecklenburgischen Straße will nicht enden. Am Sonntag drang wieder Regen ein – dabei warnen Mieter schon lange.,https://img.sparknews.funkemedien.de/406954976/406954976_1722874807_v16_9_1600.jpeg,2024-08-05T16:20:07Z,,Berlin. Der Alptraum in der Mecklenburgischen Straße will nicht enden. Am Sonntag drang wieder Regen ein dabei warnen Mieter schon lange.,,de,'Regen'
https://www.faz.net/aktuell/gesellschaft/ungluecke/florida-sturmtief-debby-erreicht-sueden-der-usa-mehrere-tote-19901748.html,https://www.faz.net/aktuell/gesellschaft/ungluecke/florida-sturmtief-debby-erreicht-sueden-der-usa-mehrere-tote-19901748.html,0,www.faz.net,Mehrere Tote: Sturm „Debby“ erreicht US-Bundesstaat Florida,"Seit dem frühen Morgen sorgt Sturm „Debby“ im Süden der USA für heftigen Wind und Regen, es gelten Unwetterwarnungen. Mindestens drei Menschen starben infolge des Unwetters, viele Haushalte sind ohne Strom.",https://media1.faz.net/ppmedia/aktuell/feuilleton/1536156387/1.9901753/facebook_teaser/ueberspuelte-strassen-das.jpg,2024-08-05T18:04:44Z,,"Ein Teenager sei nahe der Stadt Fanning Springs gestorben, nachdem ein Baum in einer Wohnwagensiedlung auf einen der Trailer gefallen sei, hieß es beim Sender WCJB. Der Sender NBC News berichtete übe… [+1124 chars]",,de,'Regen'
https://taz.de/Die-Verkehrswende-ist-machbar/!6028593/,https://taz.de/Die-Verkehrswende-ist-machbar/!6028593/,0,taz.de,Die Verkehrswende ist machbar: Hamburg hat kein schlechtes Wetter,"Regen und Wind dürften Hamburger selten vom Radeln abhalten, eher schon die Temperaturen, sagt eine Studie. Mit etwas Flexibilität bleibt man trocken.",https://taz.de/picture/7162139/948/219440524-1.jpeg,2024-08-05T19:00:00Z,,"Regen und Wind dürften Hamburger selten vom Radeln abhalten, eher schon die Temperaturen, sagt eine Studie. Mit etwas Flexibilität bleibt man trocken.
Kommt weniger häufig vor als man denkt: Radfahr… [+4812 chars]",,de,'Regen'
https://www.zeit.de/news/2024-08/06/giftiges-jakobskreuzkraut-breitet-sich-im-suedwesten-aus,https://www.zeit.de/news/2024-08/06/giftiges-jakobskreuzkraut-breitet-sich-im-suedwesten-aus,0,www.zeit.de,Natur: Giftiges Jakobskreuzkraut breitet sich im Südwesten aus,Hier finden Sie Informationen zu dem Thema „Natur“. Lesen Sie jetzt „Giftiges Jakobskreuzkraut breitet sich im Südwesten aus“.,https://img.zeit.de/news/2024-08/06/giftiges-jakobskreuzkraut-breitet-sich-im-suedwesten-aus-image-group/wide__1300x731,2024-08-06T02:00:43Z,,Es ist giftig und breitet sich auch im Südwesten immer mehr aus: Das gelbe Jakobskreuzkraut stellt vor allem für Pferde und Rinder eine Gefahr dar. Die heimische Pflanze mag besonders sonnige und tro… [+3190 chars],,de,'Natur'
https://www.stern.de/gesellschaft/regional/hessen/deutscher-wetterdienst--wechselhaftes-sommerwetter-in-hessen-34953412.html,https://www.stern.de/gesellschaft/regional/hessen/deutscher-wetterdienst--wechselhaftes-sommerwetter-in-hessen-34953412.html,0,www.stern.de,Deutscher Wetterdienst: Wechselhaftes Sommerwetter in Hessen,"Sonne, Regen, Sonne, Regen: Es bleibt wechselhaft in Hessen. Immerhin für heute können sich die Menschen auf blauen Himmel und nur ein paar Wolken freuen.",https://image.stern.de/34953414/t/o4/v1/w1440/r1.7778/-/06--pfmv76q34av11axw800h600jpeg---10054c215ac6b97b.jpg,2024-08-06T06:45:26Z,,"Sonne, Regen, Sonne, Regen: Es bleibt wechselhaft in Hessen. Immerhin für heute können sich die Menschen auf blauen Himmel und nur ein paar Wolken freuen.
Der Sommer zeigt sich weiterhin in seiner f… [+1021 chars]",,de,'Regen'
https://www.zeit.de/news/2024-08/06/sommerwetter-im-norden-temperaturen-bis-28-grad,https://www.zeit.de/news/2024-08/06/sommerwetter-im-norden-temperaturen-bis-28-grad,0,www.zeit.de,Deutscher Wetterdienst: Sommerwetter im Norden – Temperaturen bis 28 Grad,Hier finden Sie Informationen zu dem Thema „Deutscher Wetterdienst“. Lesen Sie jetzt „Sommerwetter im Norden – Temperaturen bis 28 Grad“.,https://img.zeit.de/news/2024-08/06/sommerwetter-im-norden-temperaturen-bis-28-grad-image-group/wide__1300x731,2024-08-06T06:47:57Z,,Der Deutsche Wetterdienst (DWD) hat Sommerwetter für Hamburg und Schleswig-Holstein vorausgesagt. Tagsüber sei es heiter und trocken bei Temperaturen von bis zu 28 Grad Celsius auf dem Festland und 2… [+417 chars],,de,'Temperaturen'
https://www.stern.de/gesellschaft/regional/hamburg-schleswig-holstein/deutscher-wetterdienst--sommerwetter-im-norden---temperaturen-bis-28-grad-34953422.html,https://www.stern.de/gesellschaft/regional/hamburg-schleswig-holstein/deutscher-wetterdienst--sommerwetter-im-norden---temperaturen-bis-28-grad-34953422.html,0,www.stern.de,Deutscher Wetterdienst: Sommerwetter im Norden – Temperaturen bis 28 Grad,Hamburg/Kiel (lno) - Der Deutsche Wetterdienst (DWD) hat Sommerwetter für Hamburg und Schleswig-Holstein vorausgesagt. Tagsüber sei es heiter und trocken,https://image.stern.de/34953424/t/Oj/v1/w1440/r1.7778/-/06--bj3kj7urnyv11axw800h600jpeg---090f34eadd17a3bd.jpg,2024-08-06T06:47:57Z,,"Die Bewohner Hamburgs und Schleswig-Holsteins dürfen sich auf Sommerwetter freuen. Für Mittwoch sagt der Deutsche Wetterdienst aber Gewitter voraus.
Der Deutsche Wetterdienst (DWD) hat Sommerwetter … [+576 chars]",,de,'Temperaturen'
https://www.autobild.de/artikel/dtm-pirelli-entwickelt-neue-slickreifen-26355629.html,https://www.autobild.de/artikel/dtm-pirelli-entwickelt-neue-slickreifen-26355629.html,0,www.autobild.de,DTM als Testlabor für GT3-Reifen,"Pirelli ist exklusiver Reifenausrüster in der DTM. 2024 kamen neue Regenreifen, 2025 sind neue Slicks geplant.",https://i.auto-bild.de/ir_img/3/6/4/9/5/7/7/DTM_Pirelli_16_9-18b5fd9cfb12d3b7.jpg?impolicy=og_images,2024-08-06T07:06:00Z,,Am kommenden Wochenende steht das DTM-Rennen am Nürburgring auf dem Programm. Mirko Bortolotti (SSR Performance) will im Lamborghini Huracan GT3 dann seine Tabellenführung verteidigen. Sechs Punkte V… [+1942 chars],,de,'Regen'
https://www.stern.de/gesellschaft/regional/rheinland-pfalz-saarland/wetter--wechselhafte-woche-in-rheinland-pfalz-und-saarland-34953486.html,https://www.stern.de/gesellschaft/regional/rheinland-pfalz-saarland/wetter--wechselhafte-woche-in-rheinland-pfalz-und-saarland-34953486.html,0,www.stern.de,Wetter: Wechselhafte Woche in Rheinland-Pfalz und Saarland,In Rheinland-Pfalz und dem Saarland zeigt sich die Sonne bei heißen Temperaturen. Im Laufe der Woche wechselt sich die Sonne oft mit Wolken und Niederschlägen ab.,https://image.stern.de/34953488/t/ec/v1/w1440/r1.7778/-/06--demkaitwnfv6axw800h600jpeg---ff6e58fd8a37ed76.jpg,2024-08-06T07:08:12Z,,"In Rheinland-Pfalz und dem Saarland zeigt sich die Sonne bei heißen Temperaturen. Im Laufe der Woche wechselt sich die Sonne oft mit Wolken und Niederschlägen ab.
Sonne und Regen wechseln sich diese… [+1079 chars]",,de,'Sonne'
https://www.focus.de/panorama/wetter-in-deutschland-sommer-und-sonne-kehren-zurueck-hitzewarnungen-im-sueden_id_54933749.html,https://www.focus.de/panorama/wetter-in-deutschland-sommer-und-sonne-kehren-zurueck-hitzewarnungen-im-sueden_id_54933749.html,0,www.focus.de,"Wetter im Ticker - Sommer und Sonne kehren zurück, Hitzewarnungen im Süden",Das Sommerwetter war lang ersehnt - und kommt nach einem gewittrigen Wochenende wieder nach Deutschland zurück - wenn auch nur kurz. Im Südwesten gelten in mehreren Kreisen amtliche Hitzewarnungen für den Dienstag. Ab Mittwoch werden wieder Schauer erwartet. …,https://p6.focus.de/img/regional/rheinland-pfalz/id_260193770/nach-dicken-wolken-wird-es-immer-waermer.jpg?im=Crop%3D%280%2C171%2C2048%2C1024%29%3BResize%3D%281200%2C627%29&impolicy=perceptual&quality=mediumHigh&hash=4522f08d44bdbae641e9043f46c3557734971dafc4f418eded7cf68f5d5f73d8,2024-08-06T07:21:41Z,,Das Sommerwetter war lang ersehnt - und kommt nach einem gewittrigen Wochenende wieder nach Deutschland zurück - wenn auch nur kurz. Im Südwesten gelten in mehreren Kreisen amtliche Hitzewarnungen fü… [+9369 chars],,de,'Hitze'
https://www.kicker.de/den-eigenen-atem-nicht-gehoert-triathlon-staffel-feiert-gold-im-champagner-regen-1042630/video,https://www.kicker.de/den-eigenen-atem-nicht-gehoert-triathlon-staffel-feiert-gold-im-champagner-regen-1042630/video,0,www.kicker.de,"""Den eigenen Atem nicht gehört"": Triathlon-Staffel feiert Gold im Champagner-Regen",Video: Die deutsche Mixed-Staffel hat im Triathlon die Goldmedaille gewonnen. Nach dem Zieleinlauf wurde das Quartett im Deutschen Haus empfangen und sprach über den packenden Wettkampf.,https://derivates.kicker.de/image/upload/c_crop%2Cx_572%2Cy_133%2Cw_2972%2Ch_1672/w_1200%2Cq_auto/v1/2024/08/06/9b9fb9c1-0014-4cdf-906d-4b4b5885196d.jpeg,2024-08-06T08:00:34Z,,"Werbung und Tracking: Um dir relevante Inhalte und personalisierte Werbung anzubieten, setzen wir Cookies und andere Technologien ein. Damit messen wir, wie und womit du unsere Angebote nutzt. Diese … [+1979 chars]",,de,'Regen'
https://www.bild.de/news/wetter/extrem-sommer-im-anmarsch-ab-sonntag-droht-hitzeblase-mit-40-grad-66b1bee3c3cfd352dfe78b18,https://www.bild.de/news/wetter/extrem-sommer-im-anmarsch-ab-sonntag-droht-hitzeblase-mit-40-grad-66b1bee3c3cfd352dfe78b18,0,www.bild.de,Bis zu 40 Grad - Jetzt kommen die Hitzeblasen!,Heiß ist es ja. Am Mittwoch rauschen ein paar Hitze-Unwetter durch Deutschland. Und dann knallen die Temperaturen mal so richtig nach oben!,"https://images.bild.de/66b1bee3c3cfd352dfe78b18/bed8a3405c20a334a5145405fb03ee4e,1542d8e?w=1280",2024-08-06T08:48:56Z,,"Am Mittwoch rauschen ein paar Hitze-Unwetter durch Deutschland. Und dann knallen die Temperaturen mal so richtig nach oben!
Der August fährt auf der sommerlichen Schiene weiter. Die Höchstwerte erre… [+1906 chars]",,de,'Temperaturen'
https://www.zeit.de/news/2024-08/06/outdoor-apps-koennten-beim-naturschutz-helfen,https://www.zeit.de/news/2024-08/06/outdoor-apps-koennten-beim-naturschutz-helfen,0,www.zeit.de,"Wandern, Biken, Touren gehen: Outdoor-Apps könnten beim Naturschutz helfen","Hier finden Sie Informationen zu dem Thema „Wandern, Biken, Touren gehen“. Lesen Sie jetzt „Outdoor-Apps könnten beim Naturschutz helfen“.",https://img.zeit.de/news/2024-08/06/outdoor-apps-koennten-beim-naturschutz-helfen-image-group/wide__1300x731,2024-08-06T09:18:16Z,,"Viele Outdoor-Apps weisen bei der Tourenplanung nicht auf Schutzgebiete und dort geltende Regeln hin - dabei könnten sie sogar helfen, die Natur besser zu schützen. Zu diesem Ergebnis kommt ein Fachb… [+4077 chars]",,de,'Natur'
https://www.zeit.de/news/2024-08/06/aktive-sonne-zahlreiche-sonnenflecken-sichtbar,https://www.zeit.de/news/2024-08/06/aktive-sonne-zahlreiche-sonnenflecken-sichtbar,0,www.zeit.de,Astronomie: Aktive Sonne: Zahlreiche Sonnenflecken sichtbar,Hier finden Sie Informationen zu dem Thema „Astronomie“. Lesen Sie jetzt „Aktive Sonne: Zahlreiche Sonnenflecken sichtbar“.,https://img.zeit.de/news/2024-08/06/aktive-sonne-zahlreiche-sonnenflecken-sichtbar-image-group/wide__1300x731,2024-08-06T09:18:55Z,,"Die Zahl der dunklen Sonnenflecken ist derzeit so hoch wie seit 20 Jahren nicht. «Wir sind gerade auf dem Maximum eines relativ starken Sonnenzyklus», erklärt Sonnenphysiker Achim Gandorfer vom Max-P… [+2917 chars]",,de,'Sonne'
https://www.stern.de/gesellschaft/regional/berlin-brandenburg/erste-bilanz--regenwetter-kann-melonenernte-in-velten-nicht-trueben-34954994.html,https://www.stern.de/gesellschaft/regional/berlin-brandenburg/erste-bilanz--regenwetter-kann-melonenernte-in-velten-nicht-trueben-34954994.html,0,www.stern.de,Erste Bilanz: Regenwetter kann Melonenernte in Velten nicht trüben,"""Melonenmann"" Attila Puszti gilt als der einzige gewerbsmäßige Melonen-Anbauer in Brandenburg. In diesem Jahr regnete es viel - doch das tat der Ernte nicht nur schlecht.",https://image.stern.de/34954996/t/bz/v1/w1440/r1.7778/-/06--zxf5wpat4bv14axw800h600jpeg---f5214aeacee8cc73.jpg,2024-08-06T12:24:08Z,,"""Melonenmann"" Attila Puszti gilt als der einzige gewerbsmäßige Melonen-Anbauer in Brandenburg. In diesem Jahr regnete es viel - doch das tat der Ernte nicht nur schlecht.
Genug gelbe Melonen, steige… [+1333 chars]",,de,'Regen'
https://www.zeit.de/news/2024-08/06/regenwetter-kann-melonenernte-in-velten-nicht-trueben,https://www.zeit.de/news/2024-08/06/regenwetter-kann-melonenernte-in-velten-nicht-trueben,0,www.zeit.de,Erste Bilanz: Regenwetter kann Melonenernte in Velten nicht trüben,Hier finden Sie Informationen zu dem Thema „Erste Bilanz“. Lesen Sie jetzt „Regenwetter kann Melonenernte in Velten nicht trüben“.,https://img.zeit.de/news/2024-08/06/regenwetter-kann-melonenernte-in-velten-nicht-trueben-image-group/wide__1300x731,2024-08-06T12:24:08Z,,"Genug gelbe Melonen, steigende Nachfrage: Der als «Melonenmann» bekanntgewordene Landwirt Attila Puszti ist mit der laufenden Melonenernte in Velten im Kreis Oberhavel zufrieden. Zwar habe der viele … [+1895 chars]",,de,'Regen'
https://www.tagesspiegel.de/berlin/erste-bilanz-regenwetter-kann-melonenernte-in-velten-nicht-truben-12153473.html,https://www.tagesspiegel.de/berlin/erste-bilanz-regenwetter-kann-melonenernte-in-velten-nicht-truben-12153473.html,0,www.tagesspiegel.de,Erste Bilanz: Regenwetter kann Melonenernte in Velten nicht trüben,„Melonenmann“ Attila Puszti gilt als der einzige gewerbsmäßige Melonen-Anbauer in Brandenburg. In diesem Jahr regnete es viel - doch das tat der Ernte nicht nur schlecht.,https://www.tagesspiegel.de/images/12153470/alternates/BASE_16_9_W1400/1722947104000/melonenmann-aus-velten.jpeg,2024-08-06T12:25:04Z,,"Genug gelbe Melonen, steigende Nachfrage: Der als Melonenmann bekanntgewordene Landwirt Attila Puszti ist mit der laufenden Melonenernte in Velten im Kreis Oberhavel zufrieden. Zwar habe der viele Re… [+1242 chars]",,de,'Regen'
