index,url,valid,domain,title,description,image,published,archive,content,quote,language,keyword
https://www.zeit.de/news/2022-11/22/mildere-temperaturen-in-berlin-und-brandenburg-erwartet,https://www.zeit.de/news/2022-11/22/mildere-temperaturen-in-berlin-und-brandenburg-erwartet,0,www.zeit.de,Vorhersage: Mildere Temperaturen in Berlin und Brandenburg erwartet,,,2022-11-22T05:40:40Z,https://web.archive.org/web/20221123181332/https://www.zeit.de/news/2022-11/22/mildere-temperaturen-in-berlin-und-brandenburg-erwartet,"When browsing with ads:
We collect personal data and also transmit it to third-party providers
 that help us improve and finance our digital content. Some of the information stored on your device, … [+732 chars]",,de,'Temperaturen'
https://www.stern.de/gesellschaft/regional/berlin-brandenburg/vorhersage--mildere-temperaturen-in-berlin-und-brandenburg-erwartet-32935044.html,https://www.stern.de/gesellschaft/regional/berlin-brandenburg/vorhersage--mildere-temperaturen-in-berlin-und-brandenburg-erwartet-32935044.html,0,www.stern.de,Vorhersage: Mildere Temperaturen in Berlin und Brandenburg erwartet,"Die Thermometer in Berlin und Brandenburg steigen wieder etwas an. Bis zum Vormittag kann es im Westen Brandenburgs noch örtlich zu gefrierendem Regen und Glatteis auf den Straßen und Gehwegen kommen, sonst bleibt es aber trocken, wie der Deutsche Wetterdiens…",https://image.stern.de/32935046/t/vh/v1/w1440/r1.7778/-/22--urnnewsmldpacom2009010122112299612245v3w800h600l665t153r1945b996jpeg---b5c0972ef420606b.jpg,2022-11-22T05:40:40Z,https://web.archive.org/web/20221122055820/https://www.stern.de/gesellschaft/regional/berlin-brandenburg/vorhersage--mildere-temperaturen-in-berlin-und-brandenburg-erwartet-32935044.html,Die Thermometer in Berlin und Brandenburg steigen wieder etwas an. Bis zum Vormittag kann es im Westen Brandenburgs noch örtlich zu gefrierendem Regen und Glatteis auf den Straßen und Gehwegen kommen… [+772 chars],,de,'Glatteis'
https://www.focus.de/panorama/wetter-aktuell/wetter-in-deutschland-im-ticker-etwas-mildere-temperaturen-in-berlin-und-brandenburg-erwartet_id_54933749.html,https://www.focus.de/panorama/wetter-aktuell/wetter-in-deutschland-im-ticker-etwas-mildere-temperaturen-in-berlin-und-brandenburg-erwartet_id_54933749.html,0,www.focus.de,Wetterlage im Ticker - Wetterdienst warnt vor Glatteis in vier Bundesländern,Die Temperaturen in Deutschland sinken. Schneien soll es zwar vorerst nicht mehr. Jedoch warnt der Wetterdienst vor Glatteis in einigen Bundesländern. In Berlin und Brandenburg werden etwas mildere Temperaturen erwartet. Alle News zum Wetter im Ticker im Über…,https://p6.focus.de/img/regional/mecklenburg-vorpommern/id_180201012/ein-pkw-waehrt-in-den-morgenstunden-bei-glatteis-und-nebel-ueber-eine-strasse..jpg?im=Crop%3D%280%2C75%2C2048%2C1024%29%3BResize%3D%281200%2C627%29&impolicy=perceptual&quality=medium&hash=cca1d0dca831f8560463822027e389618d81d4ad82623c438e09bdbebea4c5f3,2022-11-22T05:44:25Z,https://web.archive.org/web/20221122070618/https://www.focus.de/panorama/wetter-aktuell/wetter-in-deutschland-im-ticker-etwas-mildere-temperaturen-in-berlin-und-brandenburg-erwartet_id_54933749.html,Die Temperaturen in Deutschland sinken. Schneien soll es zwar vorerst nicht mehr. Jedoch warnt der Wetterdienst vor Glatteis in einigen Bundesländern. In Berlin und Brandenburg werden etwas mildere T… [+10356 chars],,de,'Glatteis'
https://www.zeit.de/news/2022-11/22/schnee-und-glaettegefahr-in-hamburg-und-schleswig-holstein,https://www.zeit.de/news/2022-11/22/schnee-und-glaettegefahr-in-hamburg-und-schleswig-holstein,0,www.zeit.de,Winterwetter: Schnee und Glättegefahr in Hamburg und Schleswig-Holstein,,,2022-11-22T06:06:59Z,,"When browsing with ads:
We collect personal data and also transmit it to third-party providers
 that help us improve and finance our digital content. Some of the information stored on your device, … [+732 chars]",,de,'Schnee'
https://www.stern.de/gesellschaft/regional/hamburg-schleswig-holstein/wetter--stadtreinigung-beginnt-winterdienst-auf-strassen-und-radwegen-32935186.html,https://www.stern.de/gesellschaft/regional/hamburg-schleswig-holstein/wetter--stadtreinigung-beginnt-winterdienst-auf-strassen-und-radwegen-32935186.html,0,www.stern.de,Wetter: Stadtreinigung beginnt Winterdienst auf Straßen und Radwegen,Wegen drohendem Glatteis durch Regen und Minustemperaturen hat die Hamburger Stadtreinigung in der Nacht zum Dienstag den Winterdienst-Einsatz begonnen. Vorsorglich wurden bereits die wichtigsten Straßen und ein ausgewähltes Netz an Fahrradwegen mit Feuchtsal…,https://image.stern.de/32935188/t/00/v1/w1440/r1.7778/-/22--urnnewsmldpacom2009010122112299612789v3w800h600l640t384r1920b1152jpeg---d9730797725ea2b8.jpg,2022-11-22T06:59:42Z,https://web.archive.org/web/20221122071233/https://www.stern.de/gesellschaft/regional/hamburg-schleswig-holstein/wetter--stadtreinigung-beginnt-winterdienst-auf-strassen-und-radwegen-32935186.html,Wegen drohendem Glatteis durch Regen und Minustemperaturen hat die Hamburger Stadtreinigung in der Nacht zum Dienstag den Winterdienst-Einsatz begonnen. Vorsorglich wurden bereits die wichtigsten Str… [+1181 chars],,de,'Regen'
https://www.faz.net/aktuell/politik/ausland/ukraine-krieg-regen-und-schlamm-setzen-truppen-von-russland-und-ukraine-zu-18479715.html,https://www.faz.net/aktuell/politik/ausland/ukraine-krieg-regen-und-schlamm-setzen-truppen-von-russland-und-ukraine-zu-18479715.html,0,www.faz.net,Krieg in der Ukraine: Regen und Schlamm setzen den Kriegsparteien zu,Die herbstliche Schlammperiode behindert russische und ukrainische Truppen im Osten der Ukraine erheblich. Die Kämpfe konzentrieren sich auf wenige Städte und Stellungen am Fluss Dnipro.,https://media1.faz.net/ppmedia/aktuell/politik/4171976103/1.8479713/facebook_teaser/ukrainische-soldaten-stehen.jpg,2022-11-22T16:00:01Z,https://web.archive.org/web/20221122170445/https://www.faz.net/aktuell/politik/ausland/ukraine-krieg-regen-und-schlamm-setzen-truppen-von-russland-und-ukraine-zu-18479715.html,Die herbstliche Schlammperiode behindert die Kriegsparteien im Osten der Ukraine mittlerweile erheblich bei ihren Operationen. Das amerikanische Institut für Kriegsstudien (ISW) berichtete am Diensta… [+3570 chars],,de,'Regen'
https://www.tagesspiegel.de/berlin/dramatische-anzahl-von-kollisionsopfern-immer-wieder-prallen-vogel-gegen-die-glasfassaden-der-ber-terminals-8907103.html,https://www.tagesspiegel.de/berlin/dramatische-anzahl-von-kollisionsopfern-immer-wieder-prallen-vogel-gegen-die-glasfassaden-der-ber-terminals-8907103.html,0,www.tagesspiegel.de,„Dramatische Anzahl von Kollisionsopfern“: Immer wieder prallen Vögel gegen die Glasfassaden der BER-Terminals,Tierschützern fordern in einem offenen Brief eine umfassende Vogelschutz-Sanierung des Hauptstadtflughafens. Regelmäßig fänden Experten tote Tiere am BER.,https://www.tagesspiegel.de/berlin/images/1000155/alternates/BASE_16_9_W1400/1000155.jpeg,2022-11-22T16:44:27Z,,"Die Vielzahl der Vögel, die gegen Glasflächen des Flughafens BER prallen und dabei sterben oder sich verletzen, haben Naturschützer auf den Plan gerufen. 
Fünf Umwelt- und Tierschutzverbände fordern… [+3229 chars]",,de,'Vögel'
https://www.faz.net/aktuell/feuilleton/buehne-und-konzert/wajdi-mouawads-voegel-abgesetzt-18479870.html,https://www.faz.net/aktuell/feuilleton/buehne-und-konzert/wajdi-mouawads-voegel-abgesetzt-18479870.html,0,www.faz.net,Absetzung der „Vögel“,"Das Stuttgarter Preisfiasko zieht weite Kreise. Jetzt setzt das Münchner Metropoltheater das Erfolgsstück „Vögel“ von Wajdi Mouawad ab, weil es angeblich antisemitische Passagen beinhalte.",https://media0.faz.net/ppmedia/aktuell/3582796416/1.8480220/facebook_teaser/die-voegel-am-muenchner-metropoltheater.jpg,2022-11-22T16:49:51Z,,Vorauseilender Gehorsam am Me­tropoltheater in München: Nachdem der Europäische Dramatikerpreis für die mit Antisemitismusvorwürfen konfrontierte britische Dramatikerin Caryl Churchill zurückgezogen … [+1742 chars],,de,'Vögel'
https://www.morgenpost.de/vermischtes/article236975337/emu-tiktok-australien-emmanuel-usa.html,https://www.morgenpost.de/vermischtes/article236975337/emu-tiktok-australien-emmanuel-usa.html,0,www.morgenpost.de,USA: Emu-Hype in den USA – jetzt warnen Farmer vor dem Vogel,"Bei TikTok und Instagram sind Aufnahmen mit Emus der Hit. Doch Farmer warnen davor, dass die Vögel nicht unterschätzt werden sollten.",https://img.morgenpost.de/img/incoming/crop236975185/2842601560-w820-cv16_9-q85/Emu.jpg,2022-11-22T17:28:09Z,,"Sidney. Emmanuel, der Emu, ist in den USA ein Haushaltsname. Als er vermeintlich an der Vogelgrippe erkrankt war, fieberte das ganze Land mit. Als sich seine Krankheit rein als Stressreaktion herauss… [+4286 chars]",,de,'Vögel'
https://www.sueddeutsche.de/muenchen/muenchen-heute-der-frauennotruf-wird-30-jahre-alt-wie-es-zur-absetzung-des-theaterstuecks-voegel-kam-1.5701290,https://www.sueddeutsche.de/muenchen/muenchen-heute-der-frauennotruf-wird-30-jahre-alt-wie-es-zur-absetzung-des-theaterstuecks-voegel-kam-1.5701290,0,www.sueddeutsche.de,"München heute: Der Frauennotruf wird 30 Jahre alt / Wie es zur Absetzung des Theaterstücks ""Vögel"" kam","Aktuelle News aus München: Der Frauennotruf wird 30 Jahre alt / Wie es zur Absetzung des Theaterstücks ""Vögel"" kam",https://www.sueddeutsche.de/image/sz.1.5701208/1200x675?v=1669137091,2022-11-22T17:33:16Z,,"Nachrichten und Lesenswertes aus der Stadt.Statistisch betrachtet erleben rund 60 Prozent aller Frauen in Deutschland sexuelle Belästigung, jede siebte wird im Laufe ihres Lebens Opfer strafrechtlich… [+3425 chars]",,de,'Vögel'
https://www.n-tv.de/mediathek/videos/wetter/Regen-gefriert-im-Nordosten-Schnee-faellt-an-den-Alpen-article23732765.html,https://www.n-tv.de/mediathek/videos/wetter/Regen-gefriert-im-Nordosten-Schnee-faellt-an-den-Alpen-article23732765.html,0,www.n-tv.de,"Nachts teils glatt: Regen gefriert im Nordosten, Schnee fällt an den Alpen","Bevor sich tagsüber der Schnee weitgehend auflöst, wird es in der Nacht stellenweise gefährlich glatt. Im Nordosten gefriert der Regen, während an den Alpen Schnee fällt. Am Mittwoch ziehen dann neue, teils kräftige Regenschauer von Südwesten ins Land.",https://bilder2.n-tv.de/img/incoming/crop23735865/7131325132-cImg_16_9-w1200/imago0144880170h.jpg,2022-11-22T17:49:00Z,https://web.archive.org/web/20221122175541/https://www.n-tv.de/mediathek/videos/wetter/Regen-gefriert-im-Nordosten-Schnee-faellt-an-den-Alpen-article23732765.html,,,de,'Schnee'
https://taz.de/Buch-ueber-Pflanzen-und-Raeusche/!5894280/,https://taz.de/Buch-ueber-Pflanzen-und-Raeusche/!5894280/,0,taz.de,Buch über Pflanzen und Räusche: Flower Power,Nüchternheit ist von der Natur nicht vorgesehen: Jakob Hein und Kat Menschik haben ein Buch über „Psychoaktive Pflanzen“ herausgebracht.,https://taz.de/picture/5926699/948/WE-s24-3-sp-1.jpeg,2022-11-22T18:06:00Z,https://web.archive.org/web/20221122182413/https://taz.de/Buch-ueber-Pflanzen-und-Raeusche/!5894280/,"Nüchternheit ist von der Natur nicht vorgesehen: Jakob Hein und Kat Menschik haben ein Buch über Psychoaktive Pflanzen herausgebracht.
Die Natur selbst ist psychedelisch. Illustration zu Menschik/He… [+2171 chars]",,de,'Natur'
https://www.zeit.de/news/2022-11/23/mildere-temperaturen-in-berlin-und-brandenburg,https://www.zeit.de/news/2022-11/23/mildere-temperaturen-in-berlin-und-brandenburg,0,www.zeit.de,Wetter: Mildere Temperaturen in Berlin und Brandenburg,,,2022-11-23T05:45:03Z,https://web.archive.org/web/20221123062449/https://www.zeit.de/news/2022-11/23/mildere-temperaturen-in-berlin-und-brandenburg,"When browsing with ads:
We collect personal data and also transmit it to third-party providers
 that help us improve and finance our digital content. Some of the information stored on your device, … [+732 chars]",,de,'Temperaturen'
https://www.n-tv.de/mediathek/videos/wetter/Sturmboeen-fegen-ueber-Inseln-und-Berge-article23735343.html,https://www.n-tv.de/mediathek/videos/wetter/Sturmboeen-fegen-ueber-Inseln-und-Berge-article23735343.html,0,www.n-tv.de,Kräftiger Regen von Westen: Sturmböen fegen über Inseln und Berge,"Die Sonne bricht sich zwar immer wieder Bahn und verdrängt vorerst den Schnee, doch viel blauer Himmel ist nicht lange zu sehen. Denn von Westen zieht bereits teils kräftiger Regen auf. Über Inseln und Berge im Westen fegen außerdem stürmische Böen hinweg.",https://bilder1.n-tv.de/img/incoming/crop23735988/9801329145-cImg_16_9-w1200/384810122.jpg,2022-11-23T05:54:00Z,https://web.archive.org/web/20221123060939/https://www.n-tv.de/mediathek/videos/wetter/Sturmboeen-fegen-ueber-Inseln-und-Berge-article23735343.html,,,de,'Regen'
https://www.stern.de/gesellschaft/regional/hessen/wetter--regen--schauer-und-etwas-sonne-in-hessen-32939228.html,https://www.stern.de/gesellschaft/regional/hessen/wetter--regen--schauer-und-etwas-sonne-in-hessen-32939228.html,0,www.stern.de,"Wetter: Regen, Schauer und etwas Sonne in Hessen","Regen, vereinzelte Schauer und nur etwas Sonne erwarten die Menschen in Hessen in den kommenden Tagen. Der Mittwoch beginnt mit einzelnen Schauern, die bis zum Vormittag nachlassen, wie der Deutsche Wetterdienst (DWD) in Offenbach mitteilte. Im weiteren Tages…",https://image.stern.de/32939230/t/OP/v1/w1440/r1.7778/-/23--urnnewsmldpacom2009010122112399626782v3w800h600l652t263r1932b1113jpeg---e98f43e925155d62.jpg,2022-11-23T06:07:47Z,https://web.archive.org/web/20221123062756/https://www.stern.de/gesellschaft/regional/hessen/wetter--regen--schauer-und-etwas-sonne-in-hessen-32939228.html,"Regen, vereinzelte Schauer und nur etwas Sonne erwarten die Menschen in Hessen in den kommenden Tagen. Der Mittwoch beginnt mit einzelnen Schauern, die bis zum Vormittag nachlassen, wie der Deutsche … [+1181 chars]",,de,'Sonne'
https://www.zeit.de/news/2022-11/23/regen-schauer-und-etwas-sonne-in-hessen,https://www.zeit.de/news/2022-11/23/regen-schauer-und-etwas-sonne-in-hessen,0,www.zeit.de,"Wetter: Regen, Schauer und etwas Sonne in Hessen",,,2022-11-23T06:07:47Z,,"When browsing with ads:
We collect personal data and also transmit it to third-party providers
 that help us improve and finance our digital content. Some of the information stored on your device, … [+732 chars]",,de,'Regen'
https://www.morgenpost.de/flughafen-BER/article236978079/Flughafen-BER-Hunderte-tote-Voegel-Massenkollisionen.html,https://www.morgenpost.de/flughafen-BER/article236978079/Flughafen-BER-Hunderte-tote-Voegel-Massenkollisionen.html,0,www.morgenpost.de,Alarm von Naturschützern: Flughafen BER: Hunderte tote Vögel – „Massenkollisionen“,Berliner Naturschützer machen auf den massenhaften Vogelschlag am Flughafen BER aufmerksam – und zeigen erschütternde Fotos.,https://img.morgenpost.de/img/incoming/crop236978047/5822603532-w820-cv16_9-q85/nabu-wegworth.jpg,2022-11-23T06:17:28Z,,"Berlin/Schönefeld. Am Flughafen BER verenden massenhaft Vögel an den Glasfassaden der Terminals. Darauf machen einmal mehr Berliner Naturschutzorganisationen in einem offenen Brief aufmerksam.
Die V… [+2441 chars]",,de,'Vögel'
https://www.bild.de/bild-plus/regional/frankfurt/frankfurt-aktuell/40-meter-ueber-kassel-ich-bin-der-fliegende-weihnachtsmann-82030086.bild.html,https://www.bild.de/bild-plus/regional/frankfurt/frankfurt-aktuell/40-meter-ueber-kassel-ich-bin-der-fliegende-weihnachtsmann-82030086.bild.html,0,www.bild.de,40 Meter über Buden und Besuchern - Ich bin der fliegende Weihnachtsmann,"Sie glauben, der Weihnachtsmann im fliegenden Rentier-Schlitten sei nur eine nette Legende? Dann waren sie noch nicht auf dem Märchen-Weihnachtsmarkt in Kassel!","https://images.bild.de/637d14a7378c520d06894ed8/1026a0fe76f55faa74c01dd33707e96f,c66b73b9?w=1280",2022-11-23T06:35:15Z,https://web.archive.org/web/20221123064025/https://www.bild.de/bild-plus/regional/frankfurt/frankfurt-aktuell/40-meter-ueber-kassel-ich-bin-der-fliegende-weihnachtsmann-82030086.bild.html,"Sie glauben, der Weihnachtsmann im fliegenden Rentier-Schlitten sei nur eine nette Legende? Dann waren Sie noch nicht auf dem Märchen-Weihnachtsmarkt auf dem Friedrichsplatz!
Wer so tollkühn über Ka… [+35 chars]",,de,'Schlitten'
https://www.stern.de/gesellschaft/regional/nordrhein-westfalen/wochenvorschau--wechselhaftes-wetter-in-nordrhein-westfalen-32939418.html,https://www.stern.de/gesellschaft/regional/nordrhein-westfalen/wochenvorschau--wechselhaftes-wetter-in-nordrhein-westfalen-32939418.html,0,www.stern.de,Wochenvorschau: Wechselhaftes Wetter in Nordrhein-Westfalen,"Von Wolken, Regen, Schauern bis zu gelegentlichen Auflockerungen ist in Nordrhein-Westfalen in den kommenden Tagen alles dabei. Am Mittwoch sei zunächst mit örtlichen Schauern zu rechnen, die aber im Tagesverlauf nachlassen, teilte der Deutsche Wetterdienst (…",https://image.stern.de/32939420/t/OV/v1/w1440/r1.7778/-/23--urnnewsmldpacom2009010122112399627254v2w800h600l150t1247r2495b2814jpeg---dbf4dcfd50e0b14f.jpg,2022-11-23T07:03:54Z,https://web.archive.org/web/20221123072721/https://www.stern.de/gesellschaft/regional/nordrhein-westfalen/wochenvorschau--wechselhaftes-wetter-in-nordrhein-westfalen-32939418.html,"Von Wolken, Regen, Schauern bis zu gelegentlichen Auflockerungen ist in Nordrhein-Westfalen in den kommenden Tagen alles dabei. Am Mittwoch sei zunächst mit örtlichen Schauern zu rechnen, die aber im… [+1166 chars]",,de,'Regen'
https://www.bild.de/regional/stuttgart/stuttgart-aktuell/baeume-weg-damit-eidechsen-sich-sonnen-koennen-82032616.bild.html,https://www.bild.de/regional/stuttgart/stuttgart-aktuell/baeume-weg-damit-eidechsen-sich-sonnen-koennen-82032616.bild.html,0,www.bild.de,"Für den Artenschutz wird Natur zerstört - Bäume weg, damit Eidechsen sich sonnen können",Stuttgart – Das erste Ärgernis waren die Kosten. Für die Umsiedlung von Eidechsen geben die S 21-Projektpartner rund 20 Mio. Euro  aus.,"https://images.bild.de/637dcfa2252d3f53886cb613/6471d003270c45801962cd8d3240094b,bd6c8162?w=1280",2022-11-23T08:10:39Z,http://archive.md/20221123214555/https://www.bild.de/regional/stuttgart/stuttgart-aktuell/baeume-weg-damit-eidechsen-sich-sonnen-koennen-82032616.bild.html,"Stuttgart Das erste Ärgernis waren die Kosten. Für die Umsiedlung von Eidechsen geben die S 21-Projektpartner rund 20 Mio. Euro aus (BILD berichtete).
Doch der Irrsinn um die streng geschützten Rept… [+1398 chars]",,de,'Vögel'
https://www.diepresse.com/6218785/fluechtlinge-wie-die-laender-den-bund-im-regen-stehen-lassen,https://www.diepresse.com/6218785/fluechtlinge-wie-die-laender-den-bund-im-regen-stehen-lassen,0,www.diepresse.com,Flüchtlinge: Wie die Länder den Bund im Regen stehen lassen [premium],Die Länder setzen die Vorgaben des Bundes nicht um: von Wohnen über Gelder bis Arbeitsmarkt.,https://media.diepresse.com/social_diepresse_magazin_paid/images/uploads_1200/4/2/1/6218785/Migration-Austria_166919279631214_v0_l.jpg,2022-11-23T09:06:00Z,https://web.archive.org/web/20221123100950/https://www.diepresse.com/6218785/fluechtlinge-wie-die-laender-den-bund-im-regen-stehen-lassen,"Die Länder setzen die Vorgaben des Bundes nicht um: von Wohnen über Gelder bis Arbeitsmarkt.
Ex-Kanzler Sebastian Kurz schloss nach eigenen Angaben die Balkanroute. Sie ist wieder voll in Betrieb: Z… [+1239 chars]",,de,'Regen'
https://www.welt.de/vermischtes/article242283485/Tierschuetzer-ueben-Kritik-Hauptstadtflughafen-BER-wird-zur-Todesfalle-fuer-Voegel.html,https://www.welt.de/vermischtes/article242283485/Tierschuetzer-ueben-Kritik-Hauptstadtflughafen-BER-wird-zur-Todesfalle-fuer-Voegel.html,0,www.welt.de,Hauptstadtflughafen BER wird zur Todesfalle für Vögel,"Zahlreiche Vögel sind am Berliner Flughafen BER bereits verendet, weil die Tiere die Scheiben nicht als Hindernis erkennen und dagegen schlagen. Betroffen seien auch bedrohte Arten. Das Problem sei der Flughafengesellschaft seit 2012 bekannt, klagen Tierschüt…",https://img.welt.de/img/vermischtes/mobile242284859/6541351807-ci16x9-w1200/Hauptstadtflughafen-BER.jpg,2022-11-23T09:10:57Z,,Jedes Jahr prallen zahlreiche Vögel gegen die Glasscheiben des Hauptstadtflughafens BER und sterben in einem offenen Brief an die Betreiber haben Umweltverbände nun mehr Schutzmaßnahmen für die Tiere… [+1667 chars],,de,'Vögel'
https://www.der-postillon.com/2022/11/rasensprenger.html,https://www.der-postillon.com/2022/11/rasensprenger.html,0,www.der-postillon.com,Können Regenbogen erzeugen: Katar verbietet Rasensprenger,"Doha (dpo) - Per Eilgesetz hat Katar heute den Einsatz von Rasensprengern zur Bewässerung von Sportplätzen, Parks und privaten Gärten verboten. Zuvor gingen mehrere Hinweise bei den katarischen Behörden ein, dass bei künstlicher Beregnung Regenbogen erzeugt w…",https://blogger.googleusercontent.com/img/b/R29vZ2xl/AVvXsEjy-oQChqCu0Nk6Af2eSaPRrJq6FMXITtZPoP5Lx6m9VIsmg8w6fpdGwXaauaQrlTk-rQvHHGzptmd0PPgFzhp703Kksrkveu0HTYjCjUfHvCjB9aqB0Zwgkyocmk3kiemj8Ixjy1v1zrCqeJ1UghDZKnMgkAabSMVugsD9I6rXgbW551VbmAMcbZ8kXQ/w1200-h630-p-k-no-nu/shutterstock_193014092.jpg,2022-11-23T09:50:40Z,https://web.archive.org/web/20221123094859/https://www.der-postillon.com/2022/11/rasensprenger.html,"Doha (dpo) - Per Eilgesetz hat Katar heute den Einsatz von Rasensprengern zur Bewässerung von Sportplätzen, Parks und privaten Gärten verboten. Zuvor gingen mehrere Hinweise bei den katarischen Behör… [+1188 chars]",,de,'Regen'
https://www.freitag.de/autoren/lfb/antisemitismus-im-muenchner-metropol-theater-die-einen-sagen-so-die-anderen-so,https://www.freitag.de/autoren/lfb/antisemitismus-im-muenchner-metropol-theater-die-einen-sagen-so-die-anderen-so,0,www.freitag.de,Meinung | Antisemitismus im Münchner Metropol-Theater?!,"Nach Kritik jüdischer Verbände hat das Metropol-Theater in München das Stück „Vögel“ abgesetzt. Die Vorwürfe sind ernst zu nehmen, doch die Gemengelage komplex und eine Klärung nicht mehr möglich Wajdi Mouawad hat ein sehr erfolgreiches Stück geschrieben. 201…",https://www.freitag.de/autoren/lfb/antisemitismus-im-muenchner-metropol-theater-die-einen-sagen-so-die-anderen-so/@@images/social_image,2022-11-23T11:45:00Z,,"Wajdi Mouawad hat ein sehr erfolgreiches Stück geschrieben. 2017 in Paris uraufgeführt, wurde Vögel in der 2018 entstandenen Fassung für den deutschsprachigen Raum hier bereits auf gut 20 Bühnen insz… [+3173 chars]",,de,'Vögel'
https://www.sueddeutsche.de/panorama/promis-titanic-kate-winslet-koenig-charles-iii-franz-beckenbauer-elizabeth-ii-1.5701735,https://www.sueddeutsche.de/panorama/promis-titanic-kate-winslet-koenig-charles-iii-franz-beckenbauer-elizabeth-ii-1.5701735,0,www.sueddeutsche.de,Leute: Nomen est Omen,"Kate Winslet wurde einst ""Korsett-Kate"" genannt, die Queen als eine Art Regenbringerin angesehen und Franz Beckenbauer will noch eine Weile als Fußballkaiser erhalten bleiben.",https://www.sueddeutsche.de/image/sz.1.2987838/1200x675?v=1669208007,2022-11-23T12:42:26Z,https://web.archive.org/web/20221123124453/https://www.sueddeutsche.de/panorama/promis-titanic-kate-winslet-koenig-charles-iii-franz-beckenbauer-elizabeth-ii-1.5701735,"Kate Winslet wurde einst ""Korsett-Kate"" genannt, die Queen als eine Art Regenbringerin angesehen und Franz Beckenbauer will noch eine Weile als Fußballkaiser erhalten bleiben. Kate Winslet, 47, Schau… [+3160 chars]",,de,'Regen'
https://www.tagesspiegel.de/berlin/neuer-waldzustandsbericht-fur-berlin-nur-jeder-50-baum-ist-noch-gesund-8910262.html,https://www.tagesspiegel.de/berlin/neuer-waldzustandsbericht-fur-berlin-nur-jeder-50-baum-ist-noch-gesund-8910262.html,0,www.tagesspiegel.de,Neuer Waldzustandsbericht für Berlin: Nur jeder 50. Baum ist noch gesund,Der Effekt der jahrelangen Dürre und Wärme ist dramatisch. Mit Massen neuer Laubbäume sollen die Berliner Wälder an die Klimakrise angepasst werden.,https://www.tagesspiegel.de/berlin/images/winterwaldjpg/alternates/BASE_16_9_W1400/winterwaldjpg.jpeg,2022-11-23T13:03:17Z,,Noch nie seit der deutsch-deutschen Wiedervereinigung waren Berlins Wälder in derart schlechtem Zustand wie jetzt. Laut dem am Mittwoch von der Umweltverwaltung veröffentlichten Waldzustandsbericht w… [+4519 chars],,de,'Hitze'
https://www.sueddeutsche.de/muenchen/glaspalast-h2-zentrum-fuer-gegenwartskunst-augsburg-ausstellung-zeichnung-1.5701876,https://www.sueddeutsche.de/muenchen/glaspalast-h2-zentrum-fuer-gegenwartskunst-augsburg-ausstellung-zeichnung-1.5701876,0,www.sueddeutsche.de,"Ausstellung in Augsburg: Blätter, die die Welt bedeuten","Die sehenswerte Augsburger Ausstellung ""Nacktheit der Zeichnung"" präsentiert 90 Arbeiten von 29 Künstlern im Glaspalast darunter große Namen wie Georg Baselitz oder Jonathan Meese.",https://www.sueddeutsche.de/image/sz.1.5701879/1200x675?v=1669211687,2022-11-23T13:54:55Z,https://web.archive.org/web/20221123142237/https://www.sueddeutsche.de/muenchen/glaspalast-h2-zentrum-fuer-gegenwartskunst-augsburg-ausstellung-zeichnung-1.5701876,"Die sehenswerte Augsburger Ausstellung ""Nacktheit der Zeichnung"" präsentiert 90 Arbeiten von 29 Künstlern im Glaspalast darunter große Namen wie Georg Baselitz oder Jonathan Meese.Eigentlich hätte di… [+3483 chars]",,de,'Blätter'
