index,url,valid,domain,title,description,image,published,archive,content,quote,language,keyword
https://www.stern.de/gesellschaft/regional/bayern/freizeit--bayerns-freibadbetreiber-hoffen-auf-den-wetterumschwung-33708502.html,https://www.stern.de/gesellschaft/regional/bayern/freizeit--bayerns-freibadbetreiber-hoffen-auf-den-wetterumschwung-33708502.html,0,www.stern.de,Freizeit: Bayerns Freibadbetreiber hoffen auf den Wetterumschwung,"Gewitter, Regen, Sturm - und kalt war es: In den vergangenen Wochen hat in Bayern kein Freibadwetter geherrscht. Die Städte reagierten oft mit eingeschränkten Öffnungszeiten oder gar Schließungen der Bäder. Nun soll der Sommer eine zweite Chance bekommen.",https://image.stern.de/33708504/t/yE/v1/w1440/r1.7778/-/04--urnnewsmldpacom2009010123080499694286v2w800h600l1245t710r3740b2136jpeg---2f7e3fda0a622481.jpg,2023-08-04T03:22:25Z,,"Gewitter, Regen, Sturm - und kalt war es: In den vergangenen Wochen hat in Bayern kein Freibadwetter geherrscht. Die Städte reagierten oft mit eingeschränkten Öffnungszeiten oder gar Schließungen der… [+3910 chars]",,de,'Freibad'
https://www.tagesspiegel.de/berlin/sie-haben-einen-stubenkoller-zehn-tipps-fur-schietwetter-in-berlin-10258486.html,https://www.tagesspiegel.de/berlin/sie-haben-einen-stubenkoller-zehn-tipps-fur-schietwetter-in-berlin-10258486.html,0,www.tagesspiegel.de,Sie haben einen Stubenkoller?: Zehn Tipps für Schietwetter in Berlin,Über Berlin haben sich die Regenwolken festgekrallt und Gummistiefel stehen an der Tagesordnung. Doch wie gelingt der Ferienspaß trotz Mistwetter? Wir geben Tipps.,https://www.tagesspiegel.de/images/burg-herzberg-festival-2023-30072023-breitenbach-am-herzberg-deutschland-ger-das-burg-herzberg-festival-feiert/alternates/BASE_16_9_W1400/burg-herzberg-festival-2023---30072023-breitenbach-am-herzberg-deutschland-ger---das-burg-herzberg-festival-feiert.jpeg,2023-08-04T06:39:21Z,,"Es schifft und schifft und schifft. Für das Freibad ist es zu kalt, im Hallenbad sind die Tickets rar. Doch zu Hause gehen Sie die Wände hoch. Was tun? Wir verraten, wie der Urlaub trotz Schietwetter… [+81 chars]",,de,'Freibad'
https://www.morgenpost.de/bezirke/pankow/article239105461/sommerbad-rechter-vorfall-pruegelt-euch-am-mittelmeer.html,https://www.morgenpost.de/bezirke/pankow/article239105461/sommerbad-rechter-vorfall-pruegelt-euch-am-mittelmeer.html,0,www.morgenpost.de,Besucher belästigt: „Prügelt euch am Mittelmeer“: Rechter Vorfall vor Freibad,Eine rechtsextreme Gruppe hat laut Berliner Senat migrantisch wirkende Besucher des Sommerbads Pankow belästigt. Eine Person trug eine besondere Waffe.,https://img.morgenpost.de/img/pankow/crop239105459/6037546767-w820-cv16_9-q85-fnov-fpi231768577-fpotl/441ee366-32ae-11ee-8470-5a07cef0dd2a.jpg,2023-08-04T10:24:58Z,,=tqbo dmbttµ#bsujdmf``mpdbujpo#?Cfsmjo/'octq´=0tqbo?Fjo pggfocbs sfdiutfyusfn npujwjfsufs [xjtdifogbmm ibu tjdi wps efn Tpnnfscbe =b isfgµ#iuuqt;00xxx/npshfoqptu/ef0cf{jslf0qbolpx0# ubshfuµ#`cmbol#?Q… [+13142 chars],,de,'Freibad'
https://www.sueddeutsche.de/bayern/bayern-freibadsaison-wetter-regen-1.6096166,https://www.sueddeutsche.de/bayern/bayern-freibadsaison-wetter-regen-1.6096166,0,www.sueddeutsche.de,Freizeit: Bayerns Freibadbetreiber hoffen auf den Wetterumschwung,Wegen des durchwachsenen Wetters ist die Freibadsaison in Bayern bisher nicht richtig in Tritt gekommen. Nächste Woche aber könnte der Sommer mit Temperaturen über 25 Grad zurückkehren.,https://www.sueddeutsche.de/image/sz.1.6096167/1200x675?v=1691148721,2023-08-04T11:32:06Z,,Wegen des durchwachsenen Wetters ist die Freibadsaison in Bayern bisher nicht richtig in Tritt gekommen. Nächste Woche aber könnte der Sommer mit Temperaturen über 25 Grad zurückkehren.Kälte und imme… [+3680 chars],,de,'Freibad'
https://www.stern.de/gesellschaft/dauerregen--verdammter--verkorkster-sommer--womit-habe-ich-dich-verdient--33709232.html,https://www.stern.de/gesellschaft/dauerregen--verdammter--verkorkster-sommer--womit-habe-ich-dich-verdient--33709232.html,0,www.stern.de,"Die Beschissenheit des Sommers: Weine ich oder ist das der Regen, der von meiner Oberlippe tropft?","Sie hassen das Wetter und wissen nicht, wohin mit der Wut? Dann geht es Ihnen wie unserem Autor. Oder finden Sie, ""ein wenig Regen habe noch niemandem geschadet""? Dann würde unser Autor seine Wut gerne an Ihnen auslassen. Er hält diesen Sommer, der keiner ist…",https://image.stern.de/33706616/t/9J/v5/w1440/r1.7778/-/ist-lueften-bei-regen-sinnvoll--as-85160998.jpg,2023-08-04T12:03:00Z,,"Im Radio haben sie noch die Hoffnung, die mir längst abhanden gekommen ist. ""In der zweiten Augusthälfte"", jubelte dort eine Morningshowfrau mit der diesen Leuten ganz eigenen Unerschütterlichkeit, ""… [+8269 chars]",,de,'Freibad'
https://www.tagesspiegel.de/berlin/vor-dem-sommerbad-in-berlin-pankow-neonazis-versuchten-offenbar-badegaste-einzuschuchtern-10266064.html,https://www.tagesspiegel.de/berlin/vor-dem-sommerbad-in-berlin-pankow-neonazis-versuchten-offenbar-badegaste-einzuschuchtern-10266064.html,0,www.tagesspiegel.de,"Vor dem Sommerbad in Berlin-Pankow: Neonazis versuchten offenbar, Badegäste einzuschüchtern",Anfang Juli soll eine Gruppe Rechtsextremer vor dem Freibad demonstriert haben. Dabei trugen sie laut Senat ein Banner mit der Aufschrift: „Prügelt euch am Mittelmeer“.,https://www.tagesspiegel.de/images/img6610jpeg/alternates/BASE_16_9_W1400/img6610jpeg.jpeg,2023-08-04T14:57:52Z,,"Mehrere Rechtsextreme sollen Anfang Juli versucht haben, Besucher:innen des Sommerbades in Pankow einzuschüchtern. Dort war es wenige Tage vorher zu Ausschreitungen zwischen Badbesuchern und Sicherhe… [+3781 chars]",,de,'Freibad'
https://taz.de/Berliner-Gewaltdebatten/!5952340/,https://taz.de/Berliner-Gewaltdebatten/!5952340/,0,taz.de,"Berliner Gewaltdebatten: Hauptsache, es knallt!","Silvester, Freibad, Görli – die drei Debatten in diesem Jahr zeigen: An Lösungen ist kaum einer interessiert, umso mehr aber an rassistischen Ressentiments.",https://taz.de/picture/6431260/948/204191973-1.jpeg,2023-08-04T17:00:00Z,,"Silvester, Freibad, Görli die drei Debatten in diesem Jahr zeigen: An Lösungen ist kaum einer interessiert, umso mehr aber an rassistischen Ressentiments.
Die Mutter der jüngsten Gewaltdebatte: Silv… [+3175 chars]",,de,'Freibad'
https://www.tagesspiegel.de/gesellschaft/panorama/winterartiger-einsatz-in-reutlingen-schneepfluge-raumen-30-zentimeter-hohe-hagel-schicht-weg-10267681.html,https://www.tagesspiegel.de/gesellschaft/panorama/winterartiger-einsatz-in-reutlingen-schneepfluge-raumen-30-zentimeter-hohe-hagel-schicht-weg-10267681.html,0,www.tagesspiegel.de,Wintertypischer Einsatz in Reutlingen: Schneepflüge räumen 30 Zentimeter hohe Hagel-Schicht weg,Auf den ersten Blick wirkte es wie eine dicke Schneedecke. Die Reutlinger Innenstadt wurde am Freitag von Hagel bedeckt. So musste Wintergerät zum Einsatz kommen – mitten im Sommer.,https://www.tagesspiegel.de/images/unwetter-in-reutlingen-hagel/alternates/BASE_16_9_W1400/unwetter-in-reutlingen---hagel.jpeg,2023-08-04T19:31:30Z,,Winterdienst-Einsatz mitten im Sommer: Ein lokal begrenztes Unwetter hat Straßen in der Innenstadt von Reutlingen in Baden-Württemberg am Freitag mit einer 30 Zentimeter hohen Hagel-Schicht überzogen… [+3028 chars],,de,'Blätter'
https://www.n-tv.de/panorama/Warum-Law-und-Order-bei-Freibad-Rowdies-scheitern-muss-article24305595.html,https://www.n-tv.de/panorama/Warum-Law-und-Order-bei-Freibad-Rowdies-scheitern-muss-article24305595.html,0,www.n-tv.de,"Linnemann für schnellen Prozess: Warum ""Law und Order"" bei Freibad-Rowdies scheitern muss","CDU-Generalsekretär Linnemann pocht auf Schnellverfahren für Freibad-Randalierer. Dass diese zur Verantwortung gezogen müssen, steht außer Frage. Allerdings ist das Urteil auf die Schnelle keine Lösung. Es durchzudrücken wäre eine Gefahr für wichtige Regeln d…",https://bilder1.n-tv.de/img/incoming/crop24305608/9151328145-cImg_16_9-w1200/416268829.jpg,2023-08-05T06:11:11Z,,"CDU-Generalsekretär Linnemann pocht auf Schnellverfahren für Freibad-Randalierer. Dass diese zur Verantwortung gezogen müssen, steht außer Frage. Allerdings ist das Urteil auf die Schnelle keine Lösu… [+9522 chars]",,de,'Freibad'
https://www.bild.de/regional/ruhrgebiet/ruhrgebiet-aktuell/chemikalien-vermischt-giftalarm-im-freibad-in-witten-ein-verletzter-84940764.bild.html,https://www.bild.de/regional/ruhrgebiet/ruhrgebiet-aktuell/chemikalien-vermischt-giftalarm-im-freibad-in-witten-ein-verletzter-84940764.bild.html,0,www.bild.de,Chemikalien vermischten sich - Freibad nach Gift-Unfall geräumt,Großalarm und Evakuierung im Spaßbad. Das bekannte Freizeitbad Heveney am Kemnader See musste wegen eines Chemieunfalls geräumt werden.,"https://images.bild.de/64ce22a197f8bb6b2ff1feb3/3f6c381313351520d61e4e6b9544bfd0,3b6635a7?w=1280",2023-08-05T11:28:10Z,,"Witten (NRW) Großalarm und Evakuierung im Spaßbad alle mussten raus! Schuld waren giftige Dämpfe aus einem Technikraum. 
Das Freizeitbad Heveney am Kemnader See (
Ennepe-Ruhr-Kreis) hatte erst kurz… [+1320 chars]",,de,'Freibad'
https://www.zeit.de/news/2023-08/05/chlorgasaustritt-freibad-vorsorglich-geraeumt,https://www.zeit.de/news/2023-08/05/chlorgasaustritt-freibad-vorsorglich-geraeumt,0,www.zeit.de,Freizeit: Chlorgasaustritt: Freibad vorsorglich geräumt,,,2023-08-05T13:57:55Z,,"When browsing with ads:
We collect personal data and also transmit it to third-party providers
 that help us improve and finance our digital content. Some of the information stored on your device, … [+821 chars]",,de,'Freibad'
https://www.zeit.de/gesellschaft/zeitgeschehen/2023-08/papst-franziskus-weltjugendtag-lissabon-gesundheit-sorgen,https://www.zeit.de/gesellschaft/zeitgeschehen/2023-08/papst-franziskus-weltjugendtag-lissabon-gesundheit-sorgen,0,www.zeit.de,"Papst Franziskus: ""Auf den letzten Metern muss ein Priester brennen""",Papst Franziskus will beim katholischen Weltjugendtag in Lissabon präsent sein bis zum Schluss – trotz Hitze und vollem Programm. Verantwortliche sorgen sich nun um ihn.,,2023-08-06T08:02:50Z,https://web.archive.org/web/20230806211129/https://www.zeit.de/gesellschaft/zeitgeschehen/2023-08/papst-franziskus-weltjugendtag-lissabon-gesundheit-sorgen,"When browsing with ads:
We collect personal data and also transmit it to third-party providers
 that help us improve and finance our digital content. Some of the information stored on your device, … [+821 chars]",,de,'Hitze'
https://www.zeit.de/hamburg/2023-08/regenwetter-sommer-aktivitaeten-hamburg-freibad-open-air-kino,https://www.zeit.de/hamburg/2023-08/regenwetter-sommer-aktivitaeten-hamburg-freibad-open-air-kino,0,www.zeit.de,"Regenwetter im Sommer: Egal, ich mach' das trotzdem","Der Sommer fällt ins Wasser. Aber was, wenn man das Schön-Wetter-Programm dennoch durchzieht, von Freibad bis Open-Air-Kino? Ein Selbstversuch in Gummistiefeln.",,2023-08-06T11:54:46Z,https://web.archive.org/web/20230807022207/https://www.zeit.de/hamburg/2023-08/regenwetter-sommer-aktivitaeten-hamburg-freibad-open-air-kino,"When browsing with ads:
We collect personal data and also transmit it to third-party providers
 that help us improve and finance our digital content. Some of the information stored on your device, … [+821 chars]",,de,'Regen'
