index,url,valid,domain,title,description,image,published,archive,content,quote,language,keyword
https://www.zeit.de/news/2024-03/05/regen-und-wolken-am-dienstag-in-thueringen-erwartet,https://www.zeit.de/news/2024-03/05/regen-und-wolken-am-dienstag-in-thueringen-erwartet,0,www.zeit.de,Wetter: Regen und Wolken am Dienstag in Thüringen erwartet,Hier finden Sie Informationen zu dem Thema „Wetter“. Lesen Sie jetzt „Regen und Wolken am Dienstag in Thüringen erwartet“.,https://img.zeit.de/news/2024-03/05/regen-und-wolken-am-dienstag-in-thueringen-erwartet-image-group/wide__1300x731,2024-03-05T05:49:01Z,,"Auf viele Wolken und teilweise Regen müssen sich die Menschen in Thüringen am Dienstag einstellen. Nebelig-trüb startet der Vormittag, wie der Deutsche Wetterdienst mitteilte. Im Tagesverlauf bleibt … [+303 chars]",,de,'Regen'
https://www.zeit.de/news/2024-03/05/schnee-und-regen-in-bayern,https://www.zeit.de/news/2024-03/05/schnee-und-regen-in-bayern,0,www.zeit.de,Wetter: Schnee und Regen in Bayern,Hier finden Sie Informationen zu dem Thema „Wetter“. Lesen Sie jetzt „Schnee und Regen in Bayern“.,https://img.zeit.de/news/2024-03/05/schnee-und-regen-in-bayern-image-group/wide__1300x731,2024-03-05T07:46:19Z,,"Regenschauer und Schneefälle werden in Bayern erwartet. Bei 7 bis 13 Grad soll es ab Dienstagnachmittag vor allem im Südwesten des Freistaats nass werden, wie der Deutsche Wetterdienst (DWD) mitteilt… [+764 chars]",,de,'Regen'
https://www.welt.de/politik/deutschland/article250403434/Gruenen-Politiker-Hofreiter-Ich-schaeme-mich-wie-sehr-ich-mich-geirrt-habe-ueber-die-Natur-Putins.html,https://www.welt.de/politik/deutschland/article250403434/Gruenen-Politiker-Hofreiter-Ich-schaeme-mich-wie-sehr-ich-mich-geirrt-habe-ueber-die-Natur-Putins.html,0,www.welt.de,"„Ich schäme mich, wie sehr ich mich geirrt habe über die Natur Putins“",2014 annektierte Russland völkerrechtswidrig die Krim. Damals sprach sich Grünen-Politiker Anton Hofreiter dennoch gegen Waffenlieferungen an die Ukraine aus. Inzwischen hat er seine Meinung geändert – und gesteht in der Debatte bei „Hart aber fair“ rückblick…,https://img.welt.de/img/politik/deutschland/mobile250404560/2001358567-ci16x9-w1200/Anton-Hofreiter.jpg,2024-03-05T09:49:28Z,,"Der russische Angriffskrieg auf die Ukraine geht ins dritte Jahr, mittlerweile droht Putin Europa mit dem Einsatz von Atombomben. Am Montagabend sprach deshalb Moderator Louis Klamroth bei Hart aber … [+1757 chars]",,de,'Natur'
https://www.focus.de/wissen/natur/meteorologie/bis-zu-30-zentimeter-neuschnee-turbo-winter-im-sueden-schneefall-bis-muenchen-ab-heute-abend_id_259730590.html,https://www.focus.de/wissen/natur/meteorologie/bis-zu-30-zentimeter-neuschnee-turbo-winter-im-sueden-schneefall-bis-muenchen-ab-heute-abend_id_259730590.html,0,www.focus.de,Schneefall bis nach München - Turbo-Winter startet noch heute! Was uns im Süden erwartet,Auf einmal kommt der Schnee zurück. Im Süden setzt Dauerschneefall ein. In 36 Stunden können hier bis zu 30 Zentimeter Neuschnee zusammenkommen. Teile des Südens schneien geradezu ein.,https://p6.focus.de/img/fotos/id_259730342/fol-turbo-winter2.jpg?im=Crop%3D%280%2C60%2C1920%2C960%29%3BResize%3D%281200%2C627%29&impolicy=perceptual&quality=mediumHigh&hash=ec0302ed77970a20815ddb74a7eff0cee0e745430d618146ae16b31871f4652a,2024-03-05T12:08:52Z,,Auf einmal kommt der Schnee zurück. Im Süden setzt Dauerschneefall ein. In 36 Stunden können hier bis zu 30 Zentimeter Neuschnee zusammenkommen. Teile des Südens schneien geradezu ein.Am Dienstagaben… [+2072 chars],,de,'Schlitten'
https://www.zeit.de/news/2024-03/05/superhelden-schlitten-zoll-fertigt-batmobil-ab,https://www.zeit.de/news/2024-03/05/superhelden-schlitten-zoll-fertigt-batmobil-ab,0,www.zeit.de,Buntes: Superhelden-Schlitten - Zoll fertigt «Batmobil» ab,"Hier finden Sie Informationen zu dem Thema „Buntes“. Lesen Sie jetzt „Superhelden-Schlitten - Zoll fertigt ""Batmobil"" ab“.",https://img.zeit.de/news/2024-03/05/superhelden-schlitten-zoll-fertigt-batmobil-ab-image-group/wide__1300x731,2024-03-05T13:55:15Z,,"Mit einem Flitzer für Superhelden hat es das Zollamt Untermünkheim nahe Schwäbisch Hall zu tun gehabt: Dort wurde ein «Batmobil» zur Einfuhrverzollung angemeldet, wie das Hauptzollamt Heilbronn mitte… [+846 chars]",,de,'Schlitten'
https://www.brigitte.de/leben/nach-der-winterpause--das-ist-der-perfekte-zeitpunkt--um-das-erste-mal-rasen-zu-maehen-13780926.html,https://www.brigitte.de/leben/nach-der-winterpause--das-ist-der-perfekte-zeitpunkt--um-das-erste-mal-rasen-zu-maehen-13780926.html,0,www.brigitte.de,"Nach der Winterpause: Das ist der perfekte Zeitpunkt, um das erste Mal Rasen zu mähen","Der Frühling steht vor der Tür und das bedeutet nicht nur, dass die Blätter an Bäumen und Frühblüher wachsen, auch unser Rasen erwacht aus dem Winterschlaf. Im Video verraten wir, wie du deinen Garten frühlingsfit bekommst und wann der perfekte Zeitpunkt ist,…",https://image.brigitte.de/13780846/t/AC/v2/w1440/r1.7778/-/rasenmaeher.jpg,2024-03-05T15:31:00Z,,"Der Frühling steht vor der Tür und das bedeutet nicht nur, dass die Blätter an Bäumen und Frühblüher wachsen, auch unser Rasen erwacht aus dem Winterschlaf. Im Video verraten wir, wie du deinen Garte… [+729 chars]",,de,'Blätter'
https://www.kino.de/film/dune-2-2023/news/dune-2-star-verraet-gleich-in-seiner-ersten-woche-brachen-leute-beim-dreh-zusammen/,https://www.kino.de/film/dune-2-2023/news/dune-2-star-verraet-gleich-in-seiner-ersten-woche-brachen-leute-beim-dreh-zusammen/,0,www.kino.de,„Dune 2“-Star verrät: Gleich in seiner ersten Woche brachen Leute beim Dreh zusammen,"Die Dreharbeiten zu ""Dune 2"" verlangten dem Cast und der Crew echte Hitzeresistenz ab. Austin Butler erzählt in einem Interview, wie intensiv die Arbeit am Film war.",https://crops.giga.de/5c/02/d6/7f407fe1c7733bc754a64f1c41_YyAxOTk2eDExMjIrNTUrOQJyZSAxOTIwIDEwODADNTI3MGU3MzdhZjQ=.jpg,2024-03-05T15:33:16Z,,"Die Dreharbeiten zu „Dune 2“ verlangten dem Cast und der Crew echte Hitzeresistenz ab. Austin Butler erzählt in einem Interview, wie intensiv die Arbeit am Film war.
Der Wüstenplanet Arrakis: goldgl… [+3319 chars]",,de,'Hitze'
https://taz.de/Energiekrise-vorbeugen/!5993634/,https://taz.de/Energiekrise-vorbeugen/!5993634/,0,taz.de,Energiekrise vorbeugen: EU hält am Gassparen fest,Die EU-Energiekommissarin kritisiert die deutschen Umlagen beim Gashandel als unsolidarisch. Ihre bisherigen Sparziele hat die Union erreicht.,https://taz.de/picture/6871921/948/348Gas-Energie-Deutschland-1.jpeg,2024-03-05T16:49:00Z,,"Die EU-Energiekommissarin kritisiert die deutschen Umlagen beim Gashandel als unsolidarisch. Ihre bisherigen Sparziele hat die Union erreicht.
Der Erdgasspeicher Bierwang in Mühldorf am Inn Foto: Fr… [+3499 chars]",,de,'Energiekrise'
https://www.kino.de/artikel/make-love-fake-love-2024--pcchqvj9mm,https://www.kino.de/artikel/make-love-fake-love-2024--pcchqvj9mm,0,www.kino.de,"„Make Love, Fake Love“ 2024: Wer ist vergeben?","Das Dating-Format „Make Love, Fake Love“ führt Singles aufs Glatteis, denn unter ihnen sind auch Vergebene. Welche der Kandidaten in feste Händen sind, erfahrt ihr hier!",https://static.kino.de/66/5a/d9/1eaeffc63cc4da096f8f04b3da_AzZhMWVjY2Q5ODRk_09bfa-1.jpg,2024-03-05T16:58:09Z,,"Das Dating-Format Make Love, Fake Love führt Singles aufs Glatteis, denn unter ihnen sind auch Vergebene. Welche der Kandidaten in feste Händen sind, erfahrt ihr hier!
2023 brachte RTL mit Make Love… [+6173 chars]",,de,'Glatteis'
https://www.zeit.de/news/2024-03/06/mix-aus-sonne-und-wolken-in-berlin-und-brandenburg-erwartet,https://www.zeit.de/news/2024-03/06/mix-aus-sonne-und-wolken-in-berlin-und-brandenburg-erwartet,0,www.zeit.de,Wetter: Mix aus Sonne und Wolken in Berlin und Brandenburg erwartet,Hier finden Sie Informationen zu dem Thema „Wetter“. Lesen Sie jetzt „Mix aus Sonne und Wolken in Berlin und Brandenburg erwartet“.,https://img.zeit.de/news/2024-03/06/mix-aus-sonne-und-wolken-in-berlin-und-brandenburg-erwartet-image-group/wide__1300x731,2024-03-06T05:37:57Z,,"Heitere und wolkige Abschnitte bestimmen die Wetterlage in Berlin und Brandenburg. Dabei löst sich am Mittwochvormittag zunächst der Nebel auf, wie der Deutsche Wetterdienst (DWD) mitteilte. Im Tages… [+1631 chars]",,de,'Temperaturen'
https://www.diepresse.com/18246635/toedliche-verwechslungsgefahr-baerlauch-maigloeckchen-und-herbstzeitlose-erkennen,https://www.diepresse.com/18246635/toedliche-verwechslungsgefahr-baerlauch-maigloeckchen-und-herbstzeitlose-erkennen,0,www.diepresse.com,"Tödliche Verwechslungsgefahr: Bärlauch, Maiglöckchen und Herbstzeitlose erkennen","Maiglöckchen und Herbstzeitlosen sind giftig. Ihr Blätter ähneln aber jenen des Bärlauchs. Hier ein Überblick, wie man sie auseinanderhalten kann.",https://img.diepresse.com/public/incoming/9j45oi-kein-Titel/alternates/DPR_SOCIAL_NACHRICHTEN/%28kein%20Titel%29,2024-03-06T05:58:06Z,,"Maiglöckchen und Herbstzeitlosen sind giftig. Ihr Blätter ähneln aber jenen des Bärlauchs. Hier ein Überblick, wie man sie auseinanderhalten kann.
Bärlauch ist einer der ersten Frühlingsboten, sein … [+3561 chars]",,de,'Blätter'
https://oe3.orf.at/stories/3039788/,https://oe3.orf.at/stories/3039788/,0,oe3.orf.at,Grazer Forschende lösen Rätsel um aufrollendes Papier,"<ul><li>Papiertechniker lösten Rätsel, warum sich einseitig bedruckte Blätter aus dem Tintenstrahldrucker einrollen.</li></ul>",https://tubestatic.orf.at/static/images/site/tube/20240310/ã3_story_vorlage-2_1.6009986.jpeg,2024-03-06T09:38:00Z,,"<ul><li>Papiertechniker lösten Rätsel, warum sich einseitig bedruckte Blätter aus dem Tintenstrahldrucker einrollen.</li></ul>
Loses Papier, das bedruckt aber nicht gebunden ist, beginnt sich nach g… [+3317 chars]",,de,'Blätter'
https://www.faz.net/aktuell/gesellschaft/hundeschlittenrennen-iditarod-favorit-von-elch-angegriffen-19567430.html,https://www.faz.net/aktuell/gesellschaft/hundeschlittenrennen-iditarod-favorit-von-elch-angegriffen-19567430.html,0,www.faz.net,Hundeschlittenrennen Iditarod: Favorit wird von Elch angegriffen,"In Alaska werden mehr Menschen durch Elche als durch Bären verletzt. Deswegen griff Dallas Seavey zu seiner Waffe, als ein Elch sich auf einen seiner Schlittenhunde stürzte. Das Problem: Der 37-Jährige musste das Tier direkt ausnehmen.",https://media1.faz.net/ppmedia/aktuell/847055908/1.9567441/facebook_teaser/dallas-seavey-beim-start-des.jpg,2024-03-06T12:09:12Z,,"Es war in der Nacht von Montag auf Dienstag, gegen zwei Uhr morgens, 20 Kilometer nach dem Checkpoint in Skwentna und 50 Kilometer vom nächsten Stopp in Finger Lake entfernt. Dort, mitten in der Wild… [+2802 chars]",,de,'Schlitten'
https://www.welt.de/wissenschaft/article250429266/Erwaermung-der-Ozeane-Die-Hauptursache-ist-der-Mensch.html,https://www.welt.de/wissenschaft/article250429266/Erwaermung-der-Ozeane-Die-Hauptursache-ist-der-Mensch.html,0,www.welt.de,„Die Hauptursache ist der Mensch“,"Die Ozeane erwärmen sich und brechen Rekorde. Für eine gewisse Verwunderung unter Experten sorgt der „besonders warme Atlantik“. Für die besonders hohen Temperaturen gibt es verschiedene Theorien, doch in einer Sache sind sich die Forscher einig.",https://img.welt.de/img/wissenschaft/mobile250430668/2351357197-ci16x9-w1200/Close-up-of-sea-green-turtle-swimming-in-sea-Grand-Cayman-Cayman.jpg,2024-03-06T14:01:36Z,,Die Weltmeere verzeichnen außergewöhnliche Wärmerekorde. Nun schon seit etwa einem Jahr liegt die mittlere Oberflächentemperatur im Nordatlantik an jedem einzelnen Tag auf dem höchsten Tagesstand sei… [+5939 chars],,de,'Temperaturen'
https://www.morgenpost.de/ratgeber/article241809904/bitcoin-bitpanda-kryptowaehrung-experte-anleger-prognose.html,https://www.morgenpost.de/ratgeber/article241809904/bitcoin-bitpanda-kryptowaehrung-experte-anleger-prognose.html,0,www.morgenpost.de,Bitcoin knackt die nächste Marke: Jetzt noch einsteigen?,Die Kryptowährung Bitcoin erreicht Rekordwerte – was bedeutet das für Privatanleger? Wir haben mit Bitpanda-CEO Eric Demuth gesprochen.,https://img.sparknews.funkemedien.de/241808656/241808656_1709530565_v4_3_800.jpeg,2024-03-06T14:45:00Z,,"Berlin. Die Kryptowährung Bitcoin erreicht Rekordwerte was bedeutet das für Privatanleger? Wir haben mit Bitpanda-CEO Eric Demuth gesprochen.
<ul><li>Der Bitcoin hat zuletzt ein neues Allzeithoch ma… [+12920 chars]",,de,'Rekordwerte'
https://www.welt.de/wissenschaft/article250437690/Infektionskrankheit-Zahl-der-Faelle-von-Papageienkrankheit-in-Deutschland-und-anderen-Laendern-steigt.html,https://www.welt.de/wissenschaft/article250437690/Infektionskrankheit-Zahl-der-Faelle-von-Papageienkrankheit-in-Deutschland-und-anderen-Laendern-steigt.html,0,www.welt.de,WHO schlägt Alarm wegen neuer Fälle der Papageienkrankheit in Europa,"Sie fühlt sich an wie Grippe, kann aber eine schwere Lungenentzündung auslösen: die sogenannte Papageienkrankheit. Die Infektion wird vor allem durch Papageien, Tauben und andere Vögel übertragen. In mehreren europäischen Ländern stieg die Zahl der Fälle zule…",https://img.welt.de/img/wissenschaft/mobile250438582/0461350757-ci16x9-w1200/Ill-woman-looking-at-thermometer.jpg,2024-03-06T16:42:03Z,,"In Deutschland und anderen europäischen Ländern haben sich mehr Menschen als sonst mit einer Ornithose, der von Vögeln übertragenen Papageienkrankheit, infiziert. Die Zahl der Fälle sei seit November… [+1925 chars]",,de,'Vögel'
https://www.stern.de/panorama/wissen/erwaermung-im-nordatlantik---forscher-suchen-nach-gruenden-34521392.html,https://www.stern.de/panorama/wissen/erwaermung-im-nordatlantik---forscher-suchen-nach-gruenden-34521392.html,0,www.stern.de,Klimawandel: Außergewöhnlich warme Temperaturen: Was ist in den Weltmeeren los?,"Die Meere sind wärmer als sonst, und das seit mehr als einem Jahr. Besonders im Nordatlantik sind die Temperaturen hoch. Klimaforscher suchen noch nach Erklärungen. Die Folgen lassen sich erahnen.",https://image.stern.de/34521526/t/vy/v4/w1440/r1.7778/-/erwaermung-der-weltmeere.jpg,2024-03-06T17:25:00Z,,"Die Meere sind wärmer als sonst, und das seit mehr als einem Jahr. Besonders im Nordatlantik sind die Temperaturen hoch. Klimaforscher suchen noch nach Erklärungen. Die Folgen lassen sich erahnen.
I… [+6083 chars]",,de,'Temperaturen'
https://www.diepresse.com/18249661/kranhersteller-palfinger-erzielt-hoechstwerte-bei-umsatz-und-gewinn,https://www.diepresse.com/18249661/kranhersteller-palfinger-erzielt-hoechstwerte-bei-umsatz-und-gewinn,0,www.diepresse.com,Kranhersteller Palfinger erzielt Höchstwerte bei Umsatz und Gewinn,"Der Konzernumsatz lag 2023 bei 2,45 Milliarden Euro, das Konzernergebnis stieg um 50 Prozent auf 107,7 Millionen Euro. Das Unternehmen begründet die Rekordwerte unter anderem mit seinem Produktmix und der guten Auslastung der Werke.",https://img.diepresse.com/public/incoming/jfyuql-u_PALFINGER_KRAN.jpg/alternates/DPR_SOCIAL_NACHRICHTEN/u_PALFINGER_KRAN.jpg,2024-03-06T17:49:33Z,,"Der Konzernumsatz lag 2023 bei 2,45 Milliarden Euro, das Konzernergebnis stieg um 50 Prozent auf 107,7 Millionen Euro. Das Unternehmen begründet die Rekordwerte unter anderem mit seinem Produktmix un… [+1294 chars]",,de,'Rekordwerte'
https://taz.de/Ministerpraesidentenkonferenz/!5996919/,https://taz.de/Ministerpraesidentenkonferenz/!5996919/,0,taz.de,Ministerpräsidentenkonferenz: Hase und Igel,Bundeskanzler und Ministerpräsidenten üben sich in trauter Einigkeit. Dennoch ist die Migrationspolitik in Deutschland ein Armutszeugnis.,https://taz.de/picture/6875043/948/34825185-1.jpeg,2024-03-07T09:27:00Z,,"Bundeskanzler und Ministerpräsidenten üben sich in trauter Einigkeit. Dennoch ist die Migrationspolitik in Deutschland ein Armutszeugnis.
Rhein, Scholz, Weil am 6. März 2024 in Berlin. Alles driftet… [+2883 chars]",,de,'Igel'
https://www.bild.de/regional/hessen/hessen-regional/5-cm-wassertiefe-fehlen-biedenkopf-muss-3-meter-sprungturm-abreissen-87433714.bild.html,https://www.bild.de/regional/hessen/hessen-regional/5-cm-wassertiefe-fehlen-biedenkopf-muss-3-meter-sprungturm-abreissen-87433714.bild.html,0,www.bild.de,5 cm Wassertiefe fehlen! - Biedenkopf muss 3-Meter-Sprungturm abreißen,Biedenkopf (Hessen) – Nach 30 Jahren es auf: Im Freibad-Becken fehlen 5 cm Wassertiefe. Nun muss der Sprungturm mit 3-Meter-Brett abgerissen werden,"https://images.bild.de/65e997f82cff1679c0e3728c/700d8042305106cc782756d9c7b73a59,69416c6c?w=1280",2024-03-07T13:38:17Z,,"Biedenkopf (Hessen) Seit 30 Jahren springen die Menschen im Lahnauenbad vom Drei-Meter-Brett doch damit ist diesen Sommer Schluss.
Weil die Wassertiefe des Schwimmerbeckens nur 3,45 Meter statt vorg… [+1267 chars]",,de,'Freibad'
https://www.zeit.de/news/2024-03/07/tiere-am-wasser-naturkundemuseum-mit-neuem-bereich,https://www.zeit.de/news/2024-03/07/tiere-am-wasser-naturkundemuseum-mit-neuem-bereich,0,www.zeit.de,Potsdam: Tiere am Wasser: Naturkundemuseum mit neuem Bereich,Hier finden Sie Informationen zu dem Thema „Potsdam“. Lesen Sie jetzt „Tiere am Wasser: Naturkundemuseum mit neuem Bereich“.,https://img.zeit.de/news/2024-03/07/tiere-am-wasser-naturkundemuseum-mit-neuem-bereich-image-group/wide__1300x731,2024-03-07T14:29:54Z,,Das Naturkundemuseum in Potsdam soll in diesem Jahr einen neuen Ausstellungsbereich bekommen. «Für den Fischotter und den Biber entsteht ein neuer Lebensraum und ein Ausstellungsteil rund um das Them… [+1288 chars],,de,'Natur'
https://www.zeit.de/news/2024-03/08/sonne-und-milde-temperaturen-am-freitag-in-sachsen,https://www.zeit.de/news/2024-03/08/sonne-und-milde-temperaturen-am-freitag-in-sachsen,0,www.zeit.de,Wetter: Sonne und milde Temperaturen am Freitag in Sachsen,Hier finden Sie Informationen zu dem Thema „Wetter“. Lesen Sie jetzt „Sonne und milde Temperaturen am Freitag in Sachsen“.,https://img.zeit.de/news/2024-03/08/sonne-und-milde-temperaturen-am-freitag-in-sachsen-image-group/wide__1300x731,2024-03-08T06:10:11Z,,"Ein sonniger Freitag erwartet die Menschen in Sachsen. Nach einem frostigen Start sind im Tagesverlauf Temperaturen bis zu zehn Grad zu erwarten, teilte der Deutsche Wetterdienst mit. Im Bergland ist… [+696 chars]",,de,'Temperaturen'
https://www.zeit.de/news/2024-03/08/toedliches-hindernis-fuer-voegel-an-behoerde-entschaerft,https://www.zeit.de/news/2024-03/08/toedliches-hindernis-fuer-voegel-an-behoerde-entschaerft,0,www.zeit.de,Tiere: Tödliches Hindernis für Vögel an Behörde entschärft,Hier finden Sie Informationen zu dem Thema „Tiere“. Lesen Sie jetzt „Tödliches Hindernis für Vögel an Behörde entschärft“.,https://img.zeit.de/news/2024-03/08/toedliches-hindernis-fuer-voegel-an-behoerde-entschaerft-image-group/wide__1300x731,2024-03-08T11:03:41Z,,"Nachdem Dutzende Meisen gegen eine gläserne Verbindung am Technischen Rathaus in Leipzig geflogen und verendet waren, ist die Lage nun entschärft. Der Gebäudeeigentümer habe eine Interimslösung anbri… [+414 chars]",,de,'Vögel'
https://www.bild.de/regional/bayern/nuernberg-news/markus-soeder-erhaelt-negativpreis-fuer-hundeschlittenfahrt-von-peta-87432890.bild.html,https://www.bild.de/regional/bayern/nuernberg-news/markus-soeder-erhaelt-negativpreis-fuer-hundeschlittenfahrt-von-peta-87432890.bild.html,0,www.bild.de,Im Visier von PETA - Söder erhält Negativpreis für Hundeschlittenfahrt!,"Tierschützer attackieren Söder für Teilnahme an fragwürdigen Schlittenhunderennen.Foto: PR, Sven Hoppe/dpa","https://images.bild.de/65e995ef0bae40562f75b3f0/564d33ec6abad0b7b6fc22d4719b72cd,b4b6c20?w=1280",2024-03-08T12:44:48Z,,"Nürnberg (Bayern) Bei seinem Besuch in Schweden zeigte Markus Söder (57, CSU) sich tierlieb und besonders hundefreundlich. Unter dem Hashtag #hundeliebe postete er auf Instagram ein Video und Fotos e… [+2917 chars]",,de,'Schlitten'
https://www.stern.de/gesellschaft/regional/hessen/chefwechsel--deutsche-boerse--leithner-wird-neuer-vorstandsvorsitzender-34528836.html,https://www.stern.de/gesellschaft/regional/hessen/chefwechsel--deutsche-boerse--leithner-wird-neuer-vorstandsvorsitzender-34528836.html,0,www.stern.de,Chefwechsel: Deutsche Börse: Leithner wird neuer Vorstandsvorsitzender,Frankfurt/Eschborn - Stephan Leithner wird zum 1. Oktober Co-Chef der Deutschen Börse und soll zum Jahreswechsel die alleinige Führung des Dax-Konzerns,https://image.stern.de/34528838/t/9o/v1/w1440/r1.7778/-/08--urnnewsmldpacom2009010124030899269978v3w800h600l852t308r1775b1290jpeg---facf5f665b595fe3.jpg,2024-03-08T15:52:32Z,,"Der Frankfurter Marktbetreiber bekommt einen neuen Chef aus den eigenen Reihen. Zunächst gibt es eine Doppelspitze.
Stephan Leithner wird zum 1. Oktober Co-Chef der Deutschen Börse und soll zum Jahr… [+2086 chars]",,de,'Jahreswechsel'
https://www.welt.de/reise/nah/article250432962/Oesterreich-Kommen-Sie-zu-uns-nach-Osttirol-wir-haben-nichts.html,https://www.welt.de/reise/nah/article250432962/Oesterreich-Kommen-Sie-zu-uns-nach-Osttirol-wir-haben-nichts.html,0,www.welt.de,"„Kommen Sie zu uns, wir haben nichts“","Osttirol hat sich dem sanften Tourismus verschrieben. Hier ist alles etwas kleiner, ursprünglicher und familiärer als in anderen Alpenorten. Dabei laden viele Sonnentage zum Wandern ein, und im Winter können sich Aktivurlauber über ergiebigen Schneefall freue…",https://img.welt.de/img/reise/mobile250433240/3751359747-ci16x9-w1200/GettyImages-1131118404.jpg,2024-03-09T06:38:50Z,https://web.archive.org/web/20240309065436/https://www.welt.de/reise/nah/article250432962/Oesterreich-Kommen-Sie-zu-uns-nach-Osttirol-wir-haben-nichts.html,"Schaut man auf eine Landkarte Österreichs, ist Osttirol schon eine kuriose Angelegenheit, liegt die Region (auf der Karte schwarz) doch ohne Landverbindung zum Rest Tirols (dunkelgrau). Der Grund daf… [+5276 chars]",,de,'Schnee'
https://www.ibiza-heute.de/ibiza-formentera-mit-regen-und-sturm-ins-wochenende/,https://www.ibiza-heute.de/ibiza-formentera-mit-regen-und-sturm-ins-wochenende/,0,www.ibiza-heute.de,Ibiza/Formentera: Mit Regen und Sturm ins Wochenende,"Guten Morgen liebe Leser, es pustet heute, Samstag, 9. März, gewaltig über Ibiza, Formentera und das Meer. Der spanische Wetterdienst […]
Der Beitrag Ibiza/Formentera: Mit Regen und Sturm ins Wochenende erschien zuerst auf Ibiza Heute.",https://www.ibiza-heute.de/wp-content/uploads/2020/08/Sturm-Comte-09-7.jpg,2024-03-09T07:42:44Z,,"Sturm aus Südwesten auf Ibiza und Formentera. Foto: Rüdiger Eichhorn Guten Morgen liebe Leser, es pustet heute, Samstag, 9. März, gewaltig über Ibiza, Formentera und das Meer. Der spanische Wetterdie… [+1062 chars]",,de,'Regen'
https://www.zeit.de/news/2024-03/09/sonne-wolken-mix-in-thueringen,https://www.zeit.de/news/2024-03/09/sonne-wolken-mix-in-thueringen,0,www.zeit.de,Wetter: Sonne-Wolken-Mix in Thüringen,Hier finden Sie Informationen zu dem Thema „Wetter“. Lesen Sie jetzt „Sonne-Wolken-Mix in Thüringen“.,https://img.zeit.de/news/2024-03/09/sonne-wolken-mix-in-thueringen-image-group/wide__1300x731,2024-03-09T09:02:07Z,,"Der Samstag startet mit einem Mix aus Sonne und Wolken in Thüringen. Die Höchsttemperaturen liegen bei bis zu elf Grad, im Bergland bei bis zu neun Grad, wie der Deutsche Wetterdienst am Samstagmorge… [+325 chars]",,de,'Sonne'
https://www.zeit.de/news/2024-03/09/wolken-und-etwas-regen-in-rheinland-pfalz-und-im-saarland,https://www.zeit.de/news/2024-03/09/wolken-und-etwas-regen-in-rheinland-pfalz-und-im-saarland,0,www.zeit.de,Wetter: Wolken und etwas Regen in Rheinland-Pfalz und im Saarland,Hier finden Sie Informationen zu dem Thema „Wetter“. Lesen Sie jetzt „Wolken und etwas Regen in Rheinland-Pfalz und im Saarland“.,https://img.zeit.de/news/2024-03/09/wolken-und-etwas-regen-in-rheinland-pfalz-und-im-saarland-image-group/wide__1300x731,2024-03-09T11:21:28Z,,"Trübes Wetter erwartet die Menschen in Rheinland-Pfalz und im Saarland in der kommenden Woche. Wie der Deutsche Wetterdienst (DWD) am Samstag mitteilte, beginnt der Sonntag heiter bis wolkig, bevor n… [+835 chars]",,de,'Regen'
https://www.zeit.de/news/2024-03/09/sonnenbrille-und-pudelmuetze-sonnig-kaltes-wetter-im-norden,https://www.zeit.de/news/2024-03/09/sonnenbrille-und-pudelmuetze-sonnig-kaltes-wetter-im-norden,0,www.zeit.de,Freizeit: Sonnenbrille und Pudelmütze: Sonnig-kaltes Wetter im Norden,Hier finden Sie Informationen zu dem Thema „Freizeit“. Lesen Sie jetzt „Sonnenbrille und Pudelmütze: Sonnig-kaltes Wetter im Norden“.,https://img.zeit.de/news/2024-03/09/sonnenbrille-und-pudelmuetze-sonnig-kaltes-wetter-im-norden-image-group/wide__1300x731,2024-03-09T12:03:00Z,,"Der Norden Deutschlands hat am Samstag viel Sonne abbekommen, das Wetter lockte zahlreiche Menschen ins Freie. Bei Temperaturen von bis zu zehn Grad Celsius nutzten viele den Tag zum Spazieren, Frühj… [+2181 chars]",,de,'Temperaturen'
https://www.stern.de/news/kambodscha-stellt-neuen-weltrekord-im--brauttragen--auf-34530660.html,https://www.stern.de/news/kambodscha-stellt-neuen-weltrekord-im--brauttragen--auf-34530660.html,0,www.stern.de,"Kambodscha stellt neuen Weltrekord im ""Brauttragen"" auf","Hunderte Menschen in Kambodscha haben bei schwüler tropischer Hitze einen ungewöhnlichen neuen Weltrekord aufgestellt - in der Disziplin ""Brauttragen"". 245 Männer hoben am Freitagabend ihre Frauen, Freundinnen, Schwestern oder Mütter mit einem Arm unter den B…",https://image.stern.de/34530662/t/S8/v1/w1440/r1.7778/-/09--weltrekord-maenner-tragen-frauen-in-phnom-penh---2fe2eda9949d3cab.jpg,2024-03-09T12:24:18Z,,"Hunderte Menschen in Kambodscha haben bei schwüler tropischer Hitze einen ungewöhnlichen neuen Weltrekord aufgestellt - in der Disziplin ""Brauttragen"". 245 Männer hoben am Freitagabend ihre Frauen, F… [+845 chars]",,de,'Hitze'
