index,url,valid,domain,title,description,image,published,archive,content,quote,language,keyword
https://www.visions.de/news/the-ghost-inside-neues-album-searching-for-solace/,https://www.visions.de/news/the-ghost-inside-neues-album-searching-for-solace/,0,www.visions.de,"The Ghost Inside kündigen neues Album ""Searching For Solace"" an","Mit der Single „Wash It Away“ kündigen The Ghost Inside ihr sechstes Studioalbum „Searching For Solace“, das bereits im April erscheinen wird.
Der Beitrag Auf Sonnensuche erschien zuerst auf VISIONS.de.",https://www.visions.de/wp-content/uploads/tgi.jpg,2024-02-05T15:42:52Z,,"Am 19. April erscheint das neue Album von The Ghost Inside zunächst digital, bevor es dann am 7. Juni auch physisch via Epitaph erscheint. Wie bereits das nach der Band benannte Vorgängeralbum behand… [+1248 chars]",,de,'Regen'
https://www.sueddeutsche.de/bayern/jennerbahn-schneekanonen-alpinski-1.6344368,https://www.sueddeutsche.de/bayern/jennerbahn-schneekanonen-alpinski-1.6344368,0,www.sueddeutsche.de,Wintertourismus: Schnee von gestern,"Seit 2019 schwingt sich eine neue, größere Seilbahn auf den Jenner über dem Königssee. Den alpinen Skibetrieb hat auch das 57 Millionen Euro schwere Großprojekt nicht gerettet. Mit dem Ablauf dieser Saison stellt die hoch verschuldete Betreibergesellschaft da…",https://www.sueddeutsche.de/image/sz.1.6344369/1200x675?v=1707148647,2024-02-05T15:50:18Z,,"5. Februar 2024, 16:50 Uhr
In der Nähe der Mittelstation spiegeln sich die Kabinen der Jennerbahn im Speicherteich für die Schneekanonen.
(Foto: imago)
Seit 2019 schwingt sich eine neue, größere S… [+1484 chars]",,de,'Natur'
https://orf.at/stories/3347803/,https://orf.at/stories/3347803/,0,orf.at,Megaunwetter legt Kalifornien lahm,"Heftiger Regen, zahlreiche Überschwemmungen und großräumige Stromausfälle: Ein atmosphärischer Fluss – ein schmales, aber sehr langes Wetterband, das sehr viel feuchte Luft aus der Äquatorgegend bringt – hat den US-Bundesstaat Kalifornien fest im Griff. Es ha…",https://ibs.orf.at/news?image=https%3A%2F%2Fassets.orf.at%2Fmims%2F2024%2F06%2F07%2Fcrops%2Fw%3D1200%2Ch%3D630%2Cq%3D75%2F2096856_master_792207_kalifornien_unwetter_momi_body_3_gy.jpg%3Fs%3D658dbca01527293f970b2cdcfb8d882bc077bb85,2024-02-05T16:06:31Z,,Der Nationale US-Wetterdienst (NWS) warnte vor dem heftigsten Sturm der Saison. Dieser könnte mit Geschwindigkeiten bis zu hundert Stundenkilometern über weite Teile Kaliforniens hinwegfegen. Die Men… [+2701 chars],,de,'Regen'
https://www.welt.de/sport/fussball/video249935296/Fan-Proteste-gegen-DFL-Plaene-Ohne-Investor-waere-Hertha-mausetot.html,https://www.welt.de/sport/fussball/video249935296/Fan-Proteste-gegen-DFL-Plaene-Ohne-Investor-waere-Hertha-mausetot.html,0,www.welt.de,„Ohne Investor wäre Hertha mausetot“,Mit einem nicht enden wollenden Regen an Tennisbällen protestierten die Fans von Hertha BSC gegen die Investoren-Pläne der Deutschen Fußball Liga. Das Spiel wurde für mehr als eine halbe Stunde unterbrochen. Der stellvertretende BILD-Sportchef Walter M. Strat…,https://img.welt.de/img/vermischtes/mobile249935742/7541358117-ci16x9-w1200/ONL-Straten-18-00-2164-edited-jpg.jpg,2024-02-05T18:30:52Z,,"Die WELT als ePaper: Die vollständige Ausgabe steht Ihnen bereits am Vorabend zur Verfügung so sind Sie immer hochaktuell informiert. Weitere Informationen: http://epaper.welt.de 
 Der Kurz-Link die… [+49 chars]",,de,'Regen'
https://www.n-tv.de/sport/Schwere-Unwetter-wueten-in-der-Super-Bowl-Wueste-article24714395.html,https://www.n-tv.de/sport/Schwere-Unwetter-wueten-in-der-Super-Bowl-Wueste-article24714395.html,0,www.n-tv.de,Schlamm-Lawinen und Regenstürme: Schwere Unwetter wüten in der Super-Bowl-Wüste,"""Umdrehen, nicht ertrinken"": Dunkle Wolken regieren über Las Vegas, Regenstürme peitschen durch die Wüste und schütteln die Flugzeuge mit NFL-Fans durcheinander. Ein Unwetter vom Pazifik bedroht Nevada und den teuersten Super Bowl aller Zeiten. Noch schlimmer…",https://bilder4.n-tv.de/img/incoming/crop24714419/9171329341-cImg_16_9-w1200/imago0404613309h.jpg,2024-02-05T20:00:14Z,,"""Umdrehen, nicht ertrinken"": Dunkle Wolken regieren über Las Vegas, Regenstürme peitschen durch die Wüste und schütteln die Flugzeuge mit NFL-Fans durcheinander. Ein Unwetter vom Pazifik bedroht Neva… [+4847 chars]",,de,'Regen'
https://www.stern.de/gesellschaft/regional/berlin-brandenburg/fussgaengerverband--warnung-vor-gefahr-durch-herumliegende-e-roller-34431954.html,https://www.stern.de/gesellschaft/regional/berlin-brandenburg/fussgaengerverband--warnung-vor-gefahr-durch-herumliegende-e-roller-34431954.html,0,www.stern.de,Fußgängerverband: Warnung vor Gefahr durch herumliegende E-Roller,"Berlin (bb) - Wenn mit steigenden Temperaturen mehr Menschen unterwegs sind, steigt auch die Gefahr durch herumliegende E-Roller auf Gehwegen. Davon geht",https://image.stern.de/34431956/t/N6/v1/w1440/r1.7778/-/06--urnnewsmldpacom2009010124020699884624v3w800h600l640t437r1920b1311jpeg---c788093667b672ef.jpg,2024-02-06T04:07:54Z,,"Besonders für ältere Menschen und Blinde sind herumliegende E-Roller eine Gefahr. Im Frühjahr dürfte das Ganze nicht besser werden, sagt ein Verein.
Wenn mit steigenden Temperaturen mehr Menschen un… [+2035 chars]",,de,'Temperaturen'
https://www.stern.de/gesellschaft/regional/bayern/natur--mildes-wetter-laesst-amphibien-frueher-wandern-34432120.html,https://www.stern.de/gesellschaft/regional/bayern/natur--mildes-wetter-laesst-amphibien-frueher-wandern-34432120.html,0,www.stern.de,Natur: Mildes Wetter lässt Amphibien früher wandern,"Bald machen sich Frösche und Kröten auf den Weg zu ihren Laichgewässern. Ehrenamtliche wollen den Tieren wieder mit Schutzzäunen helfen, damit sie auf Straßen nicht überfahren werden.",https://image.stern.de/34432122/t/1z/v1/w1440/r1.7778/-/06--urnnewsmldpacom2009010124020699885043v4w800h600l639t434r1917b1306jpeg---edbd76447e6d5341.jpg,2024-02-06T05:14:42Z,,"Bald machen sich Frösche und Kröten auf den Weg zu ihren Laichgewässern. Ehrenamtliche wollen den Tieren wieder mit Schutzzäunen helfen, damit sie auf Straßen nicht überfahren werden.
Die Nächte wer… [+3298 chars]",,de,'Natur'
https://www.zeit.de/news/2024-02/06/mildes-wetter-laesst-amphibien-frueher-wandern,https://www.zeit.de/news/2024-02/06/mildes-wetter-laesst-amphibien-frueher-wandern,0,www.zeit.de,Natur: Mildes Wetter lässt Amphibien früher wandern,Hier finden Sie Informationen zu dem Thema „Natur“. Lesen Sie jetzt „Mildes Wetter lässt Amphibien früher wandern“.,https://img.zeit.de/news/2024-02/06/mildes-wetter-laesst-amphibien-frueher-wandern-image-group/wide__1300x731,2024-02-06T05:14:42Z,,"Die Nächte werden milder und locken schon bald Amphibien aus ihren Winterquartieren. Nachts etwa sechs Grad und Regen sind die Wetterbedingungen, bei denen Frösche und Kröten aktiv würden, teilte ein… [+3662 chars]",,de,'Natur'
https://www.zeit.de/news/2024-02/06/wind-und-regen-in-niedersachsen-und-bremen,https://www.zeit.de/news/2024-02/06/wind-und-regen-in-niedersachsen-und-bremen,0,www.zeit.de,Deutscher Wetterdienst: Wind und Regen in Niedersachsen und Bremen,Hier finden Sie Informationen zu dem Thema „Deutscher Wetterdienst“. Lesen Sie jetzt „Wind und Regen in Niedersachsen und Bremen“.,https://img.zeit.de/news/2024-02/06/wind-und-regen-in-niedersachsen-und-bremen-image-group/wide__1300x731,2024-02-06T06:20:46Z,,"Das Wetter in Niedersachsen und Bremen wird windig und regnerisch. Am Dienstag weht frischer und im nördlichen Binnenland stürmischer Wind, an der See und im Harz kommt es zu Sturmböen, wie der Deuts… [+592 chars]",,de,'Regen'
https://www.stern.de/gesellschaft/regional/bayern/deutscher-wetterdienst--mildes-und-windiges-wetter-in-bayern-34432312.html,https://www.stern.de/gesellschaft/regional/bayern/deutscher-wetterdienst--mildes-und-windiges-wetter-in-bayern-34432312.html,0,www.stern.de,Deutscher Wetterdienst: Mildes und windiges Wetter in Bayern,"Es bleibt mild in Bayern, doch zur Wochenmitte breitet sich vielerorts Regen aus. Auch windig bis stürmisch kann es im Freistaat werden, wie der Deutsche Wetterdienst (DWD) am Dienstag mitteilte.",https://image.stern.de/34432314/t/v1/v1/w1440/r1.7778/-/06--urnnewsmldpacom2009010124020699885718v3w800h600l640t376r1920b1131jpeg---0b307741d92cfc94.jpg,2024-02-06T06:27:37Z,,"Es bleibt mild in Bayern, doch zur Wochenmitte breitet sich vielerorts Regen aus. Auch windig bis stürmisch kann es im Freistaat werden, wie der Deutsche Wetterdienst (DWD) am Dienstag mitteilte.
Es… [+1044 chars]",,de,'Regen'
https://www.tagesspiegel.de/potsdam/landeshauptstadt/sturmischer-dienstag-wetterdienst-warnt-vor-sturmboen-in-potsdam-11165647.html,https://www.tagesspiegel.de/potsdam/landeshauptstadt/sturmischer-dienstag-wetterdienst-warnt-vor-sturmboen-in-potsdam-11165647.html,0,www.tagesspiegel.de,Stürmischer Dienstag: Wetterdienst warnt vor Sturmböen in Potsdam,Bis in die Nacht hinein ist in Brandenburgs Landeshauptstadt mit starken Winden zu rechnen. Die Temperaturen steigen auf bis zu elf Grad.,https://www.tagesspiegel.de/images/orkan-fegt-uber-bayern-hinweg1/alternates/BASE_16_9_W1400/orkan-fegt-ueber-bayern-hinweg.jpeg,2024-02-06T06:36:07Z,,Potsdam muss sich am Dienstag den ganzen Tag über auf regnerisches und stürmisches Wetter einstellen. Nach Angaben des Deutschen Wetterdienstes (DWD) ist ab 10 Uhr mit Sturmböen mit Geschwindigkeiten… [+481 chars],,de,'Temperaturen'
https://www.bild.de/regional/bayern/regional/wetter-in-bayern-mildes-und-viel-wind-aber-auch-regen-87050374.bild.html,https://www.bild.de/regional/bayern/regional/wetter-in-bayern-mildes-und-viel-wind-aber-auch-regen-87050374.bild.html,0,www.bild.de,In Bayern - Mildes und windiges Wetter,"Es bleibt mild in Bayern, doch zur Wochenmitte breitet sich vielerorts Regen aus. Foto: Peter Kneffel/dpa","https://images.bild.de/65c1d01fb8059775f87f88a9/3a0ec215ebd65480a66972677ca33dd2,fc12b119?w=1280",2024-02-06T06:39:36Z,,"München Der Regenschirm sollte besser mitgenommen werden, wenn es raus an die frische Luft geht.
Es bleibt zwar mild in Bayern, doch zur Wochenmitte breitet sich vielerorts Regen aus. Auch windig bi… [+861 chars]",,de,'Regen'
https://feed.laut.de/Manu-Delago/Alben/Snow-From-Yesterday-122527,https://feed.laut.de/Manu-Delago/Alben/Snow-From-Yesterday-122527,0,feed.laut.de,"""Snow From Yesterday"" von Manu Delago","Akustischer Ambient-Pop, so zart wie frisch gefallener Schnee. (4/5)",https://www.laut.de/Manu-Delago/Alben/Snow-From-Yesterday-122527/manu-delago-snow-from-yesterday-232511.jpg?3895fa,2024-02-06T07:42:17Z,,"laut.de-Kritik
Akustischer Ambient-Pop, so zart wie frisch gefallener Schnee.
Review von Kerstin Kratochwill
Ist solche Musik Schnee von gestern? Ob der österreichische Komponist und Perkussionist… [+2198 chars]",,de,'Schnee'
