index,url,valid,domain,title,description,image,published,archive,content,quote,language,keyword
https://www.faz.net/aktuell/gesellschaft/gesundheit/corona-sommerwelle-zieht-laut-who-durch-europa-19908706.html,https://www.faz.net/aktuell/gesellschaft/gesundheit/corona-sommerwelle-zieht-laut-who-durch-europa-19908706.html,0,www.faz.net,Corona und Schnupfen im Sommer: Erkältungswelle in Europa ungewöhnlich hoch,"Bett statt Badesee, Hustensaft statt Eis in der Sonne. Europa wird laut WHO gerade von einer Corona-Welle erfasst. Warum ausgerechnet im Sommer?",https://media0.faz.net/ppmedia/aktuell/wirtschaft/3873075518/1.9908718/facebook_teaser/nasenspray-und-lutschtabletten.jpg,2024-08-08T16:35:04Z,,"Bei GrippeWeb können Bürgerinnen und Bürger direkt melden, ob sie in der Vorwoche eine Atemwegserkrankung hatten. Welcher Krankheitserreger die Erkältung oder Grippe auslöst, muss dabei nicht erfasst… [+2204 chars]",,de,'Sonne'
https://www.focus.de/panorama/wetter-in-deutschland-die-naechste-und-vielleicht-letzte-hitzewelle-rollt-auf-uns-zu_id_54933749.html,https://www.focus.de/panorama/wetter-in-deutschland-die-naechste-und-vielleicht-letzte-hitzewelle-rollt-auf-uns-zu_id_54933749.html,0,www.focus.de,Wetter im Ticker - Die nächste und vielleicht letzte Hitzewelle rollt auf uns zu,Nach den letzten Unwettern in Sachsen meldet sich in ganz Deutschland der Sommer mit voller Wucht zurück. Leider könnte dies auch die letzte Hitzewelle sein. Alles zur aktuellen Lage lesen Sie im Wetterticker.,https://p6.focus.de/img/regional/rheinland-pfalz/id_260193770/nach-dicken-wolken-wird-es-immer-waermer.jpg?im=Crop%3D%280%2C171%2C2048%2C1024%29%3BResize%3D%281200%2C627%29&impolicy=perceptual&quality=mediumHigh&hash=4522f08d44bdbae641e9043f46c3557734971dafc4f418eded7cf68f5d5f73d8,2024-08-08T17:28:07Z,,Nach den letzten Unwettern in Sachsen meldet sich in ganz Deutschland der Sommer mit voller Wucht zurück. Leider könnte dies auch die letzte Hitzewelle sein. Alles zur aktuellen Lage lesen Sie im Wet… [+10396 chars],,de,'Hitze'
https://www.faz.net/aktuell/gesellschaft/menschen/heimisches-jakobskreuzkraut-gefahr-fuer-natur-und-tier-19907578.html,https://www.faz.net/aktuell/gesellschaft/menschen/heimisches-jakobskreuzkraut-gefahr-fuer-natur-und-tier-19907578.html,0,www.faz.net,Heimisches Jakobskreuzkraut: Gefahr für Natur und Tier?,"Das Jakobskreuzkraut breitet sich in Deutschland aus. Obwohl es für eine bedrohte Insektenart sehr wichtig ist, bleibt es für die meisten Tiere gefährlich. Was muss man wissen?",https://media0.faz.net/ppmedia/aktuell/gesellschaft/2185390872/1.9907808/facebook_teaser/das-giftige-jakobskreuzkraut.jpg,2024-08-08T17:56:29Z,,"Was macht das Jakobskreuzkraut gefährlich?
Für die Giftigkeit sind sogenannte Pyrrolizidinalkaloide verantwortlich. Das sind in der Natur vorkommende Stoffe, die die Pflanze davor schützen sollen, v… [+7554 chars]",,de,'Natur'
https://www.stern.de/lifestyle/mode/abkuehlung-an-heissen-sommertagen--drei-frisuren--die-fuer-erfrischung-sorgen-34964366.html,https://www.stern.de/lifestyle/mode/abkuehlung-an-heissen-sommertagen--drei-frisuren--die-fuer-erfrischung-sorgen-34964366.html,0,www.stern.de,"Abkühlung an heißen Sommertagen: Drei Frisuren, die für Erfrischung sorgen",Heiße sommerliche Temperaturen begleiten durch den August: Diese drei einfachen Hairstyling-Ideen sorgen für Abkühlung auf dem Kopf.,https://image.stern.de/34964370/t/pk/v1/w1440/r1.7778/-/08--drei-frisuren--die-fuer-erfrischung-sorgen---16-9---spoton-article-1072350.jpg,2024-08-08T20:14:00Z,,"Heiße sommerliche Temperaturen begleiten durch den August: Diese drei einfachen Hairstyling-Ideen sorgen für Abkühlung auf dem Kopf.
Der Sommer scheint endlich da zu sein. Und mit ihm die zuweilen d… [+2387 chars]",,de,'Temperaturen'
https://www.brigitte.de/aktuell/abkuehlung-an-heissen-sommertagen--drei-stylische-frisuren-mit-erfrischungseffekt-13857080.html,https://www.brigitte.de/aktuell/abkuehlung-an-heissen-sommertagen--drei-stylische-frisuren-mit-erfrischungseffekt-13857080.html,0,www.brigitte.de,Abkühlung an heißen Sommertagen: Drei stylische Frisuren mit Erfrischungseffekt,Heiße sommerliche Temperaturen begleiten durch den August: Diese drei einfachen Hairstyling-Ideen sorgen für Abkühlung auf dem Kopf.,https://image.brigitte.de/13857082/t/OZ/v1/w1440/r1.7778/-/08--drei-stylische-frisuren-mit-erfrischungseffekt---1-1---spoton-article-1072350.jpg,2024-08-08T20:18:00Z,,"Heiße sommerliche Temperaturen begleiten durch den August: Diese drei einfachen Hairstyling-Ideen sorgen für Abkühlung auf dem Kopf.
Der Sommer scheint endlich da zu sein. Und mit ihm die zuweilen d… [+2387 chars]",,de,'Temperaturen'
https://www.stern.de/gesellschaft/regional/hessen/freizeit--freibadpreise-in-hessen--frankfurt-schwimmt-teurer-34965102.html,https://www.stern.de/gesellschaft/regional/hessen/freizeit--freibadpreise-in-hessen--frankfurt-schwimmt-teurer-34965102.html,0,www.stern.de,Freizeit: Freibadpreise in Hessen: Frankfurt schwimmt teurer,"Frankfurt/Main (lhe) - Der Sommer 2024 zeigt sich nicht immer sommerlich - Starkregen, Gewitter und zuweilen Temperaturen unter 20 Grad vergraulen manch",https://image.stern.de/34965104/t/MP/v1/w1440/r1.7778/-/09--gxheiqhvjjv6axw800h600jpeg---faebb17c20e73100.jpg,2024-08-09T02:00:36Z,,"Sommer, Sonne, Badespaß: Aber wo schwimmt es sich in Hessen gut und günstig?
Der Sommer 2024 zeigt sich nicht immer sommerlich - Starkregen, Gewitter und zuweilen Temperaturen unter 20 Grad vergraul… [+1917 chars]",,de,'Temperaturen'
https://www.zeit.de/news/2024-08/09/freibadpreise-in-hessen-frankfurt-schwimmt-teurer,https://www.zeit.de/news/2024-08/09/freibadpreise-in-hessen-frankfurt-schwimmt-teurer,0,www.zeit.de,Freizeit: Freibadpreise in Hessen: Frankfurt schwimmt teurer,Hier finden Sie Informationen zu dem Thema „Freizeit“. Lesen Sie jetzt „Freibadpreise in Hessen: Frankfurt schwimmt teurer“.,https://img.zeit.de/news/2024-08/09/freibadpreise-in-hessen-frankfurt-schwimmt-teurer-image-group/wide__1300x731,2024-08-09T02:00:36Z,,"Der Sommer 2024 zeigt sich nicht immer sommerlich - Starkregen, Gewitter und zuweilen Temperaturen unter 20 Grad vergraulen manch einen Freibad-Fan. Wer bei gutem Wetter dann ins kühle Nass springen … [+2673 chars]",,de,'Freibad'
https://www.diepresse.com/18498832/heute-vor-100-jahren-straeflinge-im-seebad,https://www.diepresse.com/18498832/heute-vor-100-jahren-straeflinge-im-seebad,0,www.diepresse.com,Heute vor 100 Jahren: Sträflinge im Seebad,"Normalerweise sitzen sie in einem Londoner Gefängnis, nun dürfen 40 Häftlinge Sonne, Strand und Meer genießen.",https://img.diepresse.com/public/incoming/84t83w-Unbenannt-1_bearbeitet-2_1573327141100231.jpg/alternates/DPR_SOCIAL_MAGAZIN/Unbenannt-1_bearbeitet-2_1573327141100231.jpg,2024-08-09T03:14:02Z,,"Normalerweise sitzen sie in einem Londoner Gefängnis, nun dürfen 40 Häftlinge Sonne, Strand und Meer genießen.
Neue Freie Presse am 10. August 1924
Die Insel Wight beherbergt augenblicklich sonderb… [+24833 chars]",,de,'Sonne'
https://www.basicthinking.de/blog/2024/08/09/klimaanlagen-als-energiespeicher/,https://www.basicthinking.de/blog/2024/08/09/klimaanlagen-als-energiespeicher/,0,www.basicthinking.de,Klimaanlagen als Energiespeicher: Kommt die nachhaltige Kühlung?,"Können wir Klimaanlagen künftig auch als Energiespeicher nutzen, um Ökostrom für den Betrieb zu speichern? Neue Technologien wie ein System namens IceBrick sollen genau das möglich machen. Bei hohen Temperaturen greifen viele Menschen inzwischen auf Ventilato…",https://www.basicthinking.de/blog/wp-content/uploads/2024/08/klimaanlagen-als-energiespeicher.jpg,2024-08-09T03:45:51Z,,"Können wir Klimaanlagen künftig auch als Energiespeicher nutzen, um Ökostrom für den Betrieb zu speichern? Neue Technologien wie ein System namens IceBrick sollen genau das möglich machen.
Bei hohen… [+3281 chars]",,de,'Temperaturen'
https://www.zeit.de/news/2024-08/09/walter-sittler-nur-in-der-sonne-liegen-ist-doch-langweilig,https://www.zeit.de/news/2024-08/09/walter-sittler-nur-in-der-sonne-liegen-ist-doch-langweilig,0,www.zeit.de,Leute: Walter Sittler: Nur in der Sonne liegen ist doch langweilig,Hier finden Sie Informationen zu dem Thema „Leute“. Lesen Sie jetzt „Walter Sittler: Nur in der Sonne liegen ist doch langweilig“.,https://img.zeit.de/news/2024-08/09/walter-sittler-nur-in-der-sonne-liegen-ist-doch-langweilig-image-group/wide__1300x731,2024-08-09T04:01:35Z,,"Walter Sittler (71) hält seine Generation keineswegs für faul. «Ich kenne genügend Menschen in meinem Alter, die sagen: Ich bin in Rente, aber das reicht mir nicht und ich kann auch nicht dauernd in … [+2895 chars]",,de,'Sonne'
https://www.diepresse.com/18745551/das-klimagedaechtnis-der-welt-zwei-tage-im-juli-1963,https://www.diepresse.com/18745551/das-klimagedaechtnis-der-welt-zwei-tage-im-juli-1963,0,www.diepresse.com,Das Klimagedächtnis der Welt: Zwei Tage im Juli 1963,"Hitzerekorde lösen bei vielen Menschen oft nur noch Achselzucken aus. So auch die jüngsten Berichte, die zu dem Thema die Weltmeteorologie-Organisation (WMO) und Copernicus veröffentlicht haben. Und doch: Im veröffentlichten Material ist diesmal etwas anders.",https://img.diepresse.com/public/incoming/3n1hcf-file7sr7511ri551cmb6tl18.jpg/alternates/DPR_SOCIAL_NACHRICHTEN/file7sr7511ri551cmb6tl18.jpg,2024-08-09T04:48:10Z,,"Hitzerekorde lösen bei vielen Menschen oft nur noch Achselzucken aus. So auch die jüngsten Berichte, die zu dem Thema die Weltmeteorologie-Organisation (WMO) und Copernicus veröffentlicht haben. Und … [+7241 chars]",,de,'Hitze'
https://www.zeit.de/news/2024-08/09/regen-wind-und-wolken-am-freitag,https://www.zeit.de/news/2024-08/09/regen-wind-und-wolken-am-freitag,0,www.zeit.de,"Wetter Berlin und Brandenburg: Regen, Wind und Wolken am Freitag","Hier finden Sie Informationen zu dem Thema „Wetter Berlin und Brandenburg“. Lesen Sie jetzt „Regen, Wind und Wolken am Freitag“.",https://img.zeit.de/news/2024-08/09/regen-wind-und-wolken-am-freitag-image-group/wide__1300x731,2024-08-09T05:31:55Z,,"Am Freitag macht sich die Sonne in Berlin und Brandenburg rar. Der Deutsche Wetterdienst rechnet mit Regen, Wolken und viel Wind. Trotzdem klettern die Temperaturen auf warme 23 bis 27 Grad. 
In der… [+971 chars]",,de,'Sonne'
https://sz-magazin.sueddeutsche.de/liebe-und-partnerschaft/sind-die-gefuehle-echt-interview-ute-frevert-94186,https://sz-magazin.sueddeutsche.de/liebe-und-partnerschaft/sind-die-gefuehle-echt-interview-ute-frevert-94186,0,sz-magazin.sueddeutsche.de,»Liebst du mich wirklich?«,"Sie ist das schönste Gefühl der Welt, heißt es. Aber was ist das überhaupt: echte Liebe? Ein Gespräch mit der Historikerin Ute Frevert, die sagt: Die Antwort darauf gibt nicht die Natur, sondern die Kultur.",https://szm-media.sueddeutsche.de/image/szm/1c10d2a3492068fda3e7b0e18693dfb3/t0l0w1200h630/1280/image.jpeg,2024-08-09T07:00:00Z,,"SZ-Magazin: Frau Frevert, Sie sind Historikerin und beschäftigen sich mit Gefühlen. Was sind für Sie Gefühle?Ute Frevert: Gefühle sind Kommunikationsträger, die uns mit anderen in Beziehung setzen, d… [+771 chars]",,de,'Natur'
https://www.focus.de/experts/keiner-bindet-besser-kohlenstoff-wald-schlaegt-industrieanlage_id_260198557.html,https://www.focus.de/experts/keiner-bindet-besser-kohlenstoff-wald-schlaegt-industrieanlage_id_260198557.html,0,www.focus.de,Spezialistin für Biodiversität erklärt - Wald schlägt Industrieanlage: Keiner bindet besser Kohlenstoff,Menschen in Industrienationen lieben technische Lösungen – wir Deutschen ganz besonders. Geld für technische Kohlenstoffbindung zusammen zu kriegen ist daher im Moment auch kein großes Problem. Das Techniklabor Natur hat aber laut Frauke Fischer einen ordentl…,https://p6.focus.de/img/fotos/id_260198558/gettyimages-1354072082.jpg?im=Crop%3D%280%2C177%2C2121%2C1060%29%3BResize%3D%281200%2C627%29&impolicy=perceptual&quality=mediumHigh&hash=362fc1649acf5f2d31cb027cd8ab98ac60228a09e498438c2042aace058672f3,2024-08-09T07:01:07Z,,"<ul><li>
Kommentare</li><li>
E-Mail</li><li>
Teilen</li><li>
Mehr</li><li>
Twitter</li><li>
Drucken</li><li>
Feedback</li><li>
Fehler meldenSie haben einen Fehler gefunden?
Bitte markieren S… [+5361 chars]",,de,'Natur'
https://www.diepresse.com/18745484/wie-es-sich-in-einer-kabine-im-freibad-lebt,https://www.diepresse.com/18745484/wie-es-sich-in-einer-kabine-im-freibad-lebt,0,www.diepresse.com,Wie es sich in einer Kabine im Freibad lebt [premium],Jeden Sommer übersiedeln Karina und Markus Hansmann in ihre Wohnkabine im Strandbad Klosterneuburg. Der Traum vieler – wäre da nicht die lange Warteliste.,https://img.diepresse.com/public/incoming/907z2z-Strandbad-Klosterneuburg/alternates/DPR_SOCIAL_MAGAZIN/Strandbad%20Klosterneuburg,2024-08-09T07:33:46Z,,"Jeden Sommer übersiedeln Karina und Markus Hansmann in ihre Wohnkabine im Strandbad Klosterneuburg. Der Traum vieler wäre da nicht die lange Warteliste. 
An heißen Wochenenden wie diesen wünschen si… [+828 chars]",,de,'Freibad'
https://www.zeit.de/2024/34/geschlechterdebatte-olympia-boxen-imane-khelif-chromosom,https://www.zeit.de/2024/34/geschlechterdebatte-olympia-boxen-imane-khelif-chromosom,0,www.zeit.de,Geschlechterdebatte bei Olympia: Y schlägt X,"Der Fall der Boxerin Imane Khelif wirft die Frage auf: Was, wenn Sportlerinnen von Natur aus einen Vorteil haben? Es gibt dafür nur eine beste unter schlechten Lösungen.",https://img.zeit.de/2024/34/y-schlaegt-x-bild-2/wide__1300x731,2024-08-09T08:32:41Z,,"Sport ist Spielen nach Regeln. Wer die Regeln bricht, wer zum Beispiel Dopingmittel nimmt, wird disqualifiziert. Gerade im Spitzensport ist das ein Gebot der Fairness. Was aber geschieht, wenn Sportl… [+575 chars]",,de,'Natur'
https://www.morgenpost.de/ratgeber-wissen/article406391963/hitze-sommer-tropische-naechte-gefaehrlich-gesundheit.html,https://www.morgenpost.de/ratgeber-wissen/article406391963/hitze-sommer-tropische-naechte-gefaehrlich-gesundheit.html,0,www.morgenpost.de,Forscher: Warme Sommernächte können lebensgefährlich sein,"Kühlen sich die Nächte im Sommer nicht ab, haben viele Menschen Schlafprobleme. Laut einer Studie sind Tropische Nächte sogar lebensgefährlich.",https://img.sparknews.funkemedien.de/406383725/406383725_1716220806_v16_9_1600.jpeg,2024-08-09T15:15:00Z,,"Berlin. Meteorologen kündigen eine Hitzeperiode inklusive warmer Nächte an. Einer Studie zufolge können Tropennächte die Gesundheit stark gefährden.
<ul><li>Die Temperaturen sollen am Wochenende auf… [+5153 chars]",,de,'Tropische Nächte'
https://www.zeit.de/news/2024-08/10/heisses-wetter-in-hessen-erwartet-dienstag-gewitter,https://www.zeit.de/news/2024-08/10/heisses-wetter-in-hessen-erwartet-dienstag-gewitter,0,www.zeit.de,Hitze: Heißes Wetter in Hessen erwartet - Dienstag Gewitter,Hier finden Sie Informationen zu dem Thema „Hitze“. Lesen Sie jetzt „Heißes Wetter in Hessen erwartet - Dienstag Gewitter“.,https://img.zeit.de/news/2024-08/10/heisses-wetter-in-hessen-erwartet-dienstag-gewitter-image-group/wide__1300x731,2024-08-10T11:10:33Z,,"Es wird heiß in Hessen: Der Deutsche Wetterdienst (DWD) erwartet für die kommenden Tage Sonne und Temperaturen bis zu 36 Grad. Erst am Dienstag sei mit vereinzelten Gewittern und Regen zu rechnen, te… [+483 chars]",,de,'Temperaturen'
https://www.zeit.de/news/2024-08/10/hitze-kommt-auf-sachsen-anhalt-zu,https://www.zeit.de/news/2024-08/10/hitze-kommt-auf-sachsen-anhalt-zu,0,www.zeit.de,Wetter: Hitze kommt auf Sachsen-Anhalt zu,Hier finden Sie Informationen zu dem Thema „Wetter“. Lesen Sie jetzt „Hitze kommt auf Sachsen-Anhalt zu“.,https://img.zeit.de/news/2024-08/10/hitze-kommt-auf-sachsen-anhalt-zu-image-group/wide__1300x731,2024-08-10T11:14:21Z,,"Die Menschen in Sachsen-Anhalt müssen sich auf Hitze einstellen. Am Wochenende bleiben die Maximaltemperaturen noch knapp unter der 30-Grad-Marke, wie der Deutsche Wetterdienst mitteilte. Am Sonntag … [+368 chars]",,de,'Hitze'
https://www.zeit.de/news/2024-08/10/heisses-sommerwetter-in-rheinland-pfalz-und-im-saarland,https://www.zeit.de/news/2024-08/10/heisses-sommerwetter-in-rheinland-pfalz-und-im-saarland,0,www.zeit.de,Hitze: Heißes Sommerwetter in Rheinland-Pfalz und im Saarland,Hier finden Sie Informationen zu dem Thema „Hitze“. Lesen Sie jetzt „Heißes Sommerwetter in Rheinland-Pfalz und im Saarland“.,https://img.zeit.de/news/2024-08/10/heisses-sommerwetter-in-rheinland-pfalz-und-im-saarland-image-group/wide__1300x731,2024-08-10T12:17:45Z,,Die Menschen in Rheinland-Pfalz und im Saarland können sich laut Deutschem Wetterdienst (DWD) für Sonntag und den Wochenbeginn auf sehr heißes Wetter einstellen. «Auf ein ruhiges und im Süden zunehme… [+844 chars],,de,'Hitze'
https://www.bild.de/regional/mecklenburg-vorpommern/wolgast-feuer-in-taubenschlag60-voegel-tot-20-gerettet-66b7729aa38a3c03ffda6141,https://www.bild.de/regional/mecklenburg-vorpommern/wolgast-feuer-in-taubenschlag60-voegel-tot-20-gerettet-66b7729aa38a3c03ffda6141,0,www.bild.de,60 Tiere verbrannt - Gerettete Vögel sehen Feuer in ihrem Taubenschlag,"In Wolgast (Mecklenburg-Vorpommern) geriet ein Taubenschlag in Brand. Die Feuerwehr konnte zwar 20 Tiere retten, jedoch verendeten bis zu 60 Tauben.","https://images.bild.de/66b7729aa38a3c03ffda6141/42b27ebf4a1bb30ac005700c16b766ef,d01fa0cb?w=1280",2024-08-10T17:51:46Z,,"Greifswald Grausamer Feuer-Tod für Dutzende Vögel  die u. a. dafür gezüchtet wurden, um bei Hochzeiten feierlich in die Lüfte zu steigen.
In der Kleinstadt Wolgast (Mecklenburg-Vorpommern) brach in … [+999 chars]",,de,'Vögel'
https://www.nzz.ch/zuerich/hitze-drogen-party-das-war-die-street-parade-2024-in-zuerich-ld.1843202,https://www.nzz.ch/zuerich/hitze-drogen-party-das-war-die-street-parade-2024-in-zuerich-ld.1843202,0,www.nzz.ch,"Rekordverdächtige Hitze, schockierende Preise, überdosierte Pillen – und der unbedingte Wille zur Ekstase",Das war die Street Parade 2024.,"https://img.nzz.ch/2024/08/10/96a6f1ab-a631-4213-822e-093b672dbde7.jpeg?width=1200&height=675&fit=bounds&quality=75&auto=webp&crop=6000,3375,x0,y474&wmark=nzz",2024-08-11T03:00:00Z,,"Die nicht vorhandene Kleiderordnung ergab diesmal besonders Sinn.
Der beglückendste Ort der Street Parade 2024 befindet sich nicht im Gedränge vor den Love-Mobiles, nicht auf den Booten im Seebecken… [+4748 chars]",,de,'Rekordwerte'
https://www.zeit.de/news/2024-08/11/sommerlicher-sonntag-temperaturen-steigen-zum-wochenstart,https://www.zeit.de/news/2024-08/11/sommerlicher-sonntag-temperaturen-steigen-zum-wochenstart,0,www.zeit.de,Wetter: Sommerlicher Sonntag - Temperaturen steigen zum Wochenstart,Hier finden Sie Informationen zu dem Thema „Wetter“. Lesen Sie jetzt „Sommerlicher Sonntag - Temperaturen steigen zum Wochenstart“.,https://img.zeit.de/news/2024-08/11/sommerlicher-sonntag-temperaturen-steigen-zum-wochenstart-image-group/wide__1300x731,2024-08-11T06:21:16Z,,"Der Sonntag wird sommerlich warm in Berlin und Brandenburg. Die Temperaturen liegen bei 24 bis 28 Grad. Die höheren Werte erwarten die Experten im Süden von Brandenburg, wie der Deutsche Wetterdienst… [+479 chars]",,de,'Temperaturen'
https://www.zeit.de/news/2024-08/11/hitze-in-nrw-zum-wochenstart,https://www.zeit.de/news/2024-08/11/hitze-in-nrw-zum-wochenstart,0,www.zeit.de,Wetter: Hitze in NRW zum Wochenstart,Hier finden Sie Informationen zu dem Thema „Wetter“. Lesen Sie jetzt „Hitze in NRW zum Wochenstart“.,https://img.zeit.de/news/2024-08/11/hitze-in-nrw-zum-wochenstart-image-group/wide__1300x731,2024-08-11T08:06:05Z,,Zum Wochenbeginn sollten sich die Menschen in Nordrhein-Westfalen ein schattiges Plätzchen suchen. Die Temperaturen steigen am Montag laut Vorhersage des Deutschen Wetterdienstes (DWD) auf 29 bis 34 … [+945 chars],,de,'Hitze'
https://www.zeit.de/news/2024-08/11/hitze-in-bayern-start-in-eine-woche-mit-bis-zu-35-grad,https://www.zeit.de/news/2024-08/11/hitze-in-bayern-start-in-eine-woche-mit-bis-zu-35-grad,0,www.zeit.de,Wetter: Hitze in Bayern - Start in eine Woche mit bis zu 35 Grad,Hier finden Sie Informationen zu dem Thema „Wetter“. Lesen Sie jetzt „Hitze in Bayern - Start in eine Woche mit bis zu 35 Grad“.,https://img.zeit.de/news/2024-08/11/hitze-in-bayern-start-in-eine-woche-mit-bis-zu-35-grad-image-group/wide__1300x731,2024-08-11T08:40:56Z,,"In Bayern werden zum Wochenwechsel sommerliche Temperaturen von bis zu 34 Grad erwartet. Laut Deutschem Wetterdienst ist bereits am Sonntag überwiegend mit Sonne und Hitze zu rechnen, wenn auch verei… [+731 chars]",,de,'Hitze'
https://www.stern.de/panorama/wettervorhersage--heisser-wochenstart---neue-unwetter-drohen-34971968.html,https://www.stern.de/panorama/wettervorhersage--heisser-wochenstart---neue-unwetter-drohen-34971968.html,0,www.stern.de,Wettervorhersage: Heißer Wochenstart - Neue Unwetter drohen,Tropische Nächte und heiße Tage in Aussicht: Der Wetterdienst erwartet Temperaturen weit über 30 Grad. Der Dienstag könnte der heißeste Tag des Jahres werden - zur Wochenmitte drohen Unwetter.,https://image.stern.de/34971970/t/Rl/v1/w1440/r1.7778/-/11--4yvrsggxvhv3axw800h600jpeg---e349646b9af4f6a3.jpg,2024-08-11T09:46:55Z,,"Tropische Nächte und heiße Tage in Aussicht: Der Wetterdienst erwartet Temperaturen weit über 30 Grad. Der Dienstag könnte der heißeste Tag des Jahres werden - zur Wochenmitte drohen Unwetter.
Die n… [+1866 chars]",,de,'Temperaturen'
https://www.tagesspiegel.de/gesellschaft/panorama/wettervorhersage-heisser-wochenstart-neue-unwetter-drohen-12180467.html,https://www.tagesspiegel.de/gesellschaft/panorama/wettervorhersage-heisser-wochenstart-neue-unwetter-drohen-12180467.html,0,www.tagesspiegel.de,Wettervorhersage: Heißer Wochenstart - Neue Unwetter drohen,Tropische Nächte und heiße Tage in Aussicht: Der Wetterdienst erwartet Temperaturen weit über 30 Grad. Der Dienstag könnte der heißeste Tag des Jahres werden - zur Wochenmitte drohen Unwetter.,https://www.tagesspiegel.de/images/12180464/alternates/BASE_16_9_W1400/1723369681000/wetter-in-sachsen-anhalt.jpeg,2024-08-11T09:48:01Z,,"Die neue Woche wird heiß: Der Deutsche Wetterdienst (DWD) erwartet Temperaturen von über 30 Grad. Zur Wochenmitte könnten allerdings neue Unwetter das Sommerwetter beenden.
Am Montag werden südwestl… [+1753 chars]",,de,'Tropische Nächte'
https://www.tagesspiegel.de/gesellschaft/38-grad-am-dienstag-moglich-hitze-zum-wochenstart--anschliessend-drohen-neue-unwetter-12180467.html,https://www.tagesspiegel.de/gesellschaft/38-grad-am-dienstag-moglich-hitze-zum-wochenstart--anschliessend-drohen-neue-unwetter-12180467.html,0,www.tagesspiegel.de,38 Grad am Dienstag möglich: Hitze zum Wochenstart – anschließend drohen neue Unwetter,Tropische Nächte und heiße Tage in Aussicht: Der Wetterdienst erwartet Temperaturen jenseits der 30 Grad. Der Dienstag könnte der heißeste Tag des Jahres werden. Zur Wochenmitte drohen Unwetter.,https://www.tagesspiegel.de/images/12180464/alternates/BASE_16_9_W1400/1723370234000/wetter-in-sachsen-anhalt.jpeg,2024-08-11T09:48:01Z,,"Die neue Woche wird heiß: Der Deutsche Wetterdienst (DWD) erwartet Temperaturen von über 30 Grad. Zur Wochenmitte könnten allerdings neue Unwetter das Sommerwetter beenden.
Die Tagesspiegel-App Aktu… [+2095 chars]",,de,'Tropische Nächte'
https://www.diepresse.com/18751642/der-schwimmfarn-sorgt-fuer-schatten-im-teich,https://www.diepresse.com/18751642/der-schwimmfarn-sorgt-fuer-schatten-im-teich,0,www.diepresse.com,Der Schwimmfarn sorgt für Schatten im Teich [premium],"Er ist adrett anzuschauen, wie er da auf der Wasseroberfläche von Teichen, Regentonnen oder Wassergärten treibt. Die Wurzeln hängen in die Tiefe, oben trägt er lustig gerüschte knallgrüne Blätter, die dank ihrer vielen Luftkammern nie untergehen.",https://img.diepresse.com/public/incoming/iocdpn-SUB-Schwimmfarn/alternates/DPR_SOCIAL_NACHRICHTEN/SUB%20Schwimmfarn,2024-08-11T14:15:36Z,,"Er ist adrett anzuschauen, wie er da auf der Wasseroberfläche von Teichen, Regentonnen oder Wassergärten treibt. Die Wurzeln hängen in die Tiefe, oben trägt er lustig gerüschte knallgrüne Blätter, di… [+688 chars]",,de,'Blätter'
https://wien.orf.at/stories/3268696/,https://wien.orf.at/stories/3268696/,0,wien.orf.at,Sonnenschutzfolien als Helfer bei Hitze,"Die aktuelle Hitze ist für viele unangenehm. Vor allem wenn man ihr nicht entkommen kann, etwa in den eigenen vier Wänden. Vor allem bei starker Sonneneinstrahlung heizen sich Wohnungen mitunter extrem auf. Eine Lösung könnten hier sogenannte Sonnenschutzfoli…",https://ibs.orf.at/wie?image=https%3A%2F%2Foekastatic.orf.at%2Fmims%2F2024%2F33%2F73%2Fcrops%2Fw%3D1200%2Ch%3D627%2Cq%3D75%2F2313755_master_880773_9308185527_25669eae60_o.jpg%3Fs%3Dc4985cbb5b1031a2265859891bded6bbc5179f4c,2024-08-12T04:00:00Z,,"Sonnenschutzfolien werden mit einer hauchdünnen Schicht Metall überzogen und funktionieren wie ein durchlässiger Spiegel. Es fällt nur noch ein Teil der Sonnenstrahlen durch die Fenster, der Rest wir… [+1190 chars]",,de,'Hitze'
