index,url,valid,domain,title,description,image,published,archive,content,quote,language,keyword
https://www.stern.de/gesellschaft/regional/bayern/vollsperrung--lastwagen-kippt-auf-a93-um---fahrer-verletzt-34955068.html,https://www.stern.de/gesellschaft/regional/bayern/vollsperrung--lastwagen-kippt-auf-a93-um---fahrer-verletzt-34955068.html,0,www.stern.de,Vollsperrung: Lastwagen kippt auf A93 um - Fahrer verletzt,Regenstauf (lby) - Ein Lastwagen ist auf der Autobahn 93 bei Regenstauf (Landkreis Regensburg) umgekippt und liegt quer auf der Fahrbahn. Der Fahrer sei,https://image.stern.de/34955070/t/Ux/v1/w1440/r1.7778/-/06--lbkd2des2qv15axw800h600jpeg---fc11878c76129ce0.jpg,2024-08-06T12:33:59Z,,"Deutlich länger werden Autofahrer heute auf der A93 benötigen. Nach einem Unfall ist die Fahrbahn in Richtung München komplett gesperrt.
Ein Lastwagen ist auf der Autobahn 93 bei Regenstauf (Landkre… [+663 chars]",,de,'Regen'
https://www.zeit.de/news/2024-08/06/waldbrandgefahr-niederbayern-ordnet-beobachtungsfluege-an,https://www.zeit.de/news/2024-08/06/waldbrandgefahr-niederbayern-ordnet-beobachtungsfluege-an,0,www.zeit.de,Natur: Waldbrandgefahr - Niederbayern ordnet Beobachtungsflüge an,Hier finden Sie Informationen zu dem Thema „Natur“. Lesen Sie jetzt „Waldbrandgefahr - Niederbayern ordnet Beobachtungsflüge an“.,https://img.zeit.de/news/2024-08/06/waldbrandgefahr-niederbayern-ordnet-beobachtungsfluege-an-image-group/wide__1300x731,2024-08-06T14:53:50Z,,Wegen der steigenden Waldbrandgefahr sollen am Mittwoch in Niederbayern drei Beobachtungsflüge stattfinden. Durch die Beobachtung aus der Luft sollen mögliche Gefahrenquellen für Waldbrände frühzeiti… [+621 chars],,de,'Natur'
https://www.stern.de/gesellschaft/regional/bayern/natur--waldbrandgefahr---niederbayern-ordnet-beobachtungsfluege-an-34955720.html,https://www.stern.de/gesellschaft/regional/bayern/natur--waldbrandgefahr---niederbayern-ordnet-beobachtungsfluege-an-34955720.html,0,www.stern.de,Natur: Waldbrandgefahr - Niederbayern ordnet Beobachtungsflüge an,Wegen trockener Böden durch fehlende Niederschläge steigt die Waldbrandgefahr in Bayern an. In Niederbayern soll die Lage am Mittwoch aus der Luft beobachtet werden. Was ist konkret geplant?,https://image.stern.de/34955722/t/mI/v1/w1440/r1.7778/-/06--yozgg4zv3hv15axw800h600jpeg---ebbcdfa876b8f25e.jpg,2024-08-06T14:53:50Z,,"Wegen trockener Böden durch fehlende Niederschläge steigt die Waldbrandgefahr in Bayern an. In Niederbayern soll die Lage am Mittwoch aus der Luft beobachtet werden. Was ist konkret geplant?
Wegen d… [+822 chars]",,de,'Natur'
https://www.n-tv.de/wissen/Perseidenschwarm-Wann-der-Sternschnuppen-Regen-wieder-sichtbar-ist-article25139901.html,https://www.n-tv.de/wissen/Perseidenschwarm-Wann-der-Sternschnuppen-Regen-wieder-sichtbar-ist-article25139901.html,0,www.n-tv.de,Phänomen Perseidenschwarm: Wann der Sternschnuppen-Regen wieder erstrahlt,Dank des Perseidenschwarms erleuchten im August unzählige Sternschnuppen den Himmel. Insbesondere in einer Nacht ist das Himmelsspektakel ideal zu erkennen - und das mit bloßem Auge. Aber wie kommt es überhaupt dazu?,https://bilder1.n-tv.de/img/incoming/crop25139900/7261329033-cImg_16_9-w1200/420724132.jpg,2024-08-06T15:32:49Z,,Hochsommer ist Sternschnuppenzeit: Mitte August sind dank des legendären Perseidenschwarms wieder unzählige Sternschnuppen mit bloßem Auge am Himmel zu sehen. Der Meteorregen wird in diesem Jahr in d… [+3532 chars],,de,'Regen'
https://www.morgenpost.de/berlin/article406965305/wetter-in-berlin-sommer-dreht-auf-doch-es-drohen-unwetter.html,https://www.morgenpost.de/berlin/article406965305/wetter-in-berlin-sommer-dreht-auf-doch-es-drohen-unwetter.html,0,www.morgenpost.de,Wetter in Berlin: Sommer dreht auf – doch es drohen Unwetter,Sonne satt und sehr hohe Temperaturen sind am Mittwoch zu erwarten. Doch später ist Vorsicht geboten. Es kann ungemütlich werden.,https://img.sparknews.funkemedien.de/406857743/406857743_1721716096_v16_9_1600.jpeg,2024-08-07T05:00:48Z,,"Berlin. Sonne satt und sehr hohe Temperaturen sind am Mittwoch zu erwarten. Doch später ist Vorsicht geboten. Es kann ungemütlich werden.
Nach einem sonnigen Tag kann es am Abend in Berlin und Brand… [+1743 chars]",,de,'Sonne'
https://sz-magazin.sueddeutsche.de/leben-und-gesellschaft/katastrophenfall-notfallplan-94175,https://sz-magazin.sueddeutsche.de/leben-und-gesellschaft/katastrophenfall-notfallplan-94175,0,sz-magazin.sueddeutsche.de,"Die Frau, die gegen unsere Albträume helfen soll","Ist Deutschland auf Naturkatastrophen oder Kriege vorbereitet? Was, wenn nicht ein Dutzend Menschen schwer verletzt sind, sondern Tausende? Die Ärztin Annika Rohde muss mit einem kleinen Team lebenswichtige Antworten finden – und wird dabei von der Wirklichke…",https://szm-media.sueddeutsche.de/image/szm/b0f3c873e2bbdaae5b959cb8891952a6/t0l0w1200h630/1280/image.jpeg,2024-08-07T05:30:00Z,,"Das erste Opfer war bereit, seine Rolle zu spielen. Der Mann sollte flüchten, als eine Explosion seine Straße erschütterte. Seine Rolle sah vor, dass die Schockwelle ihn zwei, drei Meter zurückschleu… [+373 chars]",,de,'Natur'
https://www.focus.de/panorama/wetter-in-deutschland-sommer-und-sonne-kehren-zurueck-unwetter-in-sachsen-erwartet_id_54933749.html,https://www.focus.de/panorama/wetter-in-deutschland-sommer-und-sonne-kehren-zurueck-unwetter-in-sachsen-erwartet_id_54933749.html,0,www.focus.de,"Wetter im Ticker - Sommer und Sonne kehren zurück, Unwetter in Sachsen erwartet",Das Sommerwetter war lang ersehnt - und kommt nach einem gewittrigen Wochenende wieder nach Deutschland zurück - wenn auch nur kurz. Zur Wochenmitte rechnet der Deutsche Wetterdienst mit Unwettern in Sachsen. Alles zur aktuellen Lage lesen Sie im Wetterticker.,https://p6.focus.de/img/regional/rheinland-pfalz/id_260193770/nach-dicken-wolken-wird-es-immer-waermer.jpg?im=Crop%3D%280%2C171%2C2048%2C1024%29%3BResize%3D%281200%2C627%29&impolicy=perceptual&quality=mediumHigh&hash=4522f08d44bdbae641e9043f46c3557734971dafc4f418eded7cf68f5d5f73d8,2024-08-07T06:38:32Z,,Das Sommerwetter war lang ersehnt - und kommt nach einem gewittrigen Wochenende wieder nach Deutschland zurück - wenn auch nur kurz. Zur Wochenmitte rechnet der Deutsche Wetterdienst mit Unwettern in… [+10464 chars],,de,'Sonne'
https://www.stern.de/gesellschaft/regional/hessen/deutscher-wetterdienst--viele-wolken-und-wenig-sonne-in-hessen-34957582.html,https://www.stern.de/gesellschaft/regional/hessen/deutscher-wetterdienst--viele-wolken-und-wenig-sonne-in-hessen-34957582.html,0,www.stern.de,Deutscher Wetterdienst: Viele Wolken und wenig Sonne in Hessen,"Offenbach (lhe) - Viele Wolken, wenig Sonne: Die vielen Wolken und einige Unwetter sorgen weiterhin für einen nicht wirklich sommerlichen Sommer. So auch",https://image.stern.de/34957584/t/5H/v1/w1440/r1.7778/-/07--mwra6lgd7pv9axw800h600jpeg---b36b79cfc3555a8b.jpg,2024-08-07T06:59:37Z,,"Der Sommer bleibt durchwachsen. In den nächsten Tagen erwarten die Meteorologen für Hessen vor allem wolkiges Wetter, Regen und auch Gewitter.
Viele Wolken, wenig Sonne: Die vielen Wolken und einige… [+914 chars]",,de,'Sonne'
https://www.zeit.de/news/2024-08/07/viele-wolken-und-wenig-sonne-in-hessen,https://www.zeit.de/news/2024-08/07/viele-wolken-und-wenig-sonne-in-hessen,0,www.zeit.de,Deutscher Wetterdienst: Viele Wolken und wenig Sonne in Hessen,Hier finden Sie Informationen zu dem Thema „Deutscher Wetterdienst“. Lesen Sie jetzt „Viele Wolken und wenig Sonne in Hessen“.,https://img.zeit.de/news/2024-08/07/viele-wolken-und-wenig-sonne-in-hessen-image-group/wide__1300x731,2024-08-07T06:59:37Z,,"Viele Wolken, wenig Sonne: Die vielen Wolken und einige Unwetter sorgen weiterhin für einen nicht wirklich sommerlichen Sommer. So auch heute. Der Deutsche Wetterdienst (DWD) hat für Hessen viele Wol… [+1474 chars]",,de,'Sonne'
https://www.sueddeutsche.de/projekte/artikel/wirtschaft/italien-duerre-sizilien-klimakrise-wassermangel-wein-hitze-e389582/,https://www.sueddeutsche.de/projekte/artikel/wirtschaft/italien-duerre-sizilien-klimakrise-wassermangel-wein-hitze-e389582/,0,www.sueddeutsche.de,Hitze: Siziliens großer Durst: Die Wüste rückt vor,"Auf der süditalienischen Insel herrscht Wassernotstand, das Getreide verdorrt, Tiere und Menschen leiden unter ständiger Knappheit. Doch es gibt auch Profiteure.","https://www.sueddeutsche.de/projekte/artikel/wirtschaft/italien-duerre-sizilien-klimakrise-wassermangel-wein-hitze-e389582/e191f689c3505f7e3ba400996234a0bf260c3e062c3ef3ad75d7f9ddbef12e9b_w2400_h1256_r215,0,3000,1570_oszplus_q70.jpg",2024-08-07T14:58:00Z,,"Das staubtrockene Feld, auf dem Michele Cancemi kapitulierte, ist bis zum Horizont von einer strohgelben Steppe umgeben. Hier habe er sonst Sommergemüse angebaut, sagt der Landwirt. Statt auf die grü… [+82 chars]",,de,'Blätter'
https://www.n-tv.de/wissen/Verdunstung-auf-Blaettern-Wie-sich-Eichen-vor-Hitze-schuetzen-article25144935.html,https://www.n-tv.de/wissen/Verdunstung-auf-Blaettern-Wie-sich-Eichen-vor-Hitze-schuetzen-article25144935.html,0,www.n-tv.de,Eigener Schutzmechanismus: Wie Eichenblätter auf Hitze reagieren,"Ein Forschungsteam misst im vergangenen Sommer die Temperatur auf Blättern an Eichen in der Schweiz, in Frankreich und in Spanien. Die Forschenden staunen darüber, wie gut sich die Bäume vor hohen Temperaturen schützen können - und finden den Grund.",https://bilder2.n-tv.de/img/incoming/crop25144937/3131322912-cImg_16_9-w1200/469705738.jpg,2024-08-08T10:51:42Z,,"Ein Forschungsteam misst im vergangenen Sommer die Temperatur auf Blättern an Eichen in der Schweiz, in Frankreich und in Spanien. Die Forschenden staunen darüber, wie gut sich die Bäume vor hohen Te… [+1786 chars]",,de,'Temperaturen'
https://www.photoscala.de/2024/08/08/sony-probleme-bei-cfexpress-typ-a-speicherkarten/,https://www.photoscala.de/2024/08/08/sony-probleme-bei-cfexpress-typ-a-speicherkarten/,0,www.photoscala.de,Sony: Probleme bei CFexpress Typ A Speicherkarten,Sony meldet Probleme bei einer Charge von Sony CFexpress Typ A Speicherkarten der Serie CEA-G. In seltenen Fällen werden laut Sony Pro Support die Karten nicht mehr erkannt oder sie versagen bei niedrigen Temperaturen unter minus 10 Grad Celsius den Dienst. Ü…,https://www.photoscala.de/wp-content/uploads/2020/07/CFexpress-Speicherkarte-TITEL.jpg,2024-08-08T12:14:01Z,,"Wichtiger Servicehinweis für Benutzer von Sony CFexpress Typ A Speicherkarten
Sony hat ein Problem bei einer Charge von Speicherkarten der Serie CEA-G festgestellt. Da diese Probleme zu Datenverlust… [+1261 chars]",,de,'Temperaturen'
https://www.diepresse.com/18745248/eine-feuerwehrjacke-die-vor-hitzestress-schuetzt,https://www.diepresse.com/18745248/eine-feuerwehrjacke-die-vor-hitzestress-schuetzt,0,www.diepresse.com,"Eine Feuerwehrjacke, die vor Hitzestress schützt",Feuerwehrleute haben oft mit extremen Temperaturen zu tun. Forscher von Salzburg Research und Uni Salzburg haben eine kühlende Jacke entwickelt. Getestet wurde sie bisher in der Sauna und am Laufband.,https://img.diepresse.com/public/incoming/62m7ls-TexSense_Proband-im-Brandcontainer_cSalzburg-Research_wildbild.jpg/alternates/DPR_SOCIAL_NACHRICHTEN/TexSense_Proband-im-Brandcontainer_cSalzburg-Research_wildbild.jpg,2024-08-08T12:35:47Z,,Feuerwehrleute haben oft mit extremen Temperaturen zu tun. Forscher von Salzburg Research und Uni Salzburg haben eine kühlende Jacke entwickelt. Getestet wurde sie bisher in der Sauna und am Laufband… [+3461 chars],,de,'Temperaturen'
"https://www.gamestar.de/artikel/sommer-temperaturen-tipps,3382745.html","https://www.gamestar.de/artikel/sommer-temperaturen-tipps,3382745.html",0,www.gamestar.de,Special: Kühl durch den Sommer - Mit unseren Tech-Tipps trotzen eure Geräte der Hitze,"Die hohen Temperaturen bringen auch eure PCs und Smartphones an die Belastungsgrenze. Wir haben zahlreiche Tipps für euch, was dagegen hilft!",https://images.cgames.de/images/gamestar/4/gs-tech-sommerhub-teaser_6188368.jpg,2024-08-08T12:41:00Z,,"Wie viel Zeit habt ihr heute schon wieder damit verbracht, zu schwitzen, zu ächzen und nach etwas Erfrischung zu suchen? Die sommerlichen Höchsttemperaturen sind aber nicht nur für euch ein echter Hä… [+4056 chars]",,de,'Temperaturen'
https://www.fitforfun.de/news/naechste-hitzewelle-kommt-fuer-diese-menschen-ist-die-hitze-besonders-gefaehrlich-368920.html,https://www.fitforfun.de/news/naechste-hitzewelle-kommt-fuer-diese-menschen-ist-die-hitze-besonders-gefaehrlich-368920.html,0,www.fitforfun.de,Nächste Hitzewelle kommt: Für diese Menschen ist die Hitze besonders gefährlich,"Wenn die Sonne vom Himmel brutzelt, passt sich der menschliche Körper an die heißen Bedingungen an. Doch bei einigen Personengruppen funktioniert diese Anpassung nicht ganz so gut, weshalb ihre Gesundheit besonders gefährdet ist.","https://www.fitforfun.de/files/images/201907/1/strand,368964_3x2_n.jpg",2024-08-08T12:59:00Z,,"Klettern die Temperaturen auf über 30 Grad, spaltet die Hitze früher oder später die Gemüter. Während sich viele an den heißen Sommertemperaturen erfreuen, flüchten einige möglichst schnell an kühler… [+329 chars]",,de,'Temperaturen'
https://www.dw.com/de/juli-ist-zweithei%C3%9Fester-monat-seit-beginn-der-aufzeichnungen/a-69889748,https://www.dw.com/de/juli-ist-zweithei%C3%9Fester-monat-seit-beginn-der-aufzeichnungen/a-69889748,0,www.dw.com,Juli ist zweitheißester Monat seit Beginn der Aufzeichnungen,"Hitzewelle, Rekordregen, Hurrikane: Der Juli war geprägt von extremen Wetterlagen. Jetzt teilt der europäische Klimadienst Copernicus mit: Der Monat war der zweitheißeste seit Beginn der Aufzeichnungen.",https://static.dw.com/image/69499303_6.jpg,2024-08-08T13:14:00Z,,"Das europäische Erdbeobachtungsprogramm Copernicus
(C3S) hat am 22. und 23. Juli mit einem Wert von 17,6 Grad die weltweit höchsten Durchschnittstemperaturen seit Beginn der Aufzeichnungen im Jahr 1… [+2497 chars]",,de,'Hitze'
https://www.n-tv.de/panorama/Hochsommer-setzt-zum-grossen-Finale-an-bis-zu-38-Grad-article25145802.html,https://www.n-tv.de/panorama/Hochsommer-setzt-zum-grossen-Finale-an-bis-zu-38-Grad-article25145802.html,0,www.n-tv.de,Sahara-Luft bringt extreme Hitze: Hochsommer setzt zum großen Finale an - bis zu 38 Grad,"Zwei kleine Tiefs sorgen für Abkühlung und Regen - doch der Hochsommer kehrt zurück. Und wie. Nach einem bereits sonnigen Wochenende stehen zu Beginn der neuen Woche die wohl bislang heißesten Tage des Jahres an, wie ntv-Meteorologe Björn Alexander vorausblic…",https://bilder1.n-tv.de/img/incoming/crop25145816/021132639-cImg_16_9-w1200/475144096.jpg,2024-08-08T13:42:30Z,,Zwei kleine Tiefs sorgen für Abkühlung und Regen - doch der Hochsommer kehrt zurück. Und wie. Nach einem bereits sonnigen Wochenende stehen zu Beginn der neuen Woche die wohl bislang heißesten Tage d… [+4652 chars],,de,'Temperaturen'
https://www.focus.de/earth/news/strecke-geht-zu-ende-nach-13-monaten-endet-der-weltweite-hitzerekord-das-ist-kein-grund-zur-freude_id_260208317.html,https://www.focus.de/earth/news/strecke-geht-zu-ende-nach-13-monaten-endet-der-weltweite-hitzerekord-das-ist-kein-grund-zur-freude_id_260208317.html,0,www.focus.de,Strecke geht zu Ende - Nach 13 Monaten endet der weltweite Hitzerekord - das ist kein Grund zur Freude,Monat für Monat wurde zuletzt ein weltweiter Temperaturrekord aufgestellt. Nun gibt es für Juli mal keinen neuen Höchstwert. Grund zur Entwarnung ist das aber nicht.,https://p6.focus.de/img/fotos/id_260208311/gettyimages-2162735524.jpg?im=Crop%3D%280%2C288%2C3464%2C1732%29%3BResize%3D%281200%2C627%29&impolicy=perceptual&quality=mediumHigh&hash=e1871eeb4e6c131343a80498053fc8ccd216724eb82370cf384398dc9a68b71d,2024-08-08T14:24:57Z,,Monat für Monat wurde zuletzt ein weltweiter Temperaturrekord aufgestellt. Nun gibt es für Juli mal keinen neuen Höchstwert. Grund zur Entwarnung ist das aber nicht.Die globale Temperatur hat im abge… [+3957 chars],,de,'Hitze'
https://www.focus.de/panorama/wetter-in-deutschland-die-naechste-und-vielleicht-letzte-hitzewelle-rollt-auf-uns-zu_id_54933749.html,https://www.focus.de/panorama/wetter-in-deutschland-die-naechste-und-vielleicht-letzte-hitzewelle-rollt-auf-uns-zu_id_54933749.html,0,www.focus.de,Wetter im Ticker - Die nächste und vielleicht letzte Hitzewelle rollt auf uns zu,Nach den letzten Unwettern in Sachsen meldet sich in ganz Deutschland der Sommer mit voller Wucht zurück. Leider könnte dies auch die letzte Hitzewelle sein. Alles zur aktuellen Lage lesen Sie im Wetterticker.,https://p6.focus.de/img/regional/rheinland-pfalz/id_260193770/nach-dicken-wolken-wird-es-immer-waermer.jpg?im=Crop%3D%280%2C171%2C2048%2C1024%29%3BResize%3D%281200%2C627%29&impolicy=perceptual&quality=mediumHigh&hash=4522f08d44bdbae641e9043f46c3557734971dafc4f418eded7cf68f5d5f73d8,2024-08-08T17:28:07Z,,Nach den letzten Unwettern in Sachsen meldet sich in ganz Deutschland der Sommer mit voller Wucht zurück. Leider könnte dies auch die letzte Hitzewelle sein. Alles zur aktuellen Lage lesen Sie im Wet… [+10396 chars],,de,'Hitze'
https://www.stern.de/lifestyle/mode/abkuehlung-an-heissen-sommertagen--drei-frisuren--die-fuer-erfrischung-sorgen-34964366.html,https://www.stern.de/lifestyle/mode/abkuehlung-an-heissen-sommertagen--drei-frisuren--die-fuer-erfrischung-sorgen-34964366.html,0,www.stern.de,"Abkühlung an heißen Sommertagen: Drei Frisuren, die für Erfrischung sorgen",Heiße sommerliche Temperaturen begleiten durch den August: Diese drei einfachen Hairstyling-Ideen sorgen für Abkühlung auf dem Kopf.,https://image.stern.de/34964370/t/pk/v1/w1440/r1.7778/-/08--drei-frisuren--die-fuer-erfrischung-sorgen---16-9---spoton-article-1072350.jpg,2024-08-08T20:14:00Z,,"Heiße sommerliche Temperaturen begleiten durch den August: Diese drei einfachen Hairstyling-Ideen sorgen für Abkühlung auf dem Kopf.
Der Sommer scheint endlich da zu sein. Und mit ihm die zuweilen d… [+2387 chars]",,de,'Temperaturen'
https://www.brigitte.de/aktuell/abkuehlung-an-heissen-sommertagen--drei-stylische-frisuren-mit-erfrischungseffekt-13857080.html,https://www.brigitte.de/aktuell/abkuehlung-an-heissen-sommertagen--drei-stylische-frisuren-mit-erfrischungseffekt-13857080.html,0,www.brigitte.de,Abkühlung an heißen Sommertagen: Drei stylische Frisuren mit Erfrischungseffekt,Heiße sommerliche Temperaturen begleiten durch den August: Diese drei einfachen Hairstyling-Ideen sorgen für Abkühlung auf dem Kopf.,https://image.brigitte.de/13857082/t/OZ/v1/w1440/r1.7778/-/08--drei-stylische-frisuren-mit-erfrischungseffekt---1-1---spoton-article-1072350.jpg,2024-08-08T20:18:00Z,,"Heiße sommerliche Temperaturen begleiten durch den August: Diese drei einfachen Hairstyling-Ideen sorgen für Abkühlung auf dem Kopf.
Der Sommer scheint endlich da zu sein. Und mit ihm die zuweilen d… [+2387 chars]",,de,'Temperaturen'
https://www.stern.de/gesellschaft/regional/hessen/freizeit--freibadpreise-in-hessen--frankfurt-schwimmt-teurer-34965102.html,https://www.stern.de/gesellschaft/regional/hessen/freizeit--freibadpreise-in-hessen--frankfurt-schwimmt-teurer-34965102.html,0,www.stern.de,Freizeit: Freibadpreise in Hessen: Frankfurt schwimmt teurer,"Frankfurt/Main (lhe) - Der Sommer 2024 zeigt sich nicht immer sommerlich - Starkregen, Gewitter und zuweilen Temperaturen unter 20 Grad vergraulen manch",https://image.stern.de/34965104/t/MP/v1/w1440/r1.7778/-/09--gxheiqhvjjv6axw800h600jpeg---faebb17c20e73100.jpg,2024-08-09T02:00:36Z,,"Sommer, Sonne, Badespaß: Aber wo schwimmt es sich in Hessen gut und günstig?
Der Sommer 2024 zeigt sich nicht immer sommerlich - Starkregen, Gewitter und zuweilen Temperaturen unter 20 Grad vergraul… [+1917 chars]",,de,'Temperaturen'
https://www.zeit.de/news/2024-08/09/freibadpreise-in-hessen-frankfurt-schwimmt-teurer,https://www.zeit.de/news/2024-08/09/freibadpreise-in-hessen-frankfurt-schwimmt-teurer,0,www.zeit.de,Freizeit: Freibadpreise in Hessen: Frankfurt schwimmt teurer,Hier finden Sie Informationen zu dem Thema „Freizeit“. Lesen Sie jetzt „Freibadpreise in Hessen: Frankfurt schwimmt teurer“.,https://img.zeit.de/news/2024-08/09/freibadpreise-in-hessen-frankfurt-schwimmt-teurer-image-group/wide__1300x731,2024-08-09T02:00:36Z,,"Der Sommer 2024 zeigt sich nicht immer sommerlich - Starkregen, Gewitter und zuweilen Temperaturen unter 20 Grad vergraulen manch einen Freibad-Fan. Wer bei gutem Wetter dann ins kühle Nass springen … [+2673 chars]",,de,'Freibad'
https://www.basicthinking.de/blog/2024/08/09/klimaanlagen-als-energiespeicher/,https://www.basicthinking.de/blog/2024/08/09/klimaanlagen-als-energiespeicher/,0,www.basicthinking.de,Klimaanlagen als Energiespeicher: Kommt die nachhaltige Kühlung?,"Können wir Klimaanlagen künftig auch als Energiespeicher nutzen, um Ökostrom für den Betrieb zu speichern? Neue Technologien wie ein System namens IceBrick sollen genau das möglich machen. Bei hohen Temperaturen greifen viele Menschen inzwischen auf Ventilato…",https://www.basicthinking.de/blog/wp-content/uploads/2024/08/klimaanlagen-als-energiespeicher.jpg,2024-08-09T03:45:51Z,,"Können wir Klimaanlagen künftig auch als Energiespeicher nutzen, um Ökostrom für den Betrieb zu speichern? Neue Technologien wie ein System namens IceBrick sollen genau das möglich machen.
Bei hohen… [+3281 chars]",,de,'Temperaturen'
https://www.diepresse.com/18745551/das-klimagedaechtnis-der-welt-zwei-tage-im-juli-1963,https://www.diepresse.com/18745551/das-klimagedaechtnis-der-welt-zwei-tage-im-juli-1963,0,www.diepresse.com,Das Klimagedächtnis der Welt: Zwei Tage im Juli 1963,"Hitzerekorde lösen bei vielen Menschen oft nur noch Achselzucken aus. So auch die jüngsten Berichte, die zu dem Thema die Weltmeteorologie-Organisation (WMO) und Copernicus veröffentlicht haben. Und doch: Im veröffentlichten Material ist diesmal etwas anders.",https://img.diepresse.com/public/incoming/3n1hcf-file7sr7511ri551cmb6tl18.jpg/alternates/DPR_SOCIAL_NACHRICHTEN/file7sr7511ri551cmb6tl18.jpg,2024-08-09T04:48:10Z,,"Hitzerekorde lösen bei vielen Menschen oft nur noch Achselzucken aus. So auch die jüngsten Berichte, die zu dem Thema die Weltmeteorologie-Organisation (WMO) und Copernicus veröffentlicht haben. Und … [+7241 chars]",,de,'Hitze'
