index,url,valid,domain,title,description,image,published,archive,content,quote,language,keyword
https://www.zeit.de/news/2024-08/12/linke-fordert-hitzeschutzplan-fuer-berlin,https://www.zeit.de/news/2024-08/12/linke-fordert-hitzeschutzplan-fuer-berlin,0,www.zeit.de,Hohe Temperaturen: Linke fordert Hitzeschutzplan für Berlin,Hier finden Sie Informationen zu dem Thema „Hohe Temperaturen“. Lesen Sie jetzt „Linke fordert Hitzeschutzplan für Berlin“.,https://img.zeit.de/news/2024-08/12/linke-fordert-hitzeschutzplan-fuer-berlin-image-group/wide__1300x731,2024-08-12T14:27:03Z,,"Die Berliner Linke fordert vom Senat einen Hitzeschutzplan, um die Menschen in der Stadt besser vor den Folgen von Hitzewellen und hohen Temperaturen wie in dieser Woche zu bewahren. «Vor allem älter… [+2514 chars]",,de,'Temperaturen'
https://www.tagesspiegel.de/berlin/hohe-temperaturen-linke-fordert-hitzeschutzplan-fur-berlin-12186428.html,https://www.tagesspiegel.de/berlin/hohe-temperaturen-linke-fordert-hitzeschutzplan-fur-berlin-12186428.html,0,www.tagesspiegel.de,Hohe Temperaturen: Linke fordert Hitzeschutzplan für Berlin,"In Berlin wird es diese Woche sehr heiß - Anlass für die Linke, mehr Hitzeschutz für die Bürger zu fordern. Der Senat, so die Kritik, tue hier viel zu wenig.",https://www.tagesspiegel.de/images/12186425/alternates/BASE_16_9_W1400/1723472885000/wetter-in-berlin.jpeg,2024-08-12T14:28:05Z,,"Die Berliner Linke fordert vom Senat einen Hitzeschutzplan, um die Menschen in der Stadt besser vor den Folgen von Hitzewellen und hohen Temperaturen wie in dieser Woche zu bewahren. Vor allem ältere… [+1977 chars]",,de,'Hitze'
https://www.brigitte.de/beauty/3-mascara-fehler-im-sommer--die-wir-mit-diesen-tricks-ab-sofort-vermeiden-13828736.html,https://www.brigitte.de/beauty/3-mascara-fehler-im-sommer--die-wir-mit-diesen-tricks-ab-sofort-vermeiden-13828736.html,0,www.brigitte.de,"3 Mascara-Fehler im Sommer: Kein Verschmieren, dafür volle Wimpern","Schweiß, Sonnencreme und Wimperntusche vertragen sich nicht allzu gut. Vermeidet ihr diese drei Mascara-Fehler, bleibt euer Make-up auch im Sommer unversehrt – versprochen.",https://image.brigitte.de/13828788/t/-3/v1/w1440/r1.7778/-/mascara-fehler.jpg,2024-08-12T14:53:00Z,,"Na, wie lange hält sie bei euch? Zwei Stunden? Drei? Dann seid ihr verhältnismäßig schon ganz gut dabei! Dennoch geben wir uns ab sofort nicht mehr damit zufrieden, wenn die Wimperntusche überall hän… [+6188 chars]",,de,'Hitze'
https://www.morgenpost.de/panorama/article406996590/mehr-als-47000-menschen-in-europa-wegen-hitze-gestorben.html,https://www.morgenpost.de/panorama/article406996590/mehr-als-47000-menschen-in-europa-wegen-hitze-gestorben.html,0,www.morgenpost.de,Mehr als 47.000 Menschen in Europa wegen Hitze gestorben,"Die Klimakrise fordert Tribut: Laut einer Studie starben 2023 Zehntausende an den Folgen von Hitze, aber Anpassungsstrategien wirken.",https://img.sparknews.funkemedien.de/406996900/406996900_1723452101_v16_9_1600.jpeg,2024-08-12T14:59:00Z,,"Berlin. Die Klimakrise fordert Tribut: Laut einer Studie starben 2023 Zehntausende an den Folgen von Hitze, aber Anpassungsstrategien wirken.
Der Klimawandel hat schon heute gravierende Folgen. Das … [+4109 chars]",,de,'Hitze'
https://www.faz.net/aktuell/wissen/medizin-ernaehrung/mehr-als-47-000-hitzetote-in-europa-2023-19914600.html,https://www.faz.net/aktuell/wissen/medizin-ernaehrung/mehr-als-47-000-hitzetote-in-europa-2023-19914600.html,0,www.faz.net,Hitzetote in Europa,Hohe Temperaturen gefährden die Gesundheit. Eine Studie zeigt: 2023 starben mehr als 47.000 Menschen in Europa an der Hitze. Zahlreiche Tote konnten verhindert werden.,https://media1.faz.net/ppmedia/aktuell/831027053/1.9914633/facebook_teaser/immer-oefter-muss-der.jpg,2024-08-12T15:00:00Z,,"Das Team verwendete Mortalitätsdaten des Europäischen Statistikamtes (Eurostat) über 96 Millionen Todesfälle, um die hitzebedingte Sterblichkeitslast im Jahr 2023 für 823 Regionen in 35 europäischen … [+3526 chars]",,de,'Hitze'
https://www.focus.de/earth/analyse/zahlen-fuer-ganz-europa-riesen-studie-zeigt-jetzt-wie-viele-menschen-wirklich-an-hitze-sterben_id_260217999.html,https://www.focus.de/earth/analyse/zahlen-fuer-ganz-europa-riesen-studie-zeigt-jetzt-wie-viele-menschen-wirklich-an-hitze-sterben_id_260217999.html,0,www.focus.de,"Zahlen für ganz Europa - Riesen-Studie zeigt jetzt, wie viele Menschen wirklich an Hitze sterben",Wie viele Menschen sterben in Europa an Hitze? Eine riesige Studie stellt jetzt konkrete Zahlen vor. Die klingen erstmal erschreckend - doch die Forschenden halten auch fest: Wir haben bereits wesentliche Fortschritte erzielt.,https://p6.focus.de/img/regional/berlin/id_260217890/hitze-kann-fuer-menschen-gefaehrlich-werden-archivbild-.jpg?im=Crop%3D%280%2C342%2C2048%2C1025%29%3BResize%3D%281200%2C627%29&impolicy=perceptual&quality=mediumHigh&hash=b47f674872140f5574e9773bf748fc454e0fa13f70e548d9be172ae8a6ea4ad4,2024-08-12T15:00:25Z,,Wie viele Menschen sterben in Europa an Hitze? Eine riesige Studie stellt jetzt konkrete Zahlen vor. Die klingen erstmal erschreckend - doch die Forschenden halten auch fest: Wir haben bereits wesent… [+4269 chars],,de,'Hitze'
https://www.welt.de/gesundheit/article252965390/Vier-Hitzewellen-in-Europa-An-den-Folgen-starben-fast-48-000-Menschen-im-vergangenen-Jahr.html,https://www.welt.de/gesundheit/article252965390/Vier-Hitzewellen-in-Europa-An-den-Folgen-starben-fast-48-000-Menschen-im-vergangenen-Jahr.html,0,www.welt.de,Fast 48.000 Tote durch Hitze im vergangenen Jahr,"Im vergangenen Jahr sind allein in Europa rund 48.000 Menschen an den Folgen von Hitze gestorben. Forscher sagen, die Zahl der Toten hätte noch höher ausfallen können – durch Vorbeugung sei das aber verhindert worden. Dennoch hat es eine Region besonders getr…",https://img.welt.de/img/gesundheit/mobile252966758/9077930117-ci16x9-w1200/GettyImages-1408416580-1.jpg,2024-08-12T15:00:33Z,,"Im vergangenen Jahr sind allein in Europa rund 48.000 Menschen an den Folgen von Hitze gestorben. Forscher sagen, die Zahl der Toten hätte noch höher ausfallen können durch Vorbeugung sei das aber ve… [+4627 chars]",,de,'Hitze'
https://www.stern.de/panorama/wissen/anpassung-rettet-leben--hitze-im-jahr-2023--mehr-als-47-000-tote-in-europa-34974866.html,https://www.stern.de/panorama/wissen/anpassung-rettet-leben--hitze-im-jahr-2023--mehr-als-47-000-tote-in-europa-34974866.html,0,www.stern.de,Anpassung rettet Leben: Hitze im Jahr 2023: Mehr als 47.000 Tote in Europa,"Barcelona - Mehr als 47.000 Menschen sind nach Expertenschätzungen 2023 in Europa an den Folgen hoher Temperaturen gestorben, dem weltweit wärmsten Jahr",https://image.stern.de/34974868/t/H1/v1/w1440/r1.7778/-/12--vgqmxenekzv14axw800h600jpeg---a21f3d8d36285f54.jpg,2024-08-12T15:00:35Z,,"Im vergangenen Jahr hat es einer Studie zufolge wahrscheinlich gut 47.000 Hitzetote in Europa gegeben - doch es hätten noch viel mehr sein können.
Mehr als 47.000 Menschen sind nach Expertenschätzun… [+4146 chars]",,de,'Temperaturen'
https://www.zeit.de/news/2024-08/12/hitze-im-jahr-2023-mehr-als-47-000-tote-in-europa,https://www.zeit.de/news/2024-08/12/hitze-im-jahr-2023-mehr-als-47-000-tote-in-europa,0,www.zeit.de,Anpassung rettet Leben: Hitze im Jahr 2023: Mehr als 47.000 Tote in Europa,Hier finden Sie Informationen zu dem Thema „Anpassung rettet Leben“. Lesen Sie jetzt „Hitze im Jahr 2023: Mehr als 47.000 Tote in Europa“.,https://img.zeit.de/news/2024-08/12/hitze-im-jahr-2023-mehr-als-47-000-tote-in-europa-image-group/wide__1300x731,2024-08-12T15:00:35Z,,"Mehr als 47.000 Menschen sind nach Expertenschätzungen 2023 in Europa an den Folgen hoher Temperaturen gestorben, dem weltweit wärmsten Jahr seit Beginn der Aufzeichnungen. Die entsprechende Modellie… [+4701 chars]",,de,'Hitze'
https://www.bild.de/leben-wissen/europa-ueber-47000-hitzetote-im-waerme-rekordjahr-2023-66ba00166ca156290cb3ff14,https://www.bild.de/leben-wissen/europa-ueber-47000-hitzetote-im-waerme-rekordjahr-2023-66ba00166ca156290cb3ff14,0,www.bild.de,Wärme-Rekordjahr 2023 - Fast 50 000 Tote durch Hitze allein in einem Jahr!,"Das ist die zweithöchste Sterblichkeitsrate nach 2022, zeigt eine neue Analyse. Aber die Menschheit beginnt, sich an hohe Temperaturen anzupassen.","https://images.bild.de/66ba00166ca156290cb3ff14/104ef38e84c1e2fca6a979f75c19aeb5,7426daba?w=1280",2024-08-12T15:00:50Z,,"Das vergangene Jahr war das weltweit wärmste seit Beginn der Aufzeichnungen. Die Hitze hat allein in Europa mehr als 47 000 Opfer gefordert. Das hat eine neue Analyse ergeben.
Ein internationales Fo… [+1957 chars]",,de,'Hitze'
https://www.nzz.ch/panorama/hitze-im-jahr-2023-mehr-als-47000-tote-in-europa-ld.1843320,https://www.nzz.ch/panorama/hitze-im-jahr-2023-mehr-als-47000-tote-in-europa-ld.1843320,0,www.nzz.ch,Hitze forderte letztes Jahr mehr als 47 000 Tote in Europa,Im vergangenen Jahr hat es laut einer Studie wahrscheinlich 47 000 Hitzetote in Europa gegeben. Südeuropäische Länder verzeichnen die meisten Opfer.,"https://img.nzz.ch/2024/08/12/f9b81e4a-2400-4d2c-8c8f-3b04fc6fe6dd.jpeg?width=1200&height=674&fit=bounds&quality=75&auto=webp&crop=4872,2740,x0,y251&wmark=nzz",2024-08-12T15:01:00Z,,"Die Temperaturanzeige an einer Apotheke in Rom zeigt am 11. August 45 Grad.
(dpa) Mehr als 47 000 Menschen sind nach Expertenschätzungen im Jahr 2023 in Europa an den Folgen hoher Temperaturen gesto… [+4099 chars]",,de,'Hitze'
https://www.tagesspiegel.de/wissen/anpassung-rettet-leben-hitze-im-jahr-2023-mehr-als-47000-tote-in-europa-12186755.html,https://www.tagesspiegel.de/wissen/anpassung-rettet-leben-hitze-im-jahr-2023-mehr-als-47000-tote-in-europa-12186755.html,0,www.tagesspiegel.de,Anpassung rettet Leben: Hitze im Jahr 2023: Mehr als 47.000 Tote in Europa,Im vergangenen Jahr hat es einer Studie zufolge wahrscheinlich gut 47.000 Hitzetote in Europa gegeben - doch es hätten noch viel mehr sein können.,https://www.tagesspiegel.de/images/12186752/alternates/BASE_16_9_W1400/1723474907000/hitze.jpeg,2024-08-12T15:01:48Z,,"Mehr als 47.000 Menschen sind nach Expertenschätzungen 2023 in Europa an den Folgen hoher Temperaturen gestorben, dem weltweit wärmsten Jahr seit Beginn der Aufzeichnungen. Die entsprechende Modellie… [+4077 chars]",,de,'Hitze'
https://www.spektrum.de/news/mehr-als-47-000-hitzetote-2023-in-europa/2228295,https://www.spektrum.de/news/mehr-als-47-000-hitzetote-2023-in-europa/2228295,0,www.spektrum.de,Klima: Mehr als 47 000 Hitzetote 2023 in Europa,Im Jahr 2023 sind in Europa etwa 47 000 Menschen an Hitze gestorben. Ohne Maßnahmen der Klimaanpassung wären es noch viel mehr gewesen.,https://static.spektrum.de/fm/912/f1920x1080/AdobeStock_159082487.jpeg,2024-08-12T15:08:45Z,,"Anpassungsmaßnahmen zeigen Wirkung
Das Forschungsteam untersuchte weiterhin, wie sich Klimaanpassungsmaßnahmen, die in den zurückliegenden Jahren umgesetzt wurden, auf die Sterblichkeit infolge hohe… [+1032 chars]",,de,'Hitze'
https://www.zeit.de/news/2024-08/12/wegen-hitze-baederland-oeffnet-freibaeder-auch-an-ruhetagen,https://www.zeit.de/news/2024-08/12/wegen-hitze-baederland-oeffnet-freibaeder-auch-an-ruhetagen,0,www.zeit.de,Sommerwetter: Wegen Hitze - Bäderland öffnet Freibäder auch an Ruhetagen,Hier finden Sie Informationen zu dem Thema „Sommerwetter“. Lesen Sie jetzt „Wegen Hitze - Bäderland öffnet Freibäder auch an Ruhetagen“.,https://img.zeit.de/news/2024-08/12/wegen-hitze-baederland-oeffnet-freibaeder-auch-an-ruhetagen-image-group/wide__1300x731,2024-08-12T15:22:56Z,,"Endlich Sommer: Das Bäderland Hamburg reagiert auf die erwarteten hohen Temperaturen und öffnet in der laufenden Woche verschiedene Freibäder auch an Ruhetagen. «Die Standorte Bondenwald, Stadtparkse… [+1346 chars]",,de,'Hitze'
https://www.stern.de/gesellschaft/regional/hamburg-schleswig-holstein/sommerwetter--wegen-hitze---baederland-oeffnet-freibaeder-auch-an-ruhetagen-34974924.html,https://www.stern.de/gesellschaft/regional/hamburg-schleswig-holstein/sommerwetter--wegen-hitze---baederland-oeffnet-freibaeder-auch-an-ruhetagen-34974924.html,0,www.stern.de,Sommerwetter: Wegen Hitze - Bäderland öffnet Freibäder auch an Ruhetagen,Bisher war der Sommer in Hamburg eher durchwachsen. Jetzt kommen aber ein paar heiße Tage. Darauf reagiert nun auch der Schwimmbadbetreiber Bäderland.,https://image.stern.de/34974926/t/T7/v1/w1440/r1.7778/-/12--wwsmau3zpev19axw800h600jpeg---97e9844f21adfa49.jpg,2024-08-12T15:22:56Z,,"Bisher war der Sommer in Hamburg eher durchwachsen. Jetzt kommen aber ein paar heiße Tage. Darauf reagiert nun auch der Schwimmbadbetreiber Bäderland.
Endlich Sommer: Das Bäderland Hamburg reagiert … [+875 chars]",,de,'Hitze'
https://www.stern.de/gesellschaft/regional/niedersachsen-bremen/notfaelle--nach-sprung-von-zehner--mann-stirbt-im-bremer-stadionbad-34974938.html,https://www.stern.de/gesellschaft/regional/niedersachsen-bremen/notfaelle--nach-sprung-von-zehner--mann-stirbt-im-bremer-stadionbad-34974938.html,0,www.stern.de,Notfälle: Nach Sprung von Zehner: Mann stirbt im Bremer Stadionbad,"In der Badesaison ertrinken immer wieder Menschen in Flüssen und Seen, weil sie ihre Fähigkeiten überschätzen. Nun stirbt ein 23-Jähriger in einem bekannten Freibad in Bremen.",https://image.stern.de/34974940/t/5L/v1/w1440/r1.7778/-/12--aywl6istfev15axw800h600jpeg---9756e9ba57d2b20e.jpg,2024-08-12T15:27:31Z,,"In der Badesaison ertrinken immer wieder Menschen in Flüssen und Seen, weil sie ihre Fähigkeiten überschätzen. Nun stirbt ein 23-Jähriger in einem bekannten Freibad in Bremen.
Für einen 23-Jährigen … [+403 chars]",,de,'Freibad'
https://www.n-tv.de/panorama/Rekordjahr-2023-fordert-mehr-als-47-000-Hitzetote-article25153400.html,https://www.n-tv.de/panorama/Rekordjahr-2023-fordert-mehr-als-47-000-Hitzetote-article25153400.html,0,www.n-tv.de,Studie erkennt aber Fortschritt: Rekordjahr 2023 fordert mehr als 47.000 Hitzetote,Das vergangene Jahr ist das wärmste seit Beginn der Aufzeichnungen. Die Temperaturen haben auch für Menschen gesundheitliche Folgen. Aufgrund von Hitze sterben alleine in Europa Zehntausende. Die Zahl hätte aber auch deutlich höher ausfallen können.,https://bilder3.n-tv.de/img/incoming/crop25153354/8951322820-cImg_16_9-w1200/459748708.jpg,2024-08-12T16:14:12Z,,Das vergangene Jahr ist das wärmste seit Beginn der Aufzeichnungen. Die Temperaturen haben auch für Menschen gesundheitliche Folgen. Aufgrund von Hitze sterben alleine in Europa Zehntausende. Die Zah… [+4161 chars],,de,'Temperaturen'
"https://www.gamestar.de/artikel/mobiles-klimageraet-abluftschlauch-klimaanlage-angebot,3417829.html","https://www.gamestar.de/artikel/mobiles-klimageraet-abluftschlauch-klimaanlage-angebot,3417829.html",0,www.gamestar.de,Deals: Mobiles Klimagerät - Für unter 200€: Bei MediaMarkt gibt's gerade ein Top-Angebot! [Anzeige],Ein mobiles Klimagerät ist die beste Lösung bei Hitze. Gerade jetzt zur Hitzewelle im Sommer 2024 kühlt nur eine solche Klimaanlage mit Abluftschlauch so richtig runter - und bei MediaMarkt bekommt ihr eine gerade richtig günstig!,https://images.cgames.de/images/gamestar/4/mobiles-klimagerät-mobile-klimanlage-angebot-mediamarkt-abluftschlauch-klima-kühlung-btu_6304322.jpg,2024-08-12T16:31:00Z,,"Ein mobiles Klimagerät ist immer noch die stärkste Alternative zum Ventilator oder solchen mit Wasserkühlung. Nur sie kühlen wirklich spürbar ab!
Wenn das Schlafzimmer nachts noch gefühlt 30 Grad ha… [+3474 chars]",,de,'Hitze'
https://www.kino.de/artikel/matrix-raetsel-erklaert--cxv8pwqh8r,https://www.kino.de/artikel/matrix-raetsel-erklaert--cxv8pwqh8r,0,www.kino.de,"„Matrix“-Rätsel erklärt: Darum tragen Neo, Morpheus und Co. in der Matrix eine Sonnenbrille","Egal ob Neo, Morpheus, Trinity oder Agent Smith: Die wichtigsten Charaktere in den „Matrix“-Filmen tragen alle eine markante Sonnenbrille. Aber warum eigentlich?",https://static.kino.de/55/be/ed/8d72abee4f4a778c672cb52181_AzVlODJlZjdjMjU4_imago94774878-1.jpg#fp=839b53b6ffff,2024-08-12T16:41:02Z,,"Egal ob Neo, Morpheus, Trinity oder Agent Smith: Die wichtigsten Charaktere in den Matrix-Filmen tragen alle eine markante Sonnenbrille. Aber warum eigentlich?
Als Matrix 1999 in die Kinos kam, gab … [+3813 chars]",,de,'Sonne'
https://taz.de/Folgen-der-Klimakrise/!6026777/,https://taz.de/Folgen-der-Klimakrise/!6026777/,0,taz.de,Folgen der Klimakrise: Mehr als 47.000 Hitzetote in Europa,Auch in Deutschland gab es 2023 Tausende Todesfälle wegen hoher Hitze. Es starben deswegen bereits mehr als durch den Straßenverkehr.,https://taz.de/picture/7179342/948/36176856-1.jpeg,2024-08-12T17:49:00Z,,"Auch in Deutschland gab es 2023 Tausende Todesfälle wegen hoher Hitze. Es starben deswegen bereits mehr als durch den Straßenverkehr.
Zu viel Sonne ist irgendwann nicht mehr schön, sondern gesundhei… [+3266 chars]",,de,'Hitze'
https://www.stern.de/panorama/wissen/natur/olympia-staedte--hier-kann-es-wegen-der-hitze-wohl-nie-wieder-sommerspiele-geben-34973802.html,https://www.stern.de/panorama/wissen/natur/olympia-staedte--hier-kann-es-wegen-der-hitze-wohl-nie-wieder-sommerspiele-geben-34973802.html,0,www.stern.de,Globale Erwärmung: In diesen Olympia-Städten kann es wegen der Hitze wohl nie wieder Sommerspiele geben,Paris war zum dritten Mal Olympia-Gastgeber. Auch Los Angeles richtet 2028 die dritten Sommerspiele aus. In Rom oder Atlanta kann es dagegen wohl nie wieder olympische Wettkämpfe geben.,https://image.stern.de/34798560/t/1Z/v4/w1440/r1.7778/-/griechenland-1.jpg,2024-08-12T18:25:00Z,,Das Wetter hat den Gastgebern Olympischer Spiele schon immer Sorgen bereitet. Bereits bei den ersten olympischen Wettkämpfen der Neuzeit 1896 in Athen verhinderten starker Wind und heftiger Regen ein… [+4853 chars],,de,'Hitze'
https://www.stern.de/lifestyle/mode/baggy-jeans-im-heissen-sommer---so-laesst-sich-das-it-piece-bei-hitze-tragen-34975118.html,https://www.stern.de/lifestyle/mode/baggy-jeans-im-heissen-sommer---so-laesst-sich-das-it-piece-bei-hitze-tragen-34975118.html,0,www.stern.de,Baggy Jeans im heißen Sommer?: So lässt sich das It-Piece bei Hitze tragen,Die Baggy Jeans hat längst wieder unsere Modeherzen erobert. So kommt das It-Piece auch an heißen Sommertagen zum Einsatz.,https://image.stern.de/34975122/t/Fv/v1/w1440/r1.7778/-/12--so-laesst-sich-das-it-piece-bei-hitze-tragen---16-9---spoton-article-1071879.jpg,2024-08-12T19:44:00Z,,"Die Baggy Jeans hat längst wieder unsere Modeherzen erobert. So kommt das It-Piece auch an heißen Sommertagen zum Einsatz.
Sie gilt derzeit als das It-Piece schlechthin: die Baggy Jeans. Die weite J… [+1832 chars]",,de,'Hitze'
https://www.zeit.de/news/2024-08/13/suedwesten-schwitzt-in-der-hitze,https://www.zeit.de/news/2024-08/13/suedwesten-schwitzt-in-der-hitze,0,www.zeit.de,Sommer: Südwesten schwitzt in der Hitze,Hier finden Sie Informationen zu dem Thema „Sommer“. Lesen Sie jetzt „Südwesten schwitzt in der Hitze“.,https://img.zeit.de/news/2024-08/13/suedwesten-schwitzt-in-der-hitze-image-group/wide__1300x731,2024-08-13T02:00:43Z,,"Viel trinken, im Schatten bleiben, nachts lüften, leichte Kleidung tragen, mit Sonnencreme einschmieren und auf Mitmenschen achten: Es sind die immer gleichen Tipps, die bei Hitzewellen gelten. Heute… [+3190 chars]",,de,'Hitze'
https://www.zeit.de/news/2024-08/13/viel-sonne-in-berlin-und-brandenburg-bis-zu-33-grad,https://www.zeit.de/news/2024-08/13/viel-sonne-in-berlin-und-brandenburg-bis-zu-33-grad,0,www.zeit.de,Wetter: Viel Sonne in Berlin und Brandenburg - bis zu 33 Grad,Hier finden Sie Informationen zu dem Thema „Wetter“. Lesen Sie jetzt „Viel Sonne in Berlin und Brandenburg - bis zu 33 Grad“.,https://img.zeit.de/news/2024-08/13/viel-sonne-in-berlin-und-brandenburg-bis-zu-33-grad-image-group/wide__1300x731,2024-08-13T03:50:19Z,,"Viel Sonne erwartet die Menschen in Berlin und Brandenburg am Dienstag. Dabei bleibt es regenfrei, wie der Deutsche Wetterdienst (DWD) mitteilte. Vor allem im Südwesten Brandenburgs kommt es zu einer… [+1539 chars]",,de,'Sonne'
https://www.zeit.de/news/2024-08/13/hitze-und-unwetter-in-rheinland-pfalz-und-saarland,https://www.zeit.de/news/2024-08/13/hitze-und-unwetter-in-rheinland-pfalz-und-saarland,0,www.zeit.de,Deutscher Wetterdienst: Hitze und Unwetter in Rheinland-Pfalz und Saarland,Hier finden Sie Informationen zu dem Thema „Deutscher Wetterdienst“. Lesen Sie jetzt „Hitze und Unwetter in Rheinland-Pfalz und Saarland“.,https://img.zeit.de/news/2024-08/13/hitze-und-unwetter-in-rheinland-pfalz-und-saarland-image-group/wide__1300x731,2024-08-13T05:21:56Z,,Nach einer in manchen Orten regelrecht tropischen Nacht geht es am Tag vor allem mit heftigen Niederschlägen weiter. Der Deutsche Wetterdienst hat für Rheinland-Pfalz und das Saarland zudem eine extr… [+1199 chars],,de,'Hitze'
https://www.zeit.de/news/2024-08/13/viel-sonne-in-mv,https://www.zeit.de/news/2024-08/13/viel-sonne-in-mv,0,www.zeit.de,Deutscher Wetterdienst: Viel Sonne in MV,Hier finden Sie Informationen zu dem Thema „Deutscher Wetterdienst“. Lesen Sie jetzt „Viel Sonne in MV“.,https://img.zeit.de/news/2024-08/13/viel-sonne-in-mv-image-group/wide__1300x731,2024-08-13T07:07:19Z,,"Der Deutsche Wetterdienst (DWD) hat Sommerwetter für Mecklenburg-Vorpommern angekündigt. Tagsüber scheint nahezu durchgängig die Sonne bei Temperaturen von 27 bis 31 Grad, wie der DWD mitteilte.
In … [+333 chars]",,de,'Sonne'
https://www.zeit.de/news/2024-08/13/auf-hitze-dienstag-folgt-gewitter-mittwoch,https://www.zeit.de/news/2024-08/13/auf-hitze-dienstag-folgt-gewitter-mittwoch,0,www.zeit.de,Schwitzen: Auf Hitze-Dienstag folgt Gewitter-Mittwoch,Hier finden Sie Informationen zu dem Thema „Schwitzen“. Lesen Sie jetzt „Auf Hitze-Dienstag folgt Gewitter-Mittwoch“.,https://img.zeit.de/news/2024-08/13/auf-hitze-dienstag-folgt-gewitter-mittwoch-image-group/wide__1300x731,2024-08-13T09:23:39Z,,Nach einem Dienstag mit amtlicher Hitzewarnung erwartet die Menschen in Thüringen in den kommenden Tagen etwas Abkühlung. Ab Mittwochnachmittag rechnet der Deutsche Wetterdienst (DWD) für Thüringer G… [+2321 chars],,de,'Hitze'
https://www.stern.de/gesundheit/welche-gefahr-hitze-fuer-unser-leben-hat---und-wie-man-sich-schuetzt-34974822.html,https://www.stern.de/gesundheit/welche-gefahr-hitze-fuer-unser-leben-hat---und-wie-man-sich-schuetzt-34974822.html,0,www.stern.de,Hitzeblase über Deutschland: Wie Hitze unser Leben verändert – und es gefährdet,"Die Hitze in Deutschland setzt vielen Menschen zu. Dabei zeigt sich: Es sind nicht nur die hohen Temperaturen, die zur Gefahr werden.",https://image.stern.de/34975018/t/M4/v1/w1440/r1.7778/-/hitze-blumen.jpg,2024-08-13T09:39:00Z,,"Deutschland ächzt und schwitzt unter der Hitze. Dabei zeigt sich: Es sind nicht nur die hohen Temperaturen, die zur Gefahr werden. 
Der Klimawandel beschert uns nicht nur immer neue Temperaturrekord… [+12728 chars]",,de,'Temperaturen'
https://www.tagesschau.de/inland/gesellschaft/hitze-deutschland-130.html,https://www.tagesschau.de/inland/gesellschaft/hitze-deutschland-130.html,0,www.tagesschau.de,"Erst Hitze, dann Gewitter in Deutschland",Gestern war es heiß. Heute könnte es noch heißer werden. Der Deutsche Wetterdienst warnt in weiten Teilen des Landes vor Hitze oder sogar extremer Hitze. Für den Südwesten gelten auch Unwetterwarnungen.,https://images.tagesschau.de/image/2a5c4243-9cce-4eaf-97c4-24c48dfe5c1f/AAABkUsazSc/AAABkUqnCZ0/16x9-1280/hitze-238.jpg,2024-08-13T09:58:35Z,,"Stand: 13.08.2024 11:58 Uhr
Gestern war es heiß. Heute könnte es noch heißer werden. Der Deutsche Wetterdienst warnt in weiten Teilen des Landes vor Hitze oder sogar extremer Hitze. Für den Südweste… [+3065 chars]",,de,'Hitze'
https://www.tagesspiegel.de/gesellschaft/panorama/hitze-hagel-sturmboen-deutscher-wetterdienst-warnt-vor-unwettern-und-extremer-warmebelastung-12188888.html,https://www.tagesspiegel.de/gesellschaft/panorama/hitze-hagel-sturmboen-deutscher-wetterdienst-warnt-vor-unwettern-und-extremer-warmebelastung-12188888.html,0,www.tagesspiegel.de,"Hitze, Hagel, Sturmböen: Deutscher Wetterdienst warnt vor Unwettern und „extremer Wärmebelastung“",Der Dienstag könnte den Meteorologen zufolge der bislang heißeste Tag in diesem Sommer werden. Im Tagesverlauf wird allerdings mit heftigen Gewittern gerechnet.,https://www.tagesspiegel.de/images/12189257/alternates/BASE_16_9_W1400/1723542968000/gewitter-uber-hessen-symbolbild.jpeg,2024-08-13T10:11:53Z,,Die Woche ging in Deutschland schon heiß los nun soll es noch wärmer werden. Der Dienstag könnte mit erwarteten Temperaturen bis 37 Grad laut dem Deutschen Wetterdienst (DWD) der bislang heißeste Tag… [+3360 chars],,de,'Tropische Nächte'
https://www.zeit.de/news/2024-08/13/meteorologen-erwarten-hitze-und-starke-gewitter,https://www.zeit.de/news/2024-08/13/meteorologen-erwarten-hitze-und-starke-gewitter,0,www.zeit.de,Wettervorhersage: Meteorologen erwarten Hitze und starke Gewitter,Hier finden Sie Informationen zu dem Thema „Wettervorhersage“. Lesen Sie jetzt „Meteorologen erwarten Hitze und starke Gewitter“.,https://img.zeit.de/news/2024-08/13/meteorologen-erwarten-hitze-und-starke-gewitter-image-group/wide__1300x731,2024-08-13T10:21:34Z,,"Nach einem heißen Wochenstart könnte am Dienstag erneut der diesjährige Hitzerekord gebrochen werden. Der Deutsche Wetterdienst (DWD) geht von Temperaturen bis 37 Grad aus. «Es ist mit einer starken,… [+2811 chars]",,de,'Hitze'
