index,url,valid,domain,title,description,image,published,archive,content,quote,language,keyword
https://www.nzz.ch/wirtschaft/wirtschaftsweise-fordern-hoehere-steuern-und-laengere-akw-laufzeit-ld.1711355,https://www.nzz.ch/wirtschaft/wirtschaftsweise-fordern-hoehere-steuern-und-laengere-akw-laufzeit-ld.1711355,0,www.nzz.ch,Die deutschen «Wirtschaftsweisen» regen einen Energie-Soli und längere AKW-Laufzeiten an,Das jüngste Jahresgutachten des Sachverständigenrats zur deutschen Wirtschaftspolitik steht ganz unter dem Zeichen der Energiekrise. Manche Empfehlungen überraschen.,"https://img.nzz.ch/2022/11/09/7b45c47a-e408-4982-bd64-8465849ea2bb.jpeg?width=1200&height=674&fit=bound&quality=75&auto=webp&crop=3421,1922,x0,y178&wmark=nzz",2022-11-09T13:32:30Z,https://web.archive.org/web/20221109140828/https://www.nzz.ch/wirtschaft/wirtschaftsweise-fordern-hoehere-steuern-und-laengere-akw-laufzeit-ld.1711355,"Monika Schnitzer, die Vorsitzende des Sachverständigenkrats, überreicht das Jahresgutachtens 2022/2023 an Bundeskanzler Olaf Scholz.
Der deutsche Sachverständigenrat zur Begutachtung der gesamtwirts… [+7333 chars]",,de,'Energiekrise'
https://www.sueddeutsche.de/kultur/haus-des-jahres-naturschutz-1.5691455,https://www.sueddeutsche.de/kultur/haus-des-jahres-naturschutz-1.5691455,0,www.sueddeutsche.de,Naturschutz und Architektur: Ist das eine Todesfalle?,"Dem „Haus des Jahres“ in Brandenburg wird vorgeworfen, eine Todesfalle für Vögel zu sein. Ein vogelwilder Irrtum.",https://www.sueddeutsche.de/image/sz.1.5691419/1200x675?v=1668002915,2022-11-09T14:03:37Z,https://web.archive.org/web/20221109141431/https://www.sueddeutsche.de/kultur/haus-des-jahres-naturschutz-1.5691455,"Dem ""Haus des Jahres"" in Brandenburg wird vorgeworfen, eine Gefahr für Vögel zu sein. Peter Grundmann ist als Psychopath, der Todesfallen im Wald aufstellt, schwer vorstellbar. Der Architekt aus Berl… [+3059 chars]",,de,'Natur'
https://www.sueddeutsche.de/panorama/brasilien-amazonas-regenwald-indigene-voelker-tanaru-letzter-ueberlebender-1.5691307,https://www.sueddeutsche.de/panorama/brasilien-amazonas-regenwald-indigene-voelker-tanaru-letzter-ueberlebender-1.5691307,0,www.sueddeutsche.de,Brasilien: Streit um das Grab des einsamsten Menschen der Welt,"Der Stamm der Tanaru wurde im brasilianischen Regenwald von Viehzüchtern ermordet, nur ein Mann überlebte. Er verbrachte Jahrzehnte in völliger Einsamkeit, bis er im August starb. Doch auch nach seinem Tod lassen ihm die Widersacher keine Ruhe.",https://www.sueddeutsche.de/image/sz.1.5691309/1200x675?v=1668005887,2022-11-09T14:58:49Z,https://web.archive.org/web/20221109151010/https://www.sueddeutsche.de/panorama/brasilien-amazonas-regenwald-indigene-voelker-tanaru-letzter-ueberlebender-1.5691307,"Der Stamm der Tanaru wurde im brasilianischen Regenwald von Viehzüchtern ermordet, nur ein Mann überlebte. Er verbrachte Jahrzehnte in völliger Einsamkeit, bis er im August starb. Doch auch nach sein… [+6614 chars]",,de,'Laub'
https://www.morgenpost.de/berlin/article236868689/So-wollen-die-Gruenen-den-A100-Weiterbau-in-Berlin-stoppen.html,https://www.morgenpost.de/berlin/article236868689/So-wollen-die-Gruenen-den-A100-Weiterbau-in-Berlin-stoppen.html,0,www.morgenpost.de,Autobahn: So wollen die Grünen den A100-Weiterbau in Berlin stoppen,Berlins Grünen-Fraktion will den 17. Bauabschnitt der Stadtautobahn A100 verhindern. Die FDP sieht hingegen „juristisches Glatteis“.,https://img.morgenpost.de/img/berlin/crop236868687/2392603747-w820-cv16_9-q85/c1dbb41c-6038-11ed-9d17-7eb197fd52c5.jpg,2022-11-09T15:37:56Z,https://web.archive.org/web/20221109172422/https://www.morgenpost.de/berlin/article236868689/So-wollen-die-Gruenen-den-A100-Weiterbau-in-Berlin-stoppen.html,"Berlin.  Die Berliner Grünen-Fraktion will den Weiterbau der A100 im 17. Abschnitt verhindern und fordert dazu eine Änderung des Flächennutzungsplans. Dies betrifft die Flächen, die bislang für den W… [+1904 chars]",,de,'Glatteis'
https://www.focus.de/politik/deutschland/thyssen-steel-zur-energiekrise-kosten-fuer-gas-und-strom-sind-existentielle-bedrohung_id_179266982.html,https://www.focus.de/politik/deutschland/thyssen-steel-zur-energiekrise-kosten-fuer-gas-und-strom-sind-existentielle-bedrohung_id_179266982.html,0,www.focus.de,"FOCUS-online-Report Energiekrise - Bangen in der Stahlindustrie: „Ich habe Angst, unter der Brücke zu enden“","Thyssenkrupp Steel ist der größte Stahlproduzent in Europa. Der Duisburger Konzern gehört zu den „energieintensiven“ Unternehmen in Deutschland, die besonders viel Gas, Kohle und Strom verbrauchen. Bislang kam diese Energie zu einem Großteil aus Russland.Von …",https://p6.focus.de/img/fotos/id_179272310/20210517-tsr-thyssenkrupp-steel-4-image-w1300.jpg?im=Crop%3D%280%2C108%2C1300%2C650%29%3BResize%3D%281200%2C627%29&hash=5c8387978db4877e7b704b92ebfa5cffced48b1656b95d3dd8a7258d1784d748,2022-11-09T15:55:28Z,https://web.archive.org/web/20221109165201/https://www.focus.de/politik/deutschland/thyssen-steel-zur-energiekrise-kosten-fuer-gas-und-strom-sind-existentielle-bedrohung_id_179266982.html,"Thyssenkrupp Steel ist der größte Stahlproduzent in Europa. Der Duisburger Konzern gehört zu den energieintensiven Unternehmen in Deutschland, die besonders viel Gas, Kohle und Strom verbrauchen. Bis… [+14521 chars]",,de,'Energiekrise'
https://www.tagesschau.de/inland/innenpolitik/moor-strategie-101.html,https://www.tagesschau.de/inland/innenpolitik/moor-strategie-101.html,0,www.tagesschau.de,Bundesregierung beschließt Moorschutz-Strategie,"Die Bundesregierung will Moore besser schützen und hat deshalb eine Strategie verabschiedet. Dabei geht es nicht nur um Naturschutz, sondern vor allem auch um die Rettung des Klimas. <em>Von Kirsten Girschick und Eva Huber.</em>",https://www.tagesschau.de/multimedia/bilder/lemke-121~_v-original.jpg,2022-11-09T17:41:55Z,https://web.archive.org/web/20221109180951/https://www.tagesschau.de/inland/innenpolitik/moor-strategie-101.html,"Die Bundesregierung will Moore besser schützen und hat deshalb jetzt eine Strategie verabschiedet. Dabei geht es nicht nur um Naturschutz, sondern vor allem auch um die Rettung des Klimas.
Moore kön… [+3864 chars]",,de,'Laub'
https://www.sueddeutsche.de/muenchen/landkreismuenchen/oberhaching-freiflaechen-photovoltaik-gemueseanbau-1.5691907,https://www.sueddeutsche.de/muenchen/landkreismuenchen/oberhaching-freiflaechen-photovoltaik-gemueseanbau-1.5691907,0,www.sueddeutsche.de,Erneuerbare Energien: Kartoffelernte unter den Solarmodulen,"Oberhaching will in großem Stil Sonnenstrom produzieren und plant an der Giesinger Autobahn die erste Freiflächenanlage. Um Landwirte für weitere Projekte zu gewinnen, setzt die Gemeinde auf Agri-Photovoltaik.",https://www.sueddeutsche.de/image/sz.1.5658144/1200x675?v=1668012167,2022-11-09T20:42:20Z,https://web.archive.org/web/20221109232033/https://www.sueddeutsche.de/muenchen/landkreismuenchen/oberhaching-freiflaechen-photovoltaik-gemueseanbau-1.5691907,"Oberhaching will in großem Stil Sonnenstrom produzieren und plant an der Giesinger Autobahn die erste Freiflächenanlage. Um Landwirte für weitere Projekte zu gewinnen, setzt die Gemeinde auf Agri-Pho… [+4914 chars]",,de,'Sonne'
https://www.spiegel.de/wirtschaft/soll-ich-jetzt-mein-haus-sanieren-a-c46cd5de-c7d9-4d9e-971f-8bc460e1d213,https://www.spiegel.de/wirtschaft/soll-ich-jetzt-mein-haus-sanieren-a-c46cd5de-c7d9-4d9e-971f-8bc460e1d213,0,www.spiegel.de,Energie-Krise: Soll ich jetzt mein Haus sanieren?,"Neue Heizung, Dämmung, oder Solar auf dem Dach: Angesichts der Energiekrise denken viele Immobilienbesitzer über eine Sanierung nach – doch nicht jede Maßnahme rechnet sich. Ein Leitfaden, wie Sie nun vorgehen sollten.",https://cdn.prod.www.spiegel.de/images/f62e60ba-b3bd-4b53-b44e-20d0f45fc471_w1280_r1.77_fpx70_fpy56.jpg,2022-11-09T23:20:00Z,https://web.archive.org/web/20221108085903/https://www.spiegel.de/wirtschaft/soll-ich-jetzt-mein-haus-sanieren-a-c46cd5de-c7d9-4d9e-971f-8bc460e1d213,"Mehr Perspektiven, mehr verstehen.
Freier Zugang zu allen Artikeln, Videos, Audioinhalten und Podcasts
<ul><li>
Alle Artikel auf SPIEGEL.de frei zugänglich
</li><li>
DER SPIEGEL als E-Paper und … [+743 chars]",,de,'Energiekrise'
https://www.zeit.de/news/2022-11/10/muenchen-hilfe-fuer-lng-anlandung-in-mv-zum-jahreswechsel,https://www.zeit.de/news/2022-11/10/muenchen-hilfe-fuer-lng-anlandung-in-mv-zum-jahreswechsel,0,www.zeit.de,Energie: München: Hilfe für LNG-Anlandung in MV zum Jahreswechsel,,,2022-11-10T06:40:30Z,,"When browsing with ads:
We collect personal data and also transmit it to third-party providers
 that help us improve and finance our digital content. Some of the information stored on your device, … [+732 chars]",,de,'Jahreswechsel'
https://fm4.orf.at/stories/3028852/,https://fm4.orf.at/stories/3028852/,0,fm4.orf.at,In „Sonic Frontiers“ springt der blaue Igel durch eine Open World,"Der wohl bekannteste Igel im Games-Universum ist mit „Sonic Frontiers“ zurück und rennt dabei durch eine Open World, verliert sich im Cyberspace und legt sich mit altbekannten Rivalen an. Was das temporeiche Action Game kann, testen wir in einer diesmal tempo…",https://tubestatic.orf.at/static/images/site/tube/20221145/groã.5987302.png,2022-11-10T11:08:00Z,https://web.archive.org/web/20221110115024/https://fm4.orf.at/stories/3028852/,"Der wohl bekannteste Igel im Games-Universum ist mit Sonic Frontiers zurück und rennt dabei durch eine Open World, verliert sich im Cyberspace und legt sich mit altbekannten Rivalen an. Was das tempo… [+5483 chars]",,de,'Igel'
https://www.sueddeutsche.de/muenchen/fuerstenfeldbruck/schattenpflanzen-nacktschnecken-gartenarbeit-herbst-expertentipps-1.5693348,https://www.sueddeutsche.de/muenchen/fuerstenfeldbruck/schattenpflanzen-nacktschnecken-gartenarbeit-herbst-expertentipps-1.5693348,0,www.sueddeutsche.de,"Der Garten im Herbst: ""Es gibt nix Einfacheres, als einen Schattengarten zu bauen""","Weniger ist mehr - das gilt oft auch bei der Gartenarbeit. Wer jetzt im Herbst das Laub liegen lässt, tut etwas für Nützlinge. Welche Pflanzen im Schatten gedeihen und wie Sie unerwünschte Besucher in die Flucht schlagen.",https://www.sueddeutsche.de/image/sz.1.2194522/1200x675?v=1668081819,2022-11-10T12:04:06Z,https://web.archive.org/web/20221110124936/https://www.sueddeutsche.de/muenchen/fuerstenfeldbruck/schattenpflanzen-nacktschnecken-gartenarbeit-herbst-expertentipps-1.5693348,"Weniger ist mehr - das gilt oft auch bei der Gartenarbeit. Wer jetzt im Herbst das Laub liegen lässt, tut etwas für Nützlinge. Welche Pflanzen im Schatten gedeihen und wie Sie unerwünschte Besucher i… [+448 chars]",,de,'Blätter'
https://wien.orf.at/stories/3181608/,https://wien.orf.at/stories/3181608/,0,wien.orf.at,Neue Schwimmhalle in Floridsdorf,Das Hallen- und Freibad Großfeldsiedlung bekommt eine zweite Schwimmhalle. Heute war Spatenstich. Badegäste und Schwimmsportler erhalten neue Möglichkeiten. Die Eröffnung ist für 2024 vorgesehen.,https://ibs.orf.at/wie?image=https%3A%2F%2Foekastatic.orf.at%2Fmims%2F2022%2F46%2F73%2Fcrops%2Fw%3D1200%2Ch%3D627%2Cq%3D75%2F1566669_master_572773_spatenstich1.jpg%3Fs%3Da11c344326f348f6d2ee374a2e06b4e06c047b13,2022-11-10T13:20:23Z,,"Die neue Schwimmhalle mit einem 25 mal 12,5 Meter großem Sportbecken samt den entsprechenden Nebeneinrichtungen wie Umkleiden, Sanitärräumen und anderen mehr wird an das Bestandsgebäude über zwei Ver… [+1547 chars]",,de,'Freibad'
https://www.tagesschau.de/wirtschaft/technologie/lng-terminal-gasversorgung-klimaziele-russische-gaslieferungen-eu-ersetzen-infrastruktur-fluessiggas-101.html,https://www.tagesschau.de/wirtschaft/technologie/lng-terminal-gasversorgung-klimaziele-russische-gaslieferungen-eu-ersetzen-infrastruktur-fluessiggas-101.html,0,www.tagesschau.de,Staaten bauen zu viel Infrastruktur für Flüssiggas auf,"In der aktuellen Energiekrise bauen die Staaten weltweit in großer Eile viel Infrastruktur für Flüssiggas auf. Einer aktuellen Analyse zufolge ist das sogar mehr, als eigentlich benötigt wird.",https://www.tagesschau.de/multimedia/bilder/lubmin-101~_v-original.jpg,2022-11-10T13:34:06Z,https://web.archive.org/web/20221111111849/https://www.tagesschau.de/wirtschaft/technologie/lng-terminal-gasversorgung-klimaziele-russische-gaslieferungen-eu-ersetzen-infrastruktur-fluessiggas-101.html,"In der aktuellen Energiekrise bauen die Staaten weltweit in großer Eile viel Infrastruktur für Flüssiggas auf. Einer aktuellen Analyse zufolge ist das sogar mehr, als eigentlich benötigt wird.
Bei d… [+3272 chars]",,de,'Energiekrise'
https://www.morgenpost.de/bezirke/pankow/article236879291/Heizung-laeuft-bei-20-Grad-Pankow-fuehrt-Spar-Experten-ein.html,https://www.morgenpost.de/bezirke/pankow/article236879291/Heizung-laeuft-bei-20-Grad-Pankow-fuehrt-Spar-Experten-ein.html,0,www.morgenpost.de,Energiekrise: Heizung läuft bei 20 Grad - Pankow führt Spar-Experten ein,"Gas und Strom sparen, das will Pankow schaffen dank „Ansprechpersonen“ in jedem Haus. Heizungen, die auf 3 festhängen, machen ratlos.",https://img.morgenpost.de/img/pankow/crop236879289/137260679-w820-cv16_9-q85/e05ff01c-6117-11ed-92b3-5a78de099f88.jpg,2022-11-10T16:53:00Z,,"Berlin.  51 Prozent mehr Geld für Strom, 40 Prozent Preisaufschlag für Fernwärme es sind gewaltige Kostensteigerungen die Berlins einwohnerstärkster Bezirk Pankow seit Beginn des russischen Angriffs … [+3393 chars]",,de,'Energiekrise'
https://www.spektrum.de/news/klimawandel-globale-co2-emissionen-weiter-auf-rekordniveau/2075781,https://www.spektrum.de/news/klimawandel-globale-co2-emissionen-weiter-auf-rekordniveau/2075781,0,www.spektrum.de,Klimawandel: Globale Kohlendioxid-Emissionen weiter auf Rekordniveau,"Überschwemmungen, Hitze, Trockenheit: Die Klimakrise war 2022 vielerorts besonders spürbar. Doch trotz aller Erlebnisse ändert sich am Kohlendioxid-Ausstoß bisher kaum etwas.",https://static.spektrum.de/fm/912/f1920x1080/iStock-1349205417.jpg,2022-11-11T00:01:00Z,,"Nachdem die globalen CO2-Emissionen auf 38,5 Milliarden Tonnen im ersten Pandemiejahr 2020 zurückgegangen waren, sind die Werte etwa wieder auf dem Niveau vor der Pandemie. Eine erhoffte Krisenbewält… [+1548 chars]",,de,'Hitze'
https://www.stern.de/panorama/wissen/klimakrise--globale-co2-emissionen-weiter-auf-rekordniveau-32900618.html,https://www.stern.de/panorama/wissen/klimakrise--globale-co2-emissionen-weiter-auf-rekordniveau-32900618.html,0,www.stern.de,Klimakrise: Globale CO2-Emissionen weiter auf Rekordniveau,"Überschwemmungen, sengende Hitze und Trockenheit: Die Klimakrise war in diesem Jahr vielerorts besonders spürbar. Doch aller Warnungen zum Trotz: Am CO2-Ausstoß der Welt ändert sich bislang kaum etwas.",https://image.stern.de/32900620/t/kI/v1/w1440/r1.7778/-/11--urnnewsmldpacom2009010122111199472912v3w800h600l220t650r1500b1503jpeg---487223ec3ed0b068.jpg,2022-11-11T01:12:42Z,,"Überschwemmungen, sengende Hitze und Trockenheit: Die Klimakrise war in diesem Jahr vielerorts besonders spürbar. Doch aller Warnungen zum Trotz: Am CO2-Ausstoß der Welt ändert sich bislang kaum etwa… [+4606 chars]",,de,'Hitze'
https://www.handelsblatt.com/unternehmen/energie/erneuerbare-energien-energiewende-in-gefahr-uebergewinnsteuer-alarmiert-die-strombranche/28800986.html,https://www.handelsblatt.com/unternehmen/energie/erneuerbare-energien-energiewende-in-gefahr-uebergewinnsteuer-alarmiert-die-strombranche/28800986.html,0,www.handelsblatt.com,Erneuerbare Energien: Energiewende in Gefahr – Übergewinnsteuer alarmiert die Strombranche,Die Bundesregierung will Energiekonzernen einen Teil ihrer Gewinne nehmen und so die Strompreisbremse finanzieren. Die Branche fürchtet eine Investitionsbremse für Sonne und Wind.,https://www.handelsblatt.com/images/kabelsalat/28803506/2-format2003.png,2022-11-11T03:00:00Z,http://archive.md/20221111103353/https://www.handelsblatt.com/unternehmen/energie/erneuerbare-energien-energiewende-in-gefahr-uebergewinnsteuer-alarmiert-die-strombranche/28800986.html,"KabelsalatDie Pläne aus dem Wirtschaftsministerium stoßen in der Energiewirtschaft auf harsche Kritik. 
(Foto: Getty images) 
Berlin, Düsseldorf Die Pläne der Bundesregierung zur Abschöpfung von Zu… [+1186 chars]",,de,'Sonne'
https://www.zeit.de/news/2022-11/11/milde-temperaturen-in-nrw-nachts-frost-erwartet,https://www.zeit.de/news/2022-11/11/milde-temperaturen-in-nrw-nachts-frost-erwartet,0,www.zeit.de,Wetter: Milde Temperaturen in NRW: Nachts Frost erwartet,,,2022-11-11T05:32:24Z,https://web.archive.org/web/20221111191424/https://www.zeit.de/news/2022-11/11/milde-temperaturen-in-nrw-nachts-frost-erwartet,"When browsing with ads:
We collect personal data and also transmit it to third-party providers
 that help us improve and finance our digital content. Some of the information stored on your device, … [+732 chars]",,de,'Temperaturen'
https://www.welt.de/regionales/nrw/article242073955/NRW-Ministerpraesident-Hendrik-Wuest-will-Gaspreisbremse-ab-Januar.html,https://www.welt.de/regionales/nrw/article242073955/NRW-Ministerpraesident-Hendrik-Wuest-will-Gaspreisbremse-ab-Januar.html,0,www.welt.de,"„Es wäre richtig, die Gaspreisbremse schon zum Jahreswechsel in Kraft zu setzen“","NRW-Ministerpräsident Hendrik Wüst fordert eine Gaspreisbremse ab Januar. Sollte das nicht möglich sein, müsse es ein anderes, klares Signal der Entlastung geben – zur Not rückwirkend.",https://img.welt.de/img/regionales/nrw/mobile242073953/4791354677-ci16x9-w1200/Ministerpraesidentenkonferenz-Statement-Weil-und-Wuest.jpg,2022-11-11T09:41:59Z,https://web.archive.org/web/20221111094815/https://www.welt.de/regionales/nrw/article242073955/NRW-Ministerpraesident-Hendrik-Wuest-will-Gaspreisbremse-ab-Januar.html,"Nordrhein-Westfalens Ministerpräsident Hendrik Wüst fordert von der Bundesregierung eine Entlastung durch eine Gaspreisbremse bereits ab Beginn des kommenden Jahres. Ausgerechnet im Januar, einem der… [+950 chars]",,de,'Jahreswechsel'
"https://www.cio.de/a/globale-co2-emissionen-weiter-auf-rekordniveau,3696790?utm_source=Seiten_3932&utm_medium=RSS&utm_campaign=RSS-Feeds","https://www.cio.de/a/globale-co2-emissionen-weiter-auf-rekordniveau,3696790?utm_source=Seiten_3932&utm_medium=RSS&utm_campaign=RSS-Feeds",0,www.cio.de,Noch keine Trendumkehr: Globale CO2-Emissionen weiter auf Rekordniveau,"Überschwemmungen, sengende Hitze und Trockenheit: Die Klimakrise war in diesem Jahr vielerorts besonders spürbar. Doch aller Warnungen zum Trotz: Am CO2-Ausstoß der Welt ändert sich bislang kaum etwas.",https://images.cio.de/bdb/3263099/640x360.jpg,2022-11-11T09:52:00Z,,"In der EU sinken die Werte für CO2 um 0,8 Prozent, vor allem wegen des geringeren Verbrauchs von Erdgas infolge der Energiekrise.Foto: L.F - shutterstock.com
Trotz drastischer Warnungen zur Klimakri… [+4490 chars]",,de,'Hitze'
https://www.stern.de/gesellschaft/regional/berlin-brandenburg/soziales--armutskonferenz-will-aufschub-fuer-mieten-und-energiepreise-32901774.html,https://www.stern.de/gesellschaft/regional/berlin-brandenburg/soziales--armutskonferenz-will-aufschub-fuer-mieten-und-energiepreise-32901774.html,0,www.stern.de,Soziales: Armutskonferenz will Aufschub für Mieten und Energiepreise,"Die Landesarmutskonferenz in Brandenburg fordert angesichts von Energiekrise und Inflation einen Aufschub für Erhöhungen von Mieten und Energiepreisen. Aus dem geplanten Entlastungspaket der Landesregierung müsse es konkrete Hilfen geben, forderte das Bündnis…",https://image.stern.de/6681672/t/31/v5/w1440/r1.7778/-/video-fallback-image.jpg,2022-11-11T09:57:07Z,https://web.archive.org/web/20221111101445/https://www.stern.de/gesellschaft/regional/berlin-brandenburg/soziales--armutskonferenz-will-aufschub-fuer-mieten-und-energiepreise-32901774.html,Die Landesarmutskonferenz in Brandenburg fordert angesichts von Energiekrise und Inflation einen Aufschub für Erhöhungen von Mieten und Energiepreisen. Aus dem geplanten Entlastungspaket der Landesre… [+1924 chars],,de,'Energiekrise'
https://www.faz.net/aktuell/wirtschaft/bundestag-stimmt-fuer-laufzeitverlaengerung-deutscher-atomkraftwerke-18453371.html,https://www.faz.net/aktuell/wirtschaft/bundestag-stimmt-fuer-laufzeitverlaengerung-deutscher-atomkraftwerke-18453371.html,0,www.faz.net,Bundestag stimmt für Laufzeitverlängerung deutscher Atomkraftwerke,"Der Bundestag hat am Freitag die geplante Laufzeitverlängerung für die verbliebenen drei deutschen Atomkraftwerke beschlossen. Sie sollen wegen der Energiekrise nicht nur bis zum Jahreswechsel, sondern noch bis Mitte April laufen. Diese Lösung hatte Bundeskan…",https://media0.faz.net/ppmedia/aktuell/wirtschaft/1104942103/1.8453378/facebook_teaser/kuehlturm-des-atomkraftwerks.jpg,2022-11-11T10:26:14Z,https://web.archive.org/web/20221111102850/http://www.faz.net/aktuell/wirtschaft/bundestag-stimmt-fuer-laufzeitverlaengerung-deutscher-atomkraftwerke-18453371.html,"Bundestag stimmt für Laufzeitverlängerung deutscher Atomkraftwerke
Bis zum 15. April 2023
Bundestag stimmt für Laufzeitverlängerung deutscher Atomkraftwerke
Von Der Bundestag hat am Freitag die ge… [+349 chars]",,de,'Energiekrise'
https://www.faz.net/aktuell/wirtschaft/akw-laufzeitverlaengerung-von-bundestag-beschlossen-18453371.html,https://www.faz.net/aktuell/wirtschaft/akw-laufzeitverlaengerung-von-bundestag-beschlossen-18453371.html,0,www.faz.net,Bundestag stimmt für Laufzeitverlängerung deutscher Atomkraftwerke,"Der Bundestag hat die umstrittene Laufzeitverlängerung für die verbliebenen drei deutschen Atomkraftwerke beschlossen. Sie sollen nicht nur bis zum Jahreswechsel, sondern noch bis Mitte April laufen. 375 von 661 Abgeordneten stimmten dafür.",https://media0.faz.net/ppmedia/aktuell/wirtschaft/1104942103/1.8453378/facebook_teaser/kuehlturm-des-atomkraftwerks.jpg,2022-11-11T10:26:14Z,https://web.archive.org/web/20221111110809/https://www.faz.net/aktuell/wirtschaft/akw-laufzeitverlaengerung-von-bundestag-beschlossen-18453371.html,"Der Bundestag hat den vorübergehenden Weiterbetrieb der letzten drei deutschen Atomkraftwerke zur Sicherung der Stromversorgung beschlossen. Die Meiler Isar 2, Neckarwestheim 2 und Emsland sollen dam… [+4572 chars]",,de,'Jahreswechsel'
https://www.zeit.de/news/2022-11/11/guenther-warnt-vor-verunsicherung-der-verbraucher,https://www.zeit.de/news/2022-11/11/guenther-warnt-vor-verunsicherung-der-verbraucher,0,www.zeit.de,Energiekrise: Günther warnt vor Verunsicherung der Verbraucher,,,2022-11-11T14:50:31Z,,"When browsing with ads:
We collect personal data and also transmit it to third-party providers
 that help us improve and finance our digital content. Some of the information stored on your device, … [+732 chars]",,de,'Energiekrise'
https://www.sueddeutsche.de/muenchen/wolfratshausen/naturschutz-wasserbueffel-jan-haft-stiftung-kunst-und-natur-1.5694061,https://www.sueddeutsche.de/muenchen/wolfratshausen/naturschutz-wasserbueffel-jan-haft-stiftung-kunst-und-natur-1.5694061,0,www.sueddeutsche.de,"Wasserbüffel als Landschaftspfleger: ""Da passieren wahre Naturwunder""","Das rasante Artensterben vor unserer Haustür lässt sich aufhalten, sagt der Biologe Jan Haft. Und Naturschutz kann ein Plus-Geschäft sein. Was wir dazu brauchen: große Tiere.",https://www.sueddeutsche.de/image/sz.1.5694066/1200x675?v=1668167663,2022-11-11T15:22:37Z,https://web.archive.org/web/20221111153701/https://www.sueddeutsche.de/muenchen/wolfratshausen/naturschutz-wasserbueffel-jan-haft-stiftung-kunst-und-natur-1.5694061,"Das rasante Artensterben vor unserer Haustür lässt sich aufhalten, sagt der Biologe Jan Haft. Und Naturschutz kann ein Plus-Geschäft sein. Was wir dazu brauchen: große Tiere. Im Zeichen der Klimakris… [+12939 chars]",,de,'Blätter'
https://www.der-postillon.com/2022/11/st-martin.html,https://www.der-postillon.com/2022/11/st-martin.html,0,www.der-postillon.com,Ritter und Bettler mit jeweils halbem Mantel erfroren aufgefunden,"München (dpo) - Zwei mysteriöse Kältetode beschäftigen derzeit die Münchner Behörden. Am Freitag war dort zunächst die Leiche eines armen Mannes gefunden worden, die trotz niedriger nächtlicher Temperaturen nur mit einem halben Mantel bekleidet war. Wenig spä…",https://blogger.googleusercontent.com/img/b/R29vZ2xl/AVvXsEg_xpd6GpyWH0a3b6qIWEtqK_nLg4ZQrlBNNYT_tDfg5JfR-OaVqnWkHTCUd1Jrb8M-uTW_o1DWVIksfMWrZqo_PE7U18ksG3duP6BO5yBQ7Rnd4foiDU5480empUDRifWRu7Zp6ntHQiNH-NeNJMESeJBgR5KEu5xQY7viR5IIjSLyk6eYEBp-4PKlJg/w1200-h630-p-k-no-nu/shutterstock_1713363295.jpg,2022-11-11T16:04:21Z,https://web.archive.org/web/20221111155934/https://www.der-postillon.com/2022/11/st-martin.html,"München (dpo) - Zwei mysteriöse Kältetode beschäftigen derzeit die Münchner Behörden. Am Freitag war dort zunächst die Leiche eines armen Mannes gefunden worden, die trotz niedriger nächtlicher Tempe… [+1730 chars]",,de,'Temperaturen'
https://www.zeit.de/news/2022-11/11/juedische-studierende-kritisieren-mouawads-voegel,https://www.zeit.de/news/2022-11/11/juedische-studierende-kritisieren-mouawads-voegel,0,www.zeit.de,Antisemitismusvorwurf: Jüdische Studierende kritisieren Mouawads «Vögel»,,,2022-11-11T17:15:52Z,https://web.archive.org/web/20221111175715/https://www.zeit.de/news/2022-11/11/juedische-studierende-kritisieren-mouawads-voegel,"When browsing with ads:
We collect personal data and also transmit it to third-party providers
 that help us improve and finance our digital content. Some of the information stored on your device, … [+732 chars]",,de,'Vögel'
