index,url,valid,domain,title,description,image,published,archive,content,quote,language,keyword
https://www.welt.de/wirtschaft/article241889031/Danyal-Bayaz-Eine-Krise-ist-nicht-der-richtige-Zeitpunkt-um-Steuern-zu-erhoehen.html,https://www.welt.de/wirtschaft/article241889031/Danyal-Bayaz-Eine-Krise-ist-nicht-der-richtige-Zeitpunkt-um-Steuern-zu-erhoehen.html,0,www.welt.de,"„Eine Krise ist nicht der richtige Zeitpunkt, um Steuern zu erhöhen“","Am Mittwoch wollen Bund und Länder ihr schlechtes Verhältnis kitten. Baden-Württembergs grüner Finanzminister Danyal Bayaz betont, es dürfe den Bürgern in der Energiekrise nichts in Aussicht gestellt werden, was der Staat finanziell nicht stemmen könne. Denno…",https://img.welt.de/img/wirtschaft/mobile241891049/4541358217-ci16x9-w1200/Regierungs-Pressekonerenz.jpg,2022-11-01T04:04:39Z,,"Wenn die Ministerpräsidenten der Länder am 2. November mit Bundeskanzler Olaf Scholz (SPD) zusammenkommen, geht es vor allem um eines: Geld. Während eine Reihe von Maßnahmen aus dem dritten Entlastun… [+10298 chars]",,de,'Energiekrise'
https://www.zeit.de/news/2022-11/01/kunststoff-statt-eis-schlittschuhlaufen-trotz-energiekrise,https://www.zeit.de/news/2022-11/01/kunststoff-statt-eis-schlittschuhlaufen-trotz-energiekrise,0,www.zeit.de,Freizeit: Kunststoff statt Eis: Schlittschuhlaufen trotz Energiekrise,,,2022-11-01T05:24:59Z,,"When browsing with ads:
We collect personal data and also transmit it to third-party providers
 that help us improve and finance our digital content. Some of the information stored on your device, … [+732 chars]",,de,'Energiekrise'
https://www.spiegel.de/wirtschaft/soziales/energiekrise-jede-zwoelfte-industriefirma-will-produktion-verlagern-a-6a1d507b-fc77-4fe1-b0e1-d9029737d3d9,https://www.spiegel.de/wirtschaft/soziales/energiekrise-jede-zwoelfte-industriefirma-will-produktion-verlagern-a-6a1d507b-fc77-4fe1-b0e1-d9029737d3d9,0,www.spiegel.de,Energiekrise: Jede zwölfte Industriefirma will Produktion verlagern,"In der deutschen Industrie herrscht laut einer Umfrage Alarmstimmung. Etliche Firmen erwägen demnach, ihre Produktion zu drosseln – oder sogar ins Ausland zu verlagern. Kann die Gaspreisbremse das verhindern?",https://cdn.prod.www.spiegel.de/images/841704a6-79f3-43a6-8be9-b30b86cad681_w1280_r1.77_fpx67.57_fpy49.98.jpg,2022-11-01T06:05:58Z,https://web.archive.org/web/20221101064019/https://www.spiegel.de/wirtschaft/soziales/energiekrise-jede-zwoelfte-industriefirma-will-produktion-verlagern-a-6a1d507b-fc77-4fe1-b0e1-d9029737d3d9,"Schon jetzt ist der Gasverbrauch in Deutschlands Industrie einer Studie zufolge deutlich gesunken. Die Betriebe hätten ihn im September 2022 temperaturbereinigt um 19 Prozent reduziert, heißt es in e… [+499 chars]",,de,'Energiekrise'
https://www.focus.de/finanzen/news/hotelier-dominik-posch-im-interview-der-druck-durch-die-energiekrise-hat-etwas-gutes-wir-werden-schneller_id_174695623.html,https://www.focus.de/finanzen/news/hotelier-dominik-posch-im-interview-der-druck-durch-die-energiekrise-hat-etwas-gutes-wir-werden-schneller_id_174695623.html,0,www.focus.de,Hotelier Dominik Posch im Interview - „Nur durch den Druck der Energiekrise werden wir schneller“,"Die Gemeinde Biberwier in Tirol hat 640 Einwohner. Nicht wenige arbeiten in den 16 Chalets von „LaPosch“. Dort sollen Urlaubsgäste zur Ruhe kommen, wäVon FOCUS-online-Redakteur Volker Tietz",https://p6.focus.de/img/fotos/id_174685029/laposch-parti-0520-6-web.jpg?im=Crop%3D%280%2C221%2C1800%2C900%29%3BResize%3D%281200%2C627%29&impolicy=perceptual&quality=medium&hash=4dcf58f0cd46a81c33f5f76fc894044757a17107f470e7902b37c75d2ae4ecc5,2022-11-01T09:04:45Z,,"Die Gemeinde Biberwier in Tirol hat 640 Einwohner, nicht wenige arbeiten in den 16 Chalets von LaPosch. Im Gespräch mit FOCUS online spricht der Chef Dominik Posch über die Energiewende, regionale Ei… [+8050 chars]",,de,'Energiekrise'
https://www.n-tv.de/politik/CDU-stellt-baldiges-49-Euro-Ticket-infrage-article23687854.html,https://www.n-tv.de/politik/CDU-stellt-baldiges-49-Euro-Ticket-infrage-article23687854.html,0,www.n-tv.de,"Thorsten Frei im ""ntv Frühstart"": CDU stellt baldiges 49-Euro-Ticket infrage","Eigentlich soll das ""Deutschland-Ticket"" zum Jahreswechsel starten - die Union geht jetzt aber auf Distanz. Eine schnellere Entlastung fordert Parlamentsgeschäftsführer Frei dagegen bei der Gaspreisbremse.",https://bilder4.n-tv.de/img/incoming/crop23687755/7261328485-cImg_16_9-w1200/fs.jpg,2022-11-01T09:12:36Z,https://web.archive.org/web/20221101103326/https://www.n-tv.de/politik/CDU-stellt-baldiges-49-Euro-Ticket-infrage-article23687854.html,"Eigentlich soll das ""Deutschland-Ticket"" zum Jahreswechsel starten - die Union geht jetzt aber auf Distanz. Eine schnellere Entlastung fordert Parlamentsgeschäftsführer Frei dagegen bei der Gaspreisb… [+2407 chars]",,de,'Jahreswechsel'
https://www.sueddeutsche.de/wissen/umwelt-natur-laubblaeser-garten-gartenarbeit-herbst-1.5684831,https://www.sueddeutsche.de/wissen/umwelt-natur-laubblaeser-garten-gartenarbeit-herbst-1.5684831,0,www.sueddeutsche.de,"Umwelt: ""Laut wie ein Presslufthammer""","Laubbläser haben viele Nachteile. Ganz auf sie verzichten, wollen die meisten Kommunen allerdings nicht. Wo die Geräte am ehesten Sinn machen - und wo sie nur eine Plage sind.",https://www.sueddeutsche.de/image/sz.1.5684832/1200x675?v=1667298044,2022-11-01T10:30:35Z,https://web.archive.org/web/20221101105449/https://www.sueddeutsche.de/wissen/umwelt-natur-laubblaeser-garten-gartenarbeit-herbst-1.5684831,"Laubbläser haben viele Nachteile. Ganz auf sie verzichten, wollen die meisten Kommunen allerdings nicht. Wo die Geräte am ehesten Sinn machen - und wo sie nur eine Plage sind.Irgendwann sieht man sie… [+5064 chars]",,de,'Laub'
https://www.stern.de/politik/deutschland/energiekrise--akw-streckbetrieb-hat-geringen-effekt-auf-strompreis-32869042.html,https://www.stern.de/politik/deutschland/energiekrise--akw-streckbetrieb-hat-geringen-effekt-auf-strompreis-32869042.html,0,www.stern.de,Energiekrise: AKW-Streckbetrieb hat geringen Effekt auf Strompreis,Um den Weiterbetrieb der Atomkraftwerke wurde viel gestritten. Dieser ist nun beschlossen. Doch auf die aktuell steigenden Strompreise haben die Kraftwerke wohl keinen relevanten Einfluss.,https://image.stern.de/32869044/t/IO/v1/w1440/r1.7778/-/01--urnnewsmldpacom2009010122110199340317v1w800h600l844t340r2124b1510jpeg---2910ebbc7b17071f.jpg,2022-11-01T11:14:05Z,https://web.archive.org/web/20221101113745/https://www.stern.de/politik/deutschland/energiekrise--akw-streckbetrieb-hat-geringen-effekt-auf-strompreis-32869042.html,"Um den Weiterbetrieb der Atomkraftwerke wurde viel gestritten. Dieser ist nun beschlossen. Doch auf die aktuell steigenden Strompreise haben die Kraftwerke wohl keinen relevanten Einfluss.
Ein Strec… [+1172 chars]",,de,'Energiekrise'
https://www.spiegel.de/wirtschaft/strompreisdeckel-bei-40-cent-uebergewinne-rueckwirkend-ab-september-herangezogen-a-005b0570-af90-45fd-9fb5-0dfac436458e,https://www.spiegel.de/wirtschaft/strompreisdeckel-bei-40-cent-uebergewinne-rueckwirkend-ab-september-herangezogen-a-005b0570-af90-45fd-9fb5-0dfac436458e,0,www.spiegel.de,"Strompreisdeckel bei 40 Cent, Übergewinne rückwirkend ab September herangezogen",Am Mittwoch verhandelt der Bund mit den Ländern zur Energiekrise. Nach SPIEGEL-Informationen will er eine konkrete Obergrenze pro Kilowattstunde Strom setzen – und ab September auf Übergewinne der Unternehmen zugreifen.,https://cdn.prod.www.spiegel.de/images/3667045a-0b24-4da2-b836-6a4a7be8f46f_w1280_r1.77_fpx58_fpy40.jpg,2022-11-01T16:17:00Z,https://web.archive.org/web/20221101162108/https://www.spiegel.de/wirtschaft/strompreisdeckel-bei-40-cent-uebergewinne-rueckwirkend-ab-september-herangezogen-a-005b0570-af90-45fd-9fb5-0dfac436458e,"»Befristet Zufallsgewinne werden abgeschöpft«
Das Geld für die Entlastung im Strombereich soll zum Teil bei Unternehmen durch eine Abschöpfung sogenannter Zufallsgewinne wieder eingesammelt werden. … [+617 chars]",,de,'Energiekrise'
https://www.zeit.de/news/2022-11/02/lauterbach-kuendigt-milliardenhilfe-fuer-krankenhaeuser-an,https://www.zeit.de/news/2022-11/02/lauterbach-kuendigt-milliardenhilfe-fuer-krankenhaeuser-an,0,www.zeit.de,Energiekrise: Lauterbach kündigt Milliardenhilfe für Krankenhäuser an,,,2022-11-01T23:31:59Z,https://web.archive.org/web/20221102000449/https://www.zeit.de/news/2022-11/02/lauterbach-kuendigt-milliardenhilfe-fuer-krankenhaeuser-an,"When browsing with ads:
We collect personal data and also transmit it to third-party providers
 that help us improve and finance our digital content. Some of the information stored on your device, … [+732 chars]",,de,'Energiekrise'
https://www.stern.de/gesellschaft/regional/baden-wuerttemberg/holzdiebstahl--holz-in-der-energiekrise-immer-beliebteres-diebesgut-32871556.html,https://www.stern.de/gesellschaft/regional/baden-wuerttemberg/holzdiebstahl--holz-in-der-energiekrise-immer-beliebteres-diebesgut-32871556.html,0,www.stern.de,Holzdiebstahl: Holz in der Energiekrise immer beliebteres Diebesgut,"Holz aus Baden-Württembergs Wäldern wird in der Energiekrise mehr und mehr zum begehrten Diebesgut. ""Von Januar bis September dieses Jahres liegen die Fallzahlen auf einem Fünfjahreshoch, und auch beim Schaden zeichnet sich ein Anstieg im Vergleich zu den Vor…",https://image.stern.de/32871558/t/dJ/v1/w1440/r1.7778/-/02--urnnewsmldpacom2009010122110299350482v3w800h600l678t353r1791b1206jpeg---a8dd2b5128bdd611.jpg,2022-11-02T05:53:16Z,https://web.archive.org/web/20221102060322/https://www.stern.de/gesellschaft/regional/baden-wuerttemberg/holzdiebstahl--holz-in-der-energiekrise-immer-beliebteres-diebesgut-32871556.html,"Holz aus Baden-Württembergs Wäldern wird in der Energiekrise mehr und mehr zum begehrten Diebesgut. ""Von Januar bis September dieses Jahres liegen die Fallzahlen auf einem Fünfjahreshoch, und auch be… [+1110 chars]",,de,'Energiekrise'
https://www.zeit.de/news/2022-11/02/energiekrise-gladbacher-sparmassnahmen-und-investitionen,https://www.zeit.de/news/2022-11/02/energiekrise-gladbacher-sparmassnahmen-und-investitionen,0,www.zeit.de,Fußball: Energiekrise: Gladbacher Sparmaßnahmen und Investitionen,,,2022-11-02T05:58:50Z,https://web.archive.org/web/20221102063605/https://www.zeit.de/news/2022-11/02/energiekrise-gladbacher-sparmassnahmen-und-investitionen,"When browsing with ads:
We collect personal data and also transmit it to third-party providers
 that help us improve and finance our digital content. Some of the information stored on your device, … [+732 chars]",,de,'Energiekrise'
https://www.sueddeutsche.de/wirtschaft/arbeitsmarkt-arbeitslosigkeit-krise-inflation-1.5685480,https://www.sueddeutsche.de/wirtschaft/arbeitsmarkt-arbeitslosigkeit-krise-inflation-1.5685480,0,www.sueddeutsche.de,Beschäftigung: Die Krise kommt am Arbeitsmarkt an - wenn auch nur langsam,"Die Arbeitslosigkeit in Deutschland ist nach wie vor niedrig - Krieg, Energiekrise und Inflation zum Trotz. Doch bleibt das auch so?",https://www.sueddeutsche.de/image/sz.1.5685490/1200x675?v=1667381890,2022-11-02T09:36:10Z,https://web.archive.org/web/20221102093627/https://www.sueddeutsche.de/wirtschaft/arbeitsmarkt-arbeitslosigkeit-krise-inflation-1.5685480,"Die Arbeitslosigkeit in Deutschland ist nach wie vor niedrig - Krieg, Energiekrise und Inflation zum Trotz. Doch bleibt das auch so?Trotz der Krise behalten die Menschen in Deutschland ihre Jobs, doc… [+4552 chars]",,de,'Energiekrise'
https://www.heise.de/news/Holz-ist-das-neue-Toilettenpapier-Fuenfjahreshoch-beim-Holzklau-im-Sueden-7327055.html,https://www.heise.de/news/Holz-ist-das-neue-Toilettenpapier-Fuenfjahreshoch-beim-Holzklau-im-Sueden-7327055.html,0,www.heise.de,"""Holz ist das neue Toilettenpapier"" – Fünfjahreshoch beim Holzklau im Süden","In Baden-Württemberg schnellen die Zahlen für Holzdiebstähle hoch, da Menschen in der Energiekrise vermehrt auf Holzöfen setzen. Das schadet nicht nur Wäldern.",https://heise.cloudimg.io/bound/1200x1200/q85.png-lossy-85.webp-lossy-85.foil1/_www-heise-de_/imgs/18/3/6/3/6/2/7/9/shutterstock_1797674350-005c3c95a716cc31.jpg,2022-11-02T09:56:00Z,,"Inhaltsverzeichnis
Seit der Ukraine-Krieg sich auf die Energieversorgung auswirkt und die Preise für Gas, Öl und Strom teils stark gestiegen sind, versuchen einige Menschen mit anderen Energieträger… [+7021 chars]",,de,'Energiekrise'
https://www.bild.de/regional/berlin/berlin-aktuell/nachbarschaftsstreit-81-jaehrige-wehrt-laubsauger-angriff-mit-krueckstock-ab-81801718.bild.html,https://www.bild.de/regional/berlin/berlin-aktuell/nachbarschaftsstreit-81-jaehrige-wehrt-laubsauger-angriff-mit-krueckstock-ab-81801718.bild.html,0,www.bild.de,„Ich lasse mich nicht unterkriegen“ - Sie wehrte Laubsauger-Angriff mit Krückstock ab!,Seit Jahren tobt zwischen der Uckermärkerin Aurelia de S. (81) und ihrem Nachbarn Roberto D. (49) im Dörfchen Rutenberg ein Streit. Der nun eskalierte.,"https://images.bild.de/636130e4634da35139488dd1/8cbfff436f80c04152867aac1f695f0e,b661f669?w=1280",2022-11-02T10:21:18Z,https://web.archive.org/web/20221102105718/https://www.bild.de/regional/berlin/berlin-aktuell/nachbarschaftsstreit-81-jaehrige-wehrt-laubsauger-angriff-mit-krueckstock-ab-81801718.bild.html,Rutenberg (Brandenburg) - Seit Jahren tobt zwischen der Uckermärkerin Aurelia de S. (81) und ihrem Nachbarn Roberto D. (49) im Dörfchen Rutenberg (220 Einwohner) ein erbitterter Nachbarschaftsstreit … [+2091 chars],,de,'Laub'
https://www.focus.de/auto/hohes-bussgeld-droht-mildes-wetter-bei-20-grad-darum-sollten-sie-jetzt-ihre-winterreifen-wechseln_id_175410629.html,https://www.focus.de/auto/hohes-bussgeld-droht-mildes-wetter-bei-20-grad-darum-sollten-sie-jetzt-ihre-winterreifen-wechseln_id_175410629.html,0,www.focus.de,Hohes Bußgeld droht - Mildes Wetter bei 20 Grad - darum sollten Sie jetzt Ihre Winterreifen wechseln,Wärmerekord bei 20 Grad und das Anfang November? Bei den milden Temperaturen denken wenige Autofahrende an die bekannte Faustregel „O bis O“ beim Reifenwechsel. Stattdessen fahren sie mit den Sommerreifen weiter. Doch ist das überhaupt erlaubt? FOCUS online k…,https://p6.focus.de/img/finanzen/news/id_144662703/winterreifen-werden-deutlich-teurer..jpg?im=Crop%3D%280%2C191%2C2048%2C1024%29%3BResize%3D%281200%2C627%29&impolicy=perceptual&quality=medium&hash=b2e27371729d2f224c789d3b008e80f1f884da2790304c6e5cf30134c505d07c,2022-11-02T11:14:43Z,https://web.archive.org/web/20221102122803/https://www.focus.de/auto/hohes-bussgeld-droht-mildes-wetter-bei-20-grad-darum-sollten-sie-jetzt-ihre-winterreifen-wechseln_id_175410629.html,Wärmerekord bei 20 Grad und das Anfang November? Bei den milden Temperaturen denken wenige Autofahrende an die bekannte Faustregel O bis O beim Reifenwechsel. Stattdessen fahren sie mit den Sommerrei… [+5543 chars],,de,'Glatteis'
https://www.handelsblatt.com/politik/deutschland/energiekrise-alles-auf-einen-blick-so-wirken-gas-und-strompreisbremse-diese-hilfen-koennen-verbraucher-erwarten/28783020.html,https://www.handelsblatt.com/politik/deutschland/energiekrise-alles-auf-einen-blick-so-wirken-gas-und-strompreisbremse-diese-hilfen-koennen-verbraucher-erwarten/28783020.html,0,www.handelsblatt.com,Energiekrise: Alles auf einen Blick: So wirken Gas- und Strompreisbremse – diese Hilfen können Verbraucher erwarten,"Bei den Hilfen gegen die hohen Gas- und Strompreise geht es nun Schlag auf Schlag. Höchste Zeit für einen Überblick über Zeitpläne, Ansprüche und Entlastungen.",https://www.handelsblatt.com/images/entlastung-fuer-strom-und-gaskosten/28783138/5-format2003.jpg,2022-11-02T12:46:26Z,,"Entlastung für Strom- und GaskostenEine Einmalzahlung für die hohen Gaskosten soll den Gaskunden auf ihrer Dezember-Rechnung gutgeschrieben werden.
(Foto: IMAGO/Laci Perenyi) 
Berlin Gas- und Strom… [+1511 chars]",,de,'Energiekrise'
https://www.handelsblatt.com/politik/deutschland/energiekrise-alles-was-man-jetzt-zur-gas-und-strompreisbremse-wissen-muss/28783020.html,https://www.handelsblatt.com/politik/deutschland/energiekrise-alles-was-man-jetzt-zur-gas-und-strompreisbremse-wissen-muss/28783020.html,0,www.handelsblatt.com,"Energiekrise: Alles, was man jetzt zur Gas- und Strompreisbremse wissen muss","Bei den Hilfen gegen die hohen Gas- und Strompreise geht es nun Schlag auf Schlag. Höchste Zeit für einen Überblick zu den Zeitplänen, Ansprüchen und Entlastungen.",https://www.handelsblatt.com/images/entlastung-fuer-strom-und-gaskosten/28783138/5-format2003.jpg,2022-11-02T12:46:26Z,,"Entlastung für Strom- und GaskostenEine Einmalzahlung für die hohen Gaskosten soll den Gaskunden auf ihrer Dezember-Rechnung gutgeschrieben werden.
(Foto: IMAGO/Laci Perenyi) 
Berlin Gas- und Strom… [+1510 chars]",,de,'Energiekrise'
https://www.zeit.de/wissen/2022-11/klima-europa-anstieg-klimawandel-naturkatastrophe,https://www.zeit.de/wissen/2022-11/klima-europa-anstieg-klimawandel-naturkatastrophe,0,www.zeit.de,Klimakrise: Überdurchschnittlicher Temperaturanstieg in Europa gemessen,"Seit 1991 sind die Temperaturen um 0,5 Grad pro Jahrzehnt gestiegen. Das hat drastische Folgen, wie der Klimabericht der Weltwetterorganisation und Copernicus zeigt.",,2022-11-02T14:07:20Z,https://web.archive.org/web/20221102142854/https://www.zeit.de/wissen/2022-11/klima-europa-anstieg-klimawandel-naturkatastrophe,"When browsing with ads:
We collect personal data and also transmit it to third-party providers
 that help us improve and finance our digital content. Some of the information stored on your device, … [+732 chars]",,de,'Temperaturen'
https://www.welt.de/politik/deutschland/video241927973/Boellerverbot-ja-oder-nein-Das-sagen-die-Deutschen-zu-einem-Boellerverbot.html,https://www.welt.de/politik/deutschland/video241927973/Boellerverbot-ja-oder-nein-Das-sagen-die-Deutschen-zu-einem-Boellerverbot.html,0,www.welt.de,„Es ist ein kriegsähnlicher Zustand hier in Berlin“,Wie wäre es mit einem stillen Jahreswechsel? Ein dauerhaftes Böllerverbot an Silvester wird aktuell diskutiert. Wir haben einmal nachgefragt. Das sagen die Deutschen zu einem Böllerverbot.,https://img.welt.de/img/politik/deutschland/mobile241929199/4851351627-ci16x9-w1200/Ihre-Stimme-Boellerverbot-jpg.jpg,2022-11-02T16:01:09Z,https://web.archive.org/web/20221103003431/https://www.welt.de/politik/deutschland/video241927973/Boellerverbot-ja-oder-nein-Das-sagen-die-Deutschen-zu-einem-Boellerverbot.html,"Die WELT als ePaper: Die vollständige Ausgabe steht Ihnen bereits am Vorabend zur Verfügung so sind Sie immer hochaktuell informiert. Weitere Informationen: http://epaper.welt.de 
 Der Kurz-Link die… [+49 chars]",,de,'Jahreswechsel'
https://www.sueddeutsche.de/politik/deutschland-energiekrise-liveblog-gasspeicher-1.5683334,https://www.sueddeutsche.de/politik/deutschland-energiekrise-liveblog-gasspeicher-1.5683334,0,www.sueddeutsche.de,"Liveblog zur Energiekrise: Gasspeicher zu 99,19 Prozent gefüllt",Vor allem die warme Witterung im Oktober hat das Befüllen der deutschen Gasspeicher zuletzt stark erleichtert. Jetzt sind sie fast randvoll. Netzagentur-Präsident Müller dringt trotzdem auf größtmögliche Einsparungen.,https://www.sueddeutsche.de/image/sz.1.5686146/1200x675?v=1667423248,2022-11-02T21:08:13Z,https://web.archive.org/web/20221102215651/https://www.sueddeutsche.de/politik/deutschland-energiekrise-liveblog-gasspeicher-1.5683334,"Der Krieg Russlands gegen die Ukraine hat auch massive Folgen für die Energieversorgung in Europa und Deutschland. Die Politik versucht, diese sicherzustellen und die Menschen wegen der stark steigen… [+131 chars]",,de,'Energiekrise'
https://www.zeit.de/news/2022-11/03/kommunen-unzufrieden-mit-bund-laender-beschluessen,https://www.zeit.de/news/2022-11/03/kommunen-unzufrieden-mit-bund-laender-beschluessen,0,www.zeit.de,Energiekrise: Kommunen unzufrieden mit Bund-Länder-Beschlüssen,,,2022-11-03T03:08:16Z,,"When browsing with ads:
We collect personal data and also transmit it to third-party providers
 that help us improve and finance our digital content. Some of the information stored on your device, … [+732 chars]",,de,'Energiekrise'
https://www.stern.de/politik/deutschland/bund-laender-runde--inflation-und-energiekrise--welche-entlastungen-jetzt-kommen-32873964.html,https://www.stern.de/politik/deutschland/bund-laender-runde--inflation-und-energiekrise--welche-entlastungen-jetzt-kommen-32873964.html,0,www.stern.de,Bund-Länder-Runde: Inflation und Energiekrise: Welche Entlastungen jetzt kommen,"Bund und Länder standen unter Druck - und haben sich geeinigt. 49-Euro-Ticket, Gaspreisbremse, Härtefallregelung für andere Heizmittel: Welche Entlastungen Bürgerinnen und Bürger jetzt erwarten können.",https://image.stern.de/32873966/t/DP/v7/w1440/r1.7778/-/03--urnnewsmldpacom2009010122110299359841v3w800h600l306t621r1584b1514jpeg---d6ee88ec2d1e03c2.jpg,2022-11-03T06:33:36Z,https://web.archive.org/web/20221103064231/https://www.stern.de/politik/deutschland/bund-laender-runde--inflation-und-energiekrise--welche-entlastungen-jetzt-kommen-32873964.html,"Bund und Länder standen unter Druck - und haben sich geeinigt. 49-Euro-Ticket, Gaspreisbremse, Härtefallregelung für andere Heizmittel: Welche Entlastungen Bürgerinnen und Bürger jetzt erwarten könne… [+5671 chars]",,de,'Energiekrise'
https://www.morgenpost.de/wirtschaft/article236815685/Uniper-erwartet-weiter-erhebliche-Verluste.html,https://www.morgenpost.de/wirtschaft/article236815685/Uniper-erwartet-weiter-erhebliche-Verluste.html,0,www.morgenpost.de,Energiekrise: Uniper erwartet weiter erhebliche Verluste,Uniper spielt eine zentrale Rolle für die Gasversorgung in Deutschland. Doch auch die gewährte Kredite halten vor der geplanten staatlichen Übernahme den Abwärtstrend offenbar nicht auf.,https://img.morgenpost.de/img/wirtschaft/crop236815683/3372606437-w820-cv16_9-q85/Uniper-Zentrale.jpg,2022-11-03T07:30:18Z,https://web.archive.org/web/20221103092003/https://www.morgenpost.de/wirtschaft/article236815685/Uniper-erwartet-weiter-erhebliche-Verluste.html,Düsseldorf. Der vor der Verstaatlichung stehende Energiekonzern Uniper prognostiziert für den Rest des Jahres weiterhin erhebliche Verluste. Zu erwartende Bewertungseffekte bei Derivaten sowie Rückst… [+1630 chars],,de,'Energiekrise'
https://www.zeit.de/news/2022-11/03/wolken-in-sachsen-anhalt-temperaturen-fallen,https://www.zeit.de/news/2022-11/03/wolken-in-sachsen-anhalt-temperaturen-fallen,0,www.zeit.de,Vorhersage: Wolken in Sachsen-Anhalt: Temperaturen fallen,,,2022-11-03T07:39:30Z,https://web.archive.org/web/20221103080657/https://www.zeit.de/news/2022-11/03/wolken-in-sachsen-anhalt-temperaturen-fallen,"When browsing with ads:
We collect personal data and also transmit it to third-party providers
 that help us improve and finance our digital content. Some of the information stored on your device, … [+732 chars]",,de,'Temperaturen'
https://www.faz.net/aktuell/wissen/erde-klima/indonesien-neue-arten-farbenpraechtiger-nektarvoegel-entdeckt-18423987.html,https://www.faz.net/aktuell/wissen/erde-klima/indonesien-neue-arten-farbenpraechtiger-nektarvoegel-entdeckt-18423987.html,0,www.faz.net,Neue Arten farbenprächtiger Vögel in Indonesien entdeckt,"Wissenschaftler sprechen von „aufregenden Erkenntnissen“, dabei ist der Grund klein wie ein Kolibri. Auf indonesischen Inseln haben sie neue Arten farbenprächtiger Vögel entdeckt.",https://media1.faz.net/ppmedia/aktuell/gesellschaft/640587373/1.8431615/facebook_teaser/ein-maennlicher-wakatobi-nektarvogel-mit-blau-gelber-brust.jpg,2022-11-03T10:34:28Z,https://web.archive.org/web/20221102155826/http://www.faz.net/aktuell/wissen/erde-klima/indonesien-neue-arten-farbenpraechtiger-nektarvoegel-entdeckt-18423987.html,"Auf abgelegenen Inseln Indonesiens haben Wissenschaftler mehrere neue Arten tropischer Nektarvögel entdeckt.
Zoologen des Trinity College Dublin identifizierten in Zusammenarbeit mit einem indonesis… [+2080 chars]",,de,'Vögel'
https://www.spiegel.de/panorama/wetter-in-deutschland-es-wird-herbst-zumindest-voruebergehend-a-540450f9-46bd-47e1-ae35-5031ea26e220,https://www.spiegel.de/panorama/wetter-in-deutschland-es-wird-herbst-zumindest-voruebergehend-a-540450f9-46bd-47e1-ae35-5031ea26e220,0,www.spiegel.de,Wetter in Deutschland: Es wird Herbst (zumindest vorübergehend),"Die Sonne macht sich rar, die Temperaturen sinken: Deutschlandweit müssen sich die Menschen vorerst auf herbstliches Wetter einstellen. In den Alpen erwartet der DWD oberhalb von 1300 Metern Schnee.",https://cdn.prod.www.spiegel.de/images/1d217c6c-df70-442a-8a56-b87101c33230_w1280_r1.77_fpx38.02_fpy55.jpg,2022-11-03T12:24:05Z,,"Auch am Samstag zeigt sich der Himmel vielerorts wolkenverhangen. Vor allem im Süden und an der Nordsee werden gebietsweise Regen oder einzelne Schauer erwartet, sonst bleibt es meist trocken. Die Te… [+483 chars]",,de,'Schnee'
