index,url,valid,domain,title,description,image,published,archive,content,quote,language,keyword
https://www.stern.de/panorama/meteorologischer-fruehlingsanfang--maerz-startet-mit-viel-sonne-33241402.html,https://www.stern.de/panorama/meteorologischer-fruehlingsanfang--maerz-startet-mit-viel-sonne-33241402.html,0,www.stern.de,Wettervorhersage: Meteorologischer Frühlingsanfang: März startet mit viel Sonne,Am 1. März ist meteorologischer Frühlingsanfang. Passend dazu meldet der Deutsche Wetterdienst für die kommenden Tage Sonnenschein und milde Temperaturen.,https://image.stern.de/33241434/t/fg/v3/w1440/r1.7778/-/fruehlingsanfang-wetter-hamburg.jpg,2023-03-01T09:05:00Z,https://web.archive.org/web/20230301091632/https://www.stern.de/panorama/meteorologischer-fruehlingsanfang--maerz-startet-mit-viel-sonne-33241402.html,"Am 1. März ist meteorologischer Frühlingsanfang. Passend dazu sind für die kommenden Tage Sonnenschein und milde Temperaturen gemeldet.
In den ersten März-Tagen wird in Deutschland ruhiges und häufi… [+2146 chars]",,de,'Temperaturen'
https://www.sueddeutsche.de/kultur/sonne-und-berton-david-wnendt-felix-lobrecht-rezension-1.5760115,https://www.sueddeutsche.de/kultur/sonne-und-berton-david-wnendt-felix-lobrecht-rezension-1.5760115,0,www.sueddeutsche.de,"""Sonne und Beton"" im Kino: Von ganz weit draußen",Die Jugend von Comedian Felix Lobrecht ist jetzt ein Film. „Sonne und Beton“ erzählt vom harten Aufwachsen in der Berliner Gropiusstadt.,https://www.sueddeutsche.de/image/sz.1.5760116/1200x675?v=1677664988,2023-03-01T10:03:23Z,https://web.archive.org/web/20230301120243/https://www.sueddeutsche.de/kultur/sonne-und-berton-david-wnendt-felix-lobrecht-rezension-1.5760115,"Die Jugend von ""Gemischtes Hack""-Podcaster Felix Lobrecht ist jetzt ein Film: ""Sonne und Beton"" erzählt vom Aufwachsen in der Berlin.Es ist einer dieser Scheißtage. Zu viel Beton, zu wenig Luft zum A… [+250 chars]",,de,'Sonne'
https://www.diepresse.com/6257582/mehr-als-ein-meter-schnee-auf-mallorca,https://www.diepresse.com/6257582/mehr-als-ein-meter-schnee-auf-mallorca,0,www.diepresse.com,Mehr als ein Meter Schnee auf Mallorca,Die spanische Insel bittet um Hilfe des Militärs.,https://media.diepresse.com/social_diepresse_nachrichten/images/uploads_1200/b/a/e/6257582/mallorca_1677667915639810.jpg,2023-03-01T10:51:00Z,,"Die spanische Insel bittet um Hilfe des Militärs.
Mallorca hat zur Bewältigung der Folgen des Wintersturms ""Juliette"" die Hilfe der Militärischen Nothilfe-Einheit UME angefordert. Zwar zog das Sturm… [+1301 chars]",,de,'Schnee'
https://www.morgenpost.de/vermischtes/article237781941/Mehr-als-ein-Meter-Schnee-Mallorca-bittet-Militaer-um-Hilfe.html,https://www.morgenpost.de/vermischtes/article237781941/Mehr-als-ein-Meter-Schnee-Mallorca-bittet-Militaer-um-Hilfe.html,0,www.morgenpost.de,Unwetter: Mehr als ein Meter Schnee: Mallorca bittet Militär um Hilfe,Die normalerweise von der Sonne verwöhnte Balearen-Insel wird von Schnee und Kälte heimgesucht. In einem abgelegenen Kloster werden Ausflügler eingeschneit.,https://img.morgenpost.de/img/vermischtes/crop237781931/8082605691-w820-cv16_9-q85/Eingeschneit.jpg,2023-03-01T10:59:32Z,https://web.archive.org/web/20230301113432/https://www.morgenpost.de/vermischtes/article237781941/Mehr-als-ein-Meter-Schnee-Mallorca-bittet-Militaer-um-Hilfe.html,Palma. Mallorca hat zur Bewältigung der Folgen des Wintersturms Juliette die Hilfe der Militärischen Nothilfe-Einheit UME angefordert. Zwar zog das Sturmtief am Mittwoch nach Osten Richtung Italien a… [+1352 chars],,de,'Sonne'
https://www.stern.de/panorama/unwetter--mehr-als-ein-meter-schnee--mallorca-bittet-militaer-um-hilfe-33242014.html,https://www.stern.de/panorama/unwetter--mehr-als-ein-meter-schnee--mallorca-bittet-militaer-um-hilfe-33242014.html,0,www.stern.de,Unwetter: Mehr als ein Meter Schnee: Mallorca bittet Militär um Hilfe,Die normalerweise von der Sonne verwöhnte Balearen-Insel wird von Schnee und Kälte heimgesucht. In einem abgelegenen Kloster werden Ausflügler eingeschneit.,https://image.stern.de/33242016/t/TO/v1/w1440/r1.7778/-/01--urnnewsmldpacom2009010123030199784492v2w800h600l0t302r1379b1303jpeg---f844387c5da297ff.jpg,2023-03-01T10:59:32Z,https://web.archive.org/web/20230301112119/https://www.stern.de/panorama/unwetter--mehr-als-ein-meter-schnee--mallorca-bittet-militaer-um-hilfe-33242014.html,"Die normalerweise von der Sonne verwöhnte Balearen-Insel wird von Schnee und Kälte heimgesucht. In einem abgelegenen Kloster werden Ausflügler eingeschneit.
Mallorca hat zur Bewältigung der Folgen d… [+1405 chars]",,de,'Sonne'
https://futurezone.at/myfuzo/gewinnspiele/gewinnspiel-oesterreich-berlin-sonne-beton-kino-buch-roman/402346077,https://futurezone.at/myfuzo/gewinnspiele/gewinnspiel-oesterreich-berlin-sonne-beton-kino-buch-roman/402346077,0,futurezone.at,Sonne und Beton: Mitmachen und Erfolgsroman gewinnen,Ab 3. März ist der Film in österreichischen Kinos zu sehen. Wir vergeben passend dazu 2x den Erfolgsroman von Felix Lobrecht.,https://image.futurezone.at/images/facebook/7675527/17813_700.jpg,2023-03-01T11:47:44Z,https://web.archive.org/web/20230301123546/https://futurezone.at/myfuzo/gewinnspiele/gewinnspiel-oesterreich-berlin-sonne-beton-kino-buch-roman/402346077,Ab 3. März ist der Film in österreichischen Kinos zu sehen. Wir vergeben passend dazu 2x den Erfolgsroman von Felix Lobrecht.,,de,'Sonne'
https://www.kraftfuttermischwerk.de/blogg/mix-till-von-sein-23-3/,https://www.kraftfuttermischwerk.de/blogg/mix-till-von-sein-23-3/,0,www.kraftfuttermischwerk.de,Mix: Till von Sein – 23.3,"Hier scheint heute ganz wunderbar die Sonne und auch wenn die Temperaturen noch gen 0 tendieren, habe ich nicht wenig Bock auf Frühling langsam. Da…Mehr lesen ->Mix:  Till von Sein – 23.3",https://www.kraftfuttermischwerk.de/blogg/wp-content/uploads2/2023/03/Bildschirmfoto-2023-03-01-um-13.27.49.jpg,2023-03-01T12:29:00Z,https://web.archive.org/web/20230301122904/https://www.kraftfuttermischwerk.de/blogg/mix-till-von-sein-23-3/,"Hier scheint heute ganz wunderbar die Sonne und auch wenn die Temperaturen noch gen 0 tendieren, habe ich nicht wenig Bock auf Frühling langsam. Da kommt mir der allmonatliche Mix von Till klanglich … [+274 chars]",,de,'Sonne'
https://www.n-tv.de/panorama/Schnee-ueberrascht-Schaulustige-in-Mallorcas-Bergen-article23953133.html,https://www.n-tv.de/panorama/Schnee-ueberrascht-Schaulustige-in-Mallorcas-Bergen-article23953133.html,0,www.n-tv.de,Militär zur Hilfe gerufen: Schnee überrascht Schaulustige in Mallorcas Bergen,"Schnee auf Mallorca? ""Nichts wie in die Berge!"", werden sich knapp 100 Neugierige gedacht haben, die ungewollt eine Nacht im Kloster Lluc auf der Balearen-Insel verbringen. Die Bergrettung kann sie schließlich wieder ins Tal bringen. Zur Bewältigung des Winte…",https://bilder1.n-tv.de/img/incoming/crop23953140/2801329649-cImg_16_9-w1200/4a0bb3fd5e57a0e0a0599456b15eb826.jpg,2023-03-01T12:29:13Z,https://web.archive.org/web/20230301141353/https://www.n-tv.de/panorama/Schnee-ueberrascht-Schaulustige-in-Mallorcas-Bergen-article23953133.html,"Schnee auf Mallorca? ""Nichts wie in die Berge!"", werden sich knapp 100 Neugierige gedacht haben, die ungewollt eine Nacht im Kloster Lluc auf der Balearen-Insel verbringen. Die Bergrettung kann sie s… [+3052 chars]",,de,'Schnee'
https://www.morgenpost.de/vermischtes/article237783537/Das-Ende-der-Woche-wird-unbestaendig-und-teils-winterlich.html,https://www.morgenpost.de/vermischtes/article237783537/Das-Ende-der-Woche-wird-unbestaendig-und-teils-winterlich.html,0,www.morgenpost.de,Vorhersage : Das Ende der Woche wird unbeständig und teils winterlich,Pünktlich zum Beginn des meteorologischen Frühlings am 1. März scheint vielerorts die Sonne. In den nächsten Tagen wird es aber wieder kühler.,https://img.morgenpost.de/img/vermischtes/crop237783535/9162606298-w820-cv16_9-q85/Templiner-See.jpg,2023-03-01T12:44:03Z,https://web.archive.org/web/20230301140625/https://www.morgenpost.de/vermischtes/article237783537/Das-Ende-der-Woche-wird-unbestaendig-und-teils-winterlich.html,"Offenbach. Auf einen zumeist sonnigen, aber recht kühlen meteorologischen Frühlingsanfang folgt zum Ende der Woche unbeständigeres und mitunter winterliches Wetter. Am Wochenende gelange wieder deutl… [+2388 chars]",,de,'Sonne'
https://www.faz.net/aktuell/gesellschaft/ungluecke/mallorca-mit-wintersturm-auch-an-einigen-straenden-schneite-es-18714563.html,https://www.faz.net/aktuell/gesellschaft/ungluecke/mallorca-mit-wintersturm-auch-an-einigen-straenden-schneite-es-18714563.html,0,www.faz.net,"Schnee, Sturm und Regen verursachen auf Mallorca Schäden","Insbesondere in höheren Lagen ist auf Mallorca seit Montag bis zu 1,4 Meter Schnee gefallen. Im Kloster Lluc waren knapp 100 Ausflügler eingeschneit. Die Regierung hat eine Nothilfe-Einheit des Militärs angefordert.",https://media0.faz.net/ppmedia/aktuell/gesellschaft/250912464/1.8714638/facebook_teaser/ein-van-ist-in-valldemossa-auf.jpg,2023-03-01T12:52:33Z,https://web.archive.org/web/20230301140705/https://www.faz.net/aktuell/gesellschaft/ungluecke/mallorca-mit-wintersturm-auch-an-einigen-straenden-schneite-es-18714563.html,"Mallorca hat zur Bewältigung der Folgen des Wintersturms Juliette die Hilfe der Militärischen Nothilfe-Einheit UME angefordert. Zwar zog das Sturmtief am Mittwoch nach Osten Richtung Italien ab, aber… [+2685 chars]",,de,'Regen'
https://www.focus.de/immobilien/wohnen/verbot-von-neuen-oel-und-gaskesseln-wann-sie-laut-habecks-heizungsverbot-ihr-altes-geraet-austauschen-muessen_id_187149814.html,https://www.focus.de/immobilien/wohnen/verbot-von-neuen-oel-und-gaskesseln-wann-sie-laut-habecks-heizungsverbot-ihr-altes-geraet-austauschen-muessen_id_187149814.html,0,www.focus.de,Verbot von neuen Öl- und Gaskesseln - Wann Sie laut Habecks Heizungsverbot Ihr altes Gerät austauschen müssen,"Wenn die Temperaturen im Wohnzimmer auch bei Minusgraden angenehm warm sind, liegt das in Deutschland oft an Gas und Öl. Das soll sich ändern. Die Bundesregierung will schon ab 2024 neue Gas- und Öl-Heizungen verbieten. Das trifft alle, die ihre alte Anlage f…",https://p6.focus.de/img/fotos/id_187150453/gettyimages-1367981681.jpg?im=Crop%3D%280%2C290%2C3461%2C1730%29%3BResize%3D%281200%2C627%29&impolicy=perceptual&quality=medium&hash=ac2601585296c32cb9d9c23dc234bcc29d544551cad80fd4173c271af9e67a5a,2023-03-01T13:39:13Z,https://web.archive.org/web/20230301145507/https://www.focus.de/immobilien/wohnen/verbot-von-neuen-oel-und-gaskesseln-wann-sie-laut-habecks-heizungsverbot-ihr-altes-geraet-austauschen-muessen_id_187149814.html,"Wenn die Temperaturen im Wohnzimmer auch bei Minusgraden angenehm warm sind, liegt das in Deutschland oft an Gas und Öl. Das soll sich ändern. Die Bundesregierung will schon ab 2024 neue Gas- und Öl-… [+5846 chars]",,de,'Sonne'
https://www.tagesspiegel.de/berlin/berlin-im-ersten-corona-lockdown-wie-war-das-noch-damals-im-fruhjahr-2020-9408422.html,https://www.tagesspiegel.de/berlin/berlin-im-ersten-corona-lockdown-wie-war-das-noch-damals-im-fruhjahr-2020-9408422.html,0,www.tagesspiegel.de,"Berlin im ersten Corona-Lockdown: Wie war das noch damals, im Frühjahr 2020?","Vor drei Jahren, am 1. März 2020, wurde in Berlin der erste Covid-Fall bekannt. Bald hieß es: „Stay at home!“ – selten wurden Frühlingsgefühle herber enttäuscht. Eine Fotoauswahl von damals.",https://www.tagesspiegel.de/images/eine-frau-mit-mundschutzmaske-laeuft-vor-schilder-bleib-zu-hause-in-berlin-am-2-april-2020-um-die-verbreitung-des-cor/alternates/BASE_16_9_W1400/eine-frau-mit-mundschutzmaske-laeuft-vor-schilder-bleib-zu-hause-in-berlin-am-2-april-2020-um-die-verbreitung-des-cor.jpeg,2023-03-01T14:12:49Z,https://web.archive.org/web/20230301142315/https://www.tagesspiegel.de/berlin/berlin-im-ersten-corona-lockdown-wie-war-das-noch-damals-im-fruhjahr-2020-9408422.html,"An das Berliner Frühjahr 2020 denkt fast niemand gerne zurück: Am 1. März gab es den ersten Corona-Fall in Berlin. Der erste Corona-Lockdown, der am 22. März begann, brachte den Alltag völlig durchei… [+154 chars]",,de,'Frühlingsgefühle'
