index,url,valid,domain,title,description,image,published,archive,content,quote,language,keyword
https://www.zeit.de/news/2024-08/02/weniger-einnahmen-fuer-bauern-durch-heftigen-regen,https://www.zeit.de/news/2024-08/02/weniger-einnahmen-fuer-bauern-durch-heftigen-regen,0,www.zeit.de,Getreideernte: Weniger Einnahmen für Bauern durch heftigen Regen,Hier finden Sie Informationen zu dem Thema „Getreideernte“. Lesen Sie jetzt „Weniger Einnahmen für Bauern durch heftigen Regen“.,https://img.zeit.de/news/2024-08/02/weniger-einnahmen-fuer-bauern-durch-heftigen-regen-image-group/wide__1300x731,2024-08-02T14:18:40Z,,"Die heftigen Regenfälle könnten die Einnahmen der Thüringer Bauern bei der Getreideernte schmälern. «Der Weizen, der jetzt noch draußen ist, ist kein Backweizen mehr», sagte der Präsident des Thüring… [+1913 chars]",,de,'Regen'
https://www.zeit.de/wirtschaft/2024-07/duerre-sizilien-trockenheit-landwirtschaft-tourismus,https://www.zeit.de/wirtschaft/2024-07/duerre-sizilien-trockenheit-landwirtschaft-tourismus,0,www.zeit.de,Dürre: Sizilien? Kaum wiederzuerkennen,"90 Prozent weniger Regen plus Hitzerekorde: Auf Sizilien wird sichtbar, welche Folgen extreme Sommer haben. Und wie absurd der Alltag von Landwirten und Bewohnern wird.",https://img.zeit.de/wirtschaft/2024-07/duerre-sizilien-trockenheit-landwirtschaft-tourismus-bild/wide__1300x731,2024-08-02T16:02:47Z,,"Der Pozzillo-See in der Provinz Catania auf Sizilien sah früher aus wie ein kleiner Gebirgssee: smaragdblaues Wasser, rundherum satte, grüne Wiesen. Für die Insel ist er überlebenswichtig, der künstl… [+636 chars]",,de,'Hitze'
https://taz.de/Podcast-klima-update/!6027683/,https://taz.de/Podcast-klima-update/!6027683/,0,taz.de,Podcast „klima update°“: Die Klima-News der Woche,Diese deutschen Städte sind Hitze-Höllen. Beim Ausbau der Solar-Energie läuft es gut. Wie die energetische Sanierung gerecht für Mie­te­r*in­nen wird.,https://taz.de/picture/7157127/948/28475678-1.jpeg,2024-08-02T16:15:00Z,,"Diese deutschen Städte sind Hitze-Höllen. Beim Ausbau der Solar-Energie läuft es gut. Wie die energetische Sanierung gerecht für Mie­te­r*in­nen wird.
Zu wenig grüne Inseln in der Stadt Foto: Mika V… [+1070 chars]",,de,'Hitze'
https://www.faz.net/aktuell/wirtschaft/mehr-wirtschaft/haushaltsstreit-der-ampel-kunstgriffe-mit-betraechtlichem-risiko-19896424.html,https://www.faz.net/aktuell/wirtschaft/mehr-wirtschaft/haushaltsstreit-der-ampel-kunstgriffe-mit-betraechtlichem-risiko-19896424.html,0,www.faz.net,„Kunstgriffe“ mit beträchtlichem Risiko,Zwei Gutachten weisen die Bundesregierung bei ihrer Haushaltsplanung in die Schranken. Die Bedenken sind sehr grundsätzlicher Natur. Im Parlament ist die Unruhe groß.,https://media0.faz.net/ppmedia/aktuell/politik/3984538148/1.9896488/facebook_teaser/bundesfinanzminister-christian.jpg,2024-08-02T16:48:55Z,,"Das sorgt vor allem zwischen SPD und FDP für Unmut. Sie liegen offenbar schon in der Bewertung der Gutachten weit auseinander und damit in der Frage, ob die dort genannten Hürden unüberwindbar sind. … [+4407 chars]",,de,'Natur'
https://www.bild.de/news/ausland/auf-mallorca-zwei-hitze-tote-innerhalb-weniger-stunden-66ad1476e8d7de79bfad6578,https://www.bild.de/news/ausland/auf-mallorca-zwei-hitze-tote-innerhalb-weniger-stunden-66ad1476e8d7de79bfad6578,0,www.bild.de,Auf Mallorca - Zwei Hitze-Tote innerhalb weniger Stunden,"Hitzewelle auf Mallorca: Zwei Männer (60, 61) starben an den Folgen der sengenden Hitze, die derzeit auch auf Mallorca herrscht.","https://images.bild.de/66ad1476e8d7de79bfad6578/8e1df28e03400c034ab5c956216c6621,60f70c11?w=1280",2024-08-02T18:57:40Z,,"Mallorca Temperaturen jenseits der 40 Grad, Luftfeuchtigkeit im einstelligen Bereich: Eine Hitzewelle hat Spanien fest im Griff. Auch auf Mallorca kämpfen die Menschen mit dem brutalen Wetter. Am Don… [+1625 chars]",,de,'Hitze'
"https://www.gamestar.de/artikel/klimaanlage-mobil-klima-kuehlung-ventilator-sommer-hitze,3417437.html","https://www.gamestar.de/artikel/klimaanlage-mobil-klima-kuehlung-ventilator-sommer-hitze,3417437.html",0,www.gamestar.de,Deals: Mein Mittel gegen Hitze - Mit diesen 3 Tipps hilft euch das sicherlich auch! [Anzeige],"30 Grad und Hitze in der Dachgeschosswohnung? Nachts nicht schlafen können? Kenne ich. Seit zwei Jahren habe ich für mich eine günstige Lösung gefunden, die ohne mobiles Klimagerät mit Abluftschlauch auskommt - aber dabei muss man ein paar Dinge beachten.",https://images.cgames.de/images/gamestar/4/midea-ventilator-mit-wasserkühlung-wassertank-hitze-mobile-klimaanlage-klimagerät-amazon-prime-day_6303285.jpg,2024-08-02T19:00:00Z,,"Ein Ventilator mit Wasserkühlung ist günstiger und umweltfreundlicher als ein mobiles Klimagerät. 
Mobile Klimageräte sind ein adäquates Mittel gegen Hitze aber die Sache mit dem Abluftschlauch, die… [+4240 chars]",,de,'Hitze'
https://wien.orf.at/stories/3267621/,https://wien.orf.at/stories/3267621/,0,wien.orf.at,„Positiver Trend“ bei Gebäudebegrünung,Unter den verschiedenen Maßnahmen zum Schutz vor Hitze wird in Wien auch die Begrünung von Gebäuden immer wichtiger. Klimastadtrat Jürgen Czernohorszky (SPÖ) spricht von einem gefühlt positiven Trend. Zuletzt wurden im Mai die Förderungen dafür erhöht.,https://ibs.orf.at/wie?image=https%3A%2F%2Foekastatic.orf.at%2Fmims%2F2024%2F31%2F06%2Fcrops%2Fw%3D1200%2Ch%3D627%2Cq%3D75%2F2302549_master_876506_2fassadenbegruenung-embelgasse_19.jpg%3Fs%3Dc5169b5c3e9214c009c9a867ed8c374a062b39f9,2024-08-02T22:05:00Z,,"Früher mussten im Schnitt 80 Prozent aufgezahlt werden. Mit Anhebung der Fördersummen soll der Anteil der Kostendeckung erheblich gesteigert werden. Als Folge davon hofft die Stadt, dass mehr Gebäude… [+2052 chars]",,de,'Hitze'
https://www.welt.de/sport/olympia/article252733408/Olympia-2024-Fenster-und-Tueren-zugeklebt-Sportler-schwitzen-in-versiegelten-Bussen.html,https://www.welt.de/sport/olympia/article252733408/Olympia-2024-Fenster-und-Tueren-zugeklebt-Sportler-schwitzen-in-versiegelten-Bussen.html,0,www.welt.de,Fenster und Türen zugeklebt – Sportler schwitzen in versiegelten Bussen,"Um das Einschleusen fremder Objekte ins olympische Dorf zu verhindern, werden die Busse versiegelt. Athleten berichten von Temperaturen wie in der Sauna. Wer auf Toilette muss, hat ein kleines oder großes Problem. Die Türen bleiben geschlossen.",https://img.welt.de/img/bildergalerien/mobile252812980/1741350867-ci16x9-w1200/Shuttlebus3.jpg,2024-08-03T03:01:31Z,,Der Weg endet an einem offenen weißen Zelt am Boulevard Finot. Vehicules Scanning Area steht auf dem Schild an der Einfahrt zum olympischen Dorf. Die Busse mit den Athleten müssen hier unter der Zelt… [+3483 chars],,de,'Temperaturen'
https://www.welt.de/reise/deutschland/article252813804/Wandern-im-Spessart-Staunen-wie-ein-Kind-auf-dem-Pfad-der-Achtsamkeit.html,https://www.welt.de/reise/deutschland/article252813804/Wandern-im-Spessart-Staunen-wie-ein-Kind-auf-dem-Pfad-der-Achtsamkeit.html,0,www.welt.de,Staunen wie ein Kind auf dem Pfad der Achtsamkeit,"Stress und Schnelllebigkeit bestimmen den Alltag vieler Menschen, die sich wünschen, davon für eine Weile eine Auszeit zu nehmen. Sogenannte Pfade der Achtsamkeit sollen helfen, zu entschleunigen und die Natur bewusster wahrzunehmen. Unser Autor probierte ein…",https://img.welt.de/img/reise/mobile252813800/2741351567-ci16x9-w1200/Unterwegs-auf-dem-Pfad-der-Achtsamkeit.jpg,2024-08-03T05:13:04Z,,"Ortsrand Stadtprozelten, Südspessart. Der Wanderparkplatz Dreikreuzweg liegt in einem Talgrund am Wald. Kein Haus in Sicht, kein Motorengeräusch. Dafür hallen Kuckucksrufe heran, und im Hintergrund g… [+5754 chars]",,de,'Natur'
https://www.zeit.de/news/2024-08/03/vereinzelt-wolken-und-steigende-temperaturen,https://www.zeit.de/news/2024-08/03/vereinzelt-wolken-und-steigende-temperaturen,0,www.zeit.de,Sommerlich: Vereinzelt Wolken und steigende Temperaturen,Hier finden Sie Informationen zu dem Thema „Sommerlich“. Lesen Sie jetzt „Vereinzelt Wolken und steigende Temperaturen“.,https://img.zeit.de/news/2024-08/03/vereinzelt-wolken-und-steigende-temperaturen-image-group/wide__1300x731,2024-08-03T08:39:07Z,,"Sommerliches Wetter mit Temperaturen bis zu 30 Grad werden zum Wochenstart in Hessen erwartet. Der Sonntag werde zunächst wechselnd bewölkt und vereinzelt könnte es noch Schauer geben, teilte der Deu… [+489 chars]",,de,'Temperaturen'
https://www.stern.de/gesellschaft/regional/hessen/sommerlich--vereinzelt-wolken-und-steigende-temperaturen-34944668.html,https://www.stern.de/gesellschaft/regional/hessen/sommerlich--vereinzelt-wolken-und-steigende-temperaturen-34944668.html,0,www.stern.de,Sommerlich: Vereinzelt Wolken und steigende Temperaturen,Offenbach (lhe) - Sommerliches Wetter mit Temperaturen bis zu 30 Grad werden zum Wochenstart in Hessen erwartet. Der Sonntag werde zunächst wechselnd,https://image.stern.de/34944670/t/sf/v1/w1440/r1.7778/-/03--dwwacxebsyv15axw800h600jpeg---27f232340c16f144.jpg,2024-08-03T08:39:07Z,,"Zum Wochenstart sind mitten in den Sommerferien wieder Temperaturen um die 30 Grad möglich.
Sommerliches Wetter mit Temperaturen bis zu 30 Grad werden zum Wochenstart in Hessen erwartet. Der Sonntag… [+551 chars]",,de,'Temperaturen'
https://www.stern.de/gesellschaft/regional/nordrhein-westfalen/wetter--nach-gewittern-am-wochenende--naechste-woche-schoenes-wetter-34944754.html,https://www.stern.de/gesellschaft/regional/nordrhein-westfalen/wetter--nach-gewittern-am-wochenende--naechste-woche-schoenes-wetter-34944754.html,0,www.stern.de,Wetter: Nach Gewittern am Wochenende: Nächste Woche schönes Wetter,"Blauer Himmel und Freibad-Wetter? Pustekuchen - der Himmel über Nordrhein-Westfalen ist vielerorts bewölkt, auch Gewitter sind möglich. Doch es wird bald besser.",https://image.stern.de/34944756/t/jC/v1/w1440/r1.7778/-/03--q4t62wqtxuv11axw800h600jpeg---4164c9a5aca49893.jpg,2024-08-03T09:45:06Z,,"Blauer Himmel und Freibad-Wetter? Pustekuchen - der Himmel über Nordrhein-Westfalen ist vielerorts bewölkt, auch Gewitter sind möglich. Doch es wird bald besser.
Die Menschen in Nordrhein-Westfalen … [+875 chars]",,de,'Temperaturen'
https://www.bild.de/leben-wissen/reisen/italien-proteste-gegen-die-sonnenschirm-mafia-66addf77c63bd516d6d5c440,https://www.bild.de/leben-wissen/reisen/italien-proteste-gegen-die-sonnenschirm-mafia-66addf77c63bd516d6d5c440,0,www.bild.de,Urlaubsärger in Italien - Sonnenschirm-Mafia protestiert gegen EU-Regeln,"Es wird heiß an Italiens Stränden. Aber nicht, weil die Temperaturen steigen. Sondern, weil die Proteste gegen die Sonnenschirm-Mafia immer lauter werden.","https://images.bild.de/66addf77c63bd516d6d5c440/a851dde640ddd8d4edbc0b1e8c37c36d,32cad082?w=1280",2024-08-03T10:02:56Z,,"Es wird heiß an Italiens Stränden. Aber nicht, weil das Thermometer auf über 30 Grad steigt. 
Wer an den Stränden der Adria bis hin zur Amalfiküste baden will, kennt das Bild. Dicht an dicht stehend… [+2033 chars]",,de,'Temperaturen'
https://kaernten.orf.at/stories/3267692/,https://kaernten.orf.at/stories/3267692/,0,kaernten.orf.at,Wespen sind derzeit aktiv,"Die hohen Temperaturen haben auch Auswirkungen auf Insekten, und jeder der zur Zeit im Gastgarten oder auf der Terrasse sitzt, weiß ein Lied davon zu singen, wie aktiv die Wespen jetzt sind. Das spiegelt sich nicht zuletzt auch bei den Patienten in den Kranke…",https://ibs.orf.at/ktn?image=https%3A%2F%2Foekastatic.orf.at%2Fmims%2F2024%2F31%2F62%2Fcrops%2Fw%3D1200%2Ch%3D627%2Cq%3D75%2F2303256_master_876762_kh_insert_wespen_240802_00_02_02_02.jpg%3Fs%3D8448e6300312e7cb7e3f5f7cbf9b7cfbd0654eb9,2024-08-03T10:33:39Z,,"Eine Häufung an Patienten mit Wespenstichen sei im LKH Villach nicht zu bemerken, aber immer wieder würden auch Kinder eingeliefert, mit allergischen Reaktionen, die behandelt werden müssten, sagte R… [+3371 chars]",,de,'Temperaturen'
https://www.faz.net/aktuell/politik/das-bundesverfassungsgericht-mischt-sich-oft-in-die-politik-ein-19895401.html,https://www.faz.net/aktuell/politik/das-bundesverfassungsgericht-mischt-sich-oft-in-die-politik-ein-19895401.html,0,www.faz.net,Kommentar zur Rolle des Verfassungsgerichts: Politiker in Roben,"Im Urteil zum Wahlgesetz hat Karlsruhe Augenmaß gezeigt. Doch insgesamt mischt sich das Gericht zu oft in Angelegenheiten ein, die politischer Natur sind.",https://media0.faz.net/ppmedia/aktuell/politik/3682846864/1.9895396/facebook_teaser_fplus/die-fehler-gesehen-der-zweite.jpg,2024-08-03T11:34:40Z,,"Auf öffentliche Zustimmung kann sich das Bundesverfassungsgericht meistens dann verlassen, wenn es die Grundpfeiler der Demokratie schützt. Die von der Regierungskoalition durchgepeitschte Wahlrechts… [+330 chars]",,de,'Natur'
https://www.zeit.de/news/2024-08/04/wie-hessens-kommunen-trotz-hitze-cool-bleiben,https://www.zeit.de/news/2024-08/04/wie-hessens-kommunen-trotz-hitze-cool-bleiben,0,www.zeit.de,Aufgeheizte Städte: Wie Hessens Kommunen trotz Hitze cool bleiben,Hier finden Sie Informationen zu dem Thema „Aufgeheizte Städte“. Lesen Sie jetzt „Wie Hessens Kommunen trotz Hitze cool bleiben“.,https://img.zeit.de/news/2024-08/04/wie-hessens-kommunen-trotz-hitze-cool-bleiben-image-group/wide__1300x731,2024-08-04T02:00:39Z,,"Die Hitzebelastung in Hessens Städten nimmt zu. Insbesondere seit Ende der 1980er Jahre hat sich die mittlere Sommertemperatur im Bundesland nach Angaben des Hessischen Landesamts für Naturschutz, Um… [+6735 chars]",,de,'Hitze'
https://www.zeit.de/news/2024-08/04/das-gelbe-gift-jakobskreuzkraut-auf-dem-vormarsch,https://www.zeit.de/news/2024-08/04/das-gelbe-gift-jakobskreuzkraut-auf-dem-vormarsch,0,www.zeit.de,Natur: Das gelbe Gift: Jakobskreuzkraut auf dem Vormarsch,Hier finden Sie Informationen zu dem Thema „Natur“. Lesen Sie jetzt „Das gelbe Gift: Jakobskreuzkraut auf dem Vormarsch“.,https://img.zeit.de/news/2024-08/04/das-gelbe-gift-jakobskreuzkraut-auf-dem-vormarsch-image-group/wide__1300x731,2024-08-04T03:30:36Z,,Es steht im ganzen Norden in voller gelber Blütenpracht: das Jakobskreuzkraut. Die Verbreitung hat nach Angaben der Landwirtschaftskammer Niedersachsen in den letzten Jahren deutlich zugenommen. «Es … [+5959 chars],,de,'Natur'
https://www.zeit.de/news/2024-08/04/wechselhaftes-wetter-im-norden-temperaturen-bis-21-grad,https://www.zeit.de/news/2024-08/04/wechselhaftes-wetter-im-norden-temperaturen-bis-21-grad,0,www.zeit.de,Deutscher Wetterdienst: Wechselhaftes Wetter im Norden - Temperaturen bis 21 Grad,Hier finden Sie Informationen zu dem Thema „Deutscher Wetterdienst“. Lesen Sie jetzt „Wechselhaftes Wetter im Norden - Temperaturen bis 21 Grad“.,https://img.zeit.de/news/2024-08/04/wechselhaftes-wetter-im-norden-temperaturen-bis-21-grad-image-group/wide__1300x731,2024-08-04T09:25:19Z,,"Der Deutsche Wetterdienst (DWD) hat für Hamburg und Schleswig-Holstein wechselhaftes Wetter vorausgesagt. «Am Sonntagvormittag kann es noch Wolken und vereinzelte Schauer geben, später beruhigt sich … [+597 chars]",,de,'Temperaturen'
https://www.zeit.de/news/2024-08/04/nach-wolkenwetter-die-sonne-gewinnt-allmaehlich-die-oberhand,https://www.zeit.de/news/2024-08/04/nach-wolkenwetter-die-sonne-gewinnt-allmaehlich-die-oberhand,0,www.zeit.de,Prognose: Nach Wolkenwetter: Die Sonne gewinnt allmählich die Oberhand,Hier finden Sie Informationen zu dem Thema „Prognose“. Lesen Sie jetzt „Nach Wolkenwetter: Die Sonne gewinnt allmählich die Oberhand“.,https://img.zeit.de/news/2024-08/04/nach-wolkenwetter-die-sonne-gewinnt-allmaehlich-die-oberhand-image-group/wide__1300x731,2024-08-04T09:35:49Z,,Nach verregnetem und wolkenreichem Wetter zeigt sich der Sommer in der kommenden Woche doch noch von seiner schönen Seite: In Nordrhein-Westfalen gibt es zum Wochenauftakt blauen Himmel mit viel Sonn… [+697 chars],,de,'Sonne'
https://www.zeit.de/news/2024-08/04/vereinzelte-gewitter-in-mv-temperaturen-bis-23-grad,https://www.zeit.de/news/2024-08/04/vereinzelte-gewitter-in-mv-temperaturen-bis-23-grad,0,www.zeit.de,Deutscher Wetterdienst: Vereinzelte Gewitter in MV – Temperaturen bis 23 Grad,Hier finden Sie Informationen zu dem Thema „Deutscher Wetterdienst“. Lesen Sie jetzt „Vereinzelte Gewitter in MV – Temperaturen bis 23 Grad“.,https://img.zeit.de/news/2024-08/04/vereinzelte-gewitter-in-mv-temperaturen-bis-23-grad-image-group/wide__1300x731,2024-08-04T09:57:45Z,,"Der Deutsche Wetterdienst (DWD) hat Wolken, Schauer und vereinzelte Gewitter für Mecklenburg-Vorpommern vorausgesagt. «Lokal kann es auch kräftig ausfallen, die Schauer und Gewitter ziehen aber zum N… [+407 chars]",,de,'Temperaturen'
https://wien.orf.at/stories/3267771/,https://wien.orf.at/stories/3267771/,0,wien.orf.at,Kälte vom Donaukanal ins Parlament,Das Wasser der Donau ist für viele Wienerinnen und Wiener eine willkommene Abkühlung in der Hitze. Auch ohne direkten Kontakt: Denn das Fernkältesystem speist sich unter anderem aus Donaukanalwasser und kühlt unter anderem das Parlament.,https://ibs.orf.at/wie?image=https%3A%2F%2Foekastatic.orf.at%2Fmims%2F2024%2F32%2F67%2Fcrops%2Fw%3D1200%2Ch%3D627%2Cq%3D75%2F2304828_master_877367_k3.jpg%3Fs%3D3f3218bb21edf4bfb10fe30cdcde6f8214e932e6,2024-08-04T19:19:42Z,,Moderne Technik hinter alten Mauern unter diesem Motto wurde das im 19. Jahrhundert erbaute Parlamentsgebäude in Wien im Zuge der mehrjährigen Sanierung an den Fernkältering der Wien Energie angeschl… [+2891 chars],,de,'Hitze'
https://www.welt.de/wissenschaft/article252838890/Hitze-Warum-deutsche-Staedte-so-schlecht-vor-Hitze-geschuetzt-sind.html,https://www.welt.de/wissenschaft/article252838890/Hitze-Warum-deutsche-Staedte-so-schlecht-vor-Hitze-geschuetzt-sind.html,0,www.welt.de,Warum deutsche Städte so schlecht vor Hitze geschützt sind,"Im Sommer geraten besonders die Bewohner dicht bebauter Gebiete ins Schwitzen. Mehr Schatten, Wasser und Grün könnten helfen, doch noch immer sind viele Kommunen nicht gegen die Wärme gewappnet. Das liegt auch am Geld- und Personalmangel – aber anders, als ma…",https://img.welt.de/img/wissenschaft/mobile252838878/1191355167-ci16x9-w1200/Berlin-Skyline-at-Sunset-with-Fernsehturm.jpg,2024-08-04T20:06:49Z,,"Auf einer Straße in Berlin-Friedrichshain stehen zehn Ahorn- und Lindenbäumchen tapfer Spalier. Das Bezirksamt hat die Kübel vor vier Jahren aufstellen lassen. Weil sich der dicht bebaute, zugepflast… [+8659 chars]",,de,'Hitze'
https://www.zeit.de/news/2024-08/05/hitze-macht-jedem-vierten-zu-schaffen,https://www.zeit.de/news/2024-08/05/hitze-macht-jedem-vierten-zu-schaffen,0,www.zeit.de,Wetter: Hitze macht jedem Vierten zu schaffen,Hier finden Sie Informationen zu dem Thema „Wetter“. Lesen Sie jetzt „Hitze macht jedem Vierten zu schaffen“.,https://img.zeit.de/news/2024-08/05/hitze-macht-jedem-vierten-zu-schaffen-image-group/wide__1300x731,2024-08-05T03:20:36Z,,"Rund jede und jeder Vierte in Deutschland hat in diesem Jahr bereits Gesundheitsprobleme durch extreme Hitze gehabt. Dazu können laut der Krankenkasse DAK-Gesundheit, die eine entsprechende Forsa-Stu… [+3179 chars]",,de,'Hitze'
https://www.stern.de/panorama/wetter--hitze-macht-jedem-vierten-zu-schaffen-34949554.html,https://www.stern.de/panorama/wetter--hitze-macht-jedem-vierten-zu-schaffen-34949554.html,0,www.stern.de,Wetter: Hitze macht jedem Vierten zu schaffen,"Abgeschlagenheit, Kreislaufprobleme, Schlafstörungen: Steigen die Temperaturen, sinkt bei vielen Menschen in Deutschland die Energie und wirkt sich das auf das Wohlbefinden aus.",https://image.stern.de/34949556/t/gP/v1/w1440/r1.7778/-/05--rxhinkhc27v27axw800h600jpeg---7f2296b8bf4651bb.jpg,2024-08-05T03:20:36Z,,"Abgeschlagenheit, Kreislaufprobleme, Schlafstörungen: Steigen die Temperaturen, sinkt bei vielen Menschen in Deutschland die Energie und wirkt sich das auf das Wohlbefinden aus.
Rund jede und jeder … [+2645 chars]",,de,'Hitze'
https://www.tagesspiegel.de/gesellschaft/panorama/wetter-hitze-macht-jedem-vierten-zu-schaffen-12143702.html,https://www.tagesspiegel.de/gesellschaft/panorama/wetter-hitze-macht-jedem-vierten-zu-schaffen-12143702.html,0,www.tagesspiegel.de,Wetter: Hitze macht jedem Vierten zu schaffen,"Abgeschlagenheit, Kreislaufprobleme, Schlafstörungen: Steigen die Temperaturen, sinkt bei vielen Menschen in Deutschland die Energie und wirkt sich das auf das Wohlbefinden aus.",https://www.tagesspiegel.de/images/12143699/alternates/BASE_16_9_W1400/1722828185000/ein-ventilator-steht-in-einem-buro.jpeg,2024-08-05T03:23:05Z,,"Rund jede und jeder Vierte in Deutschland hat in diesem Jahr bereits Gesundheitsprobleme durch extreme Hitze gehabt. Dazu können laut der Krankenkasse DAK-Gesundheit, die eine entsprechende Forsa-Stu… [+2553 chars]",,de,'Hitze'
https://www.zeit.de/news/2024-08/05/nrw-staedte-gegen-hitze-aktionsplaene-und-andere-massnahmen,https://www.zeit.de/news/2024-08/05/nrw-staedte-gegen-hitze-aktionsplaene-und-andere-massnahmen,0,www.zeit.de,Heiße Sommer: NRW-Städte gegen Hitze - Aktionspläne und andere Maßnahmen,Hier finden Sie Informationen zu dem Thema „Heiße Sommer“. Lesen Sie jetzt „NRW-Städte gegen Hitze - Aktionspläne und andere Maßnahmen“.,https://img.zeit.de/news/2024-08/05/nrw-staedte-gegen-hitze-aktionsplaene-und-andere-massnahmen-image-group/wide__1300x731,2024-08-05T03:30:36Z,,"In Nordrhein-Westfalen setzen laut Gesundheitsministerium bisher nur zwei Kommunen einen Hitzeaktionsplan um. Entsprechende Pläne befänden sich derzeit in Köln und im Kreis Kleve in der Umsetzung, hi… [+6103 chars]",,de,'Hitze'
https://www.stern.de/gesellschaft/regional/nordrhein-westfalen/heisse-sommer--nrw-staedte-gegen-hitze---aktionsplaene-und-andere-massnahmen-34949562.html,https://www.stern.de/gesellschaft/regional/nordrhein-westfalen/heisse-sommer--nrw-staedte-gegen-hitze---aktionsplaene-und-andere-massnahmen-34949562.html,0,www.stern.de,Heiße Sommer: NRW-Städte gegen Hitze - Aktionspläne und andere Maßnahmen,"Der Hitzeschutz rückt auch in NRW in den Fokus. Während bisher nur wenige Städte Hitzeaktionspläne umsetzen, wird vielerorts noch daran gearbeitet - und auf andere Maßnahmen zurückgegriffen.",https://image.stern.de/34949564/t/d1/v1/w1440/r1.7778/-/05--xqun5rdj2qv6axw800h600jpeg---3a09d6a66100f543.jpg,2024-08-05T03:30:36Z,,"Der Hitzeschutz rückt auch in NRW in den Fokus. Während bisher nur wenige Städte Hitzeaktionspläne umsetzen, wird vielerorts noch daran gearbeitet - und auf andere Maßnahmen zurückgegriffen.
In Nord… [+5159 chars]",,de,'Hitze'
https://www.zeit.de/news/2024-08/05/erst-sonne-dann-regen-wetter-bleibt-wechselhaft-in-nrw,https://www.zeit.de/news/2024-08/05/erst-sonne-dann-regen-wetter-bleibt-wechselhaft-in-nrw,0,www.zeit.de,"Sommer: Erst Sonne, dann Regen - Wetter bleibt wechselhaft in NRW","Hier finden Sie Informationen zu dem Thema „Sommer“. Lesen Sie jetzt „Erst Sonne, dann Regen - Wetter bleibt wechselhaft in NRW“.",https://img.zeit.de/news/2024-08/05/erst-sonne-dann-regen-wetter-bleibt-wechselhaft-in-nrw-image-group/wide__1300x731,2024-08-05T05:34:51Z,,"Zum Wochenstart können sich die Menschen in Nordrhein-Westfalen auf Sonne freuen. Wie der Deutsche Wetterdienst (DWD) mitteilte, werden Höchsttemperaturen um die 30 Grad erwartet. Am Mittwoch soll es… [+593 chars]",,de,'Sonne'
https://www.zeit.de/news/2024-08/05/neue-woche-meist-sonnig-temperaturen-um-die-30-grad,https://www.zeit.de/news/2024-08/05/neue-woche-meist-sonnig-temperaturen-um-die-30-grad,0,www.zeit.de,Sommerwetter: Neue Woche meist sonnig - Temperaturen um die 30 Grad,Hier finden Sie Informationen zu dem Thema „Sommerwetter“. Lesen Sie jetzt „Neue Woche meist sonnig - Temperaturen um die 30 Grad“.,https://img.zeit.de/news/2024-08/05/neue-woche-meist-sonnig-temperaturen-um-die-30-grad-image-group/wide__1300x731,2024-08-05T06:03:22Z,,Die Menschen in Hessen können sich zum Wochenbeginn auf sonniges Wetter freuen. Der Deutsche Wetterdienst (DWD) kündigt auch Höchsttemperaturen von etwa 30 Grad an. Aber am Mittwoch ist Regen vorherg… [+612 chars],,de,'Temperaturen'
https://www.zeit.de/news/2024-08/05/sonne-satt-und-milde-temperaturen-zum-wochenstart,https://www.zeit.de/news/2024-08/05/sonne-satt-und-milde-temperaturen-zum-wochenstart,0,www.zeit.de,Wetter: Sonne satt und milde Temperaturen zum Wochenstart,Hier finden Sie Informationen zu dem Thema „Wetter“. Lesen Sie jetzt „Sonne satt und milde Temperaturen zum Wochenstart“.,https://img.zeit.de/news/2024-08/05/sonne-satt-und-milde-temperaturen-zum-wochenstart-image-group/wide__1300x731,2024-08-05T06:26:32Z,,Die Woche beginnt mild und freundlich in Berlin und Brandenburg. Die Temperaturen erreichen heute nach den Vorhersagen des Deutschen Wetterdienstes 22 bis 24 Grad Celsius. Über den Tag bleibt es heit… [+548 chars],,de,'Sonne'
https://www.zeit.de/news/2024-08/05/sonne-setzt-sich-durch-aber-am-mittwoch-regen,https://www.zeit.de/news/2024-08/05/sonne-setzt-sich-durch-aber-am-mittwoch-regen,0,www.zeit.de,Sommerwetter: Sonne setzt sich durch - aber am Mittwoch Regen,Hier finden Sie Informationen zu dem Thema „Sommerwetter“. Lesen Sie jetzt „Sonne setzt sich durch - aber am Mittwoch Regen“.,https://img.zeit.de/news/2024-08/05/sonne-setzt-sich-durch-aber-am-mittwoch-regen-image-group/wide__1300x731,2024-08-05T06:31:56Z,,Mainz (dpa/lrs) - Die Menschen in Rheinland-Pfalz und im Saarland können sich zu Beginn der Woche auf sonniges Wetter freuen. Der Deutsche Wetterdienst (DWD) prognostiziert Höchsttemperaturen von etw… [+746 chars],,de,'Regen'
