index,url,valid,domain,title,description,image,published,archive,content,quote,language,keyword
https://www.faz.net/aktuell/feuilleton/buehne-und-konzert/karol-szymanowskis-oper-koenig-roger-in-dessau-19568027.html,https://www.faz.net/aktuell/feuilleton/buehne-und-konzert/karol-szymanowskis-oper-koenig-roger-in-dessau-19568027.html,0,www.faz.net,Karol Szymanowskis Oper „König Roger“ in Dessau,"Karol Szymanowski feiert in seiner Oper „König Roger“ Natur-Lust und All-Liebe. Dass man davon mitgerissen wird, verdankt sich am Anhaltischen Theater Dessau vor allem der Dirigentin Elisa Gogou.",https://media0.faz.net/ppmedia/aktuell/2617554060/1.9568024/facebook_teaser/koenig-roger-kay-stiefermann.jpg,2024-03-09T19:25:19Z,https://web.archive.org/web/20240309194920/https://www.faz.net/aktuell/feuilleton/buehne-und-konzert/karol-szymanowskis-oper-koenig-roger-in-dessau-19568027.html,"Regiearbeit kann sich gegen ein Stück stellen, das sie eigentlich vermitteln sollte. Wenn man dergleichen heutzutage nicht selten erlebt, bleibt oft nur die Wahl zwischen Sarkasmus und Angeödetsein. … [+5000 chars]",,de,'Natur'
https://www.basicthinking.de/blog/2024/03/09/haesslichsten-staedte-der-welt/,https://www.basicthinking.de/blog/2024/03/09/haesslichsten-staedte-der-welt/,0,www.basicthinking.de,Alles außer schön: Das sind die 10 hässlichsten Städte der Welt,"Ob Venedig, Kyōto oder Rio de Janeiro: Viele Städte sind für ihre Schönheit bekannt und locken jedes Jahr unzählige Touristen an. Andere Orte haben jedoch weder eine interessante Architektur noch besonders viel Natur zu bieten. In unserem wöchentlichen Rankin…",https://www.basicthinking.de/blog/wp-content/uploads/2024/03/00_hasslichsten-stadte-.jpeg,2024-03-09T20:15:12Z,,"Ob Venedig, Kyto oder Rio de Janeiro: Viele Städte sind für ihre Schönheit bekannt und locken jedes Jahr unzählige Touristen an. Andere Orte haben jedoch weder eine interessante Architektur noch beso… [+1483 chars]",,de,'Natur'
https://www.zeit.de/news/2024-03/10/warum-milde-temperaturen-der-apfelernte-schaden-koennten,https://www.zeit.de/news/2024-03/10/warum-milde-temperaturen-der-apfelernte-schaden-koennten,0,www.zeit.de,Lebensmittel: Warum milde Temperaturen der Apfelernte schaden könnten,Hier finden Sie Informationen zu dem Thema „Lebensmittel“. Lesen Sie jetzt „Warum milde Temperaturen der Apfelernte schaden könnten“.,https://img.zeit.de/news/2024-03/10/warum-milde-temperaturen-der-apfelernte-schaden-koennten-image-group/wide__1300x731,2024-03-10T07:15:09Z,,"Die milden Temperaturen der vergangenen Wochen könnten sich einem Experten zufolge negativ auf die Apfelernte am Bodensee auswirken. Die Obstbäume würden zu früh erwachen, der noch zu erwartende Fros… [+3124 chars]",,de,'Temperaturen'
https://www.stern.de/gesellschaft/regional/bayern/mentale-gesundheit--psychische-fehltage-in-bayern-auf-rekordstand-34531746.html,https://www.stern.de/gesellschaft/regional/bayern/mentale-gesundheit--psychische-fehltage-in-bayern-auf-rekordstand-34531746.html,0,www.stern.de,Mentale Gesundheit: Psychische Fehltage in Bayern auf Rekordstand,Seit Jahren fallen Bayerns Erwerbstätige immer öfter aufgrund psychischer Probleme auf der Arbeit aus. Auch 2023 gab es Rekordwerte. Diesmal könnte zum Teil auch die Bürokratie Grund dafür sein.,https://image.stern.de/34531748/t/sU/v1/w1440/r1.7778/-/10--urnnewsmldpacom2009010124031099284565v3w800h600l77t290r1982b1626jpeg---bf447a4340e6f365.jpg,2024-03-10T07:46:45Z,,"Seit Jahren fallen Bayerns Erwerbstätige immer öfter aufgrund psychischer Probleme auf der Arbeit aus. Auch 2023 gab es Rekordwerte. Diesmal könnte zum Teil auch die Bürokratie Grund dafür sein.
In … [+2407 chars]",,de,'Rekordwerte'
https://www.zeit.de/news/2024-03/10/sonntag-bringt-milde-temperaturen-und-sonnenschein,https://www.zeit.de/news/2024-03/10/sonntag-bringt-milde-temperaturen-und-sonnenschein,0,www.zeit.de,Wetter: Sonntag bringt milde Temperaturen und Sonnenschein,Hier finden Sie Informationen zu dem Thema „Wetter“. Lesen Sie jetzt „Sonntag bringt milde Temperaturen und Sonnenschein“.,https://img.zeit.de/news/2024-03/10/sonntag-bringt-milde-temperaturen-und-sonnenschein-image-group/wide__1300x731,2024-03-10T09:15:10Z,,"Milde Temperaturen und Sonnenschein gibt es am Sonntag in Berlin und Brandenburg. Vor allem am Vormittag wird es heiter und trocken, wie der Deutsche Wetterdienst am Sonntagmorgen mitteilte. Später z… [+946 chars]",,de,'Regen'
https://www.zeit.de/news/2024-03/10/mischung-aus-sonne-und-wolken-am-sonntag-in-sachsen-anhalt,https://www.zeit.de/news/2024-03/10/mischung-aus-sonne-und-wolken-am-sonntag-in-sachsen-anhalt,0,www.zeit.de,Wetter: Mischung aus Sonne und Wolken am Sonntag in Sachsen-Anhalt,Hier finden Sie Informationen zu dem Thema „Wetter“. Lesen Sie jetzt „Mischung aus Sonne und Wolken am Sonntag in Sachsen-Anhalt“.,https://img.zeit.de/news/2024-03/10/mischung-aus-sonne-und-wolken-am-sonntag-in-sachsen-anhalt-image-group/wide__1300x731,2024-03-10T09:20:48Z,,"Milde Temperaturen und Sonnenschein erwarten die Menschen in Sachsen-Anhalt am Sonntag. Regen fällt nicht, wie der Deutsche Wetterdienst am Morgen mitteilte. Bei 13 bis 15 Grad, im Harz 9 bis 12 Grad… [+604 chars]",,de,'Sonne'
https://www.bild.de/regional/sachsen-anhalt/sachsen-anhalt-news/teilnehmerrekord-beim-rennen-ohne-schnee-350-schlittenhunde-und-kein-einziger-sc-87461776.bild.html,https://www.bild.de/regional/sachsen-anhalt/sachsen-anhalt-news/teilnehmerrekord-beim-rennen-ohne-schnee-350-schlittenhunde-und-kein-einziger-sc-87461776.bild.html,0,www.bild.de,Rennen ohne Schnee - 350 Schlittenhunde und kein einziger Schlitten,"Apenburg (Sachsen-Anhalt) – So viele Gespanne waren noch nie am Start, so wenig Schnee leider auch selten.  Beim Schlittenhunderennen in Apenburg (Altmar...","https://images.bild.de/65ed77d9e6799d1f798b3306/e600c8ddd74b939e84da7a1b2e866de3,50b9f39e?w=1280",2024-03-10T09:29:41Z,,"Apenburg (Sachsen-Anhalt) So viele Gespanne waren noch nie am Start, so wenig Schnee leider auch selten. 
Beim Schlittenhunderennen in Apenburg (Altmarkkreis Salzwedel) zogen am Wochenende etwa 350 … [+547 chars]",,de,'Schnee'
https://www.zeit.de/news/2024-03/10/wetter-im-nrw-zum-wochenstart-wieder-grau-und-mit-viel-regen,https://www.zeit.de/news/2024-03/10/wetter-im-nrw-zum-wochenstart-wieder-grau-und-mit-viel-regen,0,www.zeit.de,Freizeit: Wetter im NRW zum Wochenstart wieder grau und mit viel Regen,Hier finden Sie Informationen zu dem Thema „Freizeit“. Lesen Sie jetzt „Wetter im NRW zum Wochenstart wieder grau und mit viel Regen“.,https://img.zeit.de/news/2024-03/10/wetter-im-nrw-zum-wochenstart-wieder-grau-und-mit-viel-regen-image-group/wide__1300x731,2024-03-10T12:06:27Z,,In der neuen Woche verabschiedet sich das schöne Frühlingswetter und macht neuem Regen Platz. Viele Wolken und viele Schauer ziehen bis Mittwoch über das Land. In den Höhenlagen können zwischen 30 un… [+432 chars],,de,'Regen'
https://www.zeit.de/news/2024-03/10/wochenstart-in-hessen-mit-regenschauern-und-wolken,https://www.zeit.de/news/2024-03/10/wochenstart-in-hessen-mit-regenschauern-und-wolken,0,www.zeit.de,Wetter: Wochenstart in Hessen mit Regenschauern und Wolken,Hier finden Sie Informationen zu dem Thema „Wetter“. Lesen Sie jetzt „Wochenstart in Hessen mit Regenschauern und Wolken“.,https://img.zeit.de/news/2024-03/10/wochenstart-in-hessen-mit-regenschauern-und-wolken-image-group/wide__1300x731,2024-03-10T12:20:44Z,,"Nach einem eher heiteren Wochenende wird es in Hessen wieder trüber. Tief «Elfi» zieht über das Bundesland. Wie der Deutsche Wetterdienst (DWD) in Offenbach am Sonntag mitteilte, regnet es am Montag … [+404 chars]",,de,'Regen'
https://www.zeit.de/news/2024-03/10/regen-in-anmarsch-naechstes-hoch-in-sicht,https://www.zeit.de/news/2024-03/10/regen-in-anmarsch-naechstes-hoch-in-sicht,0,www.zeit.de,"Wetter: Regen in Anmarsch, nächstes Hoch in Sicht","Hier finden Sie Informationen zu dem Thema „Wetter“. Lesen Sie jetzt „Regen in Anmarsch, nächstes Hoch in Sicht“.",https://img.zeit.de/news/2024-03/10/regen-in-anmarsch-naechstes-hoch-in-sicht-image-group/wide__1300x731,2024-03-10T12:45:22Z,,Auf das frühlingshafte Wochenende mit recht viel Sonne folgen in den nächsten Tagen wieder Wolken und Regen. «Zum Wochenstart am Montag und Dienstag schwingt dann Tief 'Elfi' den Löffel in der Wetter… [+1018 chars],,de,'Regen'
https://www.zeit.de/news/2024-03/10/neue-woche-bringt-wolken-und-regen-nach-bayern,https://www.zeit.de/news/2024-03/10/neue-woche-bringt-wolken-und-regen-nach-bayern,0,www.zeit.de,Wetter: Neue Woche bringt Wolken und Regen nach Bayern,Hier finden Sie Informationen zu dem Thema „Wetter“. Lesen Sie jetzt „Neue Woche bringt Wolken und Regen nach Bayern“.,https://img.zeit.de/news/2024-03/10/neue-woche-bringt-wolken-und-regen-nach-bayern-image-group/wide__1300x731,2024-03-10T14:55:19Z,,"Ein bewölkter Himmel und gebietsweise Regen werden bis Mittwoch in Bayern erwartet. Zugleich seien frühlingshafte Temperaturen von bis zu 16 Grad möglich, sagte der Deutsche Wetterdienst (DWD) bis Mi… [+854 chars]",,de,'Regen'
https://www.sueddeutsche.de/politik/eu-klimakrise-bericht-1.6441454,https://www.sueddeutsche.de/politik/eu-klimakrise-bericht-1.6441454,0,www.sueddeutsche.de,EU-Bericht: Europa bereitet sich zu unzureichend auf Klimakrise vor,"Überschwemmungen, Hitze, Brände - die Folgen der Klimaerwärmung sind in Europa deutlich zu spüren. Es besteht also seitens der EU dringend Handlungsbedarf. Doch Fachleuten sagen: Es wird viel zu wenig getan.",https://www.sueddeutsche.de/image/sz.1.6441455/1200x675?v=1710113899,2024-03-10T23:38:46Z,,Europa bereitet sich einer EU-Behörde zufolge unzureichend auf die Auswirkungen der zunehmenden Klimaerwärmung vor. Die europäischen Strategien und Anpassungsmaßnahmen hielten nicht mit den sich rasa… [+4049 chars],,de,'Hitze'
https://www.sueddeutsche.de/wissen/eu-klimakrise-folgen-hitze-duerre-1.6440259,https://www.sueddeutsche.de/wissen/eu-klimakrise-folgen-hitze-duerre-1.6440259,0,www.sueddeutsche.de,Klima: EU-Umweltagentur warnt vor katastrophalen Klimawandel-Folgen,"Die Staaten Europas sind zu schlecht auf Hitze, Dürren und Überschwemmungen vorbereitet, warnen Klimaexperten. Ihr Appell an die Politik: jetzt bloß nicht nachlassen - im Gegenteil.",https://www.sueddeutsche.de/image/sz.1.6207137/1200x675?v=1710116802,2024-03-11T00:26:45Z,,"Eine kurze Rundreise in Europa reicht schon, um die kommenden Katastrophen zu erahnen. Vom Ahrtal aus, wo die Bauarbeiten noch lange nicht abgeschlossen sind und die Angst vor der nächsten Flut groß … [+5205 chars]",,de,'Hitze'
https://www.zeit.de/news/2024-03/11/truebes-regenwetter-zum-wochenstart-in-hessen,https://www.zeit.de/news/2024-03/11/truebes-regenwetter-zum-wochenstart-in-hessen,0,www.zeit.de,Deutscher Wetterdienst: Trübes Regenwetter zum Wochenstart in Hessen,Hier finden Sie Informationen zu dem Thema „Deutscher Wetterdienst“. Lesen Sie jetzt „Trübes Regenwetter zum Wochenstart in Hessen“.,https://img.zeit.de/news/2024-03/11/truebes-regenwetter-zum-wochenstart-in-hessen-image-group/wide__1300x731,2024-03-11T08:04:54Z,,"Grau und häufig nass wird das Wetter in Hessen in der neuen Woche. Wie der Deutsche Wetterdienst (DWD) mitteilte, beginnt der Montag stark bewölkt bis bedeckt und es regnet häufig. Im Verlauf des Tag… [+959 chars]",,de,'Regen'
https://www.tagesschau.de/wissen/klima/klimaerwaermung-europa-100.html,https://www.tagesschau.de/wissen/klima/klimaerwaermung-europa-100.html,0,www.tagesschau.de,"Klima-Bericht: Europa zu wenig auf ""katastrophale"" Folgen vorbereitet","Wie gut ist Europa auf die Folgen der Klimakrise vorbereitet? In einem Bericht kommen Experten der EU zu einem alarmierenden Ergebnis: Allein durch Hitzewellen könnten Hunderttausende Menschen sterben, wenn die Politik nicht sofort handelt.",https://images.tagesschau.de/image/3b372b09-5d0d-43d7-8755-65c8cdbf055a/AAABjixv7b8/AAABjcWen7M/16x9-1280/duerre-stausee-spanien-100.jpg,2024-03-11T08:26:10Z,https://web.archive.org/web/20240311083940/https://www.tagesschau.de/wissen/klima/klimaerwaermung-europa-100.html,"Stand: 11.03.2024 09:26 Uhr
Wie gut ist Europa auf die Folgen der Klimakrise vorbereitet? In einem Bericht kommen Experten der EU zu einem alarmierenden Ergebnis: Allein durch Hitzewellen könnten Hu… [+3928 chars]",,de,'Hitze'
https://www.zeit.de/news/2024-03/12/sonne-wolken-und-einzelne-schauer-in-thueringen,https://www.zeit.de/news/2024-03/12/sonne-wolken-und-einzelne-schauer-in-thueringen,0,www.zeit.de,"Wetter: Sonne, Wolken und einzelne Schauer in Thüringen","Hier finden Sie Informationen zu dem Thema „Wetter“. Lesen Sie jetzt „Sonne, Wolken und einzelne Schauer in Thüringen“.",https://img.zeit.de/news/2024-03/12/sonne-wolken-und-einzelne-schauer-in-thueringen-image-group/wide__1300x731,2024-03-12T05:13:52Z,,"Sonne und Wolken wechseln sich am Dienstag in Thüringen ab - später wird es feucht. Tagsüber ist es bewölkt, aber gelegentlich zeigt sich die Sonne, wie der Deutsche Wetterdienst am Dienstag mitteilt… [+1298 chars]",,de,'Regen'
https://www.zeit.de/news/2024-03/12/sonne-wolken-mix-am-dienstag-in-sachsen,https://www.zeit.de/news/2024-03/12/sonne-wolken-mix-am-dienstag-in-sachsen,0,www.zeit.de,Wetter: Sonne-Wolken-Mix am Dienstag in Sachsen,Hier finden Sie Informationen zu dem Thema „Wetter“. Lesen Sie jetzt „Sonne-Wolken-Mix am Dienstag in Sachsen“.,https://img.zeit.de/news/2024-03/12/sonne-wolken-mix-am-dienstag-in-sachsen-image-group/wide__1300x731,2024-03-12T05:46:02Z,,"Sonne und Wolken wechseln sich am Dienstag in Sachsen ab. Tagsüber ist es bewölkt, gelegentlich zeigt sich die Sonne, wie der Deutsche Wetterdienst am Dienstag mitteilte. Nachmittags und abends könnt… [+1259 chars]",,de,'Temperaturen'
https://www.zeit.de/news/2024-03/12/sonne-wolken-und-milde-temperaturen-in-sachsen-anhalt,https://www.zeit.de/news/2024-03/12/sonne-wolken-und-milde-temperaturen-in-sachsen-anhalt,0,www.zeit.de,"Wetter: Sonne, Wolken und milde Temperaturen in Sachsen-Anhalt","Hier finden Sie Informationen zu dem Thema „Wetter“. Lesen Sie jetzt „Sonne, Wolken und milde Temperaturen in Sachsen-Anhalt“.",https://img.zeit.de/news/2024-03/12/sonne-wolken-und-milde-temperaturen-in-sachsen-anhalt-image-group/wide__1300x731,2024-03-12T05:47:13Z,,"Milde Temperaturen und eine Mischung aus Sonne und Wolken bestimmen am Dienstag das Wetter in Sachsen-Anhalt. Tagsüber ist es bewölkt, aber gelegentlich zeigt sich die Sonne, wie der Deutsche Wetterd… [+1312 chars]",,de,'Regen'
https://www.zeit.de/news/2024-03/12/nebel-und-milde-temperaturen-am-dienstag-in-niedersachsen,https://www.zeit.de/news/2024-03/12/nebel-und-milde-temperaturen-am-dienstag-in-niedersachsen,0,www.zeit.de,Wetter: Nebel und milde Temperaturen am Dienstag in Niedersachsen,Hier finden Sie Informationen zu dem Thema „Wetter“. Lesen Sie jetzt „Nebel und milde Temperaturen am Dienstag in Niedersachsen“.,https://img.zeit.de/news/2024-03/12/nebel-und-milde-temperaturen-am-dienstag-in-niedersachsen-image-group/wide__1300x731,2024-03-12T06:11:27Z,,Nebel hängt am Dienstagmorgen vereinzelt über Niedersachsen und Bremen. Im Norden rechnet der Deutsche Wetterdienst teilweise mit Sichtweiten unter 150 Metern. Im Verlauf des Tages bleibe es stark be… [+403 chars],,de,'Temperaturen'
https://www.stern.de/gesellschaft/regional/nordrhein-westfalen/wetter--wechselhaftes-wetter-und-milde-temperaturen-in-nrw-34536914.html,https://www.stern.de/gesellschaft/regional/nordrhein-westfalen/wetter--wechselhaftes-wetter-und-milde-temperaturen-in-nrw-34536914.html,0,www.stern.de,Wetter: Wechselhaftes Wetter und milde Temperaturen in NRW,Mit einem Mix aus Regen und Auflockerungen müssen die Menschen in Nordrhein-Westfalen für den Rest der Woche rechnen. Zum Wochenende hin wird es sehr mild.,https://image.stern.de/34536916/t/8B/v1/w1440/r1.7778/-/12--urnnewsmldpacom2009010124031299307894v3w800h600l640t425r1920b1278jpeg---1c8edb7a88c0a8e4.jpg,2024-03-12T07:26:53Z,,"Mit einem Mix aus Regen und Auflockerungen müssen die Menschen in Nordrhein-Westfalen für den Rest der Woche rechnen. Zum Wochenende hin wird es sehr mild.
Überwiegend trübes Wetter mit ein paar Auf… [+1242 chars]",,de,'Temperaturen'
https://www.zeit.de/news/2024-03/12/mix-aus-regen-und-auflockerungen,https://www.zeit.de/news/2024-03/12/mix-aus-regen-und-auflockerungen,0,www.zeit.de,Wetter: Mix aus Regen und Auflockerungen,Hier finden Sie Informationen zu dem Thema „Wetter“. Lesen Sie jetzt „Mix aus Regen und Auflockerungen“.,https://img.zeit.de/news/2024-03/12/mix-aus-regen-und-auflockerungen-image-group/wide__1300x731,2024-03-12T07:47:10Z,,"Auf eine wechselhafte Mischung aus Wolken, Regen und Auflockerungen müssen sich die Menschen in Rheinland-Pfalz und im Saarland einstellen. Stark bewölkt bis bedeckt und oft mit leichtem Regen beginn… [+963 chars]",,de,'Regen'
https://www.stern.de/gesellschaft/regional/rheinland-pfalz-saarland/wetter--mix-aus-regen-und-auflockerungen-34536954.html,https://www.stern.de/gesellschaft/regional/rheinland-pfalz-saarland/wetter--mix-aus-regen-und-auflockerungen-34536954.html,0,www.stern.de,Wetter: Mix aus Regen und Auflockerungen,"Offenbach (lrs) - Auf eine wechselhafte Mischung aus Wolken, Regen und Auflockerungen müssen sich die Menschen in Rheinland-Pfalz und im Saarland",https://image.stern.de/34536956/t/1M/v1/w1440/r1.7778/-/12--urnnewsmldpacom2009010124031299308090v3w800h600l638t425r1918b1279jpeg---0748194547e0deeb.jpg,2024-03-12T07:47:10Z,,"Das Wetter zeigt sich um die Wochenmitte herum wechselhaft. Besonders milde Temperaturen gibt es in Richtung Wochenende.
Auf eine wechselhafte Mischung aus Wolken, Regen und Auflockerungen müssen si… [+1052 chars]",,de,'Regen'
https://www.stern.de/gesellschaft/regional/bayern/wetter--ueberwiegend-bewoelkte-woche-in-bayern-erwartet-34536976.html,https://www.stern.de/gesellschaft/regional/bayern/wetter--ueberwiegend-bewoelkte-woche-in-bayern-erwartet-34536976.html,0,www.stern.de,Wetter: Überwiegend bewölkte Woche in Bayern erwartet,Eine überwiegend bewölkte Woche wird in Bayern erwartet. Gebietsweise kann es laut Deutschem Wetterdienst (DWD) auch regnen. Die Temperaturen bleiben weiterhin mild.,https://image.stern.de/34536978/t/30/v1/w1440/r1.7778/-/12--urnnewsmldpacom2009010124031299308190v3w800h600l640t420r1920b1262jpeg---1848eebc4f670321.jpg,2024-03-12T07:55:42Z,,"Eine überwiegend bewölkte Woche wird in Bayern erwartet. Gebietsweise kann es laut Deutschem Wetterdienst (DWD) auch regnen. Die Temperaturen bleiben weiterhin mild.
Eine überwiegend bewölkte Woche … [+787 chars]",,de,'Regen'
https://www.stern.de/gesellschaft/regional/hessen/hessen--wechselhaftes-wetter-und-milde-temperaturen-erwartet-34537038.html,https://www.stern.de/gesellschaft/regional/hessen/hessen--wechselhaftes-wetter-und-milde-temperaturen-erwartet-34537038.html,0,www.stern.de,Hessen: Wechselhaftes Wetter und milde Temperaturen erwartet,"Offenbach (lhe) - Wechselhaftes Wetter begleitet die Menschen in Hessen durch die Woche. Wie der Deutsche Wetterdienst (DWD) in Offenbach mitteilte,",https://image.stern.de/34537040/t/Yt/v1/w1440/r1.7778/-/12--urnnewsmldpacom2009010124031299308381v3w800h600l640t425r1920b1278jpeg---d79e514ae243af18.jpg,2024-03-12T08:16:16Z,,"Mit Wolken, Regen und ein paar Auflockerungen ist das Wetter in Hessen wechselhaft. Sehr milde Temperaturen gibt es zum Wochenende hin.
Wechselhaftes Wetter begleitet die Menschen in Hessen durch di… [+940 chars]",,de,'Temperaturen'
https://www.zeit.de/news/2024-03/12/wechselhaftes-wetter-und-milde-temperaturen-erwartet,https://www.zeit.de/news/2024-03/12/wechselhaftes-wetter-und-milde-temperaturen-erwartet,0,www.zeit.de,Hessen: Wechselhaftes Wetter und milde Temperaturen erwartet,Hier finden Sie Informationen zu dem Thema „Hessen“. Lesen Sie jetzt „Wechselhaftes Wetter und milde Temperaturen erwartet“.,https://img.zeit.de/news/2024-03/12/wechselhaftes-wetter-und-milde-temperaturen-erwartet-image-group/wide__1300x731,2024-03-12T08:16:16Z,,"Wechselhaftes Wetter begleitet die Menschen in Hessen durch die Woche. Wie der Deutsche Wetterdienst (DWD) in Offenbach mitteilte, bringt der Dienstag zunächst einen grauen Himmel und oft leichten Re… [+778 chars]",,de,'Temperaturen'
https://www.stern.de/gesellschaft/regional/rheinland-pfalz-saarland/wetter--mildes-wetter-in-rheinland-pfalz-und-im-saarland-erwartet-34540482.html,https://www.stern.de/gesellschaft/regional/rheinland-pfalz-saarland/wetter--mildes-wetter-in-rheinland-pfalz-und-im-saarland-erwartet-34540482.html,0,www.stern.de,Wetter: Mildes Wetter in Rheinland-Pfalz und im Saarland erwartet,In den kommenden Tagen erwartet der Deutsche Wetterdienst frühlingshaftes Wetter und sehr milde Temperaturen. Zum Wochenende hin sind aber auch Schauer und örtliche Gewitter möglich.,https://image.stern.de/34540484/t/JA/v1/w1440/r1.7778/-/13--urnnewsmldpacom2009010124031399320624v3w800h600l639t431r1917b1294jpeg---04d8ebf488f82c72.jpg,2024-03-13T07:23:50Z,,"In den kommenden Tagen erwartet der Deutsche Wetterdienst frühlingshaftes Wetter und sehr milde Temperaturen. Zum Wochenende hin sind aber auch Schauer und örtliche Gewitter möglich.
In den kommende… [+688 chars]",,de,'Regen'
https://www.sueddeutsche.de/sport/saarbruecken-gladbach-dfb-pokal-1.6449163,https://www.sueddeutsche.de/sport/saarbruecken-gladbach-dfb-pokal-1.6449163,0,www.sueddeutsche.de,"1. FC Saarbrücken im DFB-Pokal: ""Langsam wird es zur Gewohnheit""","Unaufhörlicher Regen, eskalierender Jubel: Der 1. FC Saarbrücken schlägt Gladbach und damit den dritten Erstligisten, wieder durch ein Tor in der Nachspielzeit - den dauernden Erfolgen liegt ein kleiner Etikettenschwindel zugrunde.",https://www.sueddeutsche.de/image/sz.1.6449164/1200x675?v=1710323398,2024-03-13T09:50:01Z,,"Es gibt im Handball oder auch im Basketball eine Art Standardstrategie, um enge Partien zu gewinnen. Wenn der Spielstand Gleichzahl anzeigt und die Spielzeit Richtung Ende tickt, dann sollte man den … [+4831 chars]",,de,'Regen'
https://www.zeit.de/news/2024-03/13/zoll-schickt-sitzheizung-mit-zu-hohen-temperaturen-zurueck,https://www.zeit.de/news/2024-03/13/zoll-schickt-sitzheizung-mit-zu-hohen-temperaturen-zurueck,0,www.zeit.de,Weiden: Zoll schickt Sitzheizung mit zu hohen Temperaturen zurück,Hier finden Sie Informationen zu dem Thema „Weiden“. Lesen Sie jetzt „Zoll schickt Sitzheizung mit zu hohen Temperaturen zurück“.,https://img.zeit.de/news/2024-03/13/zoll-schickt-sitzheizung-mit-zu-hohen-temperaturen-zurueck-image-group/wide__1300x731,2024-03-13T10:11:47Z,,Bei den Temperaturen kann man schon kochen: In Weiden in der Oberpfalz hat der Zoll eine Sitzheizung mit einer maximalen Temperatur von 105 Grad einkassiert. Der Post sei das Paket mit der Sitzheizun… [+463 chars],,de,'Temperaturen'
https://www.zeit.de/news/2024-03/13/waldbrandgefahr-mangels-regen-ueberwachung-des-nordens,https://www.zeit.de/news/2024-03/13/waldbrandgefahr-mangels-regen-ueberwachung-des-nordens,0,www.zeit.de,Bautzen: Waldbrandgefahr mangels Regen: Überwachung des Nordens,Hier finden Sie Informationen zu dem Thema „Bautzen“. Lesen Sie jetzt „Waldbrandgefahr mangels Regen: Überwachung des Nordens“.,https://img.zeit.de/news/2024-03/13/waldbrandgefahr-mangels-regen-ueberwachung-des-nordens-image-group/wide__1300x731,2024-03-13T10:55:28Z,,"In den besonders durch Waldbrand gefährdeten Landkreisen Nordsachsen, Meißen, Bautzen und Görlitz gab es in den vergangenen fünf Jahren insgesamt 409 gemeldete Feuer. Betroffen war eine Fläche von in… [+2459 chars]",,de,'Regen'
https://www.stern.de/gesellschaft/regional/sachsen/bautzen--waldbrandgefahr-mangels-regen--ueberwachung-des-nordens-34541406.html,https://www.stern.de/gesellschaft/regional/sachsen/bautzen--waldbrandgefahr-mangels-regen--ueberwachung-des-nordens-34541406.html,0,www.stern.de,Bautzen: Waldbrandgefahr mangels Regen: Überwachung des Nordens,"Immer wieder gibt es Jahre in Sachsen, wo Brände hunderte Hektar Wald vernichten. Die meisten aber können schon im Keim erstickt werden - auch dank automatischer Überwachung.",https://image.stern.de/6681672/t/31/v5/w1440/r1.7778/-/video-fallback-image.jpg,2024-03-13T10:55:28Z,,"Immer wieder gibt es Jahre in Sachsen, wo Brände hunderte Hektar Wald vernichten. Die meisten aber können schon im Keim erstickt werden - auch dank automatischer Überwachung.
In den besonders durch … [+1928 chars]",,de,'Regen'
https://www.focus.de/wissen/pollen-allergien-vorsicht-allergiker-warum-starkregen-und-gewitter-symptome-verstaerken-koennen_id_196917284.html,https://www.focus.de/wissen/pollen-allergien-vorsicht-allergiker-warum-starkregen-und-gewitter-symptome-verstaerken-koennen_id_196917284.html,0,www.focus.de,Pollen-Allergien - Warum Starkregen und Gewitter Symptome verstärken können,"Gewitter und Starkregen sind Naturgewalten, die für Allergiker oft eine schwere Zeit mit sich bringen können. Denn die typischen Symptome können sich kurz vor einem Gewitter verstärken. Was dahinter steckt und wie Sie sich Linderung verschaffen können, lesen …",https://p6.focus.de/img/fotos/id_259757479/frau-niest-unter-einem-regenschirm.jpg?im=Crop%3D%280%2C177%2C2121%2C1060%29%3BResize%3D%281200%2C627%29&impolicy=perceptual&quality=mediumHigh&hash=c4355f6e2f7319653b1db3d937305269b74977a2a32f3c04ab84176ad9ff9bd1,2024-03-13T13:24:24Z,,"Gewitter und Starkregen sind Naturphänomene, die für Allergiker oft eine herausfordernde Zeit bedeuten können. Denn die typischen Symptome von Allergien können sich kurz vor einem Gewitter verstärken… [+3247 chars]",,de,'Natur'
