index,url,valid,domain,title,description,image,published,archive,content,quote,language,keyword
https://www.zeit.de/news/2024-03/04/groesstes-schlittenhunderennen-der-welt-gestartet,https://www.zeit.de/news/2024-03/04/groesstes-schlittenhunderennen-der-welt-gestartet,0,www.zeit.de,Alaska: Größtes Schlittenhunderennen der Welt gestartet,Hier finden Sie Informationen zu dem Thema „Alaska“. Lesen Sie jetzt „Größtes Schlittenhunderennen der Welt gestartet“.,https://img.zeit.de/news/2024-03/04/groesstes-schlittenhunderennen-der-welt-gestartet-image-group/wide__1300x731,2024-03-04T02:14:56Z,https://web.archive.org/web/20240304023407/https://www.zeit.de/news/2024-03/04/groesstes-schlittenhunderennen-der-welt-gestartet/,Im eisigen Alaska sind mehr als 30 Frauen und Männer beim 52. Iditarod-Hundeschlittenrennen gestartet. Etwa zehn Tage und 1600 Kilometer liegen vor den Kontrahentinnen und Kontrahenten bei dem größte… [+1951 chars],,de,'Schlitten'
https://www.tagesschau.de/ausland/amerika/nikki-haley-us-vorwahlen-washington-dc-100.html,https://www.tagesschau.de/ausland/amerika/nikki-haley-us-vorwahlen-washington-dc-100.html,0,www.tagesschau.de,Haley gewinnt überraschend US-Vorwahl in Washington,Die republikanische Präsidentschaftsanwärterin Haley hat die Vorwahl der Partei im Hauptstadtbezirk District of Columbia gewonnen. Der erste Sieg gegen ihren Rivalen Trump ist größtenteils symbolischer Natur.,https://images.tagesschau.de/image/238ea7b5-d967-4f7d-a2b4-4aa01378edc1/AAABjgdcAV4/AAABjcWen7M/16x9-1280/nikki-haley-130.jpg,2024-03-04T03:00:23Z,,"Stand: 04.03.2024 04:00 Uhr
Die republikanische Präsidentschaftsanwärterin Haley hat die Vorwahl der Partei im Hauptstadtbezirk District of Columbia gewonnen. Der erste Sieg gegen ihren Rivalen Trum… [+2111 chars]",,de,'Natur'
https://www.nzz.ch/wissenschaft/die-weltmeere-sind-so-warm-wie-nie-und-klimawissenschafter-verstehen-nicht-warum-ld.1818237,https://www.nzz.ch/wissenschaft/die-weltmeere-sind-so-warm-wie-nie-und-klimawissenschafter-verstehen-nicht-warum-ld.1818237,0,www.nzz.ch,"Die Weltmeere sind so warm wie nie – und Klimawissenschafter verstehen nicht, warum","Seit Monaten brechen die Temperaturen der Meere alle Rekorde. Sie liegen noch deutlich höher, als natürliche Phänomene und Klimawandel erwarten liessen. Das hat Folgen für das Leben im Meer und für uns.","https://img.nzz.ch/2024/03/01/d2ab1680-d06a-44ea-bf18-d00793c4e9a2.png?width=1200&height=675&fit=bound&quality=75&auto=webp&crop=2400,1350,x0,y225&wmark=nzz",2024-03-04T04:30:00Z,,Der Frühling kündigt sich dieses Jahr besonders früh an. Mit Höchsttemperaturen von 10 bis 12 Grad Celsius ist es in der Schweiz rund 5 Grad wärmer als im Durchschnitt über viele Jahre. Ähnlich sieht… [+6517 chars],,de,'Temperaturen'
https://wien.orf.at/stories/3247343/,https://wien.orf.at/stories/3247343/,0,wien.orf.at,Warmes Frühjahr als Problem für Wildtiere,Die Temperaturen von bis zu 18 Grad erweisen sich als Problem für die Wildtiere in Wien: Sie kommen oft zu früh aus ihren Winterverstecken. Beispielweise Igel und Eichhörnchen landen derzeit häufig in der Wildtierstation oder der Fundbox der Stadt.,https://ibs.orf.at/wie?image=https%3A%2F%2Foekastatic.orf.at%2Fmims%2F2024%2F10%2F98%2Fcrops%2Fw%3D1200%2Ch%3D627%2Cq%3D75%2F2126947_master_804598_c330d793-91c6-445e-baf6-86494cb34387.jpg%3Fs%3D013a3789a262de448ee25e931e2c221eeec9c42c,2024-03-04T05:01:00Z,,"Der Einsatz für die Wildtierrettung ist untypisch für die ersten Märztage: Ein junges Eichhörnchen soll verletzt sein, so der Notruf, der Zustand des Tieres ist ungewiss. Eigentlich klettern die jung… [+1661 chars]",,de,'Temperaturen'
https://burgenland.orf.at/stories/3247295/,https://burgenland.orf.at/stories/3247295/,0,burgenland.orf.at,Marillenblüte startet deutlich früher,"Die ungewöhnlich warmen Temperaturen der vergangenen Wochen machen den heimischen Marillenbauern zu schaffen. Einige Sorten blühen bereits deutlich früher als gewohnt. Frost, der um diese Jahreszeit jederzeit möglich wäre, würde die Marillenernte zunichtemach…",https://ibs.orf.at/bgl?image=https%3A%2F%2Foekastatic.orf.at%2Fmims%2F2024%2F10%2F49%2Fcrops%2Fw%3D1200%2Ch%3D627%2Cq%3D75%2F2126576_master_804449_marille_1.jpg%3Fs%3D3035f68476ccd2e07909dc0273e97bbb535197f4,2024-03-04T05:38:01Z,,Eigentlich sollten die ersten Marillen im Burgenland frühestens in zwei Wochen blühen. Aufgrund der hohen Temperaturen blühen die Marillen vielerorts aber bereits jetzt. Das sorgt für Sorgenfalten be… [+1555 chars],,de,'Temperaturen'
https://www.stern.de/gesellschaft/regional/berlin-brandenburg/wetter--bewoelkter-wochenstart-in-berlin-und-brandenburg-34513292.html,https://www.stern.de/gesellschaft/regional/berlin-brandenburg/wetter--bewoelkter-wochenstart-in-berlin-und-brandenburg-34513292.html,0,www.stern.de,Wetter: Bewölkter Wochenstart in Berlin und Brandenburg,"Viele Wolken erwarten die Menschen in Berlin und Brandenburg zum Start in die neue Woche. Dabei tritt am Morgen und Vormittag teils Nebel und Hochnebel auf, wie der Deutsche Wetterdienst (DWD) mitteilte. Regen wird nicht erwartet, in der Uckermark kommt es zu…",https://image.stern.de/34513294/t/cf/v1/w1440/r1.7778/-/04--urnnewsmldpacom2009010124030499210245v3w800h600l638t786r1918b1676jpeg---8c423b3ac81e87f6.jpg,2024-03-04T05:57:30Z,,"Viele Wolken erwarten die Menschen in Berlin und Brandenburg zum Start in die neue Woche. Dabei tritt am Morgen und Vormittag teils Nebel und Hochnebel auf, wie der Deutsche Wetterdienst (DWD) mittei… [+1168 chars]",,de,'Regen'
https://www.tagesspiegel.de/berlin/viel-nebel-wenig-regen-bewolkter-wochenstart-in-berlin-und-brandenburg-11306377.html,https://www.tagesspiegel.de/berlin/viel-nebel-wenig-regen-bewolkter-wochenstart-in-berlin-und-brandenburg-11306377.html,0,www.tagesspiegel.de,"Viel Nebel, wenig Regen: Bewölkter Wochenstart in Berlin und Brandenburg",Der Montag beginnt in der Hauptstadtregion teils mit starkem Nebel. Die Temperaturen klettern bis auf 15 Grad. Nur die Sonne lässt sich in der ersten Wochenhälfte wenig blicken.,https://www.tagesspiegel.de/images/bewolkter-himmel-uber-berlin-und-brandenburg/alternates/BASE_16_9_W1400/bewoelkter-himmel-ueber-berlin-und-brandenburg.jpeg,2024-03-04T06:26:13Z,,"Viele Wolken erwarten die Menschen in Berlin und Brandenburg zum Start in die neue Woche. Dabei tritt am Morgen und Vormittag teils Nebel und Hochnebel auf, wie der Deutsche Wetterdienst (DWD) mittei… [+796 chars]",,de,'Sonne'
https://www.zeit.de/news/2024-03/04/fruehlingshafte-temperaturen-am-montag,https://www.zeit.de/news/2024-03/04/fruehlingshafte-temperaturen-am-montag,0,www.zeit.de,Wetter: Frühlingshafte Temperaturen am Montag,Hier finden Sie Informationen zu dem Thema „Wetter“. Lesen Sie jetzt „Frühlingshafte Temperaturen am Montag“.,https://img.zeit.de/news/2024-03/04/fruehlingshafte-temperaturen-am-montag-image-group/wide__1300x731,2024-03-04T06:26:23Z,,"Die Woche im Norden startet mit frühlingshaften Temperaturen. Der Montag bringt trockenes, jedoch bewölktes Wetter bei milden 10 bis 14 Grad, wie der Deutsche Wetterdienst am Montagmorgen mitteilte. … [+348 chars]",,de,'Temperaturen'
https://www.zeit.de/news/2024-03/04/kreativwettbewerb-zu-den-25-ringelganstagen-startet,https://www.zeit.de/news/2024-03/04/kreativwettbewerb-zu-den-25-ringelganstagen-startet,0,www.zeit.de,Natur: Kreativwettbewerb zu den 25. Ringelganstagen startet,Hier finden Sie Informationen zu dem Thema „Natur“. Lesen Sie jetzt „Kreativwettbewerb zu den 25. Ringelganstagen startet“.,https://img.zeit.de/news/2024-03/04/kreativwettbewerb-zu-den-25-ringelganstagen-startet-image-group/wide__1300x731,2024-03-04T06:28:43Z,,Das Biosphärenreservat Schleswig-Holsteinisches Wattenmeer und Halligen ruft junge Menschen zwischen 15 und 25 Jahren zu einem Kreativ-Wettbewerb anlässlich der 25. Ringelganstage (20. April bis 12. … [+2112 chars],,de,'Natur'
https://www.zeit.de/news/2024-03/04/woche-startet-bewoelkt-mit-etwas-regen,https://www.zeit.de/news/2024-03/04/woche-startet-bewoelkt-mit-etwas-regen,0,www.zeit.de,Wetter: Woche startet bewölkt mit etwas Regen,Hier finden Sie Informationen zu dem Thema „Wetter“. Lesen Sie jetzt „Woche startet bewölkt mit etwas Regen“.,https://img.zeit.de/news/2024-03/04/woche-startet-bewoelkt-mit-etwas-regen-image-group/wide__1300x731,2024-03-04T07:30:57Z,,"Die Woche bringt Hessen Wolken und teils auch Regen. Am Montag seien nur vereinzelte Auflockerungen zu erwarten, teilte der Deutsche Wetterdienst (DWD) in Offenbach mit. Meist bleibt es niederschlags… [+527 chars]",,de,'Regen'
https://www.stern.de/gesellschaft/regional/nordrhein-westfalen/vorhersage--mix-aus-wolken-und-regen--dann-zunehmend-freundliches-wetter-34513486.html,https://www.stern.de/gesellschaft/regional/nordrhein-westfalen/vorhersage--mix-aus-wolken-und-regen--dann-zunehmend-freundliches-wetter-34513486.html,0,www.stern.de,"Vorhersage: Mix aus Wolken und Regen, dann zunehmend freundliches Wetter","Die Menschen in Nordrhein-Westfalen erwartet in der neuen Woche zunächst ein Mix aus Wolken und etwas Regen, dann soll es zunehmend auflockern und sonnig werden. Wie der Deutsche Wetterdienst (DWD) mitteilte, startet der Montag bedeckt und nebelig-trüb, verei…",https://image.stern.de/34513488/t/no/v1/w1440/r1.7778/-/04--urnnewsmldpacom2009010124030499211121v3w800h600l678t568r1958b1398jpeg---4c624d9a3a33b066.jpg,2024-03-04T07:51:45Z,,"Die Menschen in Nordrhein-Westfalen erwartet in der neuen Woche zunächst ein Mix aus Wolken und etwas Regen, dann soll es zunehmend auflockern und sonnig werden. Wie der Deutsche Wetterdienst (DWD) m… [+1815 chars]",,de,'Regen'
https://www.zeit.de/news/2024-03/04/mix-aus-wolken-und-regen-dann-zunehmend-freundliches-wetter,https://www.zeit.de/news/2024-03/04/mix-aus-wolken-und-regen-dann-zunehmend-freundliches-wetter,0,www.zeit.de,"Vorhersage: Mix aus Wolken und Regen, dann zunehmend freundliches Wetter","Hier finden Sie Informationen zu dem Thema „Vorhersage“. Lesen Sie jetzt „Mix aus Wolken und Regen, dann zunehmend freundliches Wetter“.",https://img.zeit.de/news/2024-03/04/mix-aus-wolken-und-regen-dann-zunehmend-freundliches-wetter-image-group/wide__1300x731,2024-03-04T07:51:45Z,,"Die Menschen in Nordrhein-Westfalen erwartet in der neuen Woche zunächst ein Mix aus Wolken und etwas Regen, dann soll es zunehmend auflockern und sonnig werden. Wie der Deutsche Wetterdienst (DWD) m… [+2142 chars]",,de,'Regen'
https://www.stern.de/gesellschaft/regional/rheinland-pfalz-saarland/wetter--mix-aus-wolken-und-etwas-regen-zum-wochenstart-34513626.html,https://www.stern.de/gesellschaft/regional/rheinland-pfalz-saarland/wetter--mix-aus-wolken-und-etwas-regen-zum-wochenstart-34513626.html,0,www.stern.de,Wetter: Mix aus Wolken und etwas Regen zum Wochenstart,"Die Menschen in Rheinland-Pfalz und im Saarland erwartet in der neuen Woche zunächst ein Mix aus Wolken und etwas Regen, am Donnerstag soll es auflockern und sonnig werden. Wie der Deutsche Wetterdienst (DWD) mitteilte, startet der Montag bedeckt und nebelig-…",https://image.stern.de/34513628/t/cm/v1/w1440/r1.7778/-/04--urnnewsmldpacom2009010124030499211618v3w800h600l1123t87r2403b899jpeg---7ad8cfb4fd783fad.jpg,2024-03-04T08:42:28Z,,"Die Menschen in Rheinland-Pfalz und im Saarland erwartet in der neuen Woche zunächst ein Mix aus Wolken und etwas Regen, am Donnerstag soll es auflockern und sonnig werden. Wie der Deutsche Wetterdie… [+1575 chars]",,de,'Regen'
https://www.zeit.de/news/2024-03/04/mix-aus-wolken-und-etwas-regen-zum-wochenstart,https://www.zeit.de/news/2024-03/04/mix-aus-wolken-und-etwas-regen-zum-wochenstart,0,www.zeit.de,Wetter: Mix aus Wolken und etwas Regen zum Wochenstart,Hier finden Sie Informationen zu dem Thema „Wetter“. Lesen Sie jetzt „Mix aus Wolken und etwas Regen zum Wochenstart“.,https://img.zeit.de/news/2024-03/04/mix-aus-wolken-und-etwas-regen-zum-wochenstart-image-group/wide__1300x731,2024-03-04T08:42:28Z,,"Die Menschen in Rheinland-Pfalz und im Saarland erwartet in der neuen Woche zunächst ein Mix aus Wolken und etwas Regen, am Donnerstag soll es auflockern und sonnig werden. Wie der Deutsche Wetterdie… [+1878 chars]",,de,'Regen'
https://www.zeit.de/wissen/umwelt/2024-02/klimawandel-fruehlingsanfang-jahreszeiten-bluehen-pollen,https://www.zeit.de/wissen/umwelt/2024-02/klimawandel-fruehlingsanfang-jahreszeiten-bluehen-pollen,0,www.zeit.de,Klimawandel: Ist das schon der Frühling?,"15 Grad, am Wegrand blühen Krokusse: Der Frühlingsanfang hat sich um einen ganzen Monat nach vorne verschoben. Wie die Natur versucht, mit dem Klimawandel mitzuhalten.",https://img.zeit.de/wissen/umwelt/2024-03/klimawandel-fruehlingsanfang-jahreszeiten-bluehen-pollen-teaser/wide__1300x731,2024-03-04T08:54:27Z,,"Das Gefühl trügt nicht: Der &lt;b&gt;Frühling&lt;/b&gt; beginnt in diesem Jahr ganz schön früh. Denn durch den Klimawandel verschieben sich die Jahreszeiten.
Das zeigt die Phänologie, die Wissenscha… [+773 chars]",,de,'Natur'
https://www.morgenpost.de/ratgeber/article241809904/Bitcoin-knackte-60-000-Dollar-Marke-Jetzt-noch-investieren.html,https://www.morgenpost.de/ratgeber/article241809904/Bitcoin-knackte-60-000-Dollar-Marke-Jetzt-noch-investieren.html,0,www.morgenpost.de,Bitcoin knackte 60.000-Dollar-Marke: Jetzt noch investieren?,Die Kryptowährung Bitcoin erreicht Rekordwerte – was bedeutet das für Privatanleger? Wir haben mit Bitpanda-CEO Eric Demuth gesprochen.,https://img.sparknews.funkemedien.de/241399412/241399412_1704978761_v4_3_800.jpeg,2024-03-04T09:30:13Z,,"Berlin. Die Kryptowährung Bitcoin erreicht Rekordwerte was bedeutet das für Privatanleger? Wir haben mit Bitpanda-CEO Eric Demuth gesprochen.
Die Kryptowährung ein einfacher Begriff, der für einige … [+12005 chars]",,de,'Rekordwerte'
https://www.stern.de/gesellschaft/regional/bayern/muenchen--wolken-und-milde-temperaturen-zum-wochenstart-in-bayern-34513924.html,https://www.stern.de/gesellschaft/regional/bayern/muenchen--wolken-und-milde-temperaturen-zum-wochenstart-in-bayern-34513924.html,0,www.stern.de,München: Wolken und milde Temperaturen zum Wochenstart in Bayern,"Viele Wolken und milde Temperaturen werden zum Wochenstart in Bayern erwartet. In Teilen des Freistaats ist zeitweise mit Regen zu rechnen, so der Deutsche Wetterdienst (DWD).",https://image.stern.de/34513926/t/2v/v1/w1440/r1.7778/-/04--urnnewsmldpacom2009010124030499212540v3w800h600l640t425r1920b1278jpeg---fcc5cc5684f51089.jpg,2024-03-04T10:01:21Z,,"Viele Wolken und milde Temperaturen werden zum Wochenstart in Bayern erwartet. In Teilen des Freistaats ist zeitweise mit Regen zu rechnen, so der Deutsche Wetterdienst (DWD).
Viele Wolken und milde… [+805 chars]",,de,'Regen'
https://www.zeit.de/news/2024-03/04/wolken-und-milde-temperaturen-zum-wochenstart-in-bayern,https://www.zeit.de/news/2024-03/04/wolken-und-milde-temperaturen-zum-wochenstart-in-bayern,0,www.zeit.de,München: Wolken und milde Temperaturen zum Wochenstart in Bayern,Hier finden Sie Informationen zu dem Thema „München“. Lesen Sie jetzt „Wolken und milde Temperaturen zum Wochenstart in Bayern“.,https://img.zeit.de/news/2024-03/04/wolken-und-milde-temperaturen-zum-wochenstart-in-bayern-image-group/wide__1300x731,2024-03-04T10:01:21Z,,"Viele Wolken und milde Temperaturen werden zum Wochenstart in Bayern erwartet. In Teilen des Freistaats ist zeitweise mit Regen zu rechnen, so der Deutsche Wetterdienst (DWD).
Mehr Schlagzeilen
Der… [+658 chars]",,de,'Temperaturen'
https://fm4.orf.at/stories/3039725/,https://fm4.orf.at/stories/3039725/,0,fm4.orf.at,Gutes Wetter soll schlechtes und schlechtes gutes Wetter werden,Die Klimakatastrophe gebietet ein Update in unserem Sprachgebrauch - wir sollten bei Sonnenschein von schlechtem Wetter und bei Regen von Traumwetter sprechen.,https://tubestatic.orf.at/static/images/site/tube/2024039/rain-1514257_1280.6009866.jpg,2024-03-04T10:25:00Z,,"Die Klimakatastrophe gebietet ein Update in unserem Sprachgebrauch - wir sollten bei Sonnenschein von schlechtem Wetter und bei Regen von Traumwetter sprechen.
Eine Kolumne von Marc Carnal
Liebe FP… [+3410 chars]",,de,'Regen'
https://www.faz.net/aktuell/rhein-main/kultur/hessisches-staatsballett-bringt-glue-light-blue-zur-premiere-19561360.html,https://www.faz.net/aktuell/rhein-main/kultur/hessisches-staatsballett-bringt-glue-light-blue-zur-premiere-19561360.html,0,www.faz.net,Das Hessische Staatsballett mit Zelners „glue light blue“: Regen auf Wüste,"Es ist keine leichte Kost, die das Hessische Staatsballett in Wiesbaden mit dieser Choreographie serviert, doch die Premiere begeistert.",https://media1.faz.net/ppmedia/aktuell/1173652415/1.9561359/facebook_teaser_fplus/gedankenanregender.jpg,2024-03-04T11:14:54Z,,"Diese Produktion macht den Tanz zum Augenschmaus von Anfang bis Ende. Aber man schwelgt nicht in glue light blue, sondern wundert sich ständig. Was machen die da? Was passiert, oh, schon vorbei, aha,… [+689 chars]",,de,'Regen'
https://www.tagesspiegel.de/gesellschaft/panorama/startwuff-in-alaska-grosstes-schlittenhunderennen-der-welt-gestartet-11308099.html,https://www.tagesspiegel.de/gesellschaft/panorama/startwuff-in-alaska-grosstes-schlittenhunderennen-der-welt-gestartet-11308099.html,0,www.tagesspiegel.de,Startwuff in Alaska: Größtes Schlittenhunderennen der Welt gestartet,Beim Iditarod-Rennen im Norden der USA sind seit 1973 jedes Jahr unzählige Pfoten zehn Tage lang in der Wildnis unterwegs. Sie kämpfen sich mitunter auch durch Schnee und Sturm ins Ziel.,https://www.tagesspiegel.de/images/iditarod-schlittenhunderennen-beginnt/alternates/BASE_16_9_W1400/iditarod-schlittenhunderennen-beginnt.jpeg,2024-03-04T11:45:22Z,,Im eisigen Alaska sind mehr als 30 Frauen und Männer beim 52. Iditarod-Hundeschlittenrennen gestartet. Etwa zehn Tage und 1600 Kilometer liegen vor den Kontrahentinnen und Kontrahenten bei dem größte… [+1603 chars],,de,'Schlitten'
https://www.focus.de/finanzen/boerse/lira-im-freien-fall-schon-bei-67-prozent-tuerkische-wirtschaft-kaempft-gegen-hohe-inflation_id_259726669.html,https://www.focus.de/finanzen/boerse/lira-im-freien-fall-schon-bei-67-prozent-tuerkische-wirtschaft-kaempft-gegen-hohe-inflation_id_259726669.html,0,www.focus.de,Lira im freien Fall - Schon bei 67 Prozent: Türkische Wirtschaft kämpft gegen hohe Inflation,"Die Inflation in der Türkei erreicht mit gut 67 Prozent Rekordwerte. Experten befürchten, dass die Zentralbank schon bald die Zinsen anheben muss.",https://p6.focus.de/img/fotos/id_259726662/erdogan.jpg?im=Crop%3D%280%2C341%2C2048%2C1024%29%3BResize%3D%281200%2C627%29&impolicy=perceptual&quality=mediumHigh&hash=820f2788d3fb0b0e8d018a5dc4560dc550c603fe754722803665077f9efb6faa,2024-03-04T11:49:21Z,,"Die Inflation in der Türkei erreicht mit gut 67 Prozent Rekordwerte. Experten befürchten, dass die Zentralbank schon bald die Zinsen anheben muss.Die türkische Verbraucherpreisinflation stieg nach In… [+1925 chars]",,de,'Rekordwerte'
https://www.morgenpost.de/berlin/article241814622/Mit-Baeumen-Hitze-trotzen-Initiative-sagt-wie-es-gehen-kann.html,https://www.morgenpost.de/berlin/article241814622/Mit-Baeumen-Hitze-trotzen-Initiative-sagt-wie-es-gehen-kann.html,0,www.morgenpost.de,"Mit Bäumen Hitze trotzen: Initiative sagt, wie es gehen kann",Volksentscheid geplant: Eine Initiative strebt mit ihrem Gesetzesentwurf für das „BäumePlus-Gesetz“ ein hitzeresistenes Berlin an.,https://img.sparknews.funkemedien.de/241814620/241814620_1709564537_v4_3_800.jpeg,2024-03-04T15:02:18Z,,Berlin. Volksentscheid geplant: Eine Initiative strebt mit ihrem Gesetzesentwurf für das BäumePlus-Gesetz ein hitzeresistenes Berlin an.,,de,'Hitze'
https://www.brigitte.de/horoskop/fruehlings-horoskop-2024--4-sternzeichen--auf-die-jetzt-herzklopfen-und-leidenschaft-warten-13780158.html,https://www.brigitte.de/horoskop/fruehlings-horoskop-2024--4-sternzeichen--auf-die-jetzt-herzklopfen-und-leidenschaft-warten-13780158.html,0,www.brigitte.de,"Frühlings-Horoskop 2024: 4 Sternzeichen, bei denen jetzt Frühlingsgefühle erwachen","Nach dem dunklen Winter beginnt jetzt die Jahreszeit der Liebe und Verführung. Für einige Sternzeichen stehen Flirten, Annäherung und Verlieben auf dem Programm. Im Video erfahrt ihr, für wen jetzt der Frühling die Jahreszeit der Romantik ist.",https://image.brigitte.de/13780162/t/fb/v1/w1440/r1.7778/-/glueckliches-paar.jpg,2024-03-04T16:36:00Z,,"04.03.2024, 17:36
Nach dem dunklen Winter beginnt jetzt die Jahreszeit der Liebe und Verführung. Für einige Sternzeichen stehen Flirten, Annäherung und Verlieben auf dem Programm. Im Video erfahrt i… [+707 chars]",,de,'Frühlingsgefühle'
https://www.morgenpost.de/ratgeber/article241816876/Warum-der-fruehe-Fruehlingsbeginn-fuer-Igel-zur-Gefahr-wird.html,https://www.morgenpost.de/ratgeber/article241816876/Warum-der-fruehe-Fruehlingsbeginn-fuer-Igel-zur-Gefahr-wird.html,0,www.morgenpost.de,Warum der frühe Frühlingsbeginn für Igel zur Gefahr wird,Igel erwachen bei milden Temperaturen früher aus dem Winterschlaf. Warum das den Wildtieren schadet – und wie man ihnen helfen kann.,https://img.sparknews.funkemedien.de/240747474/240747474_1701779239_v4_3_800.jpeg,2024-03-04T19:38:54Z,,"Berlin. Igel erwachen bei milden Temperaturen früher aus dem Winterschlaf. Warum das den Wildtieren schadet und wie man ihnen helfen kann.
Igel überbrücken die nahrungsarme Zeit im Winter mit Schlaf… [+4400 chars]",,de,'Igel'
https://www.faz.net/aktuell/gesellschaft/52-iditarod-hundeschlittenrennen-in-alaska-gestartet-19563008.html,https://www.faz.net/aktuell/gesellschaft/52-iditarod-hundeschlittenrennen-in-alaska-gestartet-19563008.html,0,www.faz.net,Rennen in Alaska: Mit Schlittenhunden durch Eis und Schnee,Am Sonntag gingen in Willow 38 Hundeschlittenführer auf die erste Etappe des prestigeträchtigen Iditarod-Rennens. Der Sieger wird am Dienstag kommender Woche in Nome erwartet.,https://media1.faz.net/ppmedia/aktuell/902461171/1.9563007/facebook_teaser/into-the-wild.jpg,2024-03-04T20:02:25Z,,"Am Samstag waren sie noch durch die breiten Innenstadtstraßen von Anchorage gelaufen, beim traditionellen Showstart in der größten Stadt Alaskas vor Fans und Freunden. Am Sonntag wurde es ernst: In W… [+1362 chars]",,de,'Schlitten'
https://www.zeit.de/news/2024-03/05/seltene-laune-der-natur-ein-panda-im-kakao-look,https://www.zeit.de/news/2024-03/05/seltene-laune-der-natur-ein-panda-im-kakao-look,0,www.zeit.de,Tiere: Seltene Laune der Natur: Ein Panda im Kakao-Look,Hier finden Sie Informationen zu dem Thema „Tiere“. Lesen Sie jetzt „Seltene Laune der Natur: Ein Panda im Kakao-Look“.,https://img.zeit.de/news/2024-03/05/seltene-laune-der-natur-ein-panda-im-kakao-look-image-group/wide__1300x731,2024-03-05T01:45:54Z,,"Kühe mit braunen statt schwarzen Flecken gibt es viele - aber wohl kaum jemand weiß: Es gibt auch Kakao-Pandas, also Tiere mit hellbraunen statt der üblicherweise schwarz gefärbten Fellteilen. Sie se… [+3059 chars]",,de,'Natur'
https://www.zeit.de/news/2024-03/05/wolken-und-vereinzelt-regen-in-berlin-und-brandenburg,https://www.zeit.de/news/2024-03/05/wolken-und-vereinzelt-regen-in-berlin-und-brandenburg,0,www.zeit.de,Wetter: Wolken und vereinzelt Regen in Berlin und Brandenburg,Hier finden Sie Informationen zu dem Thema „Wetter“. Lesen Sie jetzt „Wolken und vereinzelt Regen in Berlin und Brandenburg“.,https://img.zeit.de/news/2024-03/05/wolken-und-vereinzelt-regen-in-berlin-und-brandenburg-image-group/wide__1300x731,2024-03-05T05:14:02Z,,"Vereinzelte Schauer und dichte Wolken bestimmen die Wetterlage in Berlin und Brandenburg am Dienstag. Wie der Deutsche Wetterdienst (DWD) mitteilte, bleibt es im Tagesverlauf stark bewölkt. In Brande… [+1293 chars]",,de,'Regen'
https://www.zeit.de/news/2024-03/05/rekordzahl-von-bruetenden-stoerchen-in-sachsen,https://www.zeit.de/news/2024-03/05/rekordzahl-von-bruetenden-stoerchen-in-sachsen,0,www.zeit.de,Natur: Rekordzahl von brütenden Störchen in Sachsen,Hier finden Sie Informationen zu dem Thema „Natur“. Lesen Sie jetzt „Rekordzahl von brütenden Störchen in Sachsen“.,https://img.zeit.de/news/2024-03/05/rekordzahl-von-bruetenden-stoerchen-in-sachsen-image-group/wide__1300x731,2024-03-05T05:44:44Z,,Die Zahl der brütenden Weißstörche in Sachsen ist im vergangenen Jahr laut einer Statistik auf ein Rekordergebnis gestiegen. «Im Vorjahr wurden 408 Brutpaare registriert. Damit wurde erstmals seit 20… [+2645 chars],,de,'Natur'
https://www.zeit.de/news/2024-03/05/viele-wolken-und-regen-am-dienstag-in-sachsen,https://www.zeit.de/news/2024-03/05/viele-wolken-und-regen-am-dienstag-in-sachsen,0,www.zeit.de,Wetter: Viele Wolken und Regen am Dienstag in Sachsen,Hier finden Sie Informationen zu dem Thema „Wetter“. Lesen Sie jetzt „Viele Wolken und Regen am Dienstag in Sachsen“.,https://img.zeit.de/news/2024-03/05/viele-wolken-und-regen-am-dienstag-in-sachsen-image-group/wide__1300x731,2024-03-05T05:45:52Z,,"Auf einen Dienstag mit vielen Wolken und Regen müssen sich die Menschen in Sachsen einstellen. In den frühen Morgenstunden ist teils mit Nebel und Sichtweiten unter 150 Metern zu rechnen, wie der Deu… [+321 chars]",,de,'Regen'
